,gid,aid,move,fen,annotation
446,23,3,d6,b'rnbqkb1r/ppp3p1/3ppn1p/5p2/2PP1B2/4PN2/PP3PPP/RN1QKB1R w KQkq -',"already, Black is preparing e5..."
447,23,4,Nc6,b'r1bqk2r/ppp3b1/2nppn1p/5pp1/2PP4/2NBPNB1/PP3PPP/R2QK2R w KQkq -',both players are postponing castling short: there is no returning from that...
448,23,5,Qc2,b'r1bqk2r/ppp3b1/2nppn1p/5pp1/2PP4/2NBPNB1/PPQ2PPP/R3K2R b KQkq -',"as always: preparing e4, and finishing development: also making castling long possible..."
449,23,6,O-O,b'r1bq1rk1/ppp3bn/2npp2p/5pp1/2PPP3/2NB1NB1/PPQ2PPP/R3K2R w KQ -',introducing a problem: f4...
450,23,7,1h3,b'r1bq1rk1/ppp3bn/2npp2p/5pp1/2PPP3/2NB1NBP/PPQ2PP1/R3K2R b KQ -',creating space for Bh2...
451,23,8,1O-O-O,b'r1bq1rk1/ppp3b1/2npp2p/6n1/2PPPpP1/2NB1N2/PPQ2PPB/2KR3R b - -',not paying attention...
452,23,9,Nxd4,b'r1bq1rk1/ppp3b1/3pp2p/8/2PnPpP1/2NB1P2/PPQ2P1B/2KR3R w - -',"forcing the White Queen to move: but where? after Qa4, Bd7, White is getting in trouble..."
453,23,10,1Qd2,b'r1bq1rk1/ppp3b1/3pp2p/8/2PnPpP1/2NB1P2/PP1Q1P1B/2KR3R b - -',"losing another tempo, but probably safest..."
454,23,11,Nd4,b'r1bq1rk1/ppp3b1/3pp2p/8/2PnPpP1/2NB4/PP2QP1B/2KR3R w - -',White has to empty the cup...
455,23,12,f3,b'r1bq1rk1/ppp3b1/3pp2p/8/2PnP1P1/2NB1p2/PP3P1B/2KR1Q1R w - -',"White has clearly made some bad decisions: not only, is Black a pawn ahead; but also introducing a multitude in threats..."
456,23,13,1Rg1,b'r1bq1rk1/ppp3b1/3pp2p/8/2PnP1P1/2NB1p2/PP3P1B/2KR1QR1 b - -',"forced: after Qg5+, g4 would fall..."
457,23,14,1Qg5+,b'r1b2rk1/ppp3b1/3pp2p/6q1/2PnP1P1/2NB1p2/PP3P1B/2KR1QR1 w - -',nonetheless...
458,23,15,a6,b'r1b2rk1/1pp3b1/p2pp2p/6q1/2PnP1P1/2NB1p2/PP3P1B/1K1R1QR1 w - -',"a safety measure, against Nb5: White has formed a battery, over the LSB diagonal..."
459,23,16,2Qh3,b'r1b2rk1/1pp3b1/p2pp2p/6q1/2PnP1P1/2NB1p1Q/PP3P1B/1K1R2R1 b - -',"searching for ways to trade Queens, with Qh5..."
460,23,17,2e5,b'r1b2rk1/1pp3b1/p2p3p/4p1q1/2PnP1P1/2NB1p1Q/PP3P1B/1K1R2R1 w - -',putting the pressure on g4...
461,23,18,Bf6,b'r1b2rk1/1pp5/p2p1b1p/4p1qQ/2PnP1P1/2NB1p2/PP3P1B/1K1R2R1 w - -',Black is ready to trade Queens: at the cost of loss in tempo for White...
462,23,19,2Bg3,b'r1b2rk1/1pp5/p2p1b1p/4p1qQ/2PnP1P1/2NB1pB1/PP3P2/1K1R2R1 b - -',"the wrong decision: this unpins the Black King, after Qxh5..."
463,23,20,2Rgh1,b'r1b2r2/1pp4k/p2p1b1p/4p2P/2PnP3/2NB1pB1/PP3P2/1K1R3R b - -',"preparing Bh4, to open the g-file..."
464,23,21,2Bd7,b'r4r2/1ppb3k/p2p1b1p/4p2P/2PnP3/2NB1pB1/PP3P2/1K1R3R w - -',preparing some counterplay: b5 comes in sight...
465,23,22,Bg5,b'r4r2/1ppb3k/p2p3p/4p1bP/2PnP2B/2NB1p2/PP3P2/1K1R3R w - -',"like earlier: Black trades, on own conditions..."
466,23,23,2Nd1,b'r5r1/1ppb3k/p2p3p/4p1bP/2PnP2B/3B1p2/PP3P2/1K1N2RR b - -',"on the surface, a logical move: there might be progress, after Ne3; but White is abandoning two important squares: b5 and e2..."
467,23,24,2Ne3,b'r5r1/2pb3k/p2p3p/1p2p1bP/2PnP2B/3BNp2/PP3P2/1K4RR b - -',"no problems, yet..."
468,23,25,2Ne2,b'r5r1/2pb3k/p2p3p/1p2p1bP/2P1P2B/3BNp2/PP2nP2/1K4RR w - -',"the price, for abandoning e2: the Rook has no place to go; if the Knight reaches f4, all is over for White: so it has to go..."
469,23,26,3Nd5,b'r5r1/2pb3k/p2p3p/1p1Np1bP/2P1P2B/8/PP2pP2/1K4RR b - -',"panicking: although Bxe3 is not nice, this will turn out worse..."
470,23,27,3Rxg8,b'r5R1/2pb3k/p2p3p/1p1Np2P/2P1P2b/8/PP2pP2/1K5R b - -',reacting too swiftly: but what too play else?
471,23,28,3Rxg8,b'6r1/2pb3k/p2p3p/1p1Np2P/2P1P2b/8/PP2pP2/1K5R w - -',"realizing, what he has done, White needs to find a way out: Rxh4, Rg1+ is over..."
472,23,29,3Rxe2,b'6r1/2pb3k/p2p3p/1p1Np2P/2P1P3/8/PP2Rb2/1K6 b - -',the only one...
473,23,30,Bh4,b'8/2pb3k/p2p3p/1p1Np2P/2P1P2b/8/PPK1R3/6r1 w - -',"just in time, to prevent Nf6+..."
474,23,31,3Nxc7,b'8/2Nb3k/p2p3p/1p2p2P/2P1P2b/8/PPK1R3/6r1 b - -',hoping to support cxb5...
475,23,32,Rc1+,b'8/3b3k/N2p3p/1p2p1bP/2P1P3/8/PPK1R3/2r5 w - -',trapped...
476,23,33,Bg4,b'8/7k/N2p3p/4p1bP/1Kp1P1b1/8/PP2R3/2r5 w - -',Black finishes it off...
477,23,34,Bf4,b'8/7k/N2p3p/4p2P/1Kp1bbR1/8/PP6/2r5 w - -',setting up mate...
478,23,35,c2,b'8/3b3k/3p3p/4p1RP/1K6/1P6/r1p5/8 w - -',White resigns...
479,24,0,e4,b'rnbqkbnr/pppppppp/8/8/4P3/8/PPPP1PPP/RNBQKBNR b KQkq e3',Regular standard king pawn opening 
480,24,1,e5,b'rnbqkbnr/pppp1ppp/8/4p3/4P3/8/PPPP1PPP/RNBQKBNR w KQkq e6',Black replies normally 
481,24,2,Qh5,b'rnbqkbnr/pppp1ppp/8/4p2Q/4P3/8/PPPP1PPP/RNB1KBNR b KQkq -',What in the world have I done.
482,24,3,Nc6,b'r1bqkbnr/pppp1ppp/2n5/4p2Q/4P3/8/PPPP1PPP/RNB1KBNR w KQkq -',Very standard development guarding the e5 pawn 
483,24,4,Bc4,b'r1bqkbnr/pppp1ppp/2n5/4p2Q/2B1P3/8/PPPP1PPP/RNB1K1NR b KQkq -',Threatening mate hopefully not though
484,24,5,g6,b'r1bqkbnr/pppp1p1p/2n3p1/4p2Q/2B1P3/8/PPPP1PPP/RNB1K1NR w KQkq -',Stopped the mate
485,24,6,Qf3,b'r1bqkbnr/pppp1p1p/2n3p1/4p3/2B1P3/5Q2/PPPP1PPP/RNB1K1NR b KQkq -',Threatening mate yet again and the next move is quite surprising. A mate on f7 is a Scholars Mate. I did not think of winning my 1st team match with a slightly delayed scholars mate!!!!
486,24,7,Nd4,b'r1bqkbnr/pppp1p1p/6p1/4p3/2BnP3/5Q2/PPPP1PPP/RNB1K1NR w KQkq -',"???????????????????????????????????????????????????????????????????????????????????????????????????????????? I have gone crazy after this. I checked for a trick, but nope."
487,24,8,Qxf7#,b'r1bqkbnr/pppp1Q1p/6p1/4p3/2BnP3/8/PPPP1PPP/RNB1K1NR b KQkq -',Sorry archangel_777. Delayed scholars mate
488,25,0,Bf5,b'rn1qkbnr/ppp1pppp/8/3p1b2/3P4/4P3/PPP2PPP/RNBQKBNR w KQkq -',"White has prepared c4, by playing e3 first: not only a loss of tempo, but also blocking Bc1; that is why I always play Bc8 first..."
489,25,1,Bg6,b'rn1qkbnr/ppp1pppp/6b1/3p4/3P4/3BP3/PPP2PPP/RNBQK1NR w KQkq -',"after Bxg6, always hxg6, opening up the h-file..."
490,25,2,e6,b'rn1qkbnr/ppp2ppp/4p1b1/3p4/3P1P2/3BP3/PPP3PP/RNBQK1NR w KQkq -',Black was going to play e6 anyway: also releasing Bf8...
491,25,3,h6,b'rn1qkbnr/ppp2pp1/4p1bp/3p4/3P1P2/3BPN2/PPP3PP/RNBQK2R w KQkq -',take out Ng5...
492,25,4,c3,b'rn1qk2r/ppp1npp1/4p1bp/3pP3/3P4/2PBP3/PP4PP/RNBQ1RK1 b kq -',"White could make it more difficult for Black with Bxg6, fxg6, prohibiting castling short for a while longer: this move is weak; why not c4?"
493,25,5,1Qg4,b'rn1q1rk1/1pp3p1/p3p1pp/3nP3/3P2Q1/2P5/PP4PP/RNB2RK1 b - -',attacking e6 and g6: but there is hardly a problem for Black...
494,25,6,Nb4,b'rn4k1/1pp3p1/p3p2p/4Pp2/1nPP4/8/PP4PP/RNB3K1 w - -',getting himself in trouble...
495,25,7,2Ba3,b'3r2k1/2p3p1/2n1p2p/1p2Pp2/3P4/BP1n4/P1N3PP/1R4K1 b - -',"White has to give up the center, before things get out of hand..."
496,25,8,c5,b'6k1/6p1/4p2p/1pprPp2/8/BP1n4/P5PP/3R1K2 w - c6',"just in time, Black closes all gaps..."
497,25,9,3bxa4,b'6k1/6p1/4p2p/2B1Pp2/P7/8/4K1PP/r7 b - -',White might have tried b4: but the Black pawn is too dangerous...
498,25,10,g5,b'6k1/8/4p2p/2B1Ppp1/r7/5K2/6PP/8 w - g6',"the rest, is a matter of technique..."
499,25,11,Ke4,b'8/8/3Bp2p/4P3/r3k1p1/6P1/5K2/8 w - -',Black is rapidly developing mating potential...
500,25,12,Kf3,b'8/8/3Bp2p/4P3/6p1/5kP1/r7/5K2 w - -',g3 will fall: it is over; White resigned...
501,26,0,f5,b'rnbqkbnr/ppppp1pp/8/5p2/3P4/8/PPP1PPPP/RNBQKBNR w KQkq f6',"the signature move: stronger than one might imagine, this turns things into a flank opening..."
502,26,1,c4,b'rnbqkbnr/ppppp1pp/8/5p2/2PP4/8/PP2PPPP/RNBQKBNR b KQkq c3',a logical continuation: White is contesting the center...
503,26,2,c6,b'rnbqkbnr/pp1pp2p/2p3p1/5p2/2PP4/2N5/PP2PPPP/R1BQKBNR w KQkq -',prophylactic: mostly controlling Nc3...
504,26,3,Bf4,b'rnbqk1nr/pp1pp1bp/2p3p1/5p2/2PP1B2/2N2N2/PP2PPPP/R2QKB1R b KQkq -',there is no use in occuping square g5: h6 will spoil all efforts...
505,26,4,d6,b'rnbq1rk1/pp2p1b1/2pp1npp/5p2/2PP1B2/2NBPN2/PP3PPP/R2Q1RK1 w - -',Black is preparing action on square e5: but not yet there...
506,26,5,Qc2,b'rnbq1rk1/pp2p1b1/2pp1npp/5p2/2PP1B2/2NBPN2/PPQ2PPP/R4RK1 b - -',"finishing development, and preparing e4..."
507,26,6,Qe8,b'rnb1qrk1/pp2p1b1/2pp1npp/5p2/2PP1B2/2NBPN2/PPQ2PPP/R4RK1 w - -',preparing e5...
508,26,7,Ng4,b'rnb1qrk1/pp2p1b1/2pp2pp/5p2/2PP1Bn1/2NBPN2/PPQ2PPP/4RRK1 w - -',"whatever happens, Black is ready for e5: covered four times..."
509,26,8,g5,b'rnb1qrk1/pp2p1b1/2pp3p/5pp1/2PP2n1/2NBPNB1/PPQ2PPP/4RRK1 w - -',relentless...
510,26,9,f4,b'rnb1qrk1/pp2p1b1/2pp3p/6p1/2PP1pn1/2NBPNBP/PPQ2PP1/4RRK1 w - -',fearless...
511,26,10,e5,b'rnb1qrk1/pp4b1/2pp3p/4p3/2PP1p2/2NB3P/PPQ2PPN/4RRK1 w - e6',there it is...
512,26,11,2f3,b'rnq2r1k/pp4bB/2p4p/3pp3/2PP1p2/5P1P/PPQ3PN/4RRK1 b - -',this time against e5-e4: Bh7 is getting in trouble...
513,26,12,2Qe8,b'rn2qr1k/pp4bB/2p4p/3pp3/2PP1p2/5P1P/PPQ3PN/4RRK1 w - -',supporting e4...
514,26,13,2dxe5,b'rn2qr1k/pp4bB/2p4p/3pP3/2P2p2/5P1P/PPQ3PN/4RRK1 b - -',forced: but this pawn will never make the difference...
515,26,14,d4,b'r3qr1k/pp4b1/2p1Pn1p/5B2/2Pp1p2/5P1P/PPQ3PN/4RRK1 w - -',"after c6-c5, Black is clearly better: after that, Nf6-h5-g3 looks promising..."
516,26,15,2c5,b'r3qr1k/pp4b1/2p1Pn1p/2P2B2/3p1p2/5P1P/PPQ3PN/4RRK1 b - -',"inaccurate: Blacks' next move, will put Bf5 under pressure..."
517,26,16,Qe7,b'r4r1k/pp2q1b1/2p1P2p/2P5/3pBp2/1Q3P1P/PP4P1/4RNK1 w - -',some of the order is restored...
518,26,17,3Bxb7,b'3r3k/1B4b1/4P2p/2r5/3p1p2/5P1P/6P1/4RNK1 b - -',White is still a pawn ahead: but his position is falling apart...
519,26,18,Kg7,b'4r3/4P1k1/7p/2r5/3bBp2/3p1P1P/6P1/4RN1K w - -',shutting off Bg6...
520,26,19,3Bxd3,b'4r3/4P1k1/7p/2r5/3b1p2/3B1P1P/6P1/4RN1K b - -',greed before the fall...
521,26,20,3Be3,b'4r3/4P1k1/7p/2r5/5p2/3BbP1P/6P1/4RN1K w - -',shutting off e7 from its' defense: Re8 cannot be attacked...
522,26,21,4Nxe3,b'4r3/4P1k1/7p/2r5/5p2/3BNP1P/6P1/4R2K b - -',a terrible move: e7 cannot be saved...
523,26,22,4Rxe7,b'8/4r1k1/7p/2r5/5p2/3BNP1P/6P1/4R2K w - -',ough...
524,26,23,4Nc2,b'8/4r1k1/7p/2r5/5p2/3B1P1P/2N3P1/4R2K b - -',White is lucky to have this move left...
525,26,24,Re8,b'4r3/8/6kp/8/5p2/5P1P/5KP1/5B2 w - -',locking up the White King...
526,26,25,Kg3,b'8/8/8/8/5pB1/5PkP/r7/4K3 w - -',Black is developing mating potential rapidly...
527,26,26,Rh2,b'8/8/8/7P/5pB1/4kP2/7r/3K4 w - -',Black has no moves left: his Bishop is shut off...
528,26,27,Kd3,b'8/8/8/7P/5pB1/3k1P2/7r/2K5 w - -',"White has to break up this sequence: after Kd1, Rh1 mate, after Kb1, Kc3, the same problem; the Bishop has to act somewhere, but will it help?"
529,26,28,Kc3,b'8/8/8/5B1P/5p2/2k2P2/7r/2K5 w - -',"trapped: Rh1 mate, so White has to run..."
530,26,29,Ke3,b'8/8/8/8/5pB1/4kP2/4r3/5K2 w - -',White resigned...
531,27,0,d6,b'r1bqkbnr/pp2pppp/2np4/2p5/4PP2/5N2/PPPP2PP/RNBQKB1R w KQkq -',the GPA variation against the Sicilian: one of my favorite games...
532,27,1,d3,b'r1bqkb1r/pp2pppp/2np1n2/2p5/4PP2/2PP1N2/PP4PP/RNBQKB1R b KQkq -',never play e5 here...
533,27,2,g3,b'r1bqkb1r/pp3ppp/2np1n2/2p1p3/4PP2/2PP1NP1/PP5P/RNBQKB1R b KQkq -',you might win a full tempo in development...
534,27,3,Bxf4,b'r1bqkb1r/pp3ppp/2np1n2/2p5/4PB2/2PP1NP1/PP5P/RN1QKB1R b KQkq -',like this...
535,27,4,Bg2,b'r1bqkb1r/pp3pp1/2np1n1p/2p5/4PB2/2PP1NP1/PP4BP/RN1QK2R b KQkq -',preparing castling...
536,27,5,Be3,b'r1bqkb1r/pp3p2/2np1n1p/2p3p1/4P3/2PPBNP1/PP4BP/RN1QK2R b KQkq -',"no sweat yet: after Ng4, Bf2..."
537,27,6,1O-O,b'r1bqkb1r/pp3p2/3p1n1p/2p1n1p1/4P3/2PPBNP1/PP4BP/RN1Q1RK1 b kq -',Black has nothing: apart from being behind in development...
538,27,7,1Nxe5,b'r1bqkb1r/pp3p2/3p3p/2p1N1p1/4P1n1/2PPB1P1/PP4BP/RN1Q1RK1 b kq -',"after Nxe3, Nxf7: in a heartbeat..."
539,27,8,1Nxe5,b'r1bqkb1r/pp3p2/3p3p/2p1n1p1/4P3/2PPB1P1/PP4BP/RN1Q1RK1 w kq -',Black has got the message...
540,27,9,1d4,b'r1bqkb1r/pp3p2/3p3p/2p1n1p1/3PP3/2P1B1P1/PP4BP/RN1Q1RK1 b kq -',harassing the Knight...
541,27,10,1Nc4,b'r1bqkb1r/pp3p2/3p3p/2p3p1/2nPP3/2P1B1P1/PP4BP/RN1Q1RK1 w kq -',the losing move: I rest my case...
542,27,11,1Qa4+,b'r1bqkb1r/pp3p2/3p3p/2p3p1/Q1nPP3/2P1B1P1/PP4BP/RN3RK1 b kq -',Black resigns...
543,28,0,d4,b'rnbqkbnr/pppppppp/8/8/3P4/8/PPP1PPPP/RNBQKBNR b KQkq d3',I am white now
544,28,1,Qd7,b'rnb1kb1r/pp1qp1pp/2pp1n2/5p2/2PP4/2N3P1/PP2PPBP/R1BQK1NR w KQkq -',"Once again, thematic(done right now)"
545,28,2,1O-O,b'r1b2rk1/p2qb1pp/n1pppn2/5p2/2P2B2/2N1P1P1/PP2NPBP/R2Q1RK1 b - -',2 O-Os in a row!
546,28,3,1Ne4c3,b'r1b2rk1/p2qb1pp/2p1pn2/3p4/1nP2B2/2N3P1/PP2NPBP/R2Q1RK1 b - -',I know the notation looks weird...
547,28,4,Rab8,b'1r3rk1/p2qb1pp/b3pn2/3p4/5B2/P1Nn2P1/1P1QNPBP/R4RK1 w - -',??
548,28,5,1Bxb8,b'1B3rk1/p2qb1pp/b3pn2/3p4/8/P1Nn2P1/1P1QNPBP/R4RK1 b - -',Bye bye rook
549,28,6,2Nxf6+,b'1r4k1/p3b1pp/b3pN2/3q4/3p4/P2n2P1/1P1QNPBP/1R3RK1 b - -',Discovered check with fork
550,28,7,2Bxd5,b'1r4k1/p3b2p/b3pp2/3B4/3p4/P2n2P1/1P1QNP1P/1R3RK1 b - -',Bye bye queen
551,28,8,2Nxd4,b'1r4k1/p3b2p/b4p1Q/3pn3/3N4/P5P1/1P3P1P/1R3RK1 b - -',The sacrifice. I hoped it would work.
552,28,9,Bf8,b'1r3bk1/p6p/4Np1Q/3pn3/8/P5P1/1P3P1P/1R3bK1 w - -',Nope!
553,28,10,2Rxf1,b'1r3bk1/p6p/4NQn1/3p4/8/P5P1/1P3P1P/5RK1 b - -',+8
554,28,11,2f5,b'5bk1/pr5p/4NQn1/3p1P2/8/P5P1/1P5P/5RK1 b - -',"Get out of my life, knight!"
555,28,12,2Rf7,b'5bk1/p4r1p/4NQn1/3p1P2/8/P5P1/1P5P/5RK1 w - -',He’s smarter than that
556,28,13,3Qg5,b'5bk1/p4r1p/4N1n1/3p1PQ1/8/P5P1/1P5P/5RK1 b - -',Now mr. knight is pinned!
557,28,14,3a5,b'5bk1/5r1p/4N1n1/p2p1PQ1/8/P5P1/1P5P/5RK1 w - a6',?
558,28,15,Rg7,b'5bk1/6r1/4N1Q1/p2p4/8/P5P1/1P5P/5RK1 w - -',Blocked
559,28,16,3Rxf8#,b'5Rk1/6r1/4N1Q1/p2p4/8/P5P1/1P5P/6K1 b - -',Not for long. Checkmate!!
560,29,0,b3,b'rnbqkbnr/pp1ppp1p/6p1/2p5/4P3/1P3N2/P1PP1PPP/RNBQKB1R b KQkq -',"a new twist: in fact, enforcing an early d4..."
561,29,1,c3,b'rnbqk1nr/pp1pppbp/6p1/2p5/4P3/1PP2N2/P2P1PPP/RNBQKB1R b KQkq -',cleverly done: but it hinders the natural development of Whites' Queens' wing; Black will use that...
562,29,2,e6,b'rnbqk1nr/pp1p1pbp/4p1p1/2p5/4P3/1PP2N2/P2P1PPP/RNBQKB1R w KQkq -',"following the lines of the Hungarian variation on the Sicilian: the object is Ne7, 0-0, d5..."
563,29,3,d4,b'rnbqk1nr/pp1p1pbp/4p1p1/2p5/3PP3/1PP2N2/P4PPP/RNBQKB1R b KQkq d3',as was to be expected: c5 gets dissolved...
564,29,4,cxd4,b'rnbqk1nr/pp1p1pbp/4p1p1/8/3pP3/1PP2N2/P4PPP/RNBQKB1R w KQkq -',forced...
565,29,5,cxd4,b'rnbqk1nr/pp1p1pbp/4p1p1/8/3PP3/1P3N2/P4PPP/RNBQKB1R b KQkq -',maybe best: White needs Nc3...
566,29,6,a6,b'rnbqk2r/1p1pnpbp/p3p1p1/8/3PP3/1PN2N2/P4PPP/R1BQKB1R w KQkq -',"this is were the Najdorf extension comes in handy: square b5 is a very important square, in any Sicilian..."
567,29,7,Bd3,b'rnbqk2r/1p1pnpbp/p3p1p1/8/3PP3/1PNB1N2/P4PPP/R1BQK2R b KQkq -',Black is about to castle: so White has to at least prepare that too...
568,29,8,d5,b'rnbqk2r/1p2npbp/p3p1p1/3p4/3PP3/1PNB1N2/P4PPP/R1BQK2R w KQkq d6',but Black decides different: made possible by a6; because otherwise Bb5+ would really be a problem for Black...
569,29,9,O-O,b'rnbqk2r/1p2npbp/p3p1p1/3p4/3PP3/1PNB1N2/P4PPP/R1BQ1RK1 b kq -',"no use in exd5, exd5..."
570,29,10,O-O,b'rnbq1rk1/1p2npbp/p3p1p1/3p4/3PP3/1PNB1N2/P4PPP/R1BQ1RK1 w - -',"a very important position: White has to decide what to do, but has little time left..."
571,29,11,1Bg5,b'rnbq1rk1/1p2npbp/p3p1p1/3p2B1/3PP3/1PNB1N2/P4PPP/R2Q1RK1 b - -',development: but not without any consequences...
572,29,12,1f6,b'rnbq1rk1/1p2n1bp/p3ppp1/3p2B1/3PP3/1PNB1N2/P4PPP/R2Q1RK1 w - -',"simple, yet very effective: first e4-e5, would have been an option..."
573,29,13,1Be3,b'rnbq1rk1/1p2n1bp/p3ppp1/3p4/3PP3/1PNBBN2/P4PPP/R2Q1RK1 b - -',"Bh4 is unholy too: Bf4, would surely induce e6-e5..."
574,29,14,1b5,b'rnbq1rk1/4n1bp/p3ppp1/1p1p4/3PP3/1PNBBN2/P4PPP/R2Q1RK1 w - b6',"making use, of the temperary status quo: taking away possible White moves..."
575,29,15,1Qc2,b'rnbq1rk1/4n1bp/p3ppp1/1p1p4/3PP3/1PNBBN2/P1Q2PPP/R4RK1 b - -',"supporting e4, no doubt..."
576,29,16,1Bb7,b'rn1q1rk1/1b2n1bp/p3ppp1/1p1p4/3PP3/1PNBBN2/P1Q2PPP/R4RK1 w - -',so let's return the favor...
577,29,17,1Ne2,b'rn1q1rk1/1b2n1bp/p3ppp1/1p1p4/3PP3/1P1BBN2/P1Q1NPPP/R4RK1 b - -',"not sure, if this is the move: giving up the c-file, with a Queen on it; this is asking for troble..."
578,29,18,1Nd7,b'r2q1rk1/1b1nn1bp/p3ppp1/1p1p4/3PP3/1P1BBN2/P1Q1NPPP/R4RK1 w - -',"serving mutliple purposes: Black controls the center, to begin with; and Rc8 is a nasty threat..."
579,29,19,1Qd2,b'r2q1rk1/1b1nn1bp/p3ppp1/1p1p4/3PP3/1P1BBN2/P2QNPPP/R4RK1 b - -',maybe preparing a trade on h6...
580,29,20,1f5,b'r2q1rk1/1b1nn1bp/p3p1p1/1p1p1p2/3PP3/1P1BBN2/P2QNPPP/R4RK1 w - -',"a little trick, I learned from my former team captain: sadly, he forgot about it (see also the previous annotation)..."
581,29,21,Nxf5,b'r2q1rk1/1b1n2bp/p3p1p1/1p1p1n2/3P4/1P1BBN2/P2QNPPP/R4RK1 w - -',"making Bh6 impossible, and attacking Be3..."
582,29,22,Bf6,b'r2q1rk1/1b1n3p/p3pbp1/1p1p1nB1/3P4/1P1B1N2/P2QNPPP/R4RK1 w - -',no solution here either...
583,29,23,1Rac1,b'r2q1r2/1b1n2kp/p4bp1/1p1p1pB1/3P4/1P1B1N2/P2Q1PPP/2R2RK1 b - -',not donating much at all...
584,29,24,1Nb6,b'r2q1r2/1b4kp/pn3bp1/1p1p1pB1/3P4/1P1B1N2/P2Q1PPP/2R2RK1 w - -',Black still has to finish development: the Black Queen needs a purpose; but White is helping with that one...
585,29,25,2Ne5,b'r4r2/1b4kp/pn3qp1/1p1pNp2/3P4/1P1B4/P2Q1PPP/2R2RK1 b - -',"trying to break iron, with bare hands..."
586,29,26,2Rac8,b'2r2r2/1b4kp/pn3qp1/1p1pNp2/3P4/1P1B4/P2Q1PPP/2R2RK1 w - -',Nc6 is not really a threat: but Black needs to simplify...
587,29,27,2Nf3,b'2r2r2/1b4kp/pn3qp1/1p1p1p2/3P4/1P1B1N2/P2Q1PPP/2R2RK1 b - -',White needs to tackle the weakness of d4: costing tempo...
588,29,28,Rc8,b'2r5/1b4kp/pn3qp1/1p1p1p2/3P4/1P1B1N2/P2Q1PPP/2R3K1 w - -',Black has the space and the play: time to equalize...
589,29,29,Qc6,b'8/1b4kp/pnq3p1/1p1p1p2/3P4/1P1B1N2/P4PPP/2Q3K1 w - -',practically forced: this will at least lead to a draw...
590,29,30,Kg8,b'6k1/1b5p/p1q3p1/1p1pQp2/3P4/1P1B4/P4PPP/6K1 w - -',"Black is holding ground: now, White has to reckon with Qc1+..."
591,29,31,Bc8,b'2b3k1/7p/p1q3p1/1p1pQp2/3P2P1/1P1B4/P4P1P/6K1 w - -',a trick: White tries to overpower the Kings' wing by force...
592,29,32,Qc1+,b'2b3k1/7p/p5p1/1p1pQP2/3P4/1P1B4/P4P1P/2q3K1 w - -',"only to cut, in his own flesh..."
593,29,33,3Bf1,b'2b3k1/7p/p5p1/1p1pQP2/3P4/1P6/P4P1P/2q2BK1 b - -',"not really an option is Kg2, Qg5+: this is not much better..."
594,29,34,3Bxf5,b'6k1/7p/p5p1/1p1pQb2/3P4/1P6/P4P1P/2q2BK1 w - -',White is in trouble: Black is threatening mate after Qg5...
595,29,35,Qb1,b'6k1/7p/p5p1/1p1p1b2/3P4/1P4Q1/P4P1P/1q3BK1 w - -',a waiting move: White can afford very little; Bd3 is already a killer...
596,29,36,Kg7,b'1Q6/6kp/p5p1/1p1p1b2/3P4/1P6/P4P1P/1q3BK1 w - -',relentless: but White does not give up that easly...
597,29,37,3Qxd5,b'8/7p/p5pk/1p1Q1b2/3P4/1P6/P4P1P/1q3BK1 b - -',"forced: White has to return, to cover for Bf1; or else Bd3 is lethal..."
598,29,38,3Qxa2,b'8/7p/p5pk/1p1Q1b2/3P4/1P6/q4P1P/5BK1 w - -',"winning the pawn back, and keeping up the threat..."
599,29,39,3Qf3,b'8/7p/p5pk/1p3b2/3P4/1P3Q2/q4P1P/5BK1 b - -',forcing this one...
600,29,40,3Qc2,b'8/7p/p5pk/1p3b2/3P4/1P3Q2/2q2P1P/5BK1 w - -',covering the Bishop
601,29,41,Kg7,b'8/6kp/p5p1/1p3b2/3P1Q2/1P6/2q2P1P/5BK1 w - -',a dangerous attempt from White; there are few checks left...
602,29,42,Kf6,b'8/7p/p4kp1/1p1Q1b2/3P4/1P6/2q2P1P/5BK1 w - -',relentless...
603,29,43,4Qxa6,b'8/7p/Q5p1/1p3bk1/3P4/1P6/2q2P1P/5BK1 b - -',a miscalculation...
604,29,44,Qc1+,b'8/7p/1Q4p1/1B3bk1/3P4/8/5P1P/2q3K1 w - -',"Bf1, will fail after Bd3..."
605,29,45,4Kg2,b'8/7p/1Q4p1/1B3bk1/3P4/8/5PKP/2q5 b - -',but this will too...
606,29,46,Qg4#,b'8/7p/1Q4p1/1B4k1/3Pb1q1/7K/5P1P/8 w - -',and resigned...
607,30,0,e4,b'rnbqkbnr/pppppppp/8/8/4P3/8/PPPP1PPP/RNBQKBNR b KQkq e3',"I didn't know how Sasha was going to open.  All I knew was that she defeated stalhandske, which you don't see often.  And, what she did in response to Joann's opening.  "
608,30,1,c5,b'rnbqkbnr/pp1ppppp/8/2p5/4P3/8/PPPP1PPP/RNBQKBNR w KQkq c6',"Not surprisingly, Julio answered with the Sicilian Defense.  It is my favorite defense, but I know that easy-win also plays this a lot because he's played it against me, as well."
609,30,2,Nf3,b'rnbqkbnr/pp1ppppp/8/2p5/4P3/5N2/PPPP1PPP/RNBQKB1R b KQkq -',"Of course, there was always the option of the Open or Closed Sicilian.  Sasha chose the Open Variation which is also what I do."
610,30,3,e6,b'rnbqkbnr/pp1p1ppp/4p3/2p5/4P3/5N2/PPPP1PPP/RNBQKB1R w KQkq -',"But, I am surprised to see this played.  I expected 2...d6 which is what I do, as then I play the Sicilian Nadjorf since it continues with 3.d4 cxd4 4.Nxd4 Nf6 5.Nc3 a6."
611,30,4,d4,b'rnbqkbnr/pp1p1ppp/4p3/2p5/3PP3/5N2/PPP2PPP/RNBQKB1R b KQkq d3',"In contrast to what I posted above, this is what I also would've played.  And, it's just the fact that black advanced his pawn one square.  Since it works, I'd just treat as if it were the first move, and black only advanced the pawn one square.  As d4 is the most common reply."
612,30,5,Nf6,b'rnbqkb1r/pp1p1ppp/4pn2/2p5/3PP3/5N2/PPP2PPP/RNBQKB1R w KQkq -',I was not surprised to see Julio developing.
613,30,6,e5,b'rnbqkb1r/pp1p1ppp/4pn2/2p1P3/3P4/5N2/PPP2PPP/RNBQKB1R b KQkq -',"I would've pinned with 4.Bg5 first.  But, I like this move better because instead of breaking it passively, which is what I do, black could do it aggressively with 4...h6.  And, I learned that taking a more aggressive approach to breaking a pin is usually better in a training game with kenneth_fiore_3.  But, this gives Sasha a tempo right away since Julio will be busy defending."
614,30,7,Nd5,b'rnbqkb1r/pp1p1ppp/4p3/2pnP3/3P4/5N2/PPP2PPP/RNBQKB1R w KQkq -',"Protecting his N and avoiding exchanges, but it's going to give Sasha another tempo."
615,30,8,dxc5,b'rnbqkb1r/pp1p1ppp/4p3/2P1P3/1nP5/5N2/PP3PPP/RNBQKB1R b KQkq -',"And, Sasha exchanges right away since it was her center pawn.  This gives brings her closer to controlling the center.  Plus, it will give her, yet, another tempo when all is said and done."
616,30,9,Nc3,b'rnbqk2r/pp1p1ppp/2n1p3/2b1P3/2P5/P1N2N2/1P3PPP/R1BQKB1R b KQkq -',"Meanwhile, Sasha continues with her development."
617,30,10,O-O,b'rnbq1rk1/pp1p1ppp/2n1p3/2b1P3/2P5/P1N2N2/1P3PPP/R1BQKB1R w KQ -',"And, this is also what I would've played as black.  Since I try to castle, ASAP.  In fact, that's one reason that I still play the Spanish Opening, as opposed to, the Guaco Piano.  The thing I don't like is after 3.Bb5, black can play 3...a6 which forces white to exchange N for B.  But, if black plays the Berlin Defense with 3...Nf6, 4.0-0 is the most common move."
618,30,11,Bd3,b'rnbq1rk1/pp1p1ppp/2n1p3/2b1P3/2P5/P1NB1N2/1P3PPP/R1BQK2R b KQ -',"In the meantime, Sasha is preparing to do the same thing by continuing with her development."
619,30,12,f6,b'rnbq1rk1/pp1p2pp/2n1pp2/2b1P3/2P5/P1NB1N2/1P3PPP/R1BQK2R w KQ -',"On the other hand, I don't like this move.  In fact, I don't know why Julio played this, but it leaves his K vulnerable to exposure after Sasha exchanges since this is his weakest pawn on the chess board.  Instead, I would've fianchettoed with 9...b6 to allow 10...Bb7.  "
620,30,13,1Ne4,b'rnb2rk1/pp1p2pp/2n1pq2/2b5/2P1N3/P2B1N2/1P3PPP/R1BQK2R b KQ -',"As one example of my last post, the Q is forced which allows Sasha to complete her development at once, whereas, Julio still has 2 pieces undeveloped.  And, she'll take advantage of that to attack his Q, again.  In return, blacks K will, officially, be exposed."
621,30,14,Bxf2+,b'rnb2rk1/pp1pq1pp/2n1p3/6B1/2P1N3/P2B1N2/1P3bPP/R2QK2R w KQ -',"?? Julio played this because he thought that it won a piece.  I'm familiar with that method as it's very similar to how I thought against blitzkov during the misstep, which he annotated.  But, like that game, black had no backup for the B.  So, it was just one attacker against 2 defenders, and the result is that this will cost him a piece for pawn.  That's a major advantage for white, especially at her rating."
622,30,15,1b4,b'rnb2rk1/pp1p2pp/2n1p3/2q3B1/1PP5/P2B1N2/5NPP/R2QK2R b KQ b3',"And, Sasha increases her advantage by attacking the Q ahead.  And, when he retreats, she'll go back on the attack again.  Not only is she 2 points up, but as noted before, Julio is yet to develop his other pieces."
623,30,16,1O-O,b'rnb2rk1/ppqp2pp/2n1p3/2P3B1/1P6/P2B1N2/5NPP/R2Q1RK1 b - -',"And, Sasha uses that time to castle."
624,30,17,1Ne5,b'rnb2rk1/ppqp2pp/4p3/2P1n1B1/1P6/P2B1N2/5NPP/R2Q1RK1 w - -',"Julio played this because it forks.  However, that fork also allows Sasha to exchange which is to her benefit since she is ahead.  With that being said, she plays the exact same move that I also would've played, as white, in this position."
625,30,18,1Qh5,b'rnb2rk1/pp1p2pp/4p3/2P1q1BQ/1P6/P2B4/5NPP/R4RK1 b - -',"I am very familiar with this move.  As we saw with 2 annotations, first bhidragon played something like this for a winning attack.  Then, Stanley did that last Friday when I took the B.  While it might not seem so since Julio will attack the Q, this is a winning attack for Sasha.  As this will allow her to swarm in with her other pieces against his monarch.  "
626,30,19,1Qh4,b'rnb2rk1/pp1p3p/4p1p1/2P1q1B1/1P5Q/P2B4/5NPP/R4RK1 b - -',"With that being said, I would've continued with 19.Qh6, but I like this move just as well, especially since her Nf2 is about to become a monster."
627,30,20,1Nc6,b'r1b2rk1/pp1p3p/2n1p1p1/2P1q1B1/1P5Q/P2B4/5NPP/R4RK1 w - -',"Continuing with his development, but it's too little too late because of Sasha's next move."
628,30,21,2Ng4,b'r1b2rk1/pp1p3p/2n1p1p1/2P1q1B1/1P4NQ/P2B4/6PP/R4RK1 b - -',"And, it's not just because the Q is attacked.  But, the overall picture is that Sasha going after Julio's K in a very similar manner to how Stanley went against my K."
629,30,22,2Qd4+,b'r1b2rk1/pp1p3p/2n1p1p1/2P3B1/1P1q2NQ/P2B4/6PP/R4RK1 w - -',Julio tries to stop it by placing Sasha in check...
630,30,23,2Be3,b'r1b2rk1/pp1p3p/2n1p1p1/2P5/1P1q2NQ/P2BB3/6PP/R4RK1 b - -',"But, Sasha fights back by interposing with her DSB.  What's more is that she's giving up her Bd3 for an inevitable mating sequence."
