,gid,aid,move,fen,annotation
310,9,68,4Qa7,b'2q1r1k1/QR3p1p/3BpPp1/3r4/4N1P1/1KP5/1P5P/8 b - -',preparing beautifully for the finish
311,9,69,4Ra5,b'2q1r1k1/QR3p1p/3BpPp1/r7/4N1P1/1KP5/1P5P/8 w - -',my final offer of sacrifice was not taken and I resign. Well played Dave! 
312,9,70,4Qb6,b'2q1r1k1/1R3p1p/1Q1BpPp1/r7/4N1P1/1KP5/1P5P/8 b - -',The end.
313,10,0,e4,b'rnbqkbnr/pppppppp/8/8/4P3/8/PPPP1PPP/RNBQKBNR b KQkq e3',Mala la 16. Ce2.
314,10,1,Qe8,b'r3qrk1/pp2b1p1/2pp1n1p/4p3/4P3/2N1BQ1P/PPP2PP1/R4RK1 w - -',No me gustaron las jugadas que van desde Df3 (no es lugar para una dama) g4 y Ce2.
315,10,2,1Ne2,b'r4rk1/pp2b1p1/2pp1nqp/4p3/4P1P1/4BQ1P/PPP1NP2/R4RK1 b - -',Acá inventé un acierto donde en realidad había un error ajeno. Es inexplicable Ch7. Corresponde Dxe4 o bien Cxe4
316,10,3,2Bxg5,b'4rrk1/pp4pn/2pp2qp/6B1/4P1P1/7P/PPP1N1Q1/R4RK1 b - -',Acá se equivoca. Al cambiar alfiles no percibe que traigo otra pieza para capturar en e4. Era correcta 20. Cc3
317,10,4,3Rd4,b'8/p7/1ppk3p/3p2p1/PP1R1rP1/2P4P/8/3K4 b - -',En el partido pensé que no podía capturar. Ilusión óptica. Se captura y sigue c5. El cambio es forzado y el final de reyes se gana caminando de espaldas.
318,10,5,3Rd3,b'8/p7/1ppk3p/3p2p1/PP4P1/2PR1r1P/8/3K4 b - -',Bueno como dijo ella estaba cansada. Igual el negro ya ganó.
319,10,6,5Kb1,b'8/8/p6p/P5p1/2k3P1/2p5/8/1K6 b - -',Otro error. Acá gano simplemente jugando Rd3 53 Rb1 c2. El rey debe mover y juego Rd2 asegurando la coronación.
320,10,7,Kf4,b'8/8/p6p/P5p1/2K2k2/8/8/8 w - -',
321,11,0,d6,b'rnbqkbnr/ppp2ppp/3p4/8/4Pp2/5N2/PPPP2PP/RNBQKB1R w KQkq -',Perhaps not the best developing move; a minor piece may have been better.
322,11,1,h6,b'rnbqkbnr/ppp2pp1/3p3p/8/2B1Pp2/5N2/PPPP2PP/RNBQK2R w KQkq -',? The Queen already guards against the Knight's advance plus Black has still not developed any pieces other than pawns.
323,11,2,Qe1,b'rnbqkbnr/ppp2p2/3p3p/6p1/2B1Pp2/5N2/PPPP2PP/RNB1QRK1 b kq -',Allowing the possibility of Nh5 should the g pawn advance and putting pressure on the uncastled King.
324,11,3,O-O-O,b'2kr2nr/1pp1qpb1/p1np3p/6p1/1PBPPpb1/B1P2N2/P2N2PP/R3QRK1 w - -',Gutsy move; the Black King is now isolated from the majority of his own forces whereas White has pieces ready to attack in the quadrant. Nf6 may have been better followed by 0-0.
325,11,4,1Bxc6,b'2kr3r/1pp1qpb1/p1Bp1n1p/6p1/1P1PPpb1/B1P2N2/P2N2PP/R3QRK1 b - -',! An even exchange that also demolishes the Black King's pawn protection.
326,11,5,Kb7,b'3r3r/1kp1qpb1/p1pp1n1p/6p1/1P1PPpb1/B1P2N2/P2NQ1PP/R4RK1 w - -',Black has no other piece to come to the aid of the a pawn.
327,11,6,1Rae1,b'3r3r/1kp1qpb1/p1pp1n1p/6p1/1P1PPpb1/B1P2N2/P2NQ1PP/4RRK1 b - -',White bolsters the e file.
328,11,7,1Nd7,b'3r3r/1kpnqpb1/p1pp3p/6p1/1P1PPpb1/B1P2N2/P2NQ1PP/4RRK1 w - -',Moving some forces to assist the isolated King.
329,11,8,1Nc4,b'3r3r/1kpnqpb1/p1pp3p/6p1/1PNPPpb1/B1P2N2/P3Q1PP/4RRK1 b - -',"White eyes a knight check with 17. Na5 to begin a Queen-side assault.
if 17. Na5+ The Black King has not positive response. 17...Ka7 or Kb8 leads to 18. Nxc6 winning the Black Queen.
if 17. Na5+ Ka8 then 18. Qxa6+ Kb8 19. Nxc6 ++
if 17. Na5+ Kc8 then 18. Qxa6+ Kb8 19. Nxc6 ++

Black needs to marshal more forces to his Queen-side to prevent the White Queen from joining the fray."
330,11,9,1Nb6,b'3r3r/1kp1qpb1/pnpp3p/6p1/1PNPPpb1/B1P2N2/P3Q1PP/4RRK1 w - -',"?? Black responds by presenting no defense other than a hope of escape for the King via the d7 square.
16...Nb8 provides the same escape route but also protects the a6 pawn.
16...Ra8 also provides an escape route and protects the a6 pawn.

Either move was preferable."
331,11,10,1Na5+,b'3r3r/1kp1qpb1/pnpp3p/N5p1/1P1PPpb1/B1P2N2/P3Q1PP/4RRK1 b - -',White launches the final assault. Black's best option now is to flee by playing 17...Kc8 an move towards the d7 escape square. Unfortunately that allows 18. Nxc6! forking the Q and R (not 18.Qxa6+? which gains only a pawn and allows the Black King to escape form pressure).
332,11,11,1Nxc6,b'2kr3r/2p1qpb1/pnNp3p/6p1/1P1PPpb1/B1P2N2/P3Q1PP/4RRK1 b - -',As projected; Black now drops the R for the white N at best.
333,11,12,1Qd7,b'2kr3r/2pq1pb1/pnNp3p/6p1/1P1PPpb1/B1P2N2/P3Q1PP/4RRK1 w - -',??? Black cuts off his King's only escape route.
334,11,13,1Qxa6#,b'2kr3r/2pq1pb1/QnNp3p/6p1/1P1PPpb1/B1P2N2/P5PP/4RRK1 b - -',"White seals the deal by bringing the Queen into the fray at the optimum moment.


In summary Black made a lot of early pawn moves at the expense of his development.
He castled into a sea of enemy forces then blocked his own defenses and finally trapped his King in a fatal position.
White was lucky here as Black's errors did more to determine the outcome than White's own efforts did."
335,12,0,c5,b'rnbqkbnr/pp3ppp/4p3/2ppP3/3P4/8/PPP2PPP/RNBQKBNR w KQkq c6',The struggle for occupation of the center by Pawns starts at once.
336,12,1,cxd4,b'r1b1kbnr/pp3ppp/1qn1p3/3pP3/3p4/2PB1N2/PP3PPP/RNBQK2R w KQkq -',After this White is able to maintain his center Pawns but only with some loss of time showing that 6 B-K2 would have been better. His Q Pawn however becomes permanently backward.
337,12,2,Bd7,b'r3kbnr/pp1b1ppp/1qn1p3/3pP3/3P4/3B1N2/PP3PPP/RNBQK2R w KQkq -',Not 7... NxP 8 NxN QxN 9 B-N5 ch. But now the threat to the Q pawn is very real.
338,12,3,1Kf1,b'r3k2r/pp1b1ppp/1qn1p3/3pPn2/1b1P4/1P3N2/PB2BPPP/RN1Q1K1R b kq -',The price White has to pay for the defence of his center Pawns is loss of the right to castle since a Knight on either Q2 or QB3 would cut off one of the defences of the Q Pawn.
339,12,4,1Be7,b'r3k2r/pp1bbppp/1qn1p3/3pPn2/3P4/1P3N2/PB2BPPP/RN1Q1K1R w kq -',The Bishop has performed one task and now retires in order to solidify Black's game. White's N-N5 is prevented while his P-KN4 can now be answered with N-R5.
340,12,5,a5,b'r3k2r/1p1bbppp/1qn1p3/p2pPn2/3P4/1P3NP1/PB2BP1P/RN1Q1K1R w kq a6',Threatening to destroy White's Q side with P-R5 thus revealing another weakness which has sprung from the defence of the Q Pawn.
341,12,6,Nb4,b'2r1k2r/1p1bbppp/1q2p3/pB1pPn2/Pn1P4/1P3NP1/1B3P1P/RN1Q1K1R w k -',Avoiding the dangers of 14... O-O 15 B-Q3 with concealed pressure on Black's KR Pawn.
342,12,7,1Bxd7+,b'2r1k2r/1p1Bbppp/1q2p3/p2pPn2/Pn1P4/1P3NP1/1B3P1P/RN1Q1K1R b k -',Black now has the initiative for if White plays the natural looking 15 N-B3 Black continues 15... BxB 16 NxB N-B7 threatening N-K6 ch.
343,12,8,Nc6,b'2r4r/1p1kbppp/1qn1p3/p2pPn2/P2P4/1PN2NP1/1B3P1P/R2Q1K1R w - -',From this point on White is made to feel the weakness of his Q Pawn. Here Black makes use of it in order to clear the QB file for his Rooks.
344,12,9,1Qd3,b'2r4r/qp1kbppp/4p3/p2pPn2/P2P4/1P1Q1NP1/1B3P1P/R4K1R b - -',Black threatened with ...Q-R3 ch to put pressure on the white squares which would have left White deplorably short of moves.
345,12,10,1Qa6,b'2r4r/1p1kbppp/q3p3/p2pPn2/P2P4/1P1Q1NP1/1B3P1P/R4K1R w - -',At the cost of doubling his Rook's Pawns he exposes the white QN pawn to attack and asserts his control over the only open file.
346,12,11,2Bc1,b'7r/3kbppp/p3p3/p2pPn2/P2P4/1P3NP1/2r2PKP/R1B4R b - -',Not B-R3 because of 22... BxB 23 RxB N-K6ch 24 K-R3 RxP.
347,12,12,Rb2,b'8/3kbppp/p3p3/B2pPn2/P2P4/5NP1/1r3PKP/7R w - -',Black has eliminated his weakness in the Q side Pawns and now threatens N-K6 ch again. The text move is stronger than R-R6 at once when White could reply 27 R-QN1 with an open file for his own Rook. If now 27 R-QB1 N-K6 ch 28 K-N1 N-B5.
348,12,13,Bb4,b'8/3k1ppp/p3p3/3pPn2/Pb1P4/5NP1/1r1B1PKP/7R w - -',Not ...NxQP [hoping for 28 NxN RxB] because of 28 B-B3.
349,12,14,h6,b'8/3k1pp1/p3p2p/3pPn2/Pb1P1B2/5NP1/1r3PKP/7R w - -',Preparing P-N4 with a general restriction of White's game.
350,12,15,Rc4,b'8/3k1pp1/p1n1p2p/3pP3/PbrP2P1/B4N2/5PKP/R7 w - -',The renewed threat to the Q Pawn now restricts White still further.
351,12,16,3Rb1,b'8/3k1pp1/p1n1p2p/3pP3/P2P2P1/2r2N2/5PKP/1R6 b - -',He has no way of avoiding the forking of two pawns by ...R-B5.
352,12,17,3g5,b'8/2k2pp1/p1n1p2p/3pP1P1/P2P4/2r2N2/5PKP/1R6 b - -',Fighting against the threatened slow death he tries to free his game. A possible continuation would be 36... P-KR4 37 P-N6 PxP 38 N-N3 NxQP 39 R-Q1 R-B5 40 RxN RxR 41 NxP ch winning so it can be seen that White's bid for freedom is not entirely without teeth.
353,12,18,3a5,b'8/2k2p2/p1n1p2p/P2pP3/2rP4/5N2/5PKP/1R6 b - -',The doomed Pawn is to be given up in the best possible way. If now 38... NxRP 39 R-R1 K-N3 40 R-N1 ch K-R2 and Black's King is out of play.
354,12,19,4Rd1,b'8/2k2p2/p1n1p2p/3pP3/3P2K1/r4N2/5P1P/3R4 b - -',To free his Knight from the defence of the Q Pawn and so allow his King to advance on the weakened black Pawns.
355,12,20,Nf5,b'8/2k2p2/p3p2p/3pPn2/3P2KP/1r6/5P2/3RN3 w - -',Now the K side Pawns are supported and the threat to White's Q Pawn in no way diminished.
356,12,21,a5,b'8/2k2p2/4p2p/p2pPn2/3P2KP/1r1N4/5P2/3R4 w - -',Not ...NxP 45 N-B5 R-N4 46 NxRP ch.
357,12,22,4Rb1,b'8/2k2p2/4p2p/p1NpPn2/3P2KP/2r5/5P2/1R6 b - -',Faced with an impending loss owing to the adance of the QR Pawn he gives up any further attempt to hold the Q Pawn and plays solely for a desperate counter-attack.
358,12,23,Rc8,b'1Rrk4/5p2/N3p2p/p2pP3/3n2KP/8/5P2/8 w - -',Not ...K-K2 49 R-N7 ch K-B1 50 N-B7 threatening 51 R-N8 ch K-N2 52 N-K8 ch K-N3 53 P-R5 ch K-R2 54 N-B6 ch K-N2 55 R-N8 mate.
359,12,24,5Nb5,b'2r2k2/1R3p2/4p2p/pN1pP3/3n2KP/8/5P2/8 b - -',Conceding that Black's defences have held for if 51 K-R5 N-B4 52 K-N5 R-B5 threatening ...RxP mate.
360,12,25,Kh7,b'8/7k/4p2p/3pP2K/r6P/8/p7/R7 w - -',Showing the neat timing of his previous move.
361,12,26,6Rg1,b'8/7k/4p2p/3pP2K/r6P/8/p7/6R1 b - -',A last desperate trap...
362,12,27,Kh8,b'7k/6R1/4p2p/3pP2K/r6P/8/8/q7 w - -',...which Black avoids. KxR would be stalemate. White resigns.
363,13,0,d4,b'rnbqkbnr/pppppppp/8/8/3P4/8/PPP1PPPP/RNBQKBNR b KQkq d3',so i will prepare my stonewall easily...
364,13,1,d5,b'rnbqkb1r/ppp2ppp/4pn2/3p4/3P4/3BP3/PPP2PPP/RNBQK1NR w KQkq d6',for the moment nothing special whith blacks they develop so so i do !
365,13,2,Nc6,b'r1bqkb1r/ppp2ppp/2n1pn2/3p4/3P1P2/3BP3/PPP3PP/RNBQK1NR w KQkq -',"at this moment ihave a risk:if i go on developping the g knight to f3 they can attack my d3 bishop whith the knight. This is very embarasting for stonewall because the bishop is very important in this attack. 
i take the risk to keep speed development so instead  of moving c3 to stop any black knight in b4 i just go on developing the g knight"
366,13,3,Nb4,b'r1bqkb1r/ppp2ppp/4pn2/3p4/1n1P1P2/3BPN2/PPP3PP/RNBQK2R w KQkq -',so here we are ! bloody knight whant to kill my plans. I have the idea to move first my bishop to b5 so he will have2 options : moving c7 and block the knight or move back his knight!
367,13,4,c6,b'r1bqkb1r/pp3ppp/2p1pn2/1B1p4/1n1P1P2/4PN2/PPP3PP/RNBQK2R w KQkq -',blocking the kniht i will kick it !
368,13,5,Be2,b'r1bqkb1r/pp3ppp/2p1pn2/3p4/1n1P1P2/4PN2/PPP1B1PP/RNBQK2R b KQkq -',loosing some tempo anyway but my bishop is still active there
369,13,6,a5,b'r1bqkb1r/1p3ppp/2p1pn2/p2p4/1n1P1P2/4PN2/PPP1B1PP/RNBQK2R w KQkq a6',for nothing
370,13,7,c3,b'r1bqkb1r/1p3ppp/2p1pn2/p2p4/1n1P1P2/2P1PN2/PP2B1PP/RNBQK2R b KQkq -',finishing my stonewall attack
371,13,8,Na6,b'r1bqkb1r/1p3ppp/n1p1pn2/p2p4/3P1P2/2P1PN2/PP2B1PP/RNBQK2R w KQkq -',now i can double his paw on a colon exchanging bishop whith knight but i have better to do whith my bishop
372,13,9,h6,b'r1bqkb1r/1p3pp1/n1p1pn1p/p2p4/3P1P2/2P1PN2/PP2B1PP/RNBQ1RK1 w kq -',passive move has no interest
373,13,10,1Qe1,b'r1bqkb1r/1p3pp1/n1p1pn1p/p2p4/3P1P2/2P1PN2/PP2B1PP/RNB1QRK1 b kq -',preraring the attack...
374,13,11,1Bd7,b'r2qkb1r/1p1b1pp1/n1p1pn1p/p2p4/3P1P2/2P1PN2/PP2B1PP/RNB1QRK1 w kq -',maybe he waspreparing to castle in queen side ?
375,13,12,1Nbd2,b'r2qkb1r/1p1b1pp1/n1p1pn1p/p2p4/3P1P2/2P1PN2/PP1NB1PP/R1B1QRK1 b kq -',now i can attack ...
376,13,13,1a3,b'r2qkb1r/3b1pp1/n1p1pn1p/pp1p4/3P1P2/P1P1PN2/1P1NB1PP/R1B1QRK1 b kq -',first anticipate b4
377,13,14,1Ne5,b'r2qkb1r/2nb1pp1/2p1pn1p/pp1pN3/3P1P2/P1P1P3/1P1NB1PP/R1B1QRK1 b kq -',here we are ! 
378,13,15,1Qg3,b'r2qk2r/2nb1pp1/2pbpn1p/pp1pN3/3P1P2/P1P1P1Q1/1P1NB1PP/R1B2RK1 b kq -',threath on g7 he will sure castle !
379,13,16,1O-O,b'r2q1rk1/2nb1pp1/2pbpn1p/pp1pN3/3P1P2/P1P1P1Q1/1P1NB1PP/R1B2RK1 w - -',now his king is mine !
380,13,17,1Bd3,b'r2q1rk1/2nb1pp1/2pbpn1p/pp1pN3/3P1P2/P1PBP1Q1/1P1N2PP/R1B2RK1 b - -',going back to his attack position
381,13,18,1Be8,b'r2qbrk1/2n2pp1/2pbpn1p/pp1pN3/3P1P2/P1PBP1Q1/1P1N2PP/R1B2RK1 w - -',to late black sir !
382,13,19,Be7,b'r2qbrk1/2n1bpp1/2p1pn1p/pp1pN3/3P1P2/P1PBP2Q/1P1N2PP/R1B2RK1 w - -',for nothing...
383,13,20,1g4,b'r2qbrk1/2n1bpp1/2p1pn1p/pp1pN3/3P1PP1/P1PBP2Q/1P1N3P/R1B2RK1 b - g3',here i am !!!
384,13,21,1Nh7,b'r2qbrk1/2n1bppn/2p1p2p/pp1pN3/3P1PP1/P1PBP2Q/1P1N3P/R1B2RK1 w - -',no enought
385,13,22,1g5,b'r2qbrk1/2n1bppn/2p1p2p/pp1pN1P1/3P1P2/P1PBP2Q/1P1N3P/R1B2RK1 b - -',so what whould you do now ? any idea?
386,13,23,1g6,b'r2qbrk1/2n1bp1n/2p1p1pp/pp1pN1P1/3P1P2/P1PBP2Q/1P1N3P/R1B2RK1 w - -',certainely no this ! loosing move
387,13,24,1Qxh6,b'r2qbrk1/2n1bp1n/2p1p1pQ/pp1pN1P1/3P1P2/P1PBP3/1P1N3P/R1B2RK1 b - -',i will bring my rook in 2 moves
388,13,25,1f6,b'r2qbrk1/2n1b2n/2p1pppQ/pp1pN1P1/3P1P2/P1PBP3/1P1N3P/R1B2RK1 w - -',ho ! but this is better for me mate in some 4 or 5 moves
389,13,26,2Qxg6+,b'r2q1rk1/2n1b2n/2p1ppQ1/pp1p2P1/3P1P2/P1PBP3/1P1N3P/R1B2RK1 b - -',so ? did you appreciate this game ?
390,14,0,f5,b'rnbqkbnr/ppp1p1pp/8/3p1p2/3P1B2/8/PPP1PPPP/RN1QKBNR w KQkq f6',A strong move in my opinion rarely played against which I am not really prepared. 
391,14,1,Bd6,b'rnbqk2r/ppp3pp/3bpn2/3p1p2/3P1B2/4PN2/PPPN1PPP/R2QKB1R w KQkq -',Now the challenge I expect in this kind of opening. 
392,14,2,Ne5,b'rnbqk2r/ppp3pp/3bpn2/3pNp2/3P1B2/4P3/PPPN1PPP/R2QKB1R b KQkq -',I like this move. Specially when the black knight is on f6. 
393,14,3,O-O,b'rnbq1rk1/ppp3pp/3bpn2/3pNp2/3P1B2/4P3/PPPN1PPP/R2QKB1R w KQ -',Normally I play the pawn in g4 but now... and to prepare it with h3 is delaying my developement. 
394,14,4,Be2,b'rnbq1rk1/ppp3pp/3bpn2/3pNp2/3P1B2/4P3/PPPNBPPP/R2QK2R b KQ -',That leaves me behind in my plan to castle queenside in order to be free to attack his kingside. But you can't have it all. That darn pawn in f5 is a good soldier!
395,14,5,Nbd7,b'r1bq1rk1/pppn2pp/3bpn2/3pNp2/3P1B2/4P3/PPPNBPPP/R2QK2R w KQ -',Black's compressed power is growingly slowly. But with this move he have to think about what happens if he moves the c pawn (say c5) and my knight jumps to f7 since his bishop is undefended. Nothing definite still. 
396,14,6,g4,b'r1bq1rk1/pppn2pp/3bpn2/3pNp2/3P1BP1/4P3/PPPNBP1P/R2QK2R b KQ g3',You play for a win. Even with a stronger opponent. 
397,14,7,Bxg4,b'r1bq1rk1/pppn2pp/3bpn2/3pN3/3P1BB1/4P3/PPPN1P1P/R2QK2R b KQ -',I'm pretty sure he didn't expect this planned continuation. Obviously if I take with the knight the following exchanged would have been in black's favour so I opted for losing the nice bishop's pair  but keep the initiative on the g column. A strong attack with its counters. 
398,14,8,1Qg2,b'r1bq1rk1/ppp3pp/3bpn2/3pN3/3P1B2/4P3/PPPN1PQP/R3K2R b KQ -',Here the queen is safe and prepares to put pressure on g7.  
399,14,9,1Rg1,b'r1bq1rk1/ppp3pp/3bp3/3pN3/3PnB2/4P3/PPPN1PQP/R3K1R1 b Q -',Of course. Running. 
400,14,10,1Ndf3,b'r1b2rk1/ppp3pp/3bpq2/3pN3/3PnB2/4PN2/PPP2PQP/R3K1R1 b Q -',"Here the first mistake. I had to exchange the knight and take the pawn. Good for me. I played the knight thinking about anything to ""brake"" black's defences. Black overlooked Bb4+ and I can't play c3 (Nxc3 with fork to follow). True I planned to move theking just to e2 overlooking the dangerous b6 (for Ba6+)."
401,14,11,1Bxe5,b'r1b2rk1/ppp3pp/4pq2/3pb3/3PnB2/4PN2/PPP2PQP/R3K1R1 w Q -',This move actually helps me. But it is hard to decide which is the best piece to  retake. 
402,14,12,1Bxe5,b'r1b2rk1/ppp3pp/4pq2/3pB3/3Pn3/4PN2/PPP2PQP/R3K1R1 b Q -',It can't be bad. Of course if QxN Qxg7#
403,14,13,1Qg6,b'r1b2rk1/ppp3pp/4p1q1/3pB3/3Pn3/4PN2/PPP2PQP/R3K1R1 w Q -',Oh yes. So I have to lose a tempo exchanging? No way sir. You'll lose that time. 
404,14,14,1O-O-O,b'r1b2rk1/ppp3pp/4p1q1/3pB3/3Pn3/4PN2/PPP2PQP/2KR2R1 b - -',Preventing any possible hit on c2 but specially RxN... but I overlooked
405,14,15,g6,b'r1b2rk1/ppp4p/4p1p1/3pB3/3Pn3/4PN2/PPP2PRP/2KR4 w - -',It is interesting to see if white's compensation is enough after RxN. 
406,14,16,1Rdg1,b'r1b2rk1/ppp4p/4p1p1/3pB3/3Pn3/4PN2/PPP2PRP/2K3R1 b - -',I just blundered again. But it is not easy for white to breack the barrier without all his forces. 
407,14,17,1Rg2xg6+,b'r1b3k1/ppp4p/4p1R1/3pB3/3Pn3/4Pr2/PPP2P1P/2K3R1 b - -',Desperation. 
408,14,18,Kd7,b'r1b3R1/pppk4/4p3/3pB3/3Pn3/4Pr2/PPP2P1P/2K5 w - -',NOw black thinks he is going to escape to c6. But I prefer to leave his pieces just as they are because they are very cramped. So may be a hope.
409,14,19,2h6,b'r1b3R1/pppk4/4p2P/3pB3/3Pn3/1P2r3/PKP5/8 b - -',And here my opponent slipped the rook to f3 instead ofh3. What do you think? Could white have survived this? Thank you for reading I hope you enjoyed it. 
410,14,20,2h7,b'r1b3R1/pppk3P/4p3/3pB3/3Pn3/1P3r2/PKP5/8 b - -',
411,15,0,e4,b'rnbqkbnr/pppppppp/8/8/4P3/8/PPPP1PPP/RNBQKBNR b KQkq e3',Book move
412,15,1,e5,b'rnbqkbnr/pppp1ppp/8/4p3/4P3/8/PPPP1PPP/RNBQKBNR w KQkq e6',Book move
413,15,2,Nf3,b'rnbqkbnr/pppp1ppp/8/4p3/4P3/5N2/PPPP1PPP/RNBQKB1R b KQkq -',"Book move
"
414,15,3,Nf6,b'rnbqkb1r/pppp1ppp/5n2/4p3/4P3/5N2/PPPP1PPP/RNBQKB1R w KQkq -',"Book move

My prefered opening during situations like this. Risky but if played well I believe it is better than the Nc6 response.
"
415,15,4,Nc3,b'rnbqkb1r/pppp1ppp/5n2/4p3/4P3/2N2N2/PPPP1PPP/R1BQKB1R b KQkq -',"Book Move 

More safe play then the exchange that devolpes another piece. This response is the most common
"
416,15,5,Nc6,b'r1bqkb1r/pppp1ppp/2n2n2/4p3/4P3/2N2N2/PPPP1PPP/R1BQKB1R w KQkq -',"Book move

Occasionaly I will play Bb4."
417,15,6,Bc4,b'r1bqkb1r/pppp1ppp/2n2n2/4p3/2B1P3/2N2N2/PPPP1PPP/R1BQK2R b KQkq -',"Basic response fights for controll of the center.
"
418,15,7,Bc5,b'r1bqk2r/pppp1ppp/2n2n2/2b1p3/2B1P3/2N2N2/PPPP1PPP/R1BQK2R w KQkq -',Symmetrical mimic works fair in this situation.
419,15,8,Ng5,b'r1bqk2r/pppp1ppp/2n2n2/2b1p1N1/2B1P3/2N5/PPPP1PPP/R1BQK2R b KQkq -',Aggressive move attacking the king's castle side while threating the f pawn. Also common play.
420,15,9,O-O,b'r1bq1rk1/pppp1ppp/2n2n2/2b1p1N1/2B1P3/2N5/PPPP1PPP/R1BQK2R w KQ -',Perhaps unsafe but if the exchange is made on f7 I will sustain more controll then my opponent. Threatens exposing the kingnthough..
421,15,10,O-O,b'r1bq4/pppp1kpp/2n2n2/2b1p3/4P3/2N5/PPPP1PPP/R1BQ1RK1 b - -',Opposition castles into saftey seeing no quick way to exploit my army.
422,15,11,d6,b'r1bq4/ppp2kpp/2np1n2/2b1p3/4P3/2N5/PPPP1PPP/R1BQ1RK1 w - -',Provides support for my central pieces a well as devolpes a opening for my bishop.
423,15,12,Nd5,b'r1bq4/ppp2kpp/2np1n2/2bNp3/4P3/8/PPPP1PPP/R1BQ1RK1 b - -',Creats an central outpost from the supporting f-pawn. I thought thisbwould occur.
424,15,13,Be6,b'r2q4/ppp2kpp/2npbn2/2bNp3/4P3/8/PPPP1PPP/R1BQ1RK1 w - -',Devolps the bishop to a very mobile square while threating the knight.
425,15,14,1d3,b'r2q4/ppp2kpp/2npbn2/2bNp3/4P3/3P4/PPP2PPP/R1BQ1RK1 b - -',Opens up the bishops file but neglects to counter the threat posed last move. Perhaps c4 would have been better.
426,15,15,1Bxd5,b'r2q4/ppp2kpp/2np1n2/2bbp3/4P3/3P4/PPP2PPP/R1BQ1RK1 w - -',Takes advantage of the mistake preparing for a material advantage while still maintaining central dominance.
427,15,16,1Qh5+,b'r2q4/ppp2kpp/2np4/2bnp2Q/8/3P4/PPP2PPP/R1B2RK1 b - -',Aggressive move deploys the queen and opens up the rooks file after the bishop is moved.
428,15,17,1Kg8,b'r2q2k1/ppp3pp/2np4/2bnp2Q/8/3P4/PPP2PPP/R1B2RK1 w - -',Moves my king away to safety from for checks.
429,15,18,1Qf3,b'r2q2k1/ppp3pp/2np4/2bnp3/8/3P1Q2/PPP2PPP/R1B2RK1 b - -',Attacks my central knight.
430,15,19,Bxe3,b'5rk1/ppp2qp1/3p4/4p2p/4Q3/P2nb3/1P2nPPP/1R3R1K w - -',
431,16,0,e6,b'rnbqkb1r/ppp2ppp/4pn2/3P4/8/5N2/PPPP1PPP/RNBQKB1R w KQkq -',I have more and more doubts about the Icelandic Gambit. 
432,16,1,h3,b'rn1qkb1r/ppp2ppp/4bn2/8/8/5N1P/PPPP1PP1/RNBQKB1R b KQkq -',Not as strong as other moves but still it will help white's position later. 
433,16,2,Bd6,b'rn1qk2r/ppp2ppp/3bbn2/8/8/5N1P/PPPP1PP1/RNBQKB1R w KQkq -',I have no other good square to get the bishop out. Both in c5 or b4 it will be easily and usefully kicked away by white. 
434,16,3,Qe7,b'rn2k2r/ppp1qppp/3bbn2/8/8/2N2N1P/PPPP1PP1/R1BQKB1R w KQkq -',"Instead of protecting my bishop pair with a3 (avoiding Nb5) I go for the typical ""Icelandic Threat"". "
435,16,4,d4,b'rn2k2r/ppp1qppp/3bbn2/8/3P4/2N2N1P/PPP2PP1/R1BQKB1R b KQkq d3',White falls for it. Now black has to choose whether if to go for the pawn with Bxh6+ taking advantage of the fact that if white shields with the bishop apparently Bxg2 wins a piece that seemed good but what after white shields with the dsb? I could leave him an useful semiopen column to his advantage in the future.
436,16,5,Bc4+,b'rn2k2r/ppp1qppp/3b1n2/8/2bP4/2N2N1P/PPP2PP1/R1BQKB1R w KQkq -',So I played this one. 
437,16,6,Be3,b'rn2k2r/ppp1qppp/3b1n2/8/2bP4/2N1BN1P/PPP2PP1/R2QKB1R b KQkq -',Obviously. Here you can see why h3 wasn't such a bad move. 
438,16,7,Bxf1,b'rn2k2r/ppp1qppp/3b1n2/8/3P4/2N1BN1P/PPP2PP1/R2QKb1R w KQkq -',Well: there is a chance that he retakes with the rook - better for me I thought - or with the king. 
439,16,8,Rxf1,b'rn2k2r/ppp1qppp/3b1n2/8/3P4/2N1BN1P/PPP2PP1/R2QKR2 b Qkq -',So I though this was better for me because of...
440,16,9,Bf4,b'rn2k2r/ppp1qppp/5n2/8/3P1b2/2N1BN1P/PPP2PP1/R2QKR2 w Qkq -',It looks promising doesn't it?
441,16,10,1Qd2,b'rn2k2r/ppp1qppp/5n2/8/3P1b2/2N1BN1P/PPPQ1PP1/R3KR2 b Qkq -',Ok but in fact... what will happen? White will castle queenside and I will have nothing. This starts to look suspicious. I have to find an alternate plan but where?
442,16,11,1O-O,b'rn3rk1/ppp1qppp/5n2/8/3P1b2/2N1BN1P/PPPQ1PP1/R3KR2 w Q -',At a loss I castled. Instead of developing. Maybe trying to castle queenside would have been wiser. 
443,16,12,Bd6,b'rn3rk1/ppp1qppp/3b1n2/8/3P4/2N1BN1P/PPPQ1PP1/2KR1R2 w - -',I'll dreamed to redirect my forces against the enemy's king but with no solid plan. It was a mistake since white does have one. 
444,16,13,1Bg5,b'rn3rk1/ppp1qppp/3b1n2/6B1/3P4/2N2N1P/PPPQ1PP1/2KR1R2 b - -',Correctly. Now I have to sweat to control Nd5 and I didn't. 
445,16,14,1h6,b'rn3rk1/ppp1qpp1/3b1n1p/6B1/3P4/2N2N1P/PPPQ1PP1/2KR1R2 w - -',I couldn't calculate it accurately but I hoped that if Nd5 I could have been doomed with the opening of my king's pawn's shield. Maybe better would have been c6. 
446,16,15,1Bh4,b'rn3rk1/ppp1qpp1/3b1n1p/8/3P3B/2N2N1P/PPPQ1PP1/2KR1R2 b - -',Tempting me to go g4 to sacrifice. I am not sure but I preferred not to risk too much. 
447,16,16,1Nbd7,b'r4rk1/pppnqpp1/3b1n1p/8/3P3B/2N2N1P/PPPQ1PP1/2KR1R2 w - -',This has the counter to leave the queen with few squares to go after Rd1. But I hoped that with correct play I could have survived. Suddenly I am in serious danger. 
448,16,17,1Nd5,b'r4rk1/pppnqpp1/3b1n1p/3N4/3P3B/5N1P/PPPQ1PP1/2KR1R2 b - -',Qe6 or Qe4 were good to analyze but not on a blitz for me...
449,16,18,Nxf6,b'r2q1rk1/ppp2pp1/3b1n1p/8/3P3B/5N1P/PPPQ1PP1/2KR1R2 w - -',That was a mistake on white's side. Now the situation is the same but white doesn't have any knight to press f6. And black's pawns are still in their place. 
450,16,19,Be7,b'r2q1rk1/ppp1bpp1/5n1p/8/3P3B/5N1P/PPPQ1PP1/2K1RR2 w - -',"This is the way I thought I could get out of here. After c4 Nd5 and... ""atomic bomb"": changes will start and I think we could end roughly ""even""... but for the ""residual advantages"" I couldn't calculate..."
451,16,20,Qd5,b'r4rk1/ppp1bpp1/5n1p/3qN3/3P3B/7P/PPPQ1PP1/2K1RR2 w - -',Time to go to attack. Two pawns at the same time. 
452,16,21,1f4,b'r4rk1/ppp1bpp1/5n1p/3qN3/3P1P1B/7P/PPPQ2P1/2K1RR2 b - f3',Strong move I would say. I'm not sure if Qxa7 is wise after Qc3 my queen is doing little job up there while white's attack goes on undisturbed. 
453,16,22,1Ne4,b'r4rk1/ppp1bpp1/7p/3qN3/3PnP1B/7P/PPPQ2P1/2K1RR2 w - -',"So I threw in this ""atomic bomb"": it forces a plethora of exchanges whose tactic are fun and interesting to analyze. I threat a queen but white has BxB for free and then BxR. On the other side the Knight has NxR on the next move so it won't work for white. He has to move the queen and in doing so he must threat the knight so to keep the balance after BxBh4. Now I think that I would have played c4 as white as a way to create complications. It is then black that has to consider BxB cxQ BxR but it is a dead end. Otherwise NxQ cxQ NxR BxB Re8 losing the exchange... very funny. "
454,16,23,1Qd3,b'r4rk1/ppp1bpp1/7p/3qN3/3PnP1B/3Q3P/PPP3P1/2K1RR2 b - -',White goes for this one. 
455,16,24,1Bxh4,b'r4rk1/ppp2pp1/7p/3qN3/3PnP1b/3Q3P/PPP3P1/2K1RR2 w - -',I like the dsb in this position I'm glad to keep it. 
456,16,25,2Rxe4,b'r4rk1/ppp2pp1/7p/3qN3/3PRP1b/3Q3P/PPP3P1/2K2R2 b - -',Ok. I am -1 and I can't say my position is preferable to white's: he is occupying the center threats c4 with a massive dominance... in other words: I'm not already lost but surely is a line I won't like to repeat. What can I do now? Again Qxa2 seems like desperate. b5 (to counter c4) could be considered. c5 too. Rd8... a lot of moves and a blitz!
457,16,26,2Qxa2,b'r4rk1/ppp2pp1/7p/4N3/3PRP1b/3Q3P/qPP3P1/2K2R2 w - -',Sometimes it is whorthy to sacre the opponent :-)
458,16,27,2g3,b'r4rk1/ppp2pp1/7p/4N3/3PRP1b/3Q2PP/qPP5/2K2R2 b - -',White has a good idea but overlooks a tactical shot.
