,gid,aid,move,fen,annotation
268,7,18,1Bf3,b'r3k2r/ppp2ppp/3b4/4p3/b6q/P4B2/1PpB1PPP/2R1R1K1 b kq -',This is the one threat that I overlooked and I admit that it shouldn't have happened.  Coaches and mentors generally won't overlook threats like that.
269,7,19,1O-O,b'r4rk1/ppp2ppp/3b4/4p3/b6q/P4B2/1PpB1PPP/2R1R1K1 w - -',"? I was more then interested in K safety and guidelines.  The idea being wasn't just to connect R's but the long term plan was to bring both of my R's on one file as that's known to be dangerous. That's how Jack defeated me despite being down a Q early on.  I kept it in mind but I now know a weakness at that which I'm familiar with and the same thing happens when playing through GM annotations.  The idea is being able to apply them in your games.  But you have to know when it's too much as overanalyzing can cause problems.  Just like the tempo I lost in that coaching game that you saw.  But a better example was my game against jstevens1 as some of you saw in ""the jkarp campaign""  How did I enable the fork.  Well I saw that Joann's pawn was pinned so I placed my Q there as an extra attacker keeping in mind.  It's mainly because I played through several variations in those GM games where the pawn right near the K is pinned so the variation included bringing that extra piece in the pin.  The only difference which was vital is that there was no safe spot for the K as this was from a private annotation which at the time was my favorite.  But that's because the opponent didn't develop properly so that pin would've been an immediate killer.  But in the game with Joann the K could move and when it did I had to face an awful fork which as she notes that's when it all went downhill.  So the lesson is that sometimes what you see and play through might not be so good in that particular game.  And that applies here with this mistake.  "
270,7,20,e4,b'r4rk1/pBp2ppp/3b4/8/b3p2q/P7/1PpB1PPP/2R1R1K1 w - -',"However I'm aware of the threat and now that I know what's going on this is where I decide to play that.  The idea being as I very recently learned what it actually called a combo.  I always thought it was gambit but it's not.  It's a combo where you sac material sometimes a R or the Q for something much worse.  That's because a common mistake is to take as I've made that mistake before.  The idea being that ""To take is a mistake.""  I anticipated and my calculation was that Sue would play 17.Bxa8 in which case I'd mate very quickly."
271,7,21,1Re3,b'r4rk1/pBp2ppp/3b4/8/b3p2q/P3R3/1PpB1PPP/2R3K1 b - -',"?? But she doesn't.  However this is just as much of a blunder as taking.  In fact I don't know exactly why white played.  But my guess would be to harrass the Q.  However this mistake will result in the same thing that would've occurred if she took.  With that being said mate is now inevitable.  Better was 17.h3 to prevent the threat but best was 17.g3 which also prevents mate but at the same time gains time and wins the R at the same time because I'd have to retreat and then you take.  After which white compensates and gets a little of that advantage back.  @knightrider62: Whenever you play a move you have to ask what's being threatened and where that threat is occuring.  If it's something like where I threaten the K then you have to ""Open Up""  That means move the pawn right where the K sits to ""give it air to breathe.""  In this case I wouldn't be able to check.  But usually they can check and when they do you can get out with the K.  With this move however there is no way out."
272,7,22,Bb5+,b'r4rk1/pBp2ppp/3b4/1b6/4p3/P3R3/1PpB1PPq/2R2K2 w - -',The lessons to learn are consider all threats made by the opponent.
273,7,23,Qh1#,b'r4rk1/pBp2ppp/3b4/1b6/4p3/P3R3/1PpB1PP1/2R1K2q w - -',So there was a lot to learn from this game.  The lessons are consider all threats made by the opponent and follow the guidelines.  In particular don't leave the N on the rim unless there is an extenuating circumstance especially when faced with a threat.  In this case a discover attack that like with Kasporov lost a piece.  @Knightrider62: If you can remember these lessons you'll improve.  And I must say that you have become a better player.  Not just by rating but I looked at a couple of your games and say that you are getting each time.  Just keep on studying remember those lessons and I'm confident that your rating will skyrocket to 1200 sooner then you know it.
274,8,0,c6,b'rnbqkb1r/pp2pppp/2p2n2/3p4/2PP4/5N2/PP2PPPP/RNBQKB1R w KQkq -',Finally I came to a semi-slav.
275,8,1,e6,b'rnbqkb1r/pp3ppp/2p1pn2/3p4/2PP4/2N2N2/PP2PPPP/R1BQKB1R w KQkq -',Although the book recommend dxc I don't like to loose tempo.
276,8,2,h6,b'rnbqkb1r/pp3pp1/2p1pn1p/3p2B1/2PP4/2N2N2/PP2PPPP/R2QKB1R w KQkq -',Forcing 6.Bxf6 Dxf6 and my Queen is creating pression on the week f pawn.
277,8,3,e3,b'rnb1kb1r/pp3pp1/2p1pq1p/3p4/2PP4/2N1PN2/PP3PPP/R2QKB1R b KQkq -',The white is protecting his c pawn.
278,8,4,exd5,b'r1b1kb1r/pp1n1pp1/2p2q1p/3p4/3P4/2N1PN2/PP3PPP/R2QKB1R w KQkq -',Not 8. ... cxd5. Queen on a4 and Bishop on b5 can be very annoying. More than that after 8. ... exd5 and king-side castling my rook on e file can be very dangerous.
279,8,5,Be7,b'r1b1k2r/pp1nbpp1/2p2q1p/3p4/3P4/2N1PN2/PPQ2PPP/R3KB1R w KQkq -',Preparing for castling on kingside.
280,8,6,1h4,b'r1b1k2r/pp1nbpp1/2p2q1p/3p4/3P3P/2N1PN2/PPQ2PP1/R3KB1R b KQkq h3',Loosing time. I think the best is 10.Bd3 0-0 11. 0-0. That was the biggest strategic mistake of the White. And you'll see why.
281,8,7,1Nb6,b'r1b1k2r/pp2bpp1/1np2q1p/3p4/3P3P/2N1PN2/PPQ2PP1/R3KB1R w KQkq -',After 10. h4 the g4 square became very attractive for  the black LSB. And after Nb6 he is ready to jump. 
282,8,8,1Ne5,b'r1b2rk1/pp2bpp1/1np2q1p/3pN3/3P3P/2NBP3/PPQ2PP1/R3K2R b KQ -',The White tries to defend g4 square.
283,8,9,1g4,b'r1b2rk1/pp2bpp1/1n3q1p/2ppN3/3P2PP/2NBP3/PPQ2P2/R3K2R b KQ g3',I think here he pursue to get rid of the dangerous LSB with consecutive Bg5. 
284,8,10,Qf4,b'r1b2rk1/pp2bpp1/1n5p/3pN3/3P1qPP/2NB4/PPQ2P2/R3K2R w KQ -',The Queen start the Black's attack. The pawn on d5 and g5 are in danger.
285,8,11,1Kd1,b'r1b2rk1/pp3pp1/1n5p/3pN3/1b1P1qPP/3B4/PPQ1NP2/R2K3R b - -',This was a big mistake. It starts an avalanche of pins and skews that led to a powerful attack. Now after 16. ... Bxg4 the Night is pinned and will be so till the end.
286,8,12,1a3,b'r4rk1/pp3pp1/1n5p/3p4/1b1P2qP/P2B4/1PQ1NP2/R2K3R b - -',I was afraid of 18. Bh7+ and 19.Qg5 but luckily for me the Black missed it.
287,8,13,1Rg1,b'r4rk1/pp3pp1/1n5p/3p4/1b1P3P/P2B1q2/1PQ1NP2/R2K2R1 b - -',Offering a pawn for free but I had other plans.
288,8,14,2Qb3,b'2r2rk1/pp3pp1/1n5p/3p4/1b1P3P/PQ1B1q2/1P2NP2/R2K2R1 b - -',And the king is in very big troubles. Now I had to prevent Bh7+ loosing my Queen and I did it with Bc3. 
289,8,15,2Bc3,b'2r2rk1/pp3pp1/1n5p/3p4/3P3P/PQbB1q2/1P2NP2/R2K2R1 w - -',Now the white Bishop is unprotected. If the White take on c3 I will regain material with tempo with Qxd3+. The only solution for White is to take away the white Bishop to b5 continuing to control d3.
290,8,16,2bxc3,b'2r2rk1/pp3pp1/1n5p/3p4/3P3P/PQPB1q2/4NP2/R2K2R1 b - -',A definite blunder. What follow was a disaster.
291,8,17,Rfe8,b'2r1r1k1/pp3pp1/1n5p/3p4/3P3P/PQPq4/4NP2/R3K1R1 w - -',The white Knight is completely useless and the pressure on c and e files is literally crushing White's pieces. He must defend the immediate Qxe2#.
292,8,18,Rxc3,b'4r1k1/pp3pp1/1n5p/3p4/3P3P/PQrq4/R3NP2/4K1R1 w - -',I was threatening Rc1#.
293,8,19,Nc4,b'4r1k1/pp3pp1/7p/3p4/2nP3P/P1rq4/RQ2NP2/4K1R1 w - -',"After the game I realized that I was able to play right away 24. ... Rxe2+ 25. Qxe2 Rc1+ 26. Qd1 Rxd1#
"
294,8,20,2Qxb7,b'4r1k1/pQ3pp1/7p/3p4/2nP3P/P1rq4/R3NP2/4K1R1 b - -',Better 25. Qa1 prolongs the agony but not for too long. After 25. Qxb7 White is mated with Rc1. The white Knight didn't move from the opening the Rook hasn't had even the time to move and I think my victory was due to full exploitation of the pinned knight and blocked king. And it all started with an useless move in the opening h4 instead of castling. It was an interesting game with lots of tactical traps that I fully enjoyed.
295,8,21,2Rc1#,b'4r1k1/pQ3pp1/7p/3p4/2nP3P/P2q4/R3NP2/2r1K1R1 w - -',
296,9,0,c4,b'rnbqkbnr/pppppppp/8/8/2P5/8/PP1PPPPP/RNBQKBNR b KQkq c3',The English opening. I couldn't find any games that my opponent previously played so I didn't know what he would play. I had prepared an opening for e4 and d4 but not for c4. I don't know the theory behind it but it's a pretty interesting opening.
297,9,1,c5,b'rnbqkbnr/pp1ppppp/8/2p5/2P5/8/PP1PPPPP/RNBQKBNR w KQkq c6',I decide to play the mirror match up. I was thinking about e5 to go into some sort of reversed Sicilian but didn't feel confident in it.
298,9,2,Bg7,b'r1bqk1nr/pp1pppbp/2n3p1/2p5/2P5/2N3P1/PP1PPPBP/R1BQK1NR w KQkq -',So far every move has been quite natural. The mirror match up apparently turns bad for Black somewhere along the line but I didn't know this at the time of playing. 
299,9,3,d3,b'r1bqk2r/pp1pppbp/2n2np1/2p5/2P5/2NP1NP1/PP2PPBP/R1BQK2R b KQkq -',I raise a question mark behind this move. Yes it's probably main theory in the English ( I haven't checked yet ) but it feels so meek. I suppose this is because I myself play the queen gambit which of course starts with d4 and thus I'm not accustomed to the entire d3 idea.
300,9,4,d5,b'r1bq1rk1/pp2ppbp/2n2np1/2pp4/2P5/2NP1NP1/PP2PPBP/R1BQ1RK1 w - d6',Explosive! This move isn't necessarily the best move but I decided that I didn't want to allow my opponent to be in his comfort zone any longer so i tried breaking open the center. I looked at cxd5 Nxd5 Nxd5 Qxd5 but couldn't find any move dangerous moves after that.
301,9,5,1e4,b'r1b2rk1/pp2ppbp/2n3p1/2pq4/4P3/3P1NP1/PP3PBP/R1BQ1RK1 b - e3',This move is just a plain mistake if you ask me. Not only are you blocking the good diagonal of White's light squared bishop giving it less scope but you also make d3 a target in the future.Yes you get a little center control due to it but I don't consider it adequate compensation.
302,9,6,1Qd8,b'r1bq1rk1/pp2ppbp/2n3p1/2p5/4P3/3P1NP1/PP3PBP/R1BQ1RK1 w - -',I was pondering on retreating to d7 or d6 but I didn't want to obstruct my bishop and if Qd6 is played then he gets Bf4 with tempo which I didn't want to allow so I opt for retreating to d8.
303,9,7,1Rb1,b'r1bq1rk1/pp2ppbp/2n3p1/2p5/4P3/3P1NP1/PP3PBP/1RBQ1RK1 b - -',Another questionable move in my opinion not because it's bad but because there are better alternatives. The idea behind Rb1 is simple. My bishop on g7 is attacking the pawn on b2 and as a result his dark squared bishop can't develop so he plays Rb1 so he can develop it in the future. That being said Qc2 accomplished the exact same thing but also threatens the c5 pawn and develops his queen so I don't understand why he didn't just play Qc2.
304,9,8,1Nb4,b'r1bq1rk1/pp2ppbp/6p1/2p5/1n2P3/3P1NP1/PP3PBP/1RBQ1RK1 w - -',This move ensures I win a pawn since it attacks both a2 and d3 which got weakened as a result of the previous e4 move and he can't defend both. That being said I do still need to be careful when I win a pawn since the knight can become a a subject to pins/skewers and whatnot if it for example were to take on d3.
305,9,9,1Be3,b'r1bq1rk1/pp2ppbp/6p1/2p5/1n2P3/3PBNP1/PP3PBP/1R1Q1RK1 b - -',Questioning my pawn on c5 and preventing Nxa2 due to Bxc5 which gets my knight in awkward position where it has trouble with retreating.
306,9,10,1b6,b'r1bq1rk1/p3ppbp/1p4p1/2p5/1n2P3/3PBNP1/PP3PBP/1R1Q1RK1 w - -',After a long think I end up playing the obvious b6 move. I was thinking whether or not I could get away with for example Nxd3 but for some reason I didn't end up playing it. Maybe because I was scared of moves like Qc2 Nb4 Rfd1 but looking back to it it isn't much to fear. The idea behind b6 is to not only protect c5 and a a result make his dark squared bishop less valuable but also to play Ba6 if he would play d4. Example: 13. d4 Ba6 14. Re1 Nd3 15. Rf1 Nxb2 16. Re1 Nd3. It doesn't win a lot of material for Black but it's something White will have to be wary of for quite some time.
307,9,11,1Ne1,b'r1bq1rk1/p3ppbp/1p4p1/2p5/1n2P3/3PB1P1/PP3PBP/1R1QNRK1 b - -',Not a big fan of this move but it's understandable why he played it. He wants to avoid Nxd3 by defending it as it would give up the little center control he had. That being said a knight on e1 isn't a lot to be scared of.
308,9,12,1Nxa2,b'r1bq1rk1/p3ppbp/1p4p1/2p5/4P3/3PB1P1/nP3PBP/1R1QNRK1 w - -',After a long time of thinking I capture on a2. I was calculating stuff along the lines of 13. Ne1 Nxa2 14. e5 Rb8 15. Qa4 Nb4 16. Qxa7 but found that it isn't really an issue. The White queen isn't helping in his defense over there and I'll be able to win the pawn on e5.
309,9,13,1e5,b'r1bq1rk1/p3ppbp/1p4p1/2p1P3/8/3PB1P1/nP3PBP/1R1QNRK1 b - -',Threatening the rook.
310,9,14,1Qa4,b'1rbq1rk1/p3ppbp/1p4p1/2p1P3/Q7/3PB1P1/nP3PBP/1R2NRK1 b - -',Executing the plan I calculated earlier.
311,9,15,Bf5,b'1r1q1rk1/Q3ppbp/1p4p1/2p1Pb2/1n6/3PB1P1/1P3PBP/1R2NRK1 w - -',This might be an inaccuracy on my part and I wonder if Ba6 isn't better. The reason being because it blocks of the escape of the White queen and maybe it'll be possible in the future to win the queen. The queen would have nowhere to run after Ba6. Bf5 is played to target the weak d3 pawn which is logical enough I suppose.
312,9,16,1Be4,b'1r1q1rk1/Q3ppbp/1p4p1/2p1Pb2/1n2B3/3PB1P1/1P3P1P/1R2NRK1 b - -',A move that emphasizes the situation White is in in my opinion. He needs to make these type of moves since if he waits I'll capture the d-pawn then win the e-pawn trade everything off and you're suddenly down in an endgame with 2 pawns down. Even if it means trading off White's strong bishop he cant' just turtle up and do nothing.
313,9,17,1Bh3,b'1r1q1rk1/Q3ppbp/1p4p1/2p1P3/1n2B3/3PB1Pb/1P3P1P/1R2NRK1 w - -',Targeting the rook on f1 however I think this is a mistake. Not only was Bxe4 probably better but maybe I could have just played Nxd3 here. I didn't go for it since I was a little scared off creating a weakness on the g-file but looking back on it this isn't that big of a deal considering the limited amount of pieces White would have left. I also would be up 2 pawns meaning an easy endgame.
314,9,18,1Ng2,b'1r1q1rk1/Q3ppbp/1p4p1/2p1P3/1n2B3/3PB1Pb/1P3PNP/1R3RK1 b - -',Defending the rook by blocking the diagonal. His knight wasn't that strong on e1 so he might as well trade it for my strong bishop. I realised Bh3 was a mistake shortly after I made the move.
315,9,19,1Kxg2,b'1r1q1rk1/Q3ppbp/1p4p1/2p1P3/1n2B3/3PB1P1/1P3PKP/1R3R2 b - -',I probably would have played Bxg2 to avoid f5 being played with tempo but this is fine too. I understand that he wants to keep his central presence as it's one of the few things White has going for him.
316,9,20,1Bxe5,b'1r1q1rk1/Q3pp1p/1p4p1/2p1b3/1n2B3/3PB1P1/1P3PKP/1R3R2 w - -',Finally capturing the material I could have ( and probably should have ) captured long ago. I was a little hesitant as I was expecting f4 to follow but my plan for f4 was just to play Bg7 once more.
317,9,21,2Rfd1,b'1r1q1rk1/Q3pp1p/1p4p1/2p1b3/1n2B3/3PB1P1/1P3PKP/1R1R4 b - -',Preparing for the d4push and avoiding the loss of the d3 pawn. 
318,9,22,2f5,b'1r1q1rk1/Q3p2p/1p4p1/2p1bp2/1n2B3/3PB1P1/1P3PKP/1R1R4 w - f6',Opening the position. The plan I had in mind was 20. Rfd1 f5 21. Bf3 f4 22. gxf4 Bxf4 23. Bxf4 Rxg4 and suddenly my rook is active. I'll play e6 or e5 in the future and get my queen involved to try for a mating attack.
319,9,23,2Bf3,b'1r1q1rk1/Q3p2p/1p4p1/2p1bp2/1n6/3PBBP1/1P3PKP/1R1R4 b - -',After a long think he retreats to f3. Perhaps he was trying to convince himself of Bb7 but it's far less threatening there then it actually looks so Bf3 is correct in my opinion.
320,9,24,2Bd2,b'1r1q1rk1/Q3p2p/1p4p1/2p1b3/1n3p2/3P1BP1/1P1B1PKP/1R1R4 b - -',After another long think he pulls out Bd2 with the plan of trading my knight for his bishop and creating doubled pawns on the c-file. which are very easy to target.
321,9,25,2Nc2,b'1r1q1rk1/Q3p2p/1p4p1/2p1b3/5p2/3P1BP1/1PnB1PKP/1R1R4 w - -',The plan is simple. Get my knight to d4 trade with his light squared bishop and open up his king to the f-file so fxg3 comes with tempo. That being said I'm not sure why I didn't just play Nxd3. The pin isn't that scary with the bishop blocking the d-file. I suppose I got so focused on my plan that I forgot to search for alternatives which are clearly better.
322,9,26,2b4,b'1r1q1rk1/Q3p2p/1p4p1/2p1b3/1P3p2/3P1BP1/2nB1PKP/1R1R4 b - b3',A little bit tricky mostly because of the a2 square. I didn't want to play Nxb4 because Bxb4 cxb4 Rxb4 follows giving White counter play again. What I should have played here was Nd4 but as I said in the introduction the first 20 or so moves aren't ones I'm proud of. I missed a lot in this game.
323,9,27,2fxg3,b'1r1q1rk1/Q3p2p/1p4p1/2p1b3/1P6/3P1Bp1/2nB1PKP/1R1R4 w - -',I played this move far too quickly convinced that b4 wasn't anything to be scared of. 24. bxc5 gxf2 25.cxb6 doesn't look too horrible after all since Black's pawn is so close to promoting.
324,9,28,2Qa2+,b'1r1q1rk1/4p2p/1p4p1/2p1b3/1P6/3P1Bp1/Q1nB1PKP/1R1R4 b - -',The dreaded move where I lose a knight. Of course you can argue that Black already has compensation for his knight in the form of the pawns he won earlier but it still was a hefty blow to my morale.
325,9,29,2Kh8,b'1r1q1r1k/4p2p/1p4p1/2p1b3/1P6/3P1Bp1/Q1nB1PKP/1R1R4 w - -',Moving out of the check.
326,9,30,2Qxc2,b'1r1q1r1k/4p2p/1p4p1/2p1b3/1P6/3P1Bp1/2QB1PKP/1R1R4 b - -',Capturing my knight. I had lost most of my spirit as I saw 20 minutes left on my clock. However it occurred to me that nearly all of White's pieces are in the same area and aren't capable of protecting the king. I start calculating the rooksac. Of course I would have to chase him for quite a while but as long as I could chase him all the way over the board I was confident to pull something off. A gut feeling so to speak.
327,9,31,2Rxf3,b'1r1q3k/4p2p/1p4p1/2p1b3/1P6/3P1rp1/2QB1PKP/1R1R4 w - -',"Stunning his previously bright face in a look of horror as he mutters something I couldn't hear to himself. ( I assume he muttered something along the lines off ""that lucky son of a ..."" ).

The problem with Rxf3 for White is that he can't really ignore it. If you decide to ignore it with for example bxc5 then Rxf2 follow and my queen will eventually enter the fray via Qd4. As if that isn't bad enough the pawn on the 3th rank can potentially promote if he isn't careful. And even if he finds some way out he's 2 pawn down like before he captured my knight. Therefore it's really hard to resist the temptation of taking the rook. Capture the rook and pray that you can flee somewhere like for example get all the way to the c1 square? Or ignore the rook and go into a lost endgame? None of the options seem appealing he chooses the former."
328,9,32,2Kxf3,b'1r1q3k/4p2p/1p4p1/2p1b3/1P6/3P1Kp1/2QB1P1P/1R1R4 b - -',There's 2 ways of approaching this for Black. Either Qd5+ or Qf8+. I'm pretty sure both of 'em are good but I wanted to prevent the White king to abuse the e-file so I chose the latter.
329,9,33,2Qf8+,b'1r3q1k/4p2p/1p4p1/2p1b3/1P6/3P1Kp1/2QB1P1P/1R1R4 w - -',"Going to e2 gets met with Qxf2+ mate. Going to g2 gets met by the same move after which Kh1 Qxh2/ is checkmate. Going to g4 gets met with Qf5+ After which Kh4 is forced. After that you play Qh5+ which is also checkmate. Ke3 gets met with Qf4+ after which the Qe2 is forced and then you get the same checkmate as if he were to go to e2 immediately. By process of elimination the only safe square for White's king is e4.

"
330,9,34,2Ke4,b'1r3q1k/4p2p/1p4p1/2p1b3/1P2K3/3P2p1/2QB1P1P/1R1R4 b - -',We're going for a walk. 
331,9,35,2Qf5+,b'1r5k/4p2p/1p4p1/2p1bq2/1P2K3/3P2p1/2QB1P1P/1R1R4 w - -',The only place to give check while limiting his options to just 1 square. Qe3 gets met with Qf4 leading to a checkmate explained earlier so e5 is his only square.
332,9,36,Ba1+,b'1r5k/4p2p/1p4p1/2pK1q2/1P6/3P2p1/2QB1P1P/bR1R4 w - -',Opting to move my bishop as far away as possible from the enemy king. Let's say I put my bishop on b2 instead then things can get fishy if he gets his king on b3. Bg7 was also a possibility. ( Note that Bf6 isn't a possibility since my queen will go to the f6 square somewhere in the future. ) At this point of the game I have about 9 minutes left to figure out a winning variation.
333,9,37,2Kc6,b'1r5k/4p2p/1pK3p1/2p2q2/1P6/3P2p1/2QB1P1P/bR1R4 b - -',As sad as it is this is the only move that doesn't immediately loses.. 29. Kc4 b5+ 30. Kb3 Qd5+ 31. Qc4 bxc4+ for example and White's future looks bleak. No matter where he goes checks will follow and checkmate seems unavoidable.
334,9,38,2Rc8+,b'2r4k/4p2p/1pK3p1/2p2q2/1P6/3P2p1/2QB1P1P/bR1R4 w - -',This move took me 8 of my remaining 9 minutes trusting on the 30 second increment per move to keep me from timing out while I work out the rest of the puzzle on the go. Other options were for example Qc8+ but then a draw by repetition seems unavoidable Qe6+ but I don't want him to flee via Kb5-> Kc4 and I don't have an immediate way to keep on checking his king without a draw by repetition. Because of all this I opt for Rc8+ 
335,9,39,3Kxb6,b'2r4k/4p2p/1K4p1/2p2q2/1P6/3P2p1/2QB1P1P/bR1R4 b - -',Moving his king to b5 would have meant I'd play c4 with discovered check. ( not cxb4 as his pawn on b4 is more of a hindrance for him then a strength ). after which he can play a5 that gets met by Ra8#. Moving to a6 instead of a5 gets met by moves like Qe6+ and if I get my queen on c6 then it's fair to say that White's king is dead. If he were to go try and escape via b5 then I'd play c4 again and White's king it in for a bad time checkmate is unavoidable in that position. Kxb6 is the most prolonging move.
336,9,40,3Qf6+,b'2r4k/4p2p/1K3qp1/2p5/1P6/3P2p1/2QB1P1P/bR1R4 w - -',Putting the king in check once again. Going 30.Kb5 means I plays Qc6+. After he moves to c4 I play bxc4+ which is a discovered check. If he plays Kb3 I plays Qxc2+ which is checkmate with Ra8 after he flees to a3. Kb7 gets met by Qc6 which is also a forced checkmate. 31.Ka7 gets met with 31. Rc7+ 32.Kb8 Qb6+ 33. Ka8 Ra7#. 6 seconds left on my clock as I try my hardest to think of a forced mate if he moves to a5. I press the clock and my time goes back to 36 seconds. I haven't found a plan for a5 yet but know I can come up with something given that I create a minute for me to work with. It helps enormously that the next few moves are rather obvious.
337,9,41,Ra8+,b'r6k/4p2p/5qp1/K1p5/1P6/3P2p1/2QB1P1P/bR1R4 w - -',Limiting him back to b5. I need to get rid of my own c-pawn in order to win his queen though I can't help but wonder if there's a forced mate here.
338,9,42,Rc8+,b'2r4k/4p2p/q5p1/2K5/1P6/3P2p1/2QB1P1P/bR1R4 w - -',Winning the queen. Like one of my friends sometimes says: win the queen first give checkmate later
339,9,43,3Rbxa1,b'7k/4p2p/q5p1/3K4/1P6/3P2p1/2rB1P1P/R2R4 b - -',Not a bad move removing my pesky bishop but White is already hopelessly lost. I think his king being in check every move since move 26 ( with the exception of move 34 where I win a queen ) says enough about how hopeless the situation for White is.
340,9,44,3Qxd3+,b'7k/4p2p/6p1/3K4/1P6/3q2p1/2rB1P1P/R2R4 w - -',The checks continue.
341,9,45,Rxd2,b'7k/4p2p/4K1p1/8/1P6/3q2p1/3r1P1P/R2R4 w - -',I decide to just win material. After a short think I couldn't find an immediately forcing checkmate.  Having a queen for his rook in an endgame should be easy enough to win.
342,9,46,3Ra8+,b'R6k/4p2p/4K1p1/8/1P6/3q2p1/3r1P1P/3R4 b - -',Trying to get some counterplay but sadly this one check is all he's going to get.
343,9,47,3Ra7,b'8/R3p1kp/4K1p1/8/1P6/3q2p1/3r1P1P/3R4 b - -',I start looking at Qf5 which is checkmate in 1 after Kxe7. I find a mate in 1 in Re2+ though.
344,9,48,3Re2#,b'8/R3p1kp/4K1p1/8/1P6/3q2p1/4rP1P/3R4 w - -',And with this the game ends. It was a close one closer then I dare to admit. I'm really happy that I found Rxf3 over the board. All the moves before that however were questionable at times. The tournament is almost nearing the end. I just need to play one more game against someone with a similar rating. After having hard matchups every round it seems they've finally taking mercy on me and let me play similar rated opponents. 
345,10,0,O-O,b'rn1qk1nr/pp2ppb1/2p1b1p1/7p/2BPP3/2N1BN2/PP3PPP/R2Q1RK1 b kq -',Bad move of my part????Didnt see at all his bishop....
346,10,1,1Ne5,b'rn1qk2r/pp2ppb1/2p2np1/4N2p/2bPP3/2N1B3/PP3PPP/R2QR1K1 b kq -',attacking the bishop
347,10,2,1Nbd7,b'r2qk2r/pp1nppb1/2p2np1/4N2p/2bPP3/2N1B3/PP3PPP/R2QR1K1 w kq -',he should have moved his bishop back
348,10,3,1Nd6+,b'r3k2r/p1qnppb1/2pN2p1/1p2P2p/3P2n1/2N1B2P/PP3PP1/R2QR1K1 b kq -',with the goal of exchanging knights and opening the e file.
349,10,4,1Bf4+,b'r3k2r/p2n1pb1/2pq2p1/1p5p/3P1Bn1/2N4P/PP3PP1/R2QR1K1 b kq -',his knight is under attack his queen is under attack and his king in check...
350,10,5,1Qd6,b'r3k2r/p4pb1/2pQq1p1/1p2P2p/5Bn1/2N4P/PP3PP1/R3R1K1 b kq -',offering the queen exchange
351,10,6,1Qc4,b'r3k2r/p4pb1/2pQ2p1/1p2P2p/2q2Bn1/2N4P/PP3PP1/R3R1K1 w kq -',he refuses...
352,10,7,2Qxc6+,b'r3k2r/p4pb1/2Q3p1/1p2P2p/5qn1/2N4P/PP3PP1/3RR1K1 b kq -',instead of taking the g4 knight I continue the attack on his exposed king
353,10,8,2Qd7#,b'7r/p2Q1pb1/4k1p1/1p2P2p/5qn1/2N4P/PP3PP1/3RR1K1 b - -',
354,11,0,e4,b'rnbqkbnr/pppppppp/8/8/4P3/8/PPPP1PPP/RNBQKBNR b KQkq e3',and so it begins e4!
355,11,1,Bc4,b'rnbqkbnr/pppp1ppp/8/4p3/2B1P3/8/PPPP1PPP/RNBQK1NR b KQkq -',bishop out!
356,11,2,a6,b'rnbqkbnr/1ppp1ppp/p7/4p3/2B1P3/8/PPPP1PPP/RNBQK1NR w KQkq -',hmm right away with the a6.  ill try something here i have never tried since its a blitz!
