,gid,aid,move,fen,annotation
0,0,0,d6,b'rnbqkbnr/ppp2ppp/3p4/4p3/4P3/5N2/PPPP1PPP/RNBQKB1R w KQkq -',I don't think this is really the best move in the world but it isn't terrible
1,0,1,d4,b'rnbqkbnr/ppp2ppp/3p4/4p3/3PP3/5N2/PPP2PPP/RNBQKB1R b KQkq d3',Most common move here
2,0,2,Qe7,b'rnb1kbnr/ppp1qppp/3p4/4p3/3PP3/5N2/PPP2PPP/RNBQKB1R w KQkq -',!? This blocks in the DSB the rest of the way as well as developing his queen too early.
3,0,3,dxe5,b'rnb1kbnr/ppp1qppp/8/4p3/4P3/5N2/PPP2PPP/RNBQKB1R w KQkq -',And I already have a superior position.
4,0,4,Qb4+,b'rnb1kbnr/ppp2ppp/8/4p1B1/1q2P3/5N2/PPP2PPP/RN1QKB1R w KQkq -',Too bad I didn't notice the fork
5,0,5,Qxc3,b'rnb1kbnr/ppp2ppp/8/4p1B1/4P3/2q2N2/P2N1PPP/R2QKB1R w KQkq -',Now I'm down by two pawns but I have three pieces developed to his one.
6,0,6,f6,b'rnb1kb1r/ppp1n1pp/5p2/4p1B1/2B1P3/2q2N2/P2N1PPP/R2Q1RK1 w kq -',!? Better would have been h6. This creates serious light square weaknesses.
7,0,7,Nec6,b'rnb1kb1r/ppp3pp/2n2p2/4p3/2B1P3/2q1BN2/P2N1PPP/R2Q1RK1 w kq -',?! Probably not great better might have been to continue development.
8,0,8,Qa5,b'rnb1kb1r/ppp3pp/2n2p2/q3p3/2B1P3/1Q2BN2/P2N1PPP/R4RK1 w kq -',? This is just a mistake that he doesn't notice the attack on f7.
9,0,9,1Nc4,b'rnbk1b1r/ppp2Bpp/2n2p2/q3p3/2N1P3/1Q2BN2/P4PPP/R4RK1 b - -',Attacks the queen and moves a piece closer to the BK
10,0,10,1Rad1+,b'rnbk1b1r/ppp2Bpp/q1n2p2/4p3/2N1P3/1Q2BN2/P4PPP/3R1RK1 b - -',Should I have moved the other rook?
11,0,11,1Bd6,b'rnbk3r/ppp2Bpp/q1nb1p2/4p3/2N1P3/1Q2BN2/P4PPP/3R1RK1 w - -',!? This loses a pawn. Better would have been Nd7.
12,0,12,1Rxd6+,b'rnbk3r/pp3Bpp/q1nR1p2/4p3/4P3/1Q2BN2/P4PPP/5RK1 b - -',And I've won one of my pawns back plus I'm in a much superior position. I'd much rather be white than black here.
13,0,13,Rd8,b'rnbr4/pp2kBpp/q1nR1p2/3Qp3/4P3/4BN2/P4PPP/5RK1 w - -',?? If I capture and he recaptures then I can play Bc5+ and the only way black can get out of check is to block with his queen. 
14,0,14,Bg4,b'rn1R4/pp2kBpp/q1n2p2/3Qp3/4P1b1/4BN2/P4PPP/5RK1 w - -',He must have seen it one move too late
15,0,15,1Nxe5,b'rn1R4/pp2kBpp/q1n2p2/3QN3/4P1b1/4B3/P4PPP/5RK1 b - -',! If he recaptures then I can play Bg5#
16,0,16,1Nxd8,b'rn1n4/pp2kBpp/q4p2/3QN3/4P1b1/4B3/P4PPP/5RK1 w - -',He sees this too but makes the blunder he managed to avoid last move.
17,0,17,2Qxd6#,b'rn1n4/pp2kBpp/3Q1p2/2B1N3/4P1b1/8/P4PPP/5RK1 b - -',And mate. I think I played pretty well this game but if you find an error please comment.
18,1,0,Nc3,b'rnbqkbnr/pppppppp/8/8/8/2N5/PPPPPPPP/R1BQKBNR b KQkq -',Not much played I was curious about what our Captain would find against the 'van Geet' (or 'Dunst' as it is sometimes known).
19,1,1,e5,b'rnbqkbnr/ppp2ppp/8/3pp3/4P3/2N5/PPPP1PPP/R1BQKBNR w KQkq e6',"OK that's a new one. The common continuation is 2...d4 3.Nce2 e5 at which point White can do 4.Ng3 with fair play.
Checking with GK and offline DBs the game move has been played before - but with uniformly disastrous results by Black. Taking with the pawn gives him counterplay however; the knight capture is definitely safer.
"
20,1,2,Bc4,b'rnbqkb1r/ppp2ppp/5n2/3Np3/2B1P3/8/PPPP1PPP/R1BQK1NR b KQkq -',"?! There are a couple of other games in the database and both went for 4.Nxf6. At the time it seemed to me that exchanging the knights offered Black far too much counterplay as after 4.Nxf6+ Qxf6 5.Nf3 Bc5 6.Be2 Bg4 7.O-O Nc6 8.d3 O-O-O Black has the freer game initiative and pressure against White's king position. The drawbacks of not exchanging the knights were less apparent to me at the time. Taught by painful experience I can now say that not exchanging knights is a definite strategic mistake: it is dangerous to keep that piece in play in the kind of position which Black gains by this pawn sacrifice.
"
21,1,3,Qxe5+,b'rnbqkb1r/ppp2ppp/3n4/3NQ3/2B5/8/PPPP1PPP/R1B1K1NR b KQkq -',I studied this move for a long time before settling for it. White is literally putting his head into a nest of wasps here. Black gets significant development and a lot of mobile threats against both White's queen and the weak c2 and g2 squares- But - significantly - in two extended key lines (one of which we see played out in this game) it seemed to me that White was able to hold on to the advantage despite this.
22,1,4,Be6,b'rn1qkb1r/ppp2ppp/3nb3/3NQ3/2B5/8/PPPP1PPP/R1B1K1NR w KQkq -',This is one of those lines. The game now follows my analysis up until move 11 at which point Black throws me a curve...
23,1,5,Ne3,b'rn1qkb1r/ppp2ppp/3nb3/4Q3/2B5/4N3/PPPP1PPP/R1B1K1NR b KQkq -',?! The computer flags this as a mistake preferring instead 7.Bb3 with a small plus to White. However I disliked the situation after 7... Nc6 8.Qf4 g5 where Black seems able to hunt the White queen at will.
24,1,6,Nxc4,b'rn1qkb1r/ppp2ppp/4b3/4Q3/2N5/8/PPPP1PPP/R1B1K1NR b KQkq -',One knight down one more to go ...
25,1,7,Qe4,b'r2qkb1r/ppp2ppp/2n1b3/8/2N1Q3/8/PPPP1PPP/R1B1K1NR b KQkq -',Not 9.Qe2 Nd4 10.Qd3 Bf5 11.Qe3+ Be7 =+
26,1,8,Qe7,b'r3kb1r/ppp1qppp/2n1b3/8/2N1Q3/8/PPPP1PPP/R1B1K1NR w KQkq -',White's problem here is that Black gets all the development while White has difficulty parking his Queen anywhere useful. That along with the open e-file down to the still uncastled king is a major worry at this point. During the game I was still confident that I would be able to ride this out but looking at the situation today I believe Black has full compensation for the pawn; certainly I would have no qualms playing Black's side of the board. Indeed the computer evaluation shows a minor plus for Black.
27,1,9,1Ne3,b'r3kb1r/ppp1qppp/2n1b3/8/4Q3/4N3/PPPP1PPP/R1B1K1NR b KQkq -',"This was the move I relied on to save the situation: from e3 the knight shields its exposed king and defends the major weaknesses on c2 and g2. I considered and rejected two alternatives:
A) 10.Ne2 f5! and I considered White's position to be lost beyond recovery.
B) 10.b3 Bxc4 11.Qxe7+ Bxe7 12.bxc4 Nd4 13.Kd1 and White may at best have equal play."
28,1,10,O-O-O,b'2kr1b1r/ppp1q1pp/2n1b3/5p2/Q7/4N3/PPPP1PPP/R1B1K1NR w KQ -',"! And this is where I got the first nasty surprise. I hadn't really looked at this option disregarding it on strategic grounds: ""Black cannot castle long because he will be castling straight into the side of the board where White has an advantage in both space and active officers!""
Except of course that White's ""advantage in space and active officers"" amounts to one piece only: a queen ""actively"" chased about the board by those pesky light officers of Black's...
What Black gains by this operation is quite interesting: king safety instant control of the d-file added pressure on White's uncastled king position full development of the rook. Count the number and color of active pieces on the board for a moment: White has two Black has six! (yes the pawn is an active piece too in this situation). I believe the GK analysis understates Black's advantage when it calculates it to a mere 0.47 pts."
29,1,11,1f4,b'1k1r1b1r/ppp1q1pp/2n1b3/5p2/Q4P2/4N3/PPPPN1PP/R1B1K2R b KQ f3',"I regarded this move as practically forced. My game notes...
""So right now I am seriously worrying about the exposed state of my king. Well actually that has been a worry since move 5 or so! And I am considering what to do about it. His move could signal a desire to move the knight (probably to b4 possibly to e5) and I have to look out for queen traps then. And I learned early on in my chess career that castling to different sides meant the person whose pawns reached the king first would have a general advantage... So what to do? Well I would *love* to castle long even if that does mean that my one-pawn advantage is lessened a bit. But I don't think I will actually have the chance to do that.
- 13.b2-b3 is a no-go on strategic grounds as he will just exchange the dark bishops and have an open avenue to my king.
- 13.d2-d4 is blocked unless I prepare by c3 first.
- 13.c2-c3 is also a no-go as it leads to the unravelling of my kingside. Main line: 13.c3 Rd3 14.Nf4 Rd8 15.d4 g5 16.Ne2 f4 17.Nc4 f3 -/+
- 13.d2-d3 does not inspire a lot of confidence either I think. The only thing going for it is that it allows Bc1-d2 and I think I know  who is the better after 13.d3 g5 14.Bd2 f4 15.Nc4 Bxc4 16.Qxc4 Re8 17.Qe4 Qxe4 18.dxe4 Rxe4 - and it sure ain't me!
However the GK analysis points to d3 as being the best option after all after 13.d3 g5 14.f4! gxf4 15.Qxf4 Bg7 16.O-O Rhe8 17.Rf2 Nd4 18.Nxd4 Bxd4 19.c3 Bc5 with practically equal play."
30,1,12,1d3,b'1k1r1b1r/ppp3pp/2n1b3/5p1q/Q4P2/3PN1P1/PPP1N2P/R1B1K2R b KQ -',"White's position grows more untenable by the move but this doesn't really help much. White of course cannot castle (the knight is hanging) and the only reasonable alternative I could see was 15.c3 in order to facilitate d2-d4 cutting off the dangerous g1-a7 diagonal. However on 15.c3 there would likely follow 15...Bd5 16.Nxd5 Rxd5 and now the sought-for d2-d4 looks more than creating a nice tomb for the king than erecting bolvarks of defence.
The possibility of d2-d4 never entered my mind - it looked (and looks) like it simply cuts off the queen from further influence on the 4th row while adding nothing to the safety of the king. Now GK claims it is the path to (relative) safety after: 15.d4 Be7 16.Bd2 Bf6 17.c3 Rhe8 18.Qb5 Qf3 19.Rf1 Qe4 20.a4 Bd5 21.O-O-O a6. But if you happen to play out that line however you may notice that the computer - being at the very limit of its event horizon - miss the deadly continuation 22.Qc5 (forced) 22...Be7 and White can resign: the queen is trapped."
31,1,13,1Bc5,b'1k1r3r/ppp3pp/2n1b3/2b2p1q/Q4P2/3PN1P1/PPP1N2P/R1B1K2R w KQ -',Adding to the pressure on White's position.
32,1,14,1Bd2,b'1k1r3r/ppp3pp/2n1b3/2b2p1q/Q4P2/3PN1P1/PPPBN2P/R3K2R b KQ -',"My game notes at the time: ""The point of this move is not quite what you'd expect: it isn't an attempt at castling long - that's still not possible - rather it is preparatory to Ke1-f2 and Ra1-e1 in order to shore up e3 and the e-file in general. Also b2-b4 is now in the cards.""
As they stand those comments are still true. However the position is almost hopeless; the only real hope for White at this point is to create a sufficiently double-edged position that Black may make a mistake. A measure of how unbalanced the game is at this point with White still nominally a pawn ahead is the ""best"" line given by GK: 16. g4 fxg4 17. f5 Bd5 18. Nxd5 Rxd5 19. Ng3 Qh3 20. Kd1 Re8 21. Bf4 Qg2 22. Kc1 Rxf5 23. Nxf5 Qxh1+ ... and White loses the rook."
33,1,15,1b4,b'1k1rr3/ppp3pp/2n1b3/2b2p1q/QP3P2/3PN1P1/P1PBN2P/R3K2R b KQ b3',White attempts to create threats against Black's king. Not extremely plausible but better than the slow and sure strangulation offered by GK's line 17.O-O-O...
34,1,16,1Bxe3,b'1k1rr3/ppp3pp/2n1b3/5p1q/QP3P2/3Pb1P1/P1PBN2P/R3K2R w KQ -',Taking on b4 would give White a half-open line directly to Black's king.
35,1,17,Bd5,b'1k1rr3/ppp3pp/2n5/3b1p1q/QP3P2/3PB1P1/P1P1N2P/R3K2R w KQ -',And White can no longer prevent Black penetrating into his camp.
36,1,18,1O-O,b'1k1rr3/ppp3pp/2n5/3b1p1q/QP3P2/3PB1P1/P1P1N2P/R4RK1 b - -',Sacrifices a piece. However nothing really works at this point. I had finally decided against resigning however as I wanted Alex to have chance at giving a nice mate.
37,1,19,Rxg3+,b'1k1r4/ppp3pp/2n5/3b1p2/QP3P2/2NP2rq/P1P2R1P/R5K1 w - -',Yes exactly.
38,1,20,Qh1#,b'1k1r4/ppp3pp/2n5/3b1p2/QP3P2/2NP2P1/P1P2R2/R5Kq w - -',
39,2,0,Bc5,b'r1bqk1nr/pppp1ppp/2n5/2b1p3/2B1P3/5N2/PPPP1PPP/RNBQK2R w KQkq -',The Giuoco Piano
40,2,1,d4,b'r1bqk1nr/pppp1ppp/2n5/2b1p3/2BPP3/5N2/PPP2PPP/RNBQK2R b KQkq d3',? This loses a pawn. You're not supposed to play this until c2c3.
41,2,2,Bxd4,b'r1bqk1nr/pppp1ppp/2n5/4p3/2BbP3/5N2/PPP2PPP/RNBQK2R w KQkq -',So I snap up the pawn
42,2,3,Nh6,b'r1bqk2r/pppp1ppp/2n4n/4p1N1/2BbP3/8/PPP2PPP/RNBQK2R w KQkq -',This seemed the best way to defend against the attack.
43,2,4,Qh5,b'r1bqk2r/pppp1ppp/2n4n/4p1NQ/2BbP3/8/PPP2PPP/RNB1K2R b KQkq -',Piles on the pressure
44,2,5,g6,b'r1bqk2r/pppp1p1p/2n3pn/4p1NQ/2BbP3/8/PPP2PPP/RNB1K2R w KQkq -',?? I block the attack but lose my knight
45,2,6,Qf6,b'r1b1k2r/pppp1p1p/2n2qpQ/4p1N1/2BbP3/8/PPP2PPP/RNB1K2R w KQkq -',So I try to get an attack going myself
46,2,7,g3,b'r1bk3r/pppp1B1p/2n2qpQ/4p1N1/3bP3/6P1/PPP2P1P/RNB1K2R b KQ -',This is a big mistake. He should have dealt with my attack of f2
47,2,8,d5,b'r1bk3r/ppp2B1p/2n3pQ/3pp1N1/3bP3/6P1/PPP2q1P/RNBK3R w - d6',If he doesn't notice it I've got mate
48,2,9,1Nxh7,b'r1bk3r/ppp2B1N/2n3pQ/3pp3/3bP3/6P1/PPP2q1P/RNBK3R b - -',He greedily snaps up another pawn
49,2,10,1Bg4#,b'r2k3r/ppp2B1N/2n3pQ/3pp3/3bP1b1/6P1/PPP2q1P/RNBK3R w - -',And my bishop comes around and checkmates the white king. As usual please comment.
50,3,0,1Re1,b'r2q1rk1/ppp2pp1/3p1n1p/4p3/1PBbP3/P1NP1P1b/1BP2P1P/R2QR1K1 b - -',INICIO - START. 1 consolidate a strong position preventing Knight to d5 somewhat bothering... with next move.
51,3,1,1c6,b'r2q1rk1/pp3pp1/2pp1n1p/4p3/1PBbP3/P1NP1P1b/1BP2P1P/R2QR1K1 w - -',Position consolidated.
52,3,2,1Rb1,b'r2q1rk1/pp3pp1/2pp1n1p/4p3/1PBbP3/P1NP1P1b/1BP2P1P/1R1QR1K1 b - -',(I'd never expected that looks like a bonus-one extra move since that rook moved means nothing to my PLAN...  supposed -confirmed now- to  checkmate performing f6 Knight and my lovely Lady Black Queen into action now.
53,3,3,1Nh5,b'r2q1rk1/pp3pp1/2pp3p/4p2n/1PBbP3/P1NP1P1b/1BP2P1P/1R1QR1K1 w - -',Knight first
54,3,4,1f4,b'r2q1rk1/pp3pp1/2pp3p/4p2n/1PBbPP2/P1NP3b/1BP2P1P/1R1QR1K1 b - -',Queen like a laser!
55,3,5,1Qh4,b'r4rk1/pp3pp1/2pp3p/4p2n/1PBbPP1q/P1NP3b/1BP2P1P/1R1QR1K1 w - -',-This game is not over yet. I just say that playing as white at this position I'd most probably would resign.
56,3,6,Nh3+,b'r4rk1/pp3pp1/2pp3p/4p3/1PBbP1bq/P1NP3n/1BP2P1P/1R2RQK1 w - -',no comments needed -or am I wrong anyhow possibly?
57,4,0,Nf6,b'rnbqkb1r/pppppppp/5n2/8/4P3/8/PPPP1PPP/RNBQKBNR w KQkq -',This is the Alkehine's defense (spelling?)
58,4,1,e5,b'rnbqkb1r/pppppppp/5n2/4P3/8/8/PPPP1PPP/RNBQKBNR b KQkq -',Most common
59,4,2,Bd3,b'rnbqkb1r/pppp1ppp/4p3/4P3/3Pn3/3B4/PPP2PPP/RNBQK1NR b KQkq -',Develops with tempo
60,4,3,Ng5,b'rnbqkb1r/pppp1ppp/4p3/4P1n1/3P4/3B4/PPP2PPP/RNBQK1NR w KQkq -',It jumps out of the way
61,4,4,Nf3,b'rnbqkb1r/pppp1ppp/4p3/4P1n1/3P4/3B1N2/PPP2PPP/RNBQK2R b KQkq -',I add another attacker forcing him to exchange and developing my queen
62,4,5,f6,b'rnbqkb1r/pppp2pp/4pp2/4P3/3P4/3B1Q2/PPP2PPP/RNB1K2R w KQkq -',Trying to attack my pawn center but better might have been d6
63,4,6,exf6,b'rnbqkb1r/pppp2pp/4pP2/8/3P4/3B1Q2/PPP2PPP/RNB1K2R b KQkq -',Would it have been better to let him capture first?
64,4,7,gxf6,b'rnb1kb1r/pppp3p/4pp2/8/3P4/3B4/PPP2PPP/RNB1K2R w KQkq -',And by move eight the queens are traded off
65,4,8,1Bd2,b'rnb1k2r/pppp3p/4pp2/8/1b1P4/2NB4/PPPB1PPP/R3K2R b KQkq -',I complete my minor piece development
66,4,9,1O-O-O,b'rnb1k2r/ppp4p/4pp2/3p4/3P4/2BB4/PPP2PPP/2KR3R b kq -',With the queens off the board and a fair amount of material exchanged I though my king would be better nearer the center.
67,4,10,1Bxh7,b'rnb1k1r1/ppp4B/4pp2/3p4/3P4/2B5/PPP2PPP/2KR3R b q -',Pawn trade
68,4,11,1Rhg1,b'rnb1k3/ppp4B/4pp2/3p4/3P4/2B5/PPP2PrP/2KR2R1 b q -',? This loses another pawn
69,4,12,1Rd2,b'rnb3R1/pppk3B/4pp2/3p4/3P4/2B5/PPPR1P1r/2K5 b - -',?? And this is the blunder where I lose my bishop.
70,4,13,1Rxh7,b'rnb3R1/pppk3r/4pp2/3p4/3P4/2B5/PPPR1P2/2K5 w - -',He takes it and I am behind be four but he doesn't have any of his queenside pieces out so I don't resign.
71,4,14,b6,b'rnb3R1/p1pk3r/1p2pp2/3p4/3P1P2/2B5/PPPR4/2K5 w - -',Preparing to develop the bishop
72,4,15,1Bb4,b'rnb3R1/p1pk3r/1p2pp2/3p4/1B1P1P2/8/PPPR4/2K5 b - -',I played this because it was a lot more active here than on c3
73,4,16,1Nc6,b'r1b3R1/p1pk3r/1pn1pp2/3p4/1B1P1P2/8/PPPR4/2K5 w - -',Development
74,4,17,2Rdg2,b'r5R1/pbpk3r/1pn1pp2/3p4/3P1P2/B7/PPP3R1/2K5 b - -',I noticed the discovered attack and defended my rook but better would have been trading as this loses a pawn
75,4,18,2Rxg7+,b'r7/pbpk2R1/1p2pp2/3p4/3n1P2/B7/PPP5/2K5 b - -',Probably a bad exchange as I am behind
76,4,19,2Kd2,b'r7/pbp3R1/1pk1pp2/3p4/3n1P2/B7/PPPK4/8 b - -',Centralizing my king
77,4,20,2Rxf6,b'r7/pbp5/1pk1pR2/5n2/3p1P2/B7/PPPK4/8 b - -',Now I'm only down four
78,4,21,3Bb2,b'4r3/2p5/1pk1pR2/p2bKn2/3p1P2/1P6/PBP5/8 b - -',Trying to win a pawn
79,4,22,Ne3,b'4r3/2p5/1p2pR2/p1kbK3/P2p1P2/1P2n3/1BP5/8 w - -',?? This loses the knight and a pawn
80,4,23,Kc3,b'4r3/2p5/1p2pR2/p2bK3/P4P2/1Pk1B3/2P5/8 w - -',The score is tied but it's only a matter of time before the BK picks of my pawns
81,4,24,exf5+,b'4r3/2p5/1p3R2/p2bKp2/P7/1Pk1B3/2P5/8 w - -',Skewers my king and bishop but I can take his bishop
82,4,25,3Kxd5,b'4r3/2p5/1p3R2/p2K1p2/P7/1Pk1B3/2P5/8 b - -',So I do
83,4,26,Kxc2,b'8/2p5/1p6/p2K1R2/P7/1P2r3/2k5/8 w - -',And now he starts picking off my pawns
84,4,27,3Kc6,b'8/2p5/1pK5/p4R2/P7/1P2r3/2k5/8 b - -',Going for his
85,4,28,3Rxb3,b'8/2p5/1pK5/p4R2/P7/1r6/2k5/8 w - -',One left
86,4,29,b5,b'8/2K5/5R2/pp6/Pr6/8/2k5/8 w - -',This forces the survival of one pawn
87,4,30,4Kc6,b'8/8/R1K5/pr6/8/1k6/8/8 b - -',I keep playing hoping he'll make a mistake
88,4,31,4Ra6,b'8/8/R1K5/1r6/pk6/8/8/8 b - -',Just shuffling back and forth because I can't see anything better to do
89,4,32,4Ka7,b'8/K7/R7/1r6/pk6/8/8/8 b - -',?? This loses the game. I should have moved back to c6 and hoped for a draw by repetition but this lets him force a rook trade.
90,4,33,4Ra5,b'8/K7/R7/r7/pk6/8/8/8 w - -',And I resign because after the trade I can't stop him from promoting. As always please comment if you see something that I didn't mention.
91,5,0,d4,b'rnbqkbnr/pppppppp/8/8/3P4/8/PPP1PPPP/RNBQKBNR b KQkq d3',Thematic benoni game
92,5,1,g6,b'rnbqkb1r/pp3p1p/3p1np1/2pP4/4P3/2N5/PP3PPP/R1BQKBNR w KQkq -',main line
93,5,2,h3,b'rnbqkb1r/pp3p1p/3p1np1/2pP4/4P3/2N4P/PP3PP1/R1BQKBNR b KQkq -',i do not like to advance the f pawn and h3 is the only other way to prevent 7. ... Bg4 or 7. ... Ng4
94,5,3,Bg7,b'rnbqk2r/pp3pbp/3p1np1/2pP4/4P3/2N4P/PP3PP1/R1BQKBNR w KQkq -',main line
95,5,4,Bd3,b'rnbqk2r/pp3pbp/3p1np1/2pP4/4P3/2NB3P/PP3PP1/R1BQK1NR b KQkq -',White chooses a quiet line (I often play 8. Bb5)
96,5,5,Nf3,b'rnbq1rk1/pp3pbp/3p1np1/2pP4/4P3/2NB1N1P/PP3PP1/R1BQK2R b KQ -',The same quiet line for black preparing a central attack.
97,5,6,b5,b'rnbq1rk1/p4pbp/3p1np1/1ppP4/4P3/2NB1N1P/PP3PP1/R1BQK2R w KQ b6',The central line chosen by white let black with open space on the queenside and Last Archimedean tries to exploit it. 
98,5,7,1Nxb5,b'rnbq1rk1/p4pbp/3p1np1/1NpP4/4P3/3B1N1P/PP3PP1/R1BQK2R b KQ -',Double edged move. It opens the b file for the black rook and the white knight can be easily fired. Another candidate move was 10. Bb5 to prevent 10. Re8 but white's plan is still the central attack and I want to menace black's d pawn with 11. Bf6
99,5,8,1Re8,b'rnbqr1k1/p4pbp/3p1np1/1NpP4/4P3/3B1N1P/PP3PP1/R1BQK2R w KQ -',Solid move
100,5,9,1O-O,b'rnbqr1k1/p4pbp/3p1np1/1NpP4/4P3/3B1N1P/PP3PP1/R1BQ1RK1 b - -',Castling when it's time
101,5,10,1Nxe4,b'rnbqr1k1/p4pbp/3p2p1/1NpP4/4n3/3B1N1P/PP3PP1/R1BQ1RK1 w - -',Logical move.
102,5,11,1Re1,b'rnbqr1k1/p4pbp/3p2p1/1NpP4/4n3/3B1N1P/PP3PP1/R1BQR1K1 b - -',If 12. ... Nf6 13. Rxe8 Qxe8 13. Nxd6
103,5,12,1a6,b'rnbqr1k1/5pbp/p2p2p1/1NpP4/4n3/3B1N1P/PP3PP1/R1BQR1K1 w - -',Attack from the knight
104,5,13,1Na3,b'rnbqr1k1/5pbp/p2p2p1/2pP4/4n3/N2B1N1P/PP3PP1/R1BQR1K1 b - -',Even Lancelot the brave has to retreat sometimes.
105,5,14,1Nf6,b'rnbqr1k1/5pbp/p2p1np1/2pP4/8/N2B1N1P/PP3PP1/R1BQR1K1 w - -',Attacking d5
106,5,15,Qxe8,b'rnb1q1k1/5pbp/p2p1np1/2pP4/8/N2B1N1P/PP3PP1/R1BQ2K1 w - -',That was part of white's idea but after 13. a3 white cannot take the d pawn. Black is doing well and plays solidly.
107,5,16,1Nc4,b'rnb1q1k1/5pbp/p2p1np1/2pP4/2N5/3B1N1P/PP3PP1/R1BQ2K1 b - -',But I want this pawn and send Lancelot to the battle again
108,5,17,1Bb7,b'rn2q1k1/1b3pbp/p2p1np1/2pP4/2N5/3B1N1P/PP3PP1/R1BQ2K1 w - -',"At first I thought this move was a blunder for : 16. Nxd6 Qd7 17. Nxb7 Qxb7 and white is one pawn up but if
18. Bc4 to protect the d5 pawn. 18. ... Rd8 and the pawn it dead for I cannot bring any other piece to protect it so that I think this is a very good move."
109,5,18,1Nb6,b'rn2q1k1/1b3pbp/pN1p1np1/2pP4/8/3B1N1P/PP3PP1/R1BQ2K1 b - -',So that I have to elect another move. I thought a lot about it because the knight is unprotected and has only two squares to retreat. But it seemed the only way to save my d pawn.
110,5,19,1Ra7,b'1n2q1k1/rb3pbp/pN1p1np1/2pP4/8/3B1N1P/PP3PP1/R1BQ2K1 w - -',No choice
111,5,20,1Bc4,b'1n2q1k1/rb3pbp/pN1p1np1/2pP4/2B5/5N1P/PP3PP1/R1BQ2K1 b - -',Now the d pawn is secured but I do not like the position at all for black controls the open file the long black diagonal  and the center (not directly but with his f knight queen and c and d pawns). Luckily for white his other pieces are blocked.
112,5,21,1Nbd7,b'4q1k1/rb1n1pbp/pN1p1np1/2pP4/2B5/5N1P/PP3PP1/R1BQ2K1 w - -',Good move to get rid of the b knight.
113,5,22,1Nxd7,b'4q1k1/rb1N1pbp/p2p1np1/2pP4/2B5/5N1P/PP3PP1/R1BQ2K1 b - -',No other choice (If 18. Na4 Ne5 19. Nxe5 Qxe5 and white is in trouble for black controls the center and the white king feels lonesome in his castle.
114,5,23,1Qxd7,b'6k1/rb1q1pbp/p2p1np1/2pP4/2B5/5N1P/PP3PP1/R1BQ2K1 w - -',18. ... Nxd7 might have been better preparing 19. ... Nb6 and the black queen would have staid on the e file.
115,5,24,1Rb1,b'6k1/rb1q1pbp/p2p1np1/2pP4/2B5/5N1P/PP3PP1/1RBQ2K1 b - -',First organising the queen side to resist an eventual attack of the DSB.
116,5,25,1Ra8,b'r5k1/1b1q1pbp/p2p1np1/2pP4/2B5/5N1P/PP3PP1/1RBQ2K1 w - -',To liberate the rook.
117,5,26,2Qd3,b'r5k1/1b1q1pbp/p2p1np1/2pP4/2B5/3Q1N1P/PP3PP1/1RB3K1 b - -',Preventing 20. ... Ne4
118,5,27,2h5,b'r5k1/1b1q1pb1/p2p1np1/2pP3p/2B5/3Q1N1P/PP3PP1/1RB3K1 w - h6',? It weakens the black king and achieves little. Re8 would have been better.
119,5,28,2b3,b'r5k1/1b1q1pb1/p2p1np1/2pP3p/2B5/1P1Q1N1P/P4PP1/1RB3K1 b - -',Everybody is in safety on the queenside.
120,5,29,2Nh7,b'r5k1/1b1q1pbn/p2p2p1/2pP3p/2B5/1P1Q1N1P/P4PP1/1RB3K1 w - -',? Blunder. For the knight is less efficient on the far side and it let white the control of the e4 square.
121,5,30,2Bb2,b'r5k1/1b1q1pbn/p2p2p1/2pP3p/2B5/1P1Q1N1P/PB3PP1/1R4K1 b - -',To get rid of the ennoying powerfull black bishop and liberate the b rook which has to come on the e file that black doesn't occupate.
122,5,31,2Bxb2,b'r5k1/1b1q1p1n/p2p2p1/2pP3p/2B5/1P1Q1N1P/Pb3PP1/1R4K1 w - -',Black had little choice (if 22. ... Bf8 23. Qc3 menacing mate.)
123,5,32,2Rxb2,b'r5k1/1b1q1p1n/p2p2p1/2pP3p/2B5/1P1Q1N1P/PR3PP1/6K1 b - -',So this diagonal can be mine when I want by Qc3. White has now a clear positionnal advantage being more mobile and controling the center.
124,5,33,2Qd8,b'r2q2k1/1b3p1n/p2p2p1/2pP3p/2B5/1P1Q1N1P/PR3PP1/6K1 w - -',Black cannot play 23. ... Re8 any longer for 24. Bxa6
125,5,34,2Re2,b'r2q2k1/1b3p1n/p2p2p1/2pP3p/2B5/1P1Q1N1P/P3RPP1/6K1 b - -',"Now it's time to attack. First take control of the open file.
White position also improves because all his pieces are connected (black's one are dispersed)."
126,5,35,2Ng5,b'r2q2k1/1b3p2/p2p2p1/2pP2np/2B5/1P1Q1N1P/P3RPP1/6K1 w - -',Probably to force the knight exchange. Black might look for a draw.
127,5,36,2Nh4,b'r2q2k1/1b3p2/p2p2p1/2pP2np/2B4N/1P1Q3P/P3RPP1/6K1 b - -',Menaces 26. Nxg6 fxg6 27. Qxg6+ Kf8 28. Qxg5 with two pawns advantage and a very weak black king.
128,5,37,2Kg7,b'r2q4/1b3pk1/p2p2p1/2pP2np/2B4N/1P1Q3P/P3RPP1/6K1 w - -',To prevent 26. Nxg6
129,5,38,2Qg3,b'r2q4/1b3pk1/p2p2p1/2pP2np/2B4N/1P4QP/P3RPP1/6K1 b - -',Menacing the knight and after 26. ... Nh7 preparing 27. Nf5+ Kg8 28. Nxd6
130,5,39,2Nh7,b'r2q4/1b3pkn/p2p2p1/2pP3p/2B4N/1P4QP/P3RPP1/6K1 w - -',Forced move.
131,5,40,2Nf5+,b'r2q4/1b3pkn/p2p2p1/2pP1N1p/2B5/1P4QP/P3RPP1/6K1 b - -',Fork attack between the king and the d pawn.
132,5,41,2Kh8,b'r2q3k/1b3p1n/p2p2p1/2pP1N1p/2B5/1P4QP/P3RPP1/6K1 w - -',27. ... Kg8 was the other candidate move but it wouldn't have changed a lot the situation.
133,5,42,2Nxd6,b'r2q3k/1b3p1n/p2N2p1/2pP3p/2B5/1P4QP/P3RPP1/6K1 b - -',Fork attack between the bishop in b7 and the f pawn.
134,5,43,2Qd7,b'r6k/1b1q1p1n/p2N2p1/2pP3p/2B5/1P4QP/P3RPP1/6K1 w - -',To protect both b7 and f7
135,5,44,2Qe5+,b'r6k/1b1q1p1n/p2N2p1/2pPQ2p/2B5/1P5P/P3RPP1/6K1 b - -',queen and rook on the same file.
136,5,45,2Kg8,b'r5k1/1b1q1p1n/p2N2p1/2pPQ2p/2B5/1P5P/P3RPP1/6K1 w - -',29. f6 would have been better but white's position is far better and it would not have saved black.
137,5,46,3Nxf7,b'r5k1/1b1q1N1n/p5p1/2pPQ2p/2B5/1P5P/P3RPP1/6K1 b - -',"If 30. ... Qxf7 31. d6 and the black queen is lost.
If 30. ... Kxf7 31. d6+ Kf8 (forced move) 32. Qh8+ mate."
138,5,47,3Rf8,b'5rk1/1b1q1N1n/p5p1/2pPQ2p/2B5/1P5P/P3RPP1/6K1 w - -',Mate in one
139,5,48,3Nh6#,b'5rk1/1b1q3n/p5pN/2pPQ2p/2B5/1P5P/P3RPP1/6K1 b - -',
140,6,0,Nf6,b'rnbqkb1r/pppppppp/5n2/8/3P4/8/PPP1PPPP/RNBQKBNR w KQkq -',What can I say? I am a fan of my Indian systems.
141,6,1,Bb4,b'rnbqk2r/pppp1ppp/4pn2/8/1bPP4/2N5/PP2PPPP/R1BQKBNR w KQkq -',I particularly like the Nimzo-Indian Defense for Black. I have spent time studying over-the-board games for many years and Indian systems make for a more dynamic game for both sides.
142,6,2,c5,b'rnbqk2r/pp1p1ppp/4pn2/2p5/1bPP4/2N1P3/PP3PPP/R1BQKBNR w KQkq c6',I believe this variation is known as the Hübner Variation but I could be wrong. Someone pleas e confirm whether this is correct or not.
143,6,3,O-O,b'rnbq1rk1/pp1p1ppp/4pn2/2p5/1bPP4/2N1PN2/PP3PPP/R1BQKB1R w KQ -',Quickly goes to the main line at this point.
144,6,4,1bxc3,b'rn1q1rk1/pb3ppp/1p2pn2/6B1/2BP4/2P2N2/P3QPPP/R4RK1 b - -',Usually white's pawn structure is weakened at this point by doubling or tripling. Like I said though this opening is quite interesting in where it leads.
