,gid,aid,move,fen,annotation
738,21,13,Qe8,b'4qrk1/1ppr2pn/p1pb1p1p/4pN2/4P1PP/3P4/PPPBQP2/5KRR w - -',"There is no more preparation I can do. Time to play g5.
"
739,21,14,2Nh6+,b'4qrk1/1ppr2p1/p1pb1n1N/4p1B1/4P3/3P4/PPP1QP2/5KRR b - -',"A pseudo sac; the open files are producing all kinds of mating patterns.
"
740,21,15,2Bxf6+,b'4qrk1/1ppr4/p1pb1B1p/4p3/4P3/3P4/PPP1QP2/5KRR b - -',"If 25....Kf7 27.Rxh6 holding the f6 Bishop and threatening Qh5+ wins in all variations.
"
741,21,16,2Kh7,b'4qr2/1ppr3k/p1pb1B1p/4p3/4P3/3P4/PPP1QP2/5KRR w - -',"This allows a sac an attack and mate.
"
742,21,17,2Qg5#,b'4qr2/1ppr4/p1pb1B2/4p1Qk/4P3/3P4/PPP2P2/5KR1 b - -',Since Black has no counter-play this is how White should respond 
743,22,0,d4,b'rnbqkbnr/pppppppp/8/8/3P4/8/PPP1PPPP/RNBQKBNR b KQkq d3',"On Tuesday September 20 Malpas & Oswestry 1 lost their first fixture at their new venue of The Bull Shocklach Malpas 4-1 against the Liverpool giants Atticus. Atticus turned up with a very strong team while Malpas & Oswestry 1 were missing a couple of key players. The first result was on board 3 when Graham Ives lost to Tim Wiseman. Charles Lowick Higgie was the next to finish losing with white on board 2. The next result was on board 4 where Celeste McCrann produced the only win for the home side. Orlando Bell lost on time a few pawns down on board 5. Finally Brian Whyte finally succumbed on board 1 in a long closely-fought game. Full result:
Brian Whyte(184) 0 Steve Kee(182) 1
Charles Lowick Higgie(166) 0 Luke Boumphrey(176) 1
Graham Ives(124) 0 Tim Wiseman(126) 1
Celeste McCrann(113) 1 Steve Burge(127) 0
Orlando Bell(64) 0 Steve Philp(120) 1."
744,22,1,Nf6,b'rnbqkb1r/pppppppp/5n2/8/3P4/8/PPP1PPPP/RNBQKBNR w KQkq -',In this game he plays an opening variation which I had forgotten the best continuation! I fight back and gain an edge but fall for a clever trap and lose horribly. Enjoy!
745,22,2,Bg7,b'rnbqk2r/ppp1ppbp/3p1np1/8/2PPP3/2N5/PP3PPP/R1BQKBNR w KQkq -',"King's Indian Defence.
https://en.wikipedia.org/wiki/King%27s_Indian_Defence"
746,22,3,f3,b'rnbqk2r/ppp1ppbp/3p1np1/8/2PPP3/2N2P2/PP4PP/R1BQKBNR b KQkq -',"Sämisch Variation
https://en.wikipedia.org/wiki/King%27s_Indian_Defence_S%C3%A4misch_Variation"
747,22,4,Be3,b'rnbq1rk1/ppp1ppbp/3p1np1/8/2PPP3/2N1BP2/PP4PP/R2QKBNR b KQ -',Usual development.
748,22,5,d5,b'rnbq1rk1/ppp2pbp/3p1np1/3Pp3/2P1P3/2N1BP2/PP4PP/R2QKBNR b KQ -',These are all the mostly played moves.
749,22,6,Nh5,b'rnbq1rk1/ppp2pbp/3p2p1/3Pp2n/2P1P3/2N1BP2/PP4PP/R2QKBNR w KQ -',7....c6 is played slightly more usual than 7....Nh5 but both are commonly played.
750,22,7,Qh4+,b'rnb2rk1/ppp2pbp/3p2p1/3Pp2n/2P1P2q/2N1BP2/PP1Q2PP/R3KBNR w KQ -',I was trying to remember the best move here. I looked at 9. g3 Nxg3 10. Bf2? Nxf1! with advantage to black. What I should have played was David Bronstein's queen sacrifice 7...Nh5 8.Qd2 Qh4+ 9.g3 Nxg3 10.Qf2 Nxf1 11.Qxh4 Nxe3 where Black has given up the queen for two bishops and a pawn and will also win a second pawn after 12...Nxc4. In return for the material Black obtains a solid and compact position devoid of weaknesses the safer king and control over the dark squares. Cherniaev and Prokuronov were sceptical of whether Black had sufficient compensation after 12.Qf2 but the line is very dangerous if White plays nonchalantly. Also my opponent obviously knew this variation better than me so perhaps it would have been hard for me to convert! But now I am at a disadvantage in that my opponent knows this variation better than me. I had to think while my opponent continued to play very quickly.
751,22,8,Bf2,b'rnb2rk1/ppp2pbp/3p2p1/3Pp2n/2P1P2q/2N2P2/PP1Q1BPP/R3KBNR b KQ -',So played this instead.
752,22,9,Qf4,b'rnb2rk1/ppp2pbp/3p2p1/3Pp2n/2P1Pq2/2N2P2/PP1Q1BPP/R3KBNR w KQ -',"He offers the exchange of queens. I did consider playing Be3 and accept a repetition but afterwards he said he would not have accepted a draw maybe withdrawing the queen to e7 after checking on h4 again. 

However I knew this was going to be a close match and we were badly out-rated on board 5 I had white I was only slightly out-rated - I felt I should play on."
753,22,10,1Qxf4,b'rnb2rk1/ppp2pbp/3p2p1/3Pp2n/2P1PQ2/2N2P2/PP3BPP/R3KBNR b KQ -',Afterwards my opponent claimed that this was a positional blunder as it leaves black with a strong pawn on f4 opens up the long black diagonal and the e5 square to use. However this exchange does score OK for white in opening database.
754,22,11,1Bd3,b'rnb2rk1/ppp2pbp/3p2p1/3P3n/2P1Pp2/2NB1P2/PP3BPP/R3K1NR b KQ -',Afterwards I found out that g4 and Ng-e2 were the moves previously played her.
755,22,12,1a6,b'rnb2rk1/1pp2pbp/p2p2p1/3P3n/2P1Pp2/2NB1P2/PP3BPP/R3K1NR w KQ -',My opponent afterwards said that this was to prevent Nb5. I then asked should I have played Nb5 the move before. He replied it wasn't too much of a problem for black with Na6 followed by Bd7.
756,22,13,1Nge2,b'rnb2rk1/1pp2pbp/p2p2p1/3P3n/2P1Pp2/2NB1P2/PP2NBPP/R3K2R b KQ -',I continue to develop.
757,22,14,1Nd7,b'r1b2rk1/1ppn1pbp/p2p2p1/3P3n/2P1Pp2/2NB1P2/PP2NBPP/R3K2R w KQ -',He has a plan to put his knight on e5
758,22,15,1Nd4,b'r1b2rk1/1ppn1pbp/p2p2p1/3P3n/2PNPp2/2NB1P2/PP3BPP/R3K2R b KQ -',But my knight also finds a strong central square.
759,22,16,1Ne5,b'r1b2rk1/1pp2pbp/p2p2p1/3Pn2n/2PNPp2/2NB1P2/PP3BPP/R3K2R w KQ -',He hits my bishop.
760,22,17,1Kd2,b'r1b2rk1/1pp2pbp/p2p2p1/3Pn2n/2PNPp2/2NB1P2/PP1K1BPP/R6R b - -',In in the light of what happens next maybe 0-0-0 would have saved me some tempi!
761,22,18,1c5,b'r1b2rk1/1p3pbp/p2p2p1/2pPn2n/2PNPp2/2NB1P2/PP1K1BPP/R6R w - c6',Challenging my knight.
762,22,19,1dxc6e.p.,b'r1b2rk1/1p3pbp/p1Pp2p1/4n2n/2PNPp2/2NB1P2/PP1K1BPP/R6R b - -',But I want to keep it there.
763,22,20,1bxc6,b'r1b2rk1/5pbp/p1pp2p1/4n2n/2PNPp2/2NB1P2/PP1K1BPP/R6R w - -',The best way to recapture.
764,22,21,1Rad1,b'r1b2rk1/5pbp/p1pp2p1/4n2n/2PNPp2/2NB1P2/PP1K1BPP/3R3R b - -',Centralising my rook.
765,22,22,1Rb8,b'1rb2rk1/5pbp/p1pp2p1/4n2n/2PNPp2/2NB1P2/PP1K1BPP/3R3R w - -',Attacking b2.
766,22,23,1Kc1,b'1rb2rk1/5pbp/p1pp2p1/4n2n/2PNPp2/2NB1P2/PP3BPP/2KR3R b - -',"Protecting and completing my ""castling by hand""."
767,22,24,1Bd7,b'1r3rk1/3b1pbp/p1pp2p1/4n2n/2PNPp2/2NB1P2/PP3BPP/2KR3R w - -',Continuing to develop.
768,22,25,1Be2,b'1r3rk1/3b1pbp/p1pp2p1/4n2n/2PNPp2/2N2P2/PP2BBPP/2KR3R b - -',Preventing the exchange of my bishop opening up the d file for my rook and also protecting f3 and hence preparing g2-g4. If I play g2-g4 immediately he can  take en passant play c6-c5 driving my Nd4 to another square followed by Ne5xf3.
769,22,26,1Rfd8,b'1r1r2k1/3b1pbp/p1pp2p1/4n2n/2PNPp2/2N2P2/PP2BBPP/2KR3R w - -',He also develops.
770,22,27,1g4,b'1r1r2k1/3b1pbp/p1pp2p1/4n2n/2PNPpP1/2N2P2/PP2BB1P/2KR3R b - g3',I continue with my plan.
771,22,28,1Nf6,b'1r1r2k1/3b1pbp/p1pp1np1/4n3/2PNPpP1/2N2P2/PP2BB1P/2KR3R w - -',He retreats.
772,22,29,2b3,b'1r1r2k1/3b1pbp/p1pp1np1/4n3/2PNPpP1/1PN2P2/P3BB1P/2KR3R b - -',With thoughts of Nc2 followed by doubling rooks on the d file. I wanted to overprotect c4 in case he wanted to play Be6.
773,22,30,2Ne8,b'1r1rn1k1/3b1pbp/p1pp2p1/4n3/2PNPpP1/1PN2P2/P3BB1P/2KR3R w - -',So he protects d rendering my plan useless. Also black is now threatening c5 driving away my Nd4 and then Nxf3 or g4 discovering an attack on my Nc3.
774,22,31,2Bh4,b'1r1rn1k1/3b1pbp/p1pp2p1/4n3/2PNPpPB/1PN2P2/P3B2P/2KR3R b - -',But I have this attacking Rd8.
775,22,32,2Rdc8,b'1rr1n1k1/3b1pbp/p1pp2p1/4n3/2PNPpPB/1PN2P2/P3B2P/2KR3R w - -',So he moves the rook.
776,22,33,2Bg5,b'1rr1n1k1/3b1pbp/p1pp2p1/4n1B1/2PNPpP1/1PN2P2/P3B2P/2KR3R b - -',"And I have this. I did see the combination my opponent played but I thought ""What of it? Material will still be level as I gain the pawn on f4 and I get rid of his strong knight on e5 his strong pawn on f4 and I am left with pressure down the d file."
777,22,34,2c5,b'1rr1n1k1/3b1pbp/p2p2p1/2p1n1B1/2PNPpP1/1PN2P2/P3B2P/2KR3R w - -',So he continues with his plan.
778,22,35,2Nc2,b'1rr1n1k1/3b1pbp/p2p2p1/2p1n1B1/2P1PpP1/1PN2P2/P1N1B2P/2KR3R b - -',The only square for the knight.
779,22,36,2Nxf3,b'1rr1n1k1/3b1pbp/p2p2p1/2p3B1/2P1PpP1/1PN2n2/P1N1B2P/2KR3R w - -',I actually thought taking on g4 was better as this capture draws my bishop onto a better square.
780,22,37,2Bxf3,b'1rr1n1k1/3b1pbp/p2p2p1/2p3B1/2P1PpP1/1PN2B2/P1N4P/2KR3R b - -',I take.
781,22,38,2Bxc3,b'1rr1n1k1/3b1p1p/p2p2p1/2p3B1/2P1PpP1/1Pb2B2/P1N4P/2KR3R w - -',He takes back.
782,22,39,2Bxf4,b'1rr1n1k1/3b1p1p/p2p2p1/2p5/2P1PBP1/1Pb2B2/P1N4P/2KR3R b - -',And I restore material equality his d6 is now attacked twice.
783,22,40,2Rb6,b'2r1n1k1/3b1p1p/pr1p2p1/2p5/2P1PBP1/1Pb2B2/P1N4P/2KR3R w - -',So he protects.
784,22,41,2Rd3,b'2r1n1k1/3b1p1p/pr1p2p1/2p5/2P1PBP1/1PbR1B2/P1N4P/2K4R b - -',I hit the bishop.
785,22,42,2Bg7,b'2r1n1k1/3b1pbp/pr1p2p1/2p5/2P1PBP1/1P1R1B2/P1N4P/2K4R w - -',Bishop withdraws.
786,22,43,2Rhd1,b'2r1n1k1/3b1pbp/pr1p2p1/2p5/2P1PBP1/1P1R1B2/P1N4P/2KR4 b - -',I double on the d file.
787,22,44,2Be6,b'2r1n1k1/5pbp/pr1pb1p1/2p5/2P1PBP1/1P1R1B2/P1N4P/2KR4 w - -',This move is an ingenious trap - into which I fall! I felt I had to take now before he protects d6 again. After the game my opponent and I were looking at variations such as 28. Ne3 Be5 29. Bxe5 dxe5 30. Nd5	Bxd5 31. Rxd5 Re6 which appears to be positional advantage to white.
788,22,45,2Bxd6,b'2r1n1k1/5pbp/pr1Bb1p1/2p5/2P1P1P1/1P1R1B2/P1N4P/2KR4 b - -',But I just took. OK what would you play as black?
789,22,46,2Bh6+,b'2r1n1k1/5p1p/pr1Bb1pb/2p5/2P1P1P1/1P1R1B2/P1N4P/2KR4 w - -',Did you find this? It is a killing check! Blocking the check with knight or rook just drops the bishop on d6 so my king is forced onto the b file.
790,22,47,Bxc4,b'2r1n1k1/5p1p/pr1B2pb/2p5/2b1P1P1/1P1R1B2/PKN4P/3R4 w - -',Which loses the c pawn and the exchange.
791,22,48,3e5,b'2r1n1k1/5p1p/pr1B2pb/2p1P3/2b3P1/1P1R1B2/PKN4P/3R4 b - -',I protect the bishop again as it is losing a protector.
792,22,49,3Bxd3,b'2r1n1k1/5p1p/pr1B2pb/2p1P3/6P1/1P1b1B2/PKN4P/3R4 w - -',He takes.
793,22,50,3Rxd3,b'2r1n1k1/5p1p/pr1B2pb/2p1P3/6P1/1P1R1B2/PKN4P/8 b - -',I take back.
794,22,51,3c4,b'2r1n1k1/5p1p/pr1B2pb/4P3/2p3P1/1P1R1B2/PKN4P/8 w - -',another strong move.
795,22,52,3Rd1,b'2r1n1k1/5p1p/pr1B2pb/4P3/2p3P1/1P3B2/PKN4P/3R4 b - -',My rook retreats.
796,22,53,3Bf4,b'2r1n1k1/5p1p/pr1B2p1/4P3/2p2bP1/1P3B2/PKN4P/3R4 w - -',Attacking h2 and also indirectly d6.
797,22,54,3Bd5,b'2r1n1k1/5p1p/pr1B2p1/3BP3/2p2bP1/1P6/PKN4P/3R4 b - -',Hoping to make something of this attack on c4 and f7.
798,22,55,3Nxd6,b'2r3k1/5p1p/pr1n2p1/3BP3/2p2bP1/1P6/PKN4P/3R4 w - -',He takes.
799,22,56,3exd6,b'2r3k1/5p1p/pr1P2p1/3B4/2p2bP1/1P6/PKN4P/3R4 b - -',I take back.
800,22,57,3c3+,b'2r3k1/5p1p/pr1P2p1/3B4/5bP1/1Pp5/PKN4P/3R4 w - -',"He throws in a check. The pawn on d6 will fall. If Ka3 it falls with check to his bishop which then takes on h2. If King moves to b1 or a1 Rxd6 threatens Rc-d8 and as I have to meet that threat the pawn on h2 goes too. I didn't fancy playing on the exchange and two pawns down against a player of his quality so I resigned.

Many thanks for reading! Please leave a comment and rate this annotation on the star system so I know how I am doing with my annotations. Until next time dear reader!"
801,23,0,d4,b'rnbqkbnr/pppppppp/8/8/3P4/8/PPP1PPPP/RNBQKBNR b KQkq d3',I am annotating this game to help vectevs (1704) who is an over-the-board team mate!
802,23,1,Nf6,b'rnbqkb1r/pppppppp/5n2/8/3P4/8/PPP1PPPP/RNBQKBNR w KQkq -',So it start conventionally.
803,23,2,d5,b'rnbqkb1r/ppp2ppp/4pn2/3p4/2PP4/2N5/PP2PPPP/R1BQKBNR w KQkq d6',Transposing into a Queen's Gambit Declined.
804,23,3,e3,b'rnbqk2r/ppp1bppp/4pn2/3p4/2PP4/2N1PN2/PP3PPP/R1BQKB1R b KQkq -',It is more usual to develop the Bc1 to g5 - that is what I do as white - but this is perfectly playable.
805,23,4,O-O,b'rnbq1rk1/ppp1bppp/4pn2/3p4/2PP4/2N1PN2/PP3PPP/R1BQKB1R w KQ -',Natural development.
806,23,5,Be2,b'rnbq1rk1/ppp1bppp/4pn2/3p4/2PP4/2N1PN2/PP2BPPP/R1BQK2R b KQ -',White wants to castle king side too.
807,23,6,dxc4,b'rnbq1rk1/ppp1bppp/4pn2/8/2pP4/2N1PN2/PP2BPPP/R1BQK2R w KQ -',Black has wisely waited until white has moved the Bf1 before taking on c4.
808,23,7,a6,b'rnbq1rk1/1pp1bppp/p3pn2/8/2BP4/2N1PN2/PP3PPP/R1BQK2R w KQ -',Preparing queen side expansion.
809,23,8,O-O,b'rnbq1rk1/1pp1bppp/p3pn2/8/2BP4/2N1PN2/PP3PPP/R1BQ1RK1 b - -',Natural developing move...
810,23,9,b5,b'rnbq1rk1/2p1bppp/p3pn2/1p6/2BP4/2N1PN2/PP3PPP/R1BQ1RK1 w - b6',So black expands.
811,23,10,Be2,b'rnbq1rk1/2p1bppp/p3pn2/1p6/3P4/2N1PN2/PP2BPPP/R1BQ1RK1 b - -',and the bishop drops back.
812,23,11,Bb7,b'rn1q1rk1/1bp1bppp/p3pn2/1p6/3P4/2N1PN2/PP2BPPP/R1BQ1RK1 w - -',Black puts the bishop on the long diagonal.
813,23,12,1Re1,b'rn1q1rk1/1bp1bppp/p3pn2/1p6/3P4/2N1PN2/PP2BPPP/R1BQR1K1 b - -',Perhaps with a view to playing e3-e4 sometime.
814,23,13,1c5,b'rn1q1rk1/1b2bppp/p3pn2/1pp5/3P4/2N1PN2/PP2BPPP/R1BQR1K1 w - c6',Black plays the natural freeing move.
815,23,14,1dxc5,b'rn1q1rk1/1b2bppp/p3pn2/1pP5/8/2N1PN2/PP2BPPP/R1BQR1K1 b - -',White takes.
816,23,15,1Bxc5,b'rn1q1rk1/1b3ppp/p3pn2/1pb5/8/2N1PN2/PP2BPPP/R1BQR1K1 w - -',Black takes back.
817,23,16,1Qxd8,b'rn1Q1rk1/1b3ppp/p3pn2/1pb5/8/2N1PN2/PP2BPPP/R1B1R1K1 b - -',Queens come off.
818,23,17,1Rd1,b'rn1r2k1/1b3ppp/p3pn2/1pb5/8/2N1PN2/PP2BPPP/R1BR2K1 b - -',White contests the d file.
819,23,18,1Rxd1+,b'rn4k1/1b3ppp/p3pn2/1pb5/8/2N1PN2/PP2BPPP/R1Br2K1 w - -',a pair of rooks come off.
820,23,19,1Bxd1,b'rn4k1/1b3ppp/p3pn2/1pb5/8/2N1PN2/PP3PPP/R1BB2K1 b - -',White takes back.
821,23,20,1Nc6,b'r5k1/1b3ppp/p1n1pn2/1pb5/8/2N1PN2/PP3PPP/R1BB2K1 w - -',Black develops the last minor piece. Black has a very small advantage here due to better development and a slight space advantage on the queen side.
822,23,21,1a3,b'r5k1/1b3ppp/p1n1pn2/1pb5/8/P1N1PN2/1P3PPP/R1BB2K1 b - -',White prevents further advance of the b pawn.
823,23,22,1Bd6,b'r5k1/1b3ppp/p1nbpn2/1p6/8/P1N1PN2/1P3PPP/R1BB2K1 w - -',I have the Gameknot computer analysis and neither side makes any mistake in this game according to it.  This looks wrong to me I would have thought the natural move would be to seize the open file with the rook or to centralise the king. I therefore set up this position on Fritz. Fritz does like this move.
824,23,23,1b4,b'r5k1/1b3ppp/p1nbpn2/1p6/1P6/P1N1PN2/5PPP/R1BB2K1 b - b3',Black's spacial advantage on the queen side is no more.
825,23,24,1Ne5,b'r5k1/1b3ppp/p2bpn2/1p2n3/1P6/P1N1PN2/5PPP/R1BB2K1 w - -',Looking for more exchanges. An impression I am getting is that neither player is particularly ambitious in this game - both seem happy to trade pieces and head towards a draw.
826,23,25,1Nxe5,b'r5k1/1b3ppp/p2bpn2/1p2N3/1P6/P1N1P3/5PPP/R1BB2K1 b - -',So the knight comes off.
827,23,26,1Bxe5,b'r5k1/1b3ppp/p3pn2/1p2b3/1P6/P1N1P3/5PPP/R1BB2K1 w - -',Recaptured.
828,23,27,1Bb2,b'r5k1/1b3ppp/p3pn2/1p2b3/1P6/P1N1P3/1B3PPP/R2B2K1 b - -',almost symmetrical position now - at least on the a b g and h files...
829,23,28,1Rc8,b'2r3k1/1b3ppp/p3pn2/1p2b3/1P6/P1N1P3/1B3PPP/R2B2K1 w - -',Threatening to take on c3.
830,23,29,1Rc1,b'2r3k1/1b3ppp/p3pn2/1p2b3/1P6/P1N1P3/1B3PPP/2RB2K1 b - -',so white protects.
831,23,30,1Kf8,b'2r2k2/1b3ppp/p3pn2/1p2b3/1P6/P1N1P3/1B3PPP/2RB2K1 w - -',King is centralised.
832,23,31,2f4,b'2r2k2/1b3ppp/p3pn2/1p2b3/1P3P2/P1N1P3/1B4PP/2RB2K1 b - f3',This move looks weakening to me and Fritz agree preferring Be7 or Bb3.
833,23,32,2Bxc3,b'2r2k2/1b3ppp/p3pn2/1p6/1P3P2/P1b1P3/1B4PP/2RB2K1 w - -',So black takes.
834,23,33,2Rxc3,b'2r2k2/1b3ppp/p3pn2/1p6/1P3P2/P1R1P3/1B4PP/3B2K1 b - -',White takes back correctly.
835,23,34,2Rd8,b'3r1k2/1b3ppp/p3pn2/1p6/1P3P2/P1R1P3/1B4PP/3B2K1 w - -',Black wisely avoids the exchange for once.
836,23,35,2Rc1,b'3r1k2/1b3ppp/p3pn2/1p6/1P3P2/P3P3/1B4PP/2RB2K1 b - -',Fritz prefers Bb3 here.
837,23,36,2Rd2,b'5k2/1b3ppp/p3pn2/1p6/1P3P2/P3P3/1B1r2PP/2RB2K1 w - -',Black takes control of the white's 2nd rank attacking g2 and b2.
838,23,37,2Bxf6,b'5k2/1b3ppp/p3pB2/1p6/1P3P2/P3P3/3r2PP/2RB2K1 b - -',Black is wise to do this capture.
839,23,38,2Rxg2+,b'5k2/1b3ppp/p3pB2/1p6/1P3P2/P3P3/6rP/2RB2K1 w - -',Black takes with check before recapturing.
840,23,39,2Kf1,b'5k2/1b3ppp/p3pB2/1p6/1P3P2/P3P3/6rP/2RB1K2 b - -',If Kh1?? Black can mate with R to g3 g4 g5 or g6!
841,23,40,2gxf6,b'5k2/1b3p1p/p3pp2/1p6/1P3P2/P3P3/6rP/2RB1K2 w - -',Now black takes back. Although black is a pawn up it is doubled and hard to convert to a win.
842,23,41,2Rc8+,b'2R2k2/1b3p1p/p3pp2/1p6/1P3P2/P3P3/6rP/3B1K2 b - -',This is an interesting move offering the exchange of rooks in an unusual way.
843,23,42,2Bxc8,b'2b2k2/5p1p/p3pp2/1p6/1P3P2/P3P3/6rP/3B1K2 w - -',Which black accepts.
844,23,43,2Kxg2,b'2b2k2/5p1p/p3pp2/1p6/1P3P2/P3P3/6KP/3B4 b - -',and white takes back.
845,23,44,2Bb7+,b'5k2/1b3p1p/p3pp2/1p6/1P3P2/P3P3/6KP/3B4 w - -',Black throws in a check.
846,23,45,2Kf2,b'5k2/1b3p1p/p3pp2/1p6/1P3P2/P3P3/5K1P/3B4 b - -',and white wisely avoids the bishop exchange. With bishops on it is harder for black to win.
847,23,46,2Bc6,b'5k2/5p1p/p1b1pp2/1p6/1P3P2/P3P3/5K1P/3B4 w - -',Presumably to prevent a3-a4 and a pawn exchange on b5.
848,23,47,2Bc2,b'5k2/5p1p/p1b1pp2/1p6/1P3P2/P3P3/2B2K1P/8 b - -',white hits the pawn on h7.
849,23,48,2f5,b'5k2/5p1p/p1b1p3/1p3p2/1P3P2/P3P3/2B2K1P/8 w - -',Black blocks the attack.
850,23,49,2Ke2,b'5k2/5p1p/p1b1p3/1p3p2/1P3P2/P3P3/2B1K2P/8 b - -',White centralises his king more.
851,23,50,2Ke7,b'8/4kp1p/p1b1p3/1p3p2/1P3P2/P3P3/2B1K2P/8 w - -',Black's king follows him across.
852,23,51,3Kd2,b'8/4kp1p/p1b1p3/1p3p2/1P3P2/P3P3/2BK3P/8 b - -',White moves the king over again avoiding Kd3? Be4+
853,23,52,3Kd7,b'8/3k1p1p/p1b1p3/1p3p2/1P3P2/P3P3/2BK3P/8 w - -',Not sure why black picked this square rather than d6.
854,23,53,3Kc3,b'8/3k1p1p/p1b1p3/1p3p2/1P3P2/P1K1P3/2B4P/8 b - -',King is heading for the centre.
855,23,54,3Kc7,b'8/2k2p1p/p1b1p3/1p3p2/1P3P2/P1K1P3/2B4P/8 w - -',I'm not sure what black is trying to do.
856,23,55,3Kd4,b'8/2k2p1p/p1b1p3/1p3p2/1P1K1P2/P3P3/2B4P/8 b - -',King comes up into he centre.
857,23,56,3Kd6,b'8/5p1p/p1bkp3/1p3p2/1P1K1P2/P3P3/2B4P/8 w - -',and the black king comes up to meet him.
858,23,57,3Bd3,b'8/5p1p/p1bkp3/1p3p2/1P1K1P2/P2BP3/7P/8 b - -',and the white king refuses to give way.
859,23,58,3f6,b'8/7p/p1bkpp2/1p3p2/1P1K1P2/P2BP3/7P/8 w - -',so black tries the only way possible.
860,23,59,3h4,b'8/7p/p1bkpp2/1p3p2/1P1K1P1P/P2BP3/8/8 b - h3',refusing to move the king again.
861,23,60,3Bb7,b'8/1b5p/p2kpp2/1p3p2/1P1K1P1P/P2BP3/8/8 w - -',not sure of the point of this either.
862,23,61,3Bc2,b'8/1b5p/p2kpp2/1p3p2/1P1K1P1P/P3P3/2B5/8 b - -',White of course is happy to mark time.
863,23,62,3e5+,b'8/1b5p/p2k1p2/1p2pp2/1P1K1P1P/P3P3/2B5/8 w - -',Black finally comes up with the pawn advance.
864,23,63,3Kc3,b'8/1b5p/p2k1p2/1p2pp2/1P3P1P/P1K1P3/2B5/8 b - -',White extremely wises refuses to exchange and undouble black's pawns - which would clearly lose - and also refuses to retreat to d3 allowing Be4+ and the bishop exchange - which would also lose. White finds the one move to draw.
865,23,64,3Be4,b'8/7p/p2k1p2/1p2pp2/1P2bP1P/P1K1P3/2B5/8 w - -',Black offers the bishop exchange again.
866,23,65,3Bb3,b'8/7p/p2k1p2/1p2pp2/1P2bP1P/PBK1P3/8/8 b - -',White wisely avoids.
867,23,66,3Bc6,b'8/7p/p1bk1p2/1p2pp2/1P3P1P/PBK1P3/8/8 w - -',Bishop drops back again.
868,23,67,3Kd2,b'8/7p/p1bk1p2/1p2pp2/1P3P1P/PB2P3/3K4/8 b - -',not sure of the point of this - the king seemed perfectly placed on c3
869,23,68,3h6,b'8/8/p1bk1p1p/1p2pp2/1P3P1P/PB2P3/3K4/8 w - -',presumably h7-h8 is played to make sure it is safe from white's bishop.
870,23,69,3Bc2,b'8/8/p1bk1p1p/1p2pp2/1P3P1P/P3P3/2BK4/8 b - -',White attacks f5.
871,23,70,3Ke6,b'8/8/p1b1kp1p/1p2pp2/1P3P1P/P3P3/2BK4/8 w - -',Black protects.
872,23,71,4Bb3+,b'8/8/p1b1kp1p/1p2pp2/1P3P1P/PB2P3/3K4/8 b - -',White checks.
873,23,72,4Ke7,b'8/4k3/p1b2p1p/1p2pp2/1P3P1P/PB2P3/3K4/8 w - -',King retreats. Maybe Bd5 was a better winning attempt but it is hard for black to win.
874,23,73,4Kc3,b'8/4k3/p1b2p1p/1p2pp2/1P3P1P/PBK1P3/8/8 b - -',King returns.
875,23,74,4Kd7,b'8/3k4/p1b2p1p/1p2pp2/1P3P1P/PBK1P3/8/8 w - -',Another king move.
876,23,75,4Kd2,b'8/3k4/p1b2p1p/1p2pp2/1P3P1P/PB2P3/3K4/8 b - -',"King drops back and a draw agreed. 

My friend asked me ""Be interesting to know if you think I played particularly well or if my opponent made major blunders."" I think my considered reply would be - neither side made any major blunders. White played the opening slightly insipidly and dropped a pawn. It was always going to be hard to convert the pawn but white played extremely well from that point on and prevented black from converting.

Anyway many thanks for reading. Please leave a comment or two let me know how I am doing with my annotations and grade this annotation on the star system. Until next time dear reader!"
877,24,0,c5,b'rnbqkb1r/pp1p1ppp/4pn2/2p5/3P1B2/5N2/PPP1PPPP/RN1QKB1R w KQkq c6',The good aggressive move I recommend.
878,24,1,Nc6,b'r1bqkb1r/pp1p1ppp/2n1pn2/2p5/3P1B2/2P2N2/PP2PPPP/RN1QKB1R w KQkq -',99% of players go like this when the tought move for me to meet would be cxd4 and I don't know how to unbalance the game in my favour. 
879,24,2,Qb6,b'r1b1kb1r/pp1p1ppp/1qn1pn2/2p5/3P1B2/2P1PN2/PP3PPP/RN1QKB1R w KQkq -',I can choose Qc2 but I wouldn't recommend  b3. I had serous bad experience with it. 
880,24,3,Qb3,b'r1b1kb1r/pp1p1ppp/1qn1pn2/2p5/3P1B2/1QP1PN2/PP3PPP/RN2KB1R b KQkq -',99% players don't exchange queens. He did.
881,24,4,axb3,b'r1b1kb1r/pp1p1ppp/2n1pn2/2p5/3P1B2/1PP1PN2/1P3PPP/RN2KB1R b KQkq -',Ok new scenario. How to attack without a Q??
882,24,5,exd4,b'r1b1kb1r/pp1p1ppp/2n1pn2/8/3P1B2/1PP2N2/1P3PPP/RN2KB1R b KQkq -',Not interested in exchanging pieces so soon I'm not going for a draw. My pawns are solid and they will keep so. 
883,24,6,b4,b'r1b1k2r/pp1pbppp/2n1pn2/8/1P1P1B2/2P2N2/1P3PPP/RN2KB1R b KQkq -',You'd queston it but look at Nc6: he has no place to go after b5 and a6 doesn't work beacuse of the pin on the a8 R. So no developing move right now but any alternative was just a shot in the dark (Bd3 is ok but what for? h3 so to get a square for the B after Nd5? How boring! Let's be nasty! :-)
884,24,7,b6,b'r1b1k2r/p2pbppp/1pn1pn2/8/1P1P1B2/2P2N2/1P3PPP/RN2KB1R w KQkq -',b5 is now uneffective because of Na5 defended. No point in playing it unless I have concrete plans on the dark center square which is not the case. My goal is to place a N on c4 so to threat Nxb6 until the R is still undefended...
885,24,8,O-O,b'r1b2rk1/p2pbppp/1pn1pn2/8/1P1P1B2/2P2N2/1P1N1PPP/R3KB1R w KQ -',? Black is allowing me a wonderful outpost!
886,24,9,1Nc4,b'r1b2rk1/p2pbppp/1pn1pn2/8/1PNP1B2/2P2N2/1P3PPP/R3KB1R b KQ -',I am now in control of d6 and threatenin Nxg6.
887,24,10,1Nd5,b'r1b2rk1/p2pbppp/1pn1p3/3n4/1PNP1B2/2P2N2/1P3PPP/R3KB1R w KQ -',Nice. No Nxg6 anymore and this is hard to attack... safely (c4 opens the way to Nb4 and Nc2+). And this makes a tempo for me to save the B (I sure want it!) before b4 followed by NxN and Rxa5 winning a pawn. 
888,24,11,f5,b'r1b2rk1/p2pb1pp/1pn1p3/3n1p2/1PNP4/2P2NB1/1P3PPP/R3KB1R w KQ f6',Still threatening and gainin space. I can save my B into h5 so I will take the tempo. 
889,24,12,1b5,b'r1b2rk1/p2pb1pp/1pn1p3/1P1n1p2/2NP4/2P2NB1/1P3PPP/R3KB1R b KQ -',If f4 Bh4. 
890,24,13,1Nd8,b'r1bn1rk1/p2pb1pp/1p2p3/1P1n1p2/2NP4/2P2NB1/1P3PPP/R3KB1R w KQ -',True is the N now has where to go. No advantage for me Nd5 still in place. Good defence no question. 
891,24,14,1Bd6,b'r1bn1rk1/p2pb1pp/1p1Bp3/1P1n1p2/2NP4/2P2N2/1P3PPP/R3KB1R b KQ -',I hope some N play can help me. I'm aiming at d7 and Nc6.
892,24,15,Nf7,b'r1b2rk1/p2p1npp/1p1Np3/1P1n1p2/3P4/2P2N2/1P3PPP/R3KB1R w KQ -',Again I played too ightly. This blocks me all the way. I should have gone back Nc4 for sure but I felt I was going nowhere so...
893,24,16,1g3,b'r1r3k1/p2p1npp/1p2p3/1P1n1p2/3P4/2P2NP1/1P3P1P/R3KB1R b KQ -',I'll play along the diagonal. 
894,24,17,1Nd6,b'r1r3k1/p2p2pp/1p1np3/1P1n1p2/3P4/2P2NP1/1P3P1P/R3KB1R w KQ -',...but he has Ne4. 
895,24,18,1Ne5,b'r1r3k1/p2p2pp/1p1np3/1P1nNp2/3P4/2P3P1/1P3P1P/R3KB1R b KQ -',The weack side of his good move...
896,24,19,1Rc7,b'r5k1/p1rp2pp/1p1np3/1P1nNp2/3P4/2P3P1/1P3P1P/R3KB1R w KQ -',The natural defence leaves Ra8 undefended but I am in no position to exploit it. 
897,24,20,1Bg2,b'r5k1/p1rp2pp/1p1np3/1P1nNp2/3P4/2P3P1/1P3PBP/R3K2R b KQ -',Unfortunately I can't play c4. Rc1 would be wise. 
898,24,21,1Ne4,b'r5k1/p1rp2pp/1p2p3/1P1nNp2/3Pn3/2P3P1/1P3PBP/R3K2R w KQ -',I seriously though about BxN here and try to win the black pawn. 
899,24,22,2O-O,b'r5k1/p1rp2pp/1p2p3/1P1nNp2/3Pn3/2P3P1/1P3PBP/R4RK1 b - -',Instsad I went for a disappointed and suboptimal move like my opponent did before. 
900,24,23,2Rf8,b'5rk1/p1rp2pp/1p2p3/1P1nNp2/3Pn3/2P3P1/1P3PBP/R4RK1 w - -',Planning an attack on f4 but I have BxN.
901,24,24,2Rae1,b'5rk1/p1rp2pp/1p2p3/1P1nNp2/3Pn3/2P3P1/1P3PBP/4RRK1 b - -',with the idea BxN winning the pawn but fatally overlooking...
902,24,25,2Nd2,b'5rk1/p1rp2pp/1p2p3/1P1nNp2/3P4/2P3P1/1P1n1PBP/4RRK1 w - -',Ouch! Nothing nothing to do!
903,24,26,Ne7,b'5rk1/p1rpn1pp/1p2p3/1P2Np2/3P4/2P3P1/1P2RPBP/5K2 w - -',Black prepares d6.
904,24,27,2f4,b'5rk1/p1rpn1pp/1p2p3/1P2Np2/3P1P2/2P3P1/1P2R1BP/5K2 b - f3',Sooner or later I will play it so why not now? Sigh... a balanced game like this almost decent... and I blundered like a novice! 
905,24,28,2Ng6,b'5rk1/p1rp2pp/1p2p1n1/1P2Np2/3P1P2/2P3P1/1P2R1BP/5K2 w - -',No d6 (he saw Rxe6 after it). No point in exchanging the N I have to shield in. 
906,24,29,2Nf3,b'5rk1/p1rp2pp/1p2p1n1/1P3p2/3P1P2/2P2NP1/1P2R1BP/5K2 b - -',No evil in closing the diagonal for the B: it is useless right now.
907,24,30,2Re8,b'4r1k1/p1rp2pp/1p2p1n1/1P3p2/3P1P2/2P2NP1/1P2R1BP/5K2 w - -',Preparing a strike so I can't move my N. I'm getting tangled. 
908,24,31,2Kf2,b'4r1k1/p1rp2pp/1p2p1n1/1P3p2/3P1P2/2P2NP1/1P2RKBP/8 b - -',For my B to come to f1 if needed. 
