,gid,aid,move,fen,annotation
705,28,2,Qa4,b'r1b1k2r/ppq1npbp/2npp1p1/2p5/Q1P1PN2/3B1N2/PP1P1PPP/R1B2RK1 b kq -',..thought this was wasting time..needed to activate more pieces...i.e black bishop Rf1 or prepare for longer f4
706,28,3,Bd7,b'r3k2r/ppqbnpbp/2npp1p1/2p5/Q1P1PN2/3B1N2/PP1P1PPP/R1B2RK1 w kq -',..gain another tempo..helpful for black.
707,28,4,d5,b'r3k2r/ppqbnpbp/4p1p1/2pp4/1nP1PN2/1Q1B1N2/PP1P1PPP/R1B2RK1 w kq -',No need to take the bishop now gain time and pressure the centre.
708,28,5,1Qxd3,b'r3k2r/ppqbnpbp/4p1p1/2pp4/2P1PN2/P2Q1N2/1P1P1PPP/R1B2RK1 b kq -',mistake...should be Nxd3 white drops a piece.
709,28,6,Qxc4,b'r4rk1/pp1bnpbp/4p1p1/2ppP3/2q5/P4N2/1P1PQPPP/R1B2RK1 w - -',..swop Q's and head for end game...
710,28,7,2Rdc1,b'r4rk1/pp3pbp/q3p1p1/1bpnP1B1/3p4/P2P1N2/1P2QPPP/R1R3K1 b - -',..white needed to get rid of pin..maybe Ne1 first
711,28,8,Qe2,b'r4rk1/pp3pbp/4p1p1/R2nP1B1/3p4/P4b2/1P1QqPPP/R5K1 w - -',..i want to force off pieces as i am a piece up...
712,28,9,d2,b'r4rk1/pp3p1p/4p1pB/R2n4/8/P4P1P/1b1p1P2/3R2K1 w - -',..i can afford the exchange down..and it also removes another piece
713,28,10,2Rxd2,b'r4rk1/pp3p1p/4p1pB/R2n4/8/P4P1P/1b1R1P2/6K1 b - -',....white is lost completely with the skewer Bc3 white can resign.
714,28,11,Rd1+,b'r5k1/pp5p/4pppB/b7/5n2/P4R1P/5P2/3r2K1 w - -',..at last an opportunity to quickly force off more material if not end the game with a mating threat.
715,28,12,3Kf1,b'r5k1/pR5p/4pp1r/b5p1/5n2/P7/5P2/5K2 b - -',..white is 3 pieces down and mate threatened...
716,28,13,Rh1#,b'3r2k1/p6p/4pp2/b5p1/5n2/P7/5P2/1R3K1r w - -',
717,29,0,d5,b'rnbqkb1r/pp3ppp/4pn2/2pp4/2P5/2N3P1/PP1PPPBP/R1BQK1NR w KQkq d6',I try to play active with black - because I much higher then my opponent.
718,29,1,cxd4,b'rnbqkb1r/pp3ppp/5n2/3p4/3p4/2N3P1/PP2PPBP/R1BQK1NR w KQkq -',I develop the knight with tempo.
719,29,2,d4,b'r1bqkb1r/pp3ppp/2n2n2/8/3p4/2N3P1/PP2PPBP/R1BQK1NR w KQkq -',maybe the only way to defend my pawn. After Be6 Bg5 makes problems.
720,29,3,1Bxc6+,b'r1b1k2r/pp2qppp/2B5/8/3p4/6P1/PP1QPP1P/R3K1NR b KQkq -',I have oversee this. Instead Qe7 a Be6 could be good enough.
721,29,4,1bxc6,b'r1b1k2r/p3qppp/2p5/8/3p4/6P1/PP1QPP1P/R3K1NR w KQkq -',my pieces are active I loose a pawn but then I castle and all my pieces can attack - anyway white can be better after Qxd4 0-0 Nf3
722,29,5,Bh3,b'r2r2k1/p3qppp/2p5/8/2Q5/5NPb/PP2PP1P/R3K2R w KQ -',to prevent 0-0 so I get a quality - I give a bishop for the rook stay out of game... That's good for my pawn. If Qxc6 now I play Qb4  if Nd2 Qxd2# if Qc3 after Qxc3 bxc3 and Rd8 then Rg1 is a must for white and after Bg4 the king must go to f1 and black's position is good enough.
723,29,6,Qd7,b'r2r2k1/p2q1ppp/2p5/8/7Q/5NPb/PP2PP1P/R3K2R w KQ -',Rg1 Bg4 and after the exchange Qd2  with winning the b2 and the a2 pawn because he cannot defend the rook on a1.
724,29,7,1e3,b'r2r2k1/p2q1ppp/2p5/8/7Q/4PNPb/PP3P1P/R3K2R b KQ -',Rg1!!!
725,29,8,Qd3+,b'r2r2k1/p4ppp/2p5/8/7Q/3qPNP1/PP2KPbP/R6R w - -',it is over...
726,29,9,2Ke1,b'r2r2k1/p4ppp/2p5/8/7Q/3qPNP1/PP3PbP/R3K2R b - -',Bxf3 and the mate on e2 is unstoppable.
727,30,0,c5,b'rnbqkbnr/pp1ppppp/8/2p5/4P3/8/PPPP1PPP/RNBQKBNR w KQkq c6',Sicilian ... I didn't expect this. I thought I'd stick to my usual development moves where Black moved e5 ... I know it isn't a good idea    
728,30,1,Bc4,b'rnbqkbnr/pp2pppp/3p4/2p5/2B1P3/5N2/PPPP1PPP/RNBQK2R b KQkq -',In retrospect d4 would have been better
729,30,2,d3,b'r1bqkbnr/pp2pppp/2np4/2p5/2B1P3/3P1N2/PPP2PPP/RNBQK2R b KQkq -',I decide to open my other bishop
730,30,3,Bg5,b'r1bqkb1r/pp3ppp/2nppn2/2p3B1/2B1P3/2NP1N2/PPP2PPP/R2QK2R b KQkq -',The knight is pinned
731,30,4,h3,b'r1bqk2r/pp2bppp/2nppn2/2p3B1/2B1P3/2NP1N1P/PPP2PP1/R2QK2R b KQkq -',I didn't want to exchange the knight unless my foe forced me too. So I decided to move h3 as then my foe's white bishop can't pin my knight in the future .. But now I think it was a bad move
732,30,5,a6,b'r1bqk2r/1p3pp1/p1nppb1p/2p5/2B1P3/2NP1N1P/PPP2PP1/R2Q1RK1 w kq -',My foe wants to capture the queen side 
733,30,6,1Rb1,b'1rbqk2r/1p3pp1/p1nppb1p/2p5/P1B1P3/2NP1N1P/1PP2PP1/1R1Q1RK1 b k -',This suits me the I can move Ne2 followed by d4
734,30,7,1b6,b'1rbqk2r/5pp1/ppnppb1p/2p5/P1B1P3/2NP1N1P/1PP2PP1/1R1Q1RK1 w k -',My opponent does this to develop his bishop. 
735,30,8,b5,b'1rbqk2r/5pp1/p1nppb1p/1pp5/P1B1P3/3P1N1P/1PP1NPP1/1R1Q1RK1 w k -',Due to that move my opponent has a change of plans and settles for b5. This is a mistake of my opponent throughout the game. He goes moves down due to such tactics
736,30,9,1c3,b'1rbq1rk1/5pp1/2nppb1p/1pp5/4P3/1BPP1N1P/1P2NPP1/1R1Q1RK1 b - -',c3 attacking for the center and making space for my bishop
737,30,10,1Bc2,b'1rbqr1k1/5pp1/2nppb1p/1p6/2pPP3/2P2N1P/1PB1NPP1/1R1Q1RK1 b - -',Both me and my opponent think that the game looks pretty jammed 
738,30,11,1Ra8,b'r1bqr1k1/5pp1/2nppb1p/1p6/2pPP3/2P2N1P/1PB1NPP1/1R1Q1RK1 w - -',"Black decides to conquer the ""a"" row however in doing so he goes another move down. He has no game plan another reason why I end up winning  "
739,30,12,1b4,b'r1bqr1k1/5pp1/2nppb1p/1p6/1PpPP3/2P2N1P/2B1NPP1/1R1Q1RK1 b - b3',Fearing Na5 an intrusion into my base
740,30,13,1Bb7,b'r2qr1k1/1b3pp1/2nppb1p/1p6/1PpPP3/2P2N1P/2B1NPP1/1R1Q1RK1 w - -',Black develops his bishop
741,30,14,1Re1,b'r2qr1k1/1b3pp1/2nppb1p/1p6/1PpPP3/2P2N1P/2B1NPP1/1R1QR1K1 b - -',By this I can take the center (d5) without pawn support
742,30,15,1d5,b'r2qr1k1/1b3pp1/2n1pb1p/1p1p4/1PpPP3/2P2N1P/2B1NPP1/1R1QR1K1 w - -',I don' t think this is a good move 
743,30,16,2Nh2,b'r2qr1k1/1b2bpp1/2n1p2p/1p1pP3/1PpP4/2P4P/2B1NPPN/1R1QR1K1 b - -',I fear f6 so I decide to make space for f4
744,30,17,2Nb8,b'rn1qr1k1/1b2bpp1/4p2p/1p1pP3/1PpP4/2P4P/2B1NPPN/1R1QR1K1 w - -',Black decides to maneuver his knight and ring it out on his king side ... again wasting moves 
745,30,18,2f4,b'rn1qr1k1/1b2bpp1/4p2p/1p1pP3/1PpP1P2/2P4P/2B1N1PN/1R1QR1K1 b - f3',I reinforce my capture 
746,30,19,Nf8,b'r2qrnk1/1b4p1/4p2p/1p1pPp1Q/1PpP1P1b/2P1R1NP/2B3PN/1R4K1 w - -',My foe wants to develop his knight by the king side  ..... If I have to act it must be now blacks position is pathetic 
747,30,20,2Bxf5,b'r2qrnk1/1b4p1/4p2p/1p1pPB1Q/1PpP1P1b/2P1R1NP/6PN/1R4K1 b - -',Now the fun starts ... If exf then Nxf5 Be7 Nxh6 Qxh6 And then a mate would eventually follow by Rg3 . However if Bxg3 then .....
748,30,21,Re7,b'r2q1nk1/1b2r1p1/7Q/1p1pPp2/1PpP1P2/2P3RP/6PN/1R4K1 w - -',Not my preferred way to defend  
749,30,22,3Nf3,b'r1bq1nk1/4r1p1/8/1p1pPp1Q/1PpP1P2/2P2NRP/6P1/1R4K1 b - -',I decide to get my knight into offense 
750,30,23,3Ng5,b'r1bq2k1/4r1p1/4n3/1p1pPpNQ/1PpP1P2/2P3RP/6P1/1R4K1 b - -',But I then got a better idea ... The exchange would favor me
751,30,24,3g6,b'r1bq2k1/4r1p1/6P1/1p1pP2Q/1PpP1p2/2P3RP/6P1/1R4K1 b - -',Qh7  Kf8 Qh8  
752,30,25,3Rf1,b'r1bq1k2/r5pQ/6P1/1p1pP3/1PpP1p2/2P3RP/6P1/5RK1 b - -',The pin
753,30,26,3Ra7a1,b'r1bq1k2/6pQ/6P1/1p1pP3/1PpP1p2/2P3RP/6P1/r4RK1 w - -',Just as I had hoped 
754,30,27,3Qf7#,b'r1bq4/5Q2/4k1P1/1p1pP3/1PpP1p2/2P3RP/6P1/r4RK1 b - -',
755,31,0,c4,b'rnbqkbnr/pppppppp/8/8/2P5/8/PP1PPPPP/RNBQKBNR b KQkq c3',this can go several ways...possibly English opening
756,31,1,d4,b'rnbqkb1r/pppppppp/5n2/8/2PP4/8/PP2PPPP/RNBQKBNR b KQkq d3',now it appears to transpose into a nimzo-indian
757,31,2,e6,b'rnbqkb1r/pppp1ppp/4pn2/8/2PP4/8/PP2PPPP/RNBQKBNR w KQkq -',Nc3 and then Bb4 would be a nimzo-indian round-about but this game doesn't take that direction. Being a transposed d-pawn opening though it is a good idea to get the c pawn to c4 and the knight out behind it asap.
758,31,3,a3,b'rnbqkb1r/pppp1ppp/4pn2/8/2PP4/P7/1P2PPPP/RNBQKBNR b KQkq -',this is a very unusual move per the chessgames.com database 20699 upper-ranked players played Nc3 here whereas only 45 played a3 (with a 28.9 % white score and a 49.9 black win score). It now turns into a Queen Pawn game (E00) or a Queen's Indian (E12).
759,31,4,a6,b'rnbqkb1r/1ppp1ppp/p3pn2/8/2PP4/P7/1P2PPPP/RNBQKBNR w KQkq -',NO more book moves these guys are on their own.
760,31,5,e3,b'rnbqkb1r/1ppp1ppp/p3pn2/8/2PP4/P3P3/1P3PPP/RNBQKBNR b KQkq -',this looks like too many pawn moves with no development.  If Nc3 was in place then the pawn could have gone to d4 right off...
761,31,6,c6,b'rnbqkb1r/1p1p1ppp/p1p1pn2/8/2PP4/P3P3/1P3PPP/RNBQKBNR w KQkq -',another pawn move presumably preparing d5 but it wasn't needed (and now blocks the knight.
762,31,7,b4,b'rnbqkb1r/1p1p1ppp/p1p1pn2/8/1PPP4/P3P3/5PPP/RNBQKBNR b KQkq b3',total forgoing of development to get space. The problem is that if the pieces aren't out there the opponents pieces can invade behind the pawn wall. 
763,31,8,d5,b'rnbqkb1r/1p3ppp/p1p1pn2/3p4/1PPP4/P3P3/5PPP/RNBQKBNR w KQkq d6',here comes the d5 'break move' but it doesn't really break anything. Both sides are dangerously underdeveloped and and black at least can castle in 2 moves...
764,31,9,Nf3,b'rnbqkb1r/1p3ppp/p1p1pn2/3p4/1PPP4/P3PN2/5PPP/RNBQKB1R b KQkq -',scrambling to prepare for castling. Prevents e5 which WOULD be a break move for black (albeit a dangerous one).
765,31,10,b6,b'rnbqkb1r/5ppp/ppp1pn2/3p4/1PPP4/P3PN2/5PPP/RNBQKB1R w KQkq -',I read on digg.com today that checkers had been solved this week.... maybe these guys were inspired by this computer feat....
766,31,11,Nfd2,b'rnbqkb1r/5ppp/ppp1p3/2Pp4/1P1Pn3/P3P3/3N1PPP/RNBQKB1R b KQkq -',Why not the other knight....develop a piece and then exchanging knights would have doubled black's pawns. The only thing saving White so fare is that black isn't developing either. White may have planned to kick the knight with f3 but there are now dangerous threats with Qh5. 
767,31,12,bxc5,b'rnbqkb1r/5ppp/p1p1p3/2Pp4/3Pn3/P3P3/3N1PPP/RNBQKB1R b KQkq -',black opens a file but it will take a while to use it. 
768,31,13,Qf6,b'rnb1kb1r/5ppp/p1p1pq2/2Pp4/3Pn3/P3P3/3N1PPP/RNBQKB1R w KQkq -',Immediate checkmate threat plus threatens bishop sacrifice on c5 with pressure on the unprotected a-rook.
769,31,14,1Nxe4,b'rnb1kb1r/5ppp/p1p1pq2/2Pp4/3PN3/P3P3/5PPP/RNBQKB1R b KQkq -',White quickly douses the flames.
770,31,15,1Bb2,b'rnb1kb1r/5ppp/p1p1pq2/2P5/3Pp3/P3P3/1B3PPP/RN1QKB1R b KQkq -',threatens a discovery on the queen and somewhat protects the rook. White is still not too bad both players have one iece developed and black has both doubled and 2 isolated pawns. White has one problem pawn but the bishop is weaker than black's queen.
771,31,16,1Qf5,b'rnb1kb1r/5ppp/p1p1p3/2P2q2/3Pp3/P3P3/1B3PPP/RN1QKB1R w KQkq -',black gets out of discovered attack.
772,31,17,1Bc4,b'rnb1kb1r/5ppp/p1p1p3/2P2q2/2BPp3/P3P3/1B3PPP/RN1QK2R b KQkq -',White prepares to castle.
773,31,18,1g6,b'rnb1kb1r/5p1p/p1p1p1p1/2P2q2/2BPp3/P3P3/1B3PPP/RN1QK2R w KQkq -',Black takes his time in castling in order to get a better bishop. 
774,31,19,1Qa4,b'rnb1k2r/5pbp/p1p1p1p1/2P2q2/Q1BPp3/P3P3/1B3PPP/RN3RK1 b kq -',rooks still aren't connected. What is white attacking here...it does prevent the black knight from coming out but the queen is dangerously off-side. The precep of attacking on the side where the pawns are pointing does not apply here as the center is not locked and it was never the 2 central pawns that were locked (just the c and d pawns). 
775,31,20,1O-O,b'rnb2rk1/5pbp/p1p1p1p1/2P2q2/Q1BPp3/P3P3/1B3PPP/RN3RK1 w - -',now black castles (finally) but white can connect his rooks more quickly. 
776,31,21,1d6,b'rnbr2k1/5pbp/p1pP2p1/2P1pq2/Q1B1p3/P3P3/1B1N1PPP/R4RK1 b - -',this stops the threat but the c5 pawn is weak. If the knight has to go into service to defend c5 the king will be woefully blocked in....
777,31,22,1Qc2,b'1nbr2k1/r4pbp/p1pP2p1/2P1pq2/2B1p3/P3P3/1BQN1PPP/R4RK1 b - -',good move - double threat on e4 and the queen can defend f2 if she has to... Black's queen would like to go to g5 and threaten Bh3 but the double attack on e4 prevents this. 
778,31,23,1Be6,b'1n1r2k1/r4pbp/p1pPb1p1/2P1pq2/2B1p3/P3P3/1BQN1PPP/R4RK1 w - -',one way to remove the threat on e4.  (but white shows that it doesn't work) 
779,31,24,2Nxe4,b'1n1r2k1/r4pbp/p1pPq1p1/2P1p3/4N3/P3P3/1BQ2PPP/R4RK1 b - -',white grabs the free pawn and double protects the weak c5. However this may prove to be a poisoned pawn as it was keeping the black bishop forever blocked in.
780,31,25,2Nd2,b'3r2k1/r2n1pbp/p1pPq1p1/2P1p3/8/P3P3/1BQN1PPP/R4RK1 b - -',seeing that the knight can be hassles by f5 he quickly moves out of the way giving up double protection on c5.
781,31,26,2Nf6,b'3r2k1/r4pbp/p1pPqnp1/2P1p3/8/P3P3/1BQN1PPP/R4RK1 w - -',knight/queen combinations are deadly...white has to keep the knight out of the kingside. h3 would do it. 
782,31,27,2exf4,b'3r2k1/r4pbp/p1pPqnp1/2P5/5P2/P7/1BQN2PP/R4RK1 b - -',the problem here is that black gets the open file...two of them. The queen can get out of the way and switch in a rook on f8.
783,31,28,2Rb7,b'3r2k1/1r3pbp/p1pPqnp1/2P5/5P2/P7/1BQN2PP/R4RK1 w - -',a blockaid with Be5 or N to c4/b7 might be a plan here. Double threat on b2 and overworked queen problems are starting to arise.
784,31,29,2Re5,b'3r2k1/1r3pbp/p1pP1np1/2PqR3/5P2/P7/1BQN2PP/R5K1 b - -',Re7 may have tied black up more and threatened using the good d pawn.
785,31,30,2Rxb2,b'3r2k1/5pbp/p1pP1np1/2PqR3/5P2/P7/1rQN2PP/R5K1 w - -',a bold exchange sacrifice.
786,31,31,Qd3,b'3r2k1/5pbp/p1pP1np1/2P1R3/5P2/P2q4/1Q1N2PP/R5K1 w - -',basically the only place for the queen to go....
787,31,32,2Rd1,b'3r2k1/5pbp/p1pP1np1/2P1R3/5P2/P2q4/1Q1N2PP/3R2K1 b - -',this just pins the unprotected rook....
788,31,33,2Ne4,b'3r2k1/5pbp/p1pP2p1/2P1R3/4nP2/P2q4/1Q1N2PP/3R2K1 w - -',now black has a skewer on the rook and queen.....
789,31,34,2Qb3,b'3r2k1/5pbp/p1pP2p1/2P1R3/4nP2/PQ1q4/3N2PP/3R2K1 b - -',"Qb1 would have been better....Qx on b1 RxQ N takes a free knight on d2 or an exchange on e5 and NxN on e4....white at least has some counter-play with Q to b6 or b7 and using the advanced d-pawn.....instead a horrible windmill ensues....
actually looking at this again the windmill would have happened with Qb1 anyway....!"
790,31,35,2Kh1,b'3r2k1/5pbp/p1pP2p1/2P1R3/3qnP2/PQ6/3N2PP/3R3K b - -',if white played K the other way to f1 it would be an immediate checkmate.
791,31,36,Qf2#,b'3r2k1/5pbp/p1pP2p1/2P1R3/5P2/PQ5n/3N1qPP/5K2 w - -',"beautiful windmill.....this game goes to show the power of queen/knight combinations. One of the benefits of having 2 bishops is the ability to exchange one of them at a propicous juncture in order to get rid of a nasty knight if need-be. Could white have kept the 2-bishop advantage instead of exchanging white bishops at move 19? It seemed reasonable at the time as white valued the black bishop due to black being weak on black squares.....but maybe 19.Be2 was the better move.
White played a good gameno real obvious errors until the end when (as it usually does) tactics took over. Probably 25.Re5 was the loosing mistake."
792,32,0,d4,b'rnbqkbnr/pppppppp/8/8/3P4/8/PPP1PPPP/RNBQKBNR b KQkq d3',QG opening.
793,32,1,dxc4,b'rnbqkbnr/ppp1pppp/8/8/2pP4/8/PP2PPPP/RNBQKBNR w KQkq -',Queen's gambit accepted!  Actually not used to this...
794,32,2,e4,b'rnbqkbnr/ppp1pppp/8/8/2pPP3/8/PP3PPP/RNBQKBNR b KQkq e3',"Assert centre control the point of the gambit...

In response to comments by sarasani and sicilianunleash it is true that I was not particularly concerned about 3... b5.  In that case I would have responded 4. a4 c6 5.b3 (not 5. axb5) or possibly 4.a4 a6? 5.axb5 if I got the chance."
795,32,3,Qd6,b'rnb1kbnr/ppp1pppp/3q4/8/2pPP3/8/PP3PPP/RNBQKBNR w KQkq -',Qd6?  Why move the Queen out?  Becomes a potential target.
796,32,4,Bxc4,b'rnb1kbnr/ppp1pppp/3q4/8/2BPP3/8/PP3PPP/RNBQK1NR b KQkq -',Recapture the pawn assert stronger centre control
797,32,5,Qb4+,b'rnb1kbnr/ppp1pppp/8/8/1qBPP3/8/PP3PPP/RNBQK1NR w KQkq -',Qb4 ?  Why?  Attempting to grab the bishop?  Easily defended.  And from here I can start developing with tempo.
798,32,6,Nd2,b'rnb1kbnr/ppp1pppp/8/8/1qBPP3/8/PP1N1PPP/R1BQK1NR b KQkq -',Defensive but the Queen is vulnerable. 
799,32,7,Nc6,b'r1b1kbnr/ppp1pppp/2n5/8/1qBPP3/8/PP1N1PPP/R1BQK1NR w KQkq -',Not bad.  Attempt to regain centre control since the pawn is not protected by the Queen anymore.
800,32,8,Ngf3,b'r1b1kbnr/ppp1pppp/2n5/8/1qBPP3/5N2/PP1N1PPP/R1BQK2R b KQkq -',But again easily defended.
801,32,9,g6,b'r1b1kbnr/ppp1pp1p/2n3p1/8/1qBPP3/5N2/PP1N1PPP/R1BQK2R w KQkq -',Setting up the fianchetto with idea to move ...Bg7.
802,32,10,a3,b'r1b1kbnr/ppp1pp1p/2n3p1/8/1qBPP3/P4N2/1P1N1PPP/R1BQK2R b KQkq -',So let me get the Queen out of here and develop my pieces
803,32,11,Qa5,b'r1b1kbnr/ppp1pp1p/2n3p1/q7/2BPP3/P4N2/1P1N1PPP/R1BQK2R w KQkq -',Backs up the Queen.  I do not want to move b4 since 8.b4 Nxb4 loses a pawn or worse for me.
804,32,12,O-O,b'r1b1kbnr/ppp1pp1p/2n3p1/q7/2BPP3/P4N2/1P1N1PPP/R1BQ1RK1 b kq -',Castle my King to get rid of that annoying pin.
805,32,13,Nf6,b'r1b1kb1r/ppp1pp1p/2n2np1/q7/2BPP3/P4N2/1P1N1PPP/R1BQ1RK1 w kq -',Not sure why this play.  Blocks in Bg7 also the Knight on d2 is no longer pinned.
806,32,14,Nb3,b'r1b1kb1r/ppp1pp1p/2n2np1/q7/2BPP3/PN3N2/1P3PPP/R1BQ1RK1 b kq -',As seen here.  Of course this exposes my pawn on e4 which I regretted later.
807,32,15,Qh5,b'r1b1kb1r/ppp1pp1p/2n2np1/7q/2BPP3/PN3N2/1P3PPP/R1BQ1RK1 w kq -',Moves Queen to Kingside which is where my King is now.  Also Queen is less exposed to my pieces which for the moment are all Queenside.
808,32,16,1Bf4,b'r1b1kb1r/ppp1pp1p/2n2np1/7q/2BPPB2/PN3N2/1P3PPP/R2Q1RK1 b kq -',Desiring here to gain dominant centre control.  However overlooked vulnerable pawn on e4.
809,32,17,1Nxe4,b'r1b1kb1r/ppp1pp1p/2n3p1/7q/2BPnB2/PN3N2/1P3PPP/R2Q1RK1 w kq -',Takes the pawn.  Overall though I have slightly better centre control and black's queen is still exposed.
810,32,18,1Qe2,b'r1b1kb1r/ppp1pp1p/2n3p1/7q/2BPnB2/PN3N2/1P2QPPP/R4RK1 b kq -',Attack the Knight.
811,32,19,1f5,b'r1b1kb1r/ppp1p2p/2n3p1/5p1q/2BPnB2/PN3N2/1P2QPPP/R4RK1 w kq f6',Why?  The Queen is limited in space she can go and is not really a threat here.  Why not Bf4 developing a more mobile piece and freeing up the rook on a8 to move to half-open d file.
812,32,20,1Rad1,b'r1b1kb1r/ppp1p2p/2n3p1/5p1q/2BPnB2/PN3N2/1P2QPPP/3R1RK1 b kq -',Take advantage of space to move to half-open file.  Coming down the centre.
813,32,21,1h6,b'r1b1kb1r/ppp1p3/2n3pp/5p1q/2BPnB2/PN3N2/1P2QPPP/3R1RK1 w kq -',?  Not sure why.  Presumably to stop Bg5.
814,32,22,1Be5,b'r1b1kb1r/ppp1p3/2n3pp/4Bp1q/2BPn3/PN3N2/1P2QPPP/3R1RK1 b kq -',But I wasn't going there.  Now castling become harder.  Also by tempting the Knight away the d file becomes open so my Rook on d1 is now worth more.  Still right here my dark bishop is currently worth more than his Knight on c6 so this isn't a bad play really.  Besides my bishop is obviously threatening his rook and his options are either give up right to castle or kill the bishop.
815,32,23,1Nxe5,b'r1b1kb1r/ppp1p3/6pp/4np1q/2BPn3/PN3N2/1P2QPPP/3R1RK1 w kq -',Now when I take with dxe5 my rook has access through all of d-file.
816,32,24,1dxe5,b'r1b1kb1r/ppp1p3/6pp/4Pp1q/2B1n3/PN3N2/1P2QPPP/3R1RK1 b kq -',Like so.
817,32,25,1e6,b'r1b1kb1r/ppp5/4p1pp/4Pp1q/2B1n3/PN3N2/1P2QPPP/3R1RK1 w kq -',Good job.  Blocks in my pawn prevents my white bishop from offering a threat in case black wants to castle.  However further blocks in black's white bishop.  From here on black is on the defensive.
818,32,26,1Qd3,b'r1b1kb1r/ppp5/4p1pp/4Pp1q/2B1n3/PN1Q1N2/1P3PPP/3R1RK1 b kq -',Threatening Qd8  which would have actually been a bad idea.  After 16. Qd8   Kf7 my Queen would have had few places to go.  Still this would pin his bishops potentially.  Note that 16. Qd8   Kf7 17.Qf6  would lead to disaster for me.  Anyway getting my forces ready for a move down the centre.
819,32,27,1Be7,b'r1b1k2r/ppp1b3/4p1pp/4Pp1q/2B1n3/PN1Q1N2/1P3PPP/3R1RK1 w kq -',Not bad defensive move.  Now I can't do Qd8 .  I have to get rid of one of these bishops is what I'm thinking here.
820,32,28,1Nbd4,b'r1b1k2r/ppp1b3/4p1pp/4Pp1q/2BNn3/P2Q1N2/1P3PPP/3R1RK1 b kq -',Here I was thinking of 17. Nd4xe6 with an idea to lure out the white bishop or possibly 17.Bxe6 to force the white bishop out.  This wouldn't have been too bad as 17.Bxe6 Bxe6 18.Nx36 would have allowed me to move Qd7  barricading in the King.  Wonder what would have happened if I did that?
821,32,29,1b6,b'r1b1k2r/p1p1b3/1p2p1pp/4Pp1q/2BNn3/P2Q1N2/1P3PPP/3R1RK1 w kq -',But now this allows me to threaten the black bishop.  I would prefer to move my Queen to the back rank directly anyway.
822,32,30,1Nc6,b'r1b1k2r/p1p1b3/1pN1p1pp/4Pp1q/2B1n3/P2Q1N2/1P3PPP/3R1RK1 b kq -',Eyes on black's dark bishop.
823,32,31,1Nd6,b'r1b1k2r/p1p1b3/1pNnp1pp/4Pp1q/2B5/P2Q1N2/1P3PPP/3R1RK1 w kq -',Threatens my bishop here but more importantly blocks my access to the d-file.  I definitely do not want to take the Knight here since 18.exd6 cxd6 means this file is pretty much closed to me.
824,32,32,1Nxe7,b'r1b1k2r/p1p1N3/1p1np1pp/4Pp1q/2B5/P2Q1N2/1P3PPP/3R1RK1 b kq -',Death to the black bishop!
825,32,33,1Nxc4,b'r1b1k2r/p1p1N3/1p2p1pp/4Pp1q/2n5/P2Q1N2/1P3PPP/3R1RK1 w kq -',At this point who cares about the white bishop?  The file is open so I take it.
826,32,34,Kf7,b'r1bQ3r/p1p1Nk2/1p2p1pp/4Pp1q/2n5/P4N2/1P3PPP/3R1RK1 w - -',Only place to move I have to do something about that rook.
827,32,35,2Qxh8,b'r1b4Q/p1p1Nk2/1p2p1pp/4Pp1q/2n5/P4N2/1P3PPP/3R1RK1 b - -',Gotta do it.
828,32,36,2Kxe7,b'r1b4Q/p1p1k3/1p2p1pp/4Pp1q/2n5/P4N2/1P3PPP/3R1RK1 w - -',White bishop is still pinned the King has minimal access here.  My King is nice and safe and the black Queen is still stuck.  Goodbye Knight you served me well.
829,32,37,2Qf6+,b'r1b5/p1p1k3/1p2pQpp/4Pp1q/2n5/P4N2/1P3PPP/3R1RK1 b - -',Best play at the moment.  Conversely I suppose I could have done Qd8  but that would have led to repetition.  This way the King is barricaded in.
830,32,38,2Ke8,b'r1b1k3/p1p5/1p2pQpp/4Pp1q/2n5/P4N2/1P3PPP/3R1RK1 w - -',And it's all over from here.
831,32,39,2Rd8#,b'r1bRk3/p1p5/1p2pQpp/4Pp1q/2n5/P4N2/1P3PPP/5RK1 b - -',Really enjoyed this game.
832,33,0,e4,b'rnbqkbnr/pppppppp/8/8/4P3/8/PPPP1PPP/RNBQKBNR b KQkq e3',King pawn opening - typically the start of a tactical game.
833,33,1,e5,b'rnbqkbnr/pppp1ppp/8/4p3/4P3/8/PPPP1PPP/RNBQKBNR w KQkq e6',Double king pawn opening which can lead to the Ruy Lopez Kings Gambit Petrov Bishops Opening.
834,33,2,Nc6,b'r1bqkbnr/pppp1ppp/2n5/4p3/4P3/5N2/PPPP1PPP/RNBQKB1R w KQkq -',Looking like a Ruy Lopez.
835,33,3,Nf6,b'r1bqkb1r/pppp1ppp/2n2n2/4p3/4P3/2N2N2/PPPP1PPP/R1BQKB1R w KQkq -',Four Knights Spanish Classical Defense.
836,33,4,Bb5,b'r1bqkb1r/pppp1ppp/2n2n2/1B2p3/4P3/2N2N2/PPPP1PPP/R1BQK2R b KQkq -',Last book move.
837,33,5,Bd6,b'r1bqk2r/pppp1ppp/2nb1n2/1B2p3/4P3/2N2N2/PPPP1PPP/R1BQK2R w KQkq -',Bb4 Bc5 d6 Nd4 d4 are a few typical book choices here. The text move has the disadvantage of blocking the d pawn but has the advantage of enabling castling.
838,33,6,Bc4,b'r1bqk2r/pppp1ppp/2nb1n2/4p3/2B1P3/2N2N2/PPPP1PPP/R1BQK2R b KQkq -',White positions the bishop better to target f7 which will enable a pin after 0-0-0 by black. White can afford some non developing moves because black is positionally bad due to the bishop and knight blocking the c and d pawns which close in the c8 bishop and limit the queen.
839,33,7,Bc5,b'r1bqk2r/pppp1ppp/2n2n2/2b1p3/2B1P3/2N2N2/PPPP1PPP/R1BQK2R w KQkq -',Black finds a better position for the bishop. The position is equal.
840,33,8,d3,b'r1bqk2r/pppp1ppp/2n2n2/2b1p3/2B1P3/2NP1N2/PPP2PPP/R1BQK2R b KQkq -',Opening a bishop line c1-h6 while closing f1-d3 for the other bishop. The goal appears to keep both bishops good and developing a bishop outside the pawn chain is a plus.
841,33,9,d6,b'r1bqk2r/ppp2ppp/2np1n2/2b1p3/2B1P3/2NP1N2/PPP2PPP/R1BQK2R w KQkq -',Black seeks a similiar and symetrical strategy.
842,33,10,h3,b'r1bqk2r/ppp2ppp/2np1n2/2b1p3/2B1P3/2NP1N1P/PPP2PP1/R1BQK2R b KQkq -',The text move weakens the pawn structure if castling short but prevents a pin by Bc8-g4 or Nf6-g4. Future moves will determine the effectiveness of this move.
843,33,11,Be6,b'r2qk2r/ppp2ppp/2npbn2/2b1p3/2B1P3/2NP1N1P/PPP2PP1/R1BQK2R w KQkq -',A trade of B x B will result in doubled pawns for black. Perhaps black is willing to sacrifice the pawn structure to gain 0-0-0. Another idea may be to castle short after the exchange which will give the rook the half open f file which can be used to attack by exchange sacrifice later at f3.
844,33,12,Bg5,b'r2qk2r/ppp3pp/2nppn2/2b1p1B1/4P3/2NP1N1P/PPP2PP1/R2QK2R b KQkq -',Applying a pin which is hard to refute without creating additional weakness on the kingside.
845,33,13,O-O,b'r2q1rk1/ppp3pp/2nppn2/2b1p1B1/4P3/2NP1N1P/PPP2PP1/R2QK2R w KQ -',Black takes a lead in development.
846,33,14,1Bxf6,b'r2q1rk1/ppp3pp/2nppB2/2b1p3/4P3/2NP1N1P/PPP2PP1/R2QK2R b KQ -',This move should be criticized because it offers nothing for the exchange. White just hands over the bishop advantage to black.
847,33,15,1Qxf6,b'r4rk1/ppp3pp/2nppq2/2b1p3/4P3/2NP1N1P/PPP2PP1/R2QK2R w KQ -',Stronger perhaps was Rf8xf6 with the idea of Qd8-f8 for better use of the f file. The queen gains no real advantage from this position because of a lack of good use of diagonals.
848,33,16,1Nb5,b'r4rk1/ppp3pp/2nppq2/1Nb1p3/4P3/3P1N1P/PPP2PP1/R2QK2R b KQ -',White targets a weak point at c7.
849,33,17,1Bb6,b'r4rk1/ppp3pp/1bnppq2/1N2p3/4P3/3P1N1P/PPP2PP1/R2QK2R w KQ -',Black covers the weakness while maintaining the useful bishop line.
850,33,18,1a4,b'r4rk1/ppp3pp/1bnppq2/1N2p3/P3P3/3P1N1P/1PP2PP1/R2QK2R b KQ a3',Probably with the idea of a4-a5 to dislodge the bishop which would be bad for white because black owns a5 via N + B vs R for white. Better would be to develop with the intent of castling long then using all resources for a kingside attack which should have good chances considering the weak kingside pawns for black.
851,33,19,1a6,b'r4rk1/1pp3pp/pbnppq2/1N2p3/P3P3/3P1N1P/1PP2PP1/R2QK2R w KQ -',Black drives the knight back which removes the pressure on c7 but helps the knight to centralize more gaining central control.
