,gid,aid,move,fen,annotation
152,7,10,Bb6,b'rnb1k2r/1p1n3p/pb2N1p1/1q4B1/4p1B1/4Q3/2P2KPP/3R1R2 w kq -',My opponent had this sequence of moves in mind which is probably another reason why he played 19... Ba5.  At first glance it looks like white is helpless but I read much further than my opponent in this line.
153,7,11,2Ng7+,b'rnb1k2r/1p1n2Np/pb4p1/1q4B1/4p1B1/4Q3/2P2KPP/3R1R2 b kq -',Exploiting the vulnerability at g7 that was present in earlier lines.
154,7,12,Nf6,b'rnb4r/1p3kNp/pb3np1/1q4B1/4p1B1/4Q1K1/2P3PP/3R1R2 w - -',23... Kxg7 24. Bh6+ Kg8 25. Be6#
155,7,13,Kxg7,b'rnb4r/1p4kp/pb3Rp1/1q4B1/4p1B1/4Q1K1/2P3PP/3R4 w - -',Kg8 prevents immediate mate.
156,7,14,2Qc3+,b'rnb4r/1p5p/pb3kpB/1q6/4p1B1/2Q3K1/2P3PP/3R4 b - -',My opponent resigned.
157,7,15,2Bg7#,b'rnb4r/1p4Bp/pb4p1/4k3/4p1B1/6K1/2P3PP/3R4 b - -',This is honestly one of the coolest mate positions I have ever seen let alone played.  Material-wise I am down a rook+knight+pawn yet the black king is checkmated in the center of the board.
158,8,0,Nf6,b'rnbqkb1r/pppp1ppp/5n2/4p3/4P3/5N2/PPPP1PPP/RNBQKB1R w KQkq -',Here nicely attacking each other !
159,8,1,Nxe4,b'rnbqkb1r/pppp1ppp/8/4N3/4n3/8/PPPP1PPP/RNBQKB1R w KQkq -',Like to have less pieces.
160,8,2,d6,b'rnbqkb1r/ppp2ppp/3p1n2/4N3/8/1P3Q2/P1PP1PPP/RNB1KB1R w KQkq -',Black side is slightly taking control of the board !
161,8,3,Nxf7,b'rnbqkb1r/ppp2Npp/3p1n2/8/8/1P3Q2/P1PP1PPP/RNB1KB1R b KQkq -',Brave white Knight ! It  looks like a sack ! Better be watching !
162,8,4,Be6,b'rn1q1b1r/ppp2kpp/3pbn2/8/2B5/1P3Q2/P1PP1PPP/RNB1K2R w KQ -',Black King in front asking trouble but fortunately Bishop covered the King. 
163,8,5,Qxb7,b'rn1q1b1r/pQp2kpp/3pbn2/8/2B5/1P6/P1PP1PPP/RNB1K2R b KQ -',Further white Queen is trying to do some damage.
164,8,6,Nc5,b'r2q1b1r/pQp2kpp/3pbn2/2n5/8/1P1B4/P1PP1PPP/RNB1K2R w KQ -',Unfortunately a fork ! Get back 1 Otherwise...
165,8,7,Nxd3+,b'r2q1b1r/p1p2kpp/3pbn2/8/8/1P1n1Q2/P1PP1PPP/RNB1K2R w KQ -',Another attack. This time white king was the target.
166,8,8,1cxd3,b'r2q1b1r/p1p2kpp/3pbn2/8/8/1P1P1Q2/P2P1PPP/RNB1K2R b KQ -',Pawn got rid of the Knight. I guess...   11. Qxd3 is better.
167,8,9,1Bg4,b'r2q1b1r/p1p2kpp/3p1n2/8/6b1/1P1P1Q2/P2P1PPP/RNB1K2R w KQ -',See ! Further trouble.
168,8,10,Qe8+,b'r3qb1r/p1p2kpp/3p1n2/8/5Qb1/1P1P4/P2P1PPP/RNB1K2R w KQ -',One after another ... because of that silly move.
169,8,11,Qe2+,b'r4b1r/p1p2kpp/3p1n2/8/5Qb1/1P1P4/P2PqPPP/RNB2K1R w - -',White King is in great danger ! what to do? Watch out...
170,8,12,Qe1#,b'r4b1r/p1p2kpp/3p1n2/8/5Qb1/1P1P4/P2P1PPP/RNB1q1KR w - -',"Done !
White side is too aggressive. First need some covering for the King then one can attack the other."
171,9,0,f4,b'rnbqkbnr/pppp1ppp/8/4p3/4PP2/8/PPPP2PP/RNBQKBNR b KQkq f3',Atwood ventures a King's Gambit.
172,9,1,exf4,b'rnbqkbnr/pppp1ppp/8/8/4Pp2/8/PPPP2PP/RNBQKBNR w KQkq -',As a man of honor Philidor accepts.
173,9,2,Nf3,b'rnbqkbnr/pppp1ppp/8/8/4Pp2/5N2/PPPP2PP/RNBQKB1R b KQkq -',A sure way to prevent a Black counterattack of ...Q-R5 ch always a danger in the King's Gambit.
174,9,3,g5,b'rnbqkbnr/pppp1p1p/8/6p1/4Pp2/5N2/PPPP2PP/RNBQKB1R w KQkq g6',Philidor supports the advanced Pawn.
175,9,4,Bc4,b'rnbqkbnr/pppp1p1p/8/6p1/2B1Pp2/5N2/PPPP2PP/RNBQK2R b KQkq -',Naturally Atwood goes after the weakness at KB7.
176,9,5,g4,b'rnbqkbnr/pppp1p1p/8/8/2B1Ppp1/5N2/PPPP2PP/RNBQK2R w KQkq -',Philidor counterattacks with verve.
177,9,6,d4,b'rnbqkbnr/pppp1p1p/8/8/2BPPpp1/5N2/PPP3PP/RNBQK2R b KQkq d3',Opening more attacking lines...
178,9,7,gxf3,b'rnbqkbnr/pppp1p1p/8/8/2BPPp2/5p2/PPP3PP/RNBQK2R w KQkq -',...but sacrificing a whole piece.
179,9,8,Qxf3,b'rnbqkbnr/pppp1p1p/8/8/2BPPp2/5Q2/PPP3PP/RNB1K2R b KQkq -',Bringing out the heavy artillery.
180,9,9,Nc6,b'r1bqkbnr/pppp1p1p/2n5/8/2BPPp2/5Q2/PPP3PP/RNB1K2R w KQkq -',Philidor hastens to begin his own development and consolidate his position.
181,9,10,c3,b'r1bqkbnr/pppp1p1p/2n5/8/2BPPp2/2P2Q2/PP4PP/RNB1K2R b KQkq -',Securely guarding the QP.
182,9,11,Qf6,b'r1b1kbnr/pppp1p1p/2n2q2/8/2BPPp2/2P2Q2/PP4PP/RNB1K2R w KQkq -',Adding a defender to the KB2 square.
183,9,12,e5,b'r1b1kbnr/pppp1p1p/2n2q2/4P3/2BP1p2/2P2Q2/PP4PP/RNB1K2R b KQkq -',Thrusting forward in the center.
184,9,13,Qxe5+,b'r1b1kbnr/pppp1p1p/2n5/4q3/2BP1p2/2P2Q2/PP4PP/RNB1K2R w KQkq -',Countering with a check.
185,9,14,Kd1,b'r1b1kbnr/pppp1p1p/2n5/4q3/2BP1p2/2P2Q2/PP4PP/RNBK3R b kq -',I must be missing something here. Why is 9 PxQ a bad move? I can't imagine Atwood overlooking it or Philidor missing it when he played his previous move.
186,9,15,Qf6,b'r1b1kbnr/pppp1p1p/2n2q2/8/2BP1p2/2P2Q2/PP4PP/RNBK3R w kq -',Having forced Atwood's King to move the Queen retreats.
187,9,16,1Re1+,b'r1b1kbnr/pppp1p1p/2n2q2/8/2BP1p2/2P2Q2/PP4PP/RNBKR3 b kq -',Down a piece and a Pawn Atwood must attack.
188,9,17,1Be7,b'r1b1k1nr/ppppbp1p/2n2q2/8/2BP1p2/2P2Q2/PP4PP/RNBKR3 w kq -',Philidor cuts him off at the pass.
189,9,18,1Bxf4,b'r1b1k1nr/ppppbp1p/2n2q2/8/2BP1B2/2P2Q2/PP4PP/RN1KR3 b kq -',Winning back the Pawn.
190,9,19,1d6,b'r1b1k1nr/ppp1bp1p/2np1q2/8/2BP1B2/2P2Q2/PP4PP/RN1KR3 w kq -',Enabling the QB to move folowed by O-O-O. With his attack gone and down a piece without compensation Atwood resigns.
191,10,0,e4,b'rnbqkbnr/pppppppp/8/8/4P3/8/PPPP1PPP/RNBQKBNR b KQkq e3',Classical...
192,10,1,e5,b'rnbqkbnr/pppp1ppp/8/4p3/4P3/8/PPPP1PPP/RNBQKBNR w KQkq e6',Book...
193,10,2,Nf3,b'rnbqkbnr/pppp1ppp/8/4p3/4P3/5N2/PPPP1PPP/RNBQKB1R b KQkq -',Planning a Ruy Lopez.
194,10,3,Nc6,b'r1bqkbnr/pppp1ppp/2n5/4p3/4P3/5N2/PPPP1PPP/RNBQKB1R w KQkq -',Von Pohl allows it.
195,10,4,Bb5,b'r1bqkbnr/pppp1ppp/2n5/1B2p3/4P3/5N2/PPPP1PPP/RNBQK2R b KQkq -',Following up.
196,10,5,a6,b'r1bqkbnr/1ppp1ppp/p1n5/1B2p3/4P3/5N2/PPPP1PPP/RNBQK2R w KQkq -',The Morphy defense.
197,10,6,Ba4,b'r1bqkbnr/1ppp1ppp/p1n5/4p3/B3P3/5N2/PPPP1PPP/RNBQK2R b KQkq -',Dodging the question.
198,10,7,b5,b'r1bqkbnr/2pp1ppp/p1n5/1p2p3/B3P3/5N2/PPPP1PPP/RNBQK2R w KQkq b6',Driving the Bishop.
199,10,8,Bb3,b'r1bqkbnr/2pp1ppp/p1n5/1p2p3/4P3/1B3N2/PPPP1PPP/RNBQK2R b KQkq -',Forced.
200,10,9,Nf6,b'r1bqkb1r/2pp1ppp/p1n2n2/1p2p3/4P3/1B3N2/PPPP1PPP/RNBQK2R w KQkq -',Solid development.
201,10,10,d4,b'r1bqkb1r/2pp1ppp/p1n2n2/1p2p3/3PP3/1B3N2/PPP2PPP/RNBQK2R b KQkq d3',Rellstab thrusts forward in the center.
202,10,11,exd4,b'r1bqkb1r/2pp1ppp/p1n2n2/1p6/3pP3/1B3N2/PPP2PPP/RNBQK2R w KQkq -',Logical.
203,10,12,e5,b'r1bqkb1r/2pp1ppp/p1n2n2/1p2P3/3p4/1B3N2/PPP2PPP/RNBQK2R b KQkq -',Rellstap postpones the recapture.
204,10,13,Bb4+,b'r1bqk2r/2pp1ppp/p1n2n2/1p2P3/1b1p4/1B3N2/PPP2PPP/RNBQK2R w KQkq -',Overreaching. Von Pohl should simply move his KN.
205,10,14,c3,b'r1bqk2r/2pp1ppp/p1n2n2/1p2P3/1b1p4/1BP2N2/PP3PPP/RNBQK2R b KQkq -',Now *two* Black pieces are en prise.
206,10,15,dxc3,b'r1bqk2r/2pp1ppp/p1n2n2/1p2P3/1b6/1Bp2N2/PP3PPP/RNBQK2R w KQkq -',Trying to squirm loose.
207,10,16,bxc3,b'r1bqk2r/2pp1ppp/p1n2n2/1p2P3/1b6/1BP2N2/P4PPP/RNBQK2R b KQkq -',Renewing the threat.
208,10,17,Nxe5,b'r1bqk2r/2pp1ppp/p4n2/1p2n3/1b6/1BP2N2/P4PPP/RNBQK2R w KQkq -',Still trying to wiggle off the hook.
209,10,18,1Nxe5,b'r1bqk2r/2pp1ppp/p4n2/1p2N3/1b6/1BP5/P4PPP/RNBQK2R b KQkq -',White already up a piece for 2 Pawns threatens both PxB and NxBP forking Q and R. In the face of this Von Pohl resigns.
210,11,0,c5,b'rnbqkb1r/pp3ppp/4pn2/2pp4/2PP4/2N2N2/PP2PPPP/R1BQKB1R w KQkq c6',The semi-tarrasch isn't an opening that I am particularly booked up on. I very rarely get it due to the Nf3 move order and as a general rule active play is normally enough to at least maintain the balance (apologies to any semi-tarrasch players)
211,11,1,h6,b'rnbqkb1r/pp3pp1/4pn1p/2pp2B1/2PP4/2N2N2/PP2PPPP/R2QKB1R w KQkq -',This was unexpected. To be honest at the time I felt that it must be downright inaccurate and very well may be but I struggled to an extent. The only sensible continuation at this point is Bxf6 Qxf6 cxd5 as otherwise I felt as if some of the purpose behind Bg5 was misguided.
212,11,2,cxd5,b'rnb1kb1r/pp3pp1/4pq1p/2pP4/3P4/2N2N2/PP2PPPP/R2QKB1R b KQkq -',Winning a pawn and at the same time rapidly liquidating the centre
213,11,3,cxd4,b'rnb1kb1r/pp3pp1/4pq1p/3P4/3p4/2N2N2/PP2PPPP/R2QKB1R w KQkq -',This move is best as after exd5 dxc5 Bxc5 e3 Black will be a pawn down with a very vulnerable isolated queen's pawn
214,11,4,Bb4,b'rnb1k2r/pp3pp1/4p2p/3P4/1b1N4/2N5/PP2PPPP/R3KB1R w KQkq -',An interesting move which I probably don't respond to very accurately. In hindsight dxe6 is by fr and away the best move where it isn't too relevant that Black can give White an isolated pawn on c3 as he will have his own weakling on e6. Sadly the aesthetics of having a passed pawn on d5 and the c pawn potentially supporting this caused me to play the following.
215,11,5,O-O,b'rnb2rk1/pp3pp1/7p/3P4/1b1N4/2N5/PP3PPP/R3KB1R w KQ -',Black though a pawn down does in fact now have an extent of compensation. The White knights aren't particularly good in spite of the seeming strength of the outposted d4 horseman. This is because there isn't actually any significant threats to be made on the dark squares c7 or e7 in time and the large amount of options for both of Black's bishops mean that the squares controlled by the knight are devalued. Meanwhile the d pawn can be easily attacked by Black and if it drops and material is restored it is likely he will have the better chances thanks to the bishop pair in the open position.
216,11,6,Re8+,b'rnb1r1k1/pp3pp1/7p/3P4/1b1N4/2N2B2/PP3PPP/R3K2R w KQ -',An impressive move order by Black. White can now begrudgingly accept a repetition a pawn up with Be2 or retreat his knight and cede the f5 square in which case Black's other bishop comes to life. 
217,11,7,Nd7,b'r1b1r1k1/pp1n1pp1/7p/3P4/1b6/2N2B2/PP2NPPP/R3K2R w KQ -',This is fine as White doesn't have the means of regaining control over f5 before the knight moves to free the light-squared bishop whilst gaining a tempo.
218,11,8,Ne5,b'r1b1r1k1/pp3pp1/7p/3Pn3/1b6/2N2B2/PP2NPPP/R4RK1 w - -',This was a bit of a nasty surprise. I had only considered Nf6 and Nb6 applying pressure to the pawn directly. The indirect attack targeting the defending bishop is significantly better as illustrated by the game continuation
219,11,9,Nc4,b'r1b1r1k1/pp3pp1/7p/3P4/1bn1B3/2N5/PP2NPPP/R4RK1 w - -',Winning back the pawn due to the double threat of Nxb2 and Nd2. Thankfully it wont be the d pawn that drops however. Whilst Black regains the pawn White gains time to unscramble his pieces and achieve a position with mutual chances
220,11,10,1a3,b'r1b1r1k1/pp3pp1/7p/3P4/1bn1B3/P1N5/1P2NPPP/R4RK1 b - -',I felt this was very necessary to avoid being worse. Black now should probably play Bf8 after which Ng3 Nxb2 Nb5 Rd8 Rac1 he will stand marginally better with the bishops if he can find good squares for them. Black opts instead however to maintain some traps which is in itself a perfectly viable option.
221,11,11,1Nxc3,b'r1b1r1k1/pp3pp1/7p/3P4/2n1B3/P1N5/1P3PPP/R4RK1 b - -',Obviously not bxc3 Ne2
222,11,12,Bd7,b'r3r1k1/pp1b1pp1/7p/3P4/4B3/P1N5/1n3PPP/R3R1K1 w - -',Preventing Bh7+
223,11,13,2d6,b'r3r1k1/pp1b1pp1/3P3p/8/4B3/P1N5/1n3PPP/R3R1K1 b - -',I felt that I had to be dynamic in this position due to the temporary discoordination of Black's knight and a8 rook. In fact though Ra1b1 is just the better move. It looked a bit hairy at first with Nc4 Rb7 in which both Nd6 and potential backrow mate tricks are in circulation but the tempo on the bishop makes this irrelevant and White will have regained his pawn with a winning position. Disappointingly though this entire branch was missed during the game.
224,11,14,2Bxc6,b'r3r1k1/pp3pp1/2BP3p/8/8/P1N5/1n3PPP/R3R1K1 b - -',I had convinced myself that the c6 pawn would be weak when deep down I knew that this was completely untrue due to their being no imminent means of attacking it and in fact control over d5 and b5 is significantly more relevant.
225,11,15,2d7,b'r3r1k1/p2P1pp1/2p4p/8/8/P1N5/1n3PPP/R3R1K1 b - -',I had quite a think before this move. The other main candidate was Rxe8+ Rxe8 d7 after which Rb1 (Re1 Kf8 gives White a lost position as Black's knight will round up the pawn with via c4-b6) Nc4 (Rxd7 does not work as the night covers d1) Rb7 where Nxa3 looks full of possibilities in which White sacks a pawn with Na4 playing for Nc5 and Rc8. Sadly though instead on Nxa3 if Black plays Nb6 the line simplifies into a dead level position. Therefore in the adventurous spirit of the game d7 was played with optimistic (misguided) ideas initially of Re7 Kf8 Re1 followed by routing the Knight to d6 with a won game.
226,11,16,2Re2,b'r2r2k1/p2P1pp1/2p4p/8/8/P1N5/1n2RPPP/R5K1 b - -',I realised fortuitously at this point that Re7 Kf8 Re1 Nd3 leaves White busted as he must waste a tempo moving the e1 rook after which Nc5 picks up the d pawn. The position now is quite edgy and in all honesty probably slightly better for Black. This next move though is a complete blunder
227,11,17,2Rab8,b'1r1r2k1/p2P1pp1/2p4p/8/8/P1N5/1n2RPPP/R5K1 w - -',I imagine Black had missed that after Rb1 Rxd7 R2xb2 Rxb2 Rxb2 that he wouldn't have mate on d1 due to the knight on c3. Black now loses at least a piece.
228,11,18,Nc4,b'1r1r2k1/p2P1pp1/2p4p/8/2n5/P1N5/4RPPP/1R4K1 w - -',Making a bad situation a lot worse
229,11,19,2dxe8=Q+,b'4Q1k1/p4pp1/2p4p/8/2n5/P1N5/5PPP/6K1 b - -',
230,12,0,c4,b'rnbqkbnr/pppppppp/8/8/2P5/8/PP1PPPPP/RNBQKBNR b KQkq c3',This is probably the most aggressive and risky game I have played for a long time. It happened in my Halibut gambit tournament.
231,12,1,b5,b'rnbqkbnr/p1pppppp/8/1p6/2P5/8/PP1PPPPP/RNBQKBNR w KQkq b6',Starting position
232,12,2,e4,b'rnbqkbnr/2pppppp/8/1p6/4P3/2N5/PP1P1PPP/R1BQKBNR b KQkq e3',This is surely a mistake.
233,12,3,c5,b'rnbqkbnr/3ppppp/8/2pN4/1p2P3/8/PP1P1PPP/R1BQKBNR w KQkq c6',I think I would have been tempted by e6.
234,12,4,e6,b'rnbqkbnr/3p1ppp/4p3/2pN4/1p1PP3/8/PP3PPP/R1BQKBNR w KQkq -',It was around this point that I decided to go for it. I think having such an advanced position for my knight went to my head and I thought I could see all sorts of possibilities. 
235,12,5,Bg5,b'rnbqkbnr/3p1ppp/4p3/2pN2B1/1p1PP3/8/PP3PPP/R2QKBNR b KQkq -',Obviously if the queen takes the bishop I can fork King and rook with my knight and may get to develop my remaining knight with tempo to f3
236,12,6,Nxf6+,b'rnbqkbnr/3p2pp/4pN2/2p3B1/1p1PP3/8/PP3PPP/R2QKBNR b KQkq -',Against a player ranked so much higher than me this is a high risk gambit.
237,12,7,Nxf6,b'rnbqkb1r/3p2pp/4pn2/2p3B1/1p1PP3/8/PP3PPP/R2QKBNR w KQkq -',I was hoping for (though not expecting) gxf6 as I then have Qh5+ 
238,12,8,e5,b'rnbqkb1r/3p2pp/4pn2/2p1P1B1/1p1P4/8/PP3PPP/R2QKBNR b KQkq -',Trying to maintain the pressure on black.
239,12,9,1exf6,b'rnbqkb1r/3p2p1/4pP1p/2p3B1/1p1P4/8/PP3PPP/R2QKBNR b KQkq -',I didn't want to retreat the bishop as g5 might follow if I did and that would give black advanced pawns on the kings side where I was looking to castle in future
240,12,10,1f7+,b'rnbqkb1r/3p1Pp1/4p3/2p3p1/1p1P4/8/PP3PPP/R2QKBNR b KQkq -',Black may have been expecting fxg7 but I have another plan which will regain my lost material and possibly more the bonus with this was that black couldn't castle - not that he was likely to now
241,12,11,1Kxf7,b'rnbq1b1r/3p1kp1/4p3/2p3p1/1p1P4/8/PP3PPP/R2QKBNR w KQ -',Black can't afford to leave one of my pawns so far advanced so has little choice
242,12,12,1Qxa8,b'Qnb2b1r/3p1kp1/4pq2/2p3p1/1p1P4/8/PP3PPP/R3KBNR b KQ -',Suddenly I am ahead on material with the chance of more. Black can no longer castle and  and I need to work out how to take advantage of the position
243,12,13,1Qxd4,b'Qnb2b1r/3p1kp1/4p3/2p3p1/1p1q4/8/PP3PPP/R3KBNR w KQ -',I was really expecting something like Bd6 here though black was trying to keep his advanced pawns together they could still yet prove a thorn in my side.
244,12,14,1Rd1,b'Qnb2b1r/3p1kp1/4p3/2p3p1/1p1q4/8/PP3PPP/3RKBNR b K -',I'm still not sure that the simple Qxb8 wouldn't have been better here in the end I decided to keep trying to pressure black. I figured that he would be tempted with Qxb2 partly to equalise on material but also because it means that his c and b pawns look a lot more threatening then.
245,12,15,1Bb5,b'Qnb2b1r/3p1kp1/4p3/1Bp3p1/1p6/8/Pq3PPP/3RK1NR b K -',Looking to develop here but again the simple Qxb8 or Nf3 may have been better. I wanted to preserve my a pawn as I may need it to keep the black pawns back a little. 
246,12,16,1Kf1,b'Qnb2b1r/3p1kp1/4p3/1Bp1q1p1/1p6/8/P4PPP/3R1KNR b - -',I didn't want to block as I wanted to develop my knight to f3 threatening check with Nxg5
247,12,17,1Qf3+,b'1nb2b1r/2qp1kp1/4p3/1Bp3p1/1p6/5Q2/P4PPP/3R1KNR b - -',With blacks queen there my queen is better off somewhere else. I wanted to try to keep black under pressure
248,12,18,1Kg8,b'1nb2bkr/2qp2p1/4p3/1Bp3p1/1p6/5Q2/P4PPP/3R1KNR w - -',This works well for me as I still have my lsb and am hoping to make good use of it
249,12,19,1Nh3,b'1nb2bkr/2qp2p1/4p3/1Bp3p1/1p6/5Q1N/P4PPP/3R1K1R b - -',Aiming at g5 with the simple threat of Qf7
250,12,20,1Qb3,b'1n3bkr/1bqp2p1/4p3/1Bp3p1/1p6/1Q5N/P4PPP/3R1K1R b - -',This foils my immediate plan but now I am looking at another. If I can get my knight to g5 then a sacrifice on d7 could be nasty for black with Qxe6 threatened
251,12,21,1Bxg2+,b'1n3bkr/2qp2p1/4p3/1Bp3p1/1p6/1Q5N/P4PbP/3R1K1R w - -',I'd completely missed this nice move which allows black to gain a pawn
252,12,22,2Nxg5,b'1n3bkr/3p2p1/4p3/1qp3N1/1p6/1Q3P2/P5KP/3R3R b - -',I am very happy with my knight here
253,12,23,Qa6,b'1n3bkr/3p2p1/q3p3/6N1/1pp5/4QP2/P5KP/3R3R w - -',Black now wants my a pawn so that he can escape but I think this is a blunder
254,12,24,2Qf4,b'1n3bkr/3p2p1/q3p3/6N1/1pp2Q2/5P2/P5KP/3R3R b - -',reverts to my earlier threat of Qf7# as far as I can see the only way to slow this down is something like ... Qxa2+ Rd2 Qxd2 Qxd2 with more material loss to follow. 
255,12,25,2Kf1,b'1n3bkr/3p2p1/4p3/6N1/1pp2Q2/5P2/q6P/3R1K1R b - -',Now things are really looking up for me black cannot check and I have mate in one
256,12,26,2Rh6,b'1n3bk1/3p2p1/4p2r/6N1/1pp2Q2/5P2/q6P/3R1K1R w - -',I don't understand this move I guess he was looking at Rf6 and had missed my threat.
257,12,27,2Qf7+,b'1n3bk1/3p1Qp1/4p2r/6N1/1pp5/5P2/q6P/3R1K1R b - -',Thanks for reading please comment.
258,13,0,1Nc5,b'2kr3r/ppp3p1/2n4p/2N4n/8/P6P/1PP2PPK/R1B2R2 b - -',You will see how much this move worth !!!
259,13,1,2Rad1,b'1k1r3r/ppp5/2n4p/2N3pn/8/P3B2P/1PP2PPK/3R1R2 b - -',"I think that i am better than him  because i have one Pawns more
So i decided to switch pieces"
260,13,2,g4,b'1k1r3r/ppp5/2n2n1p/2N5/6p1/P1P1B2P/1P3PPK/3R1R2 w - -',no need to switch so i will move my Pawns forward..
261,13,3,h5,b'1k1r3r/ppp5/2n2n2/2N4p/6pP/P1P1B3/1P3PPK/3R1R2 w - -',Now i think that i have a chance to get his night  let's see
262,13,4,2Bg5,b'1k1r4/ppp5/2n2n2/2N3Bp/6pP/P1P5/1P3PPK/5R2 b - -',Here we are a free night or i will get a rock for free
263,13,5,2Rd6,b'1k6/ppp5/2nr1n2/2N3Bp/6pP/P1P5/1P3PPK/5R2 w - -',I will get the night
264,13,6,2Bxf6,b'1k6/ppp5/2nr1B2/2N4p/6pP/P1P5/1P3PPK/5R2 b - -',It 's a trap
265,13,7,2Nd7+,b'1k6/pppN4/2n2r2/7p/6pP/P1P5/1P3PPK/5R2 b - -',Here is the move that make him reassign !! ;)
266,14,0,c4,b'rnbqkbnr/1p1p1ppp/p3p3/8/2PNP3/8/PP3PPP/RNBQKB1R b KQkq c3',"Alternative variation: 5. Bd3 Nf6 6. O-O Qc7 7. Qe2 d6 8. f4 Nbd7 9. c4 Be7 10. b3 O-O 11. Bb2
"
267,14,1,Nc2,b'r1b1kbnr/1pqp1ppp/p1n1p3/8/2P1P3/3B4/PPN2PPP/RNBQK2R b KQkq -',"Alternative variation: 7. Nxc6 bxc6 8. Nc3 d5 9. O-O
"
268,14,2,Be7,b'r1b1k1nr/1pqpbppp/p1n1p3/8/2P1P3/3B4/PPN2PPP/RNBQK2R w KQkq -',"Alternative variation: 7... Ne5 8. b3 Nxd3+
"
269,14,3,Qd6,b'r1b1k2r/1p1p1pp1/p1nq1n2/2b1pP1p/2P1P3/1P1BB3/P1N3PP/RN1Q1R1K w kq -',"Alternative variation: 13... Nb4
"
270,14,4,1exd5,b'r1b1k2r/3p1pp1/pp1q4/3PpP1p/2Pn4/1P1BN3/P5PP/2RQ1R1K b kq -',"Alternative variation: 18. cxd5 b5 19. Nc2 Nxc2 20. Qxc2 Bb7 ( 20... f6 21. Qxc8+) 21. f6 g6 (21... gxf6 22. Qc7 Qxc7 23. Rxc7 Bc8 24. Rxf6 Kd8 25. d6) 22. Be2 O-O (22... Rb8 23. Qc3) 23. Qc7
Alternative variation: 18. Nxd5 Bb7 (18... f6 19. c5 bxc5 20. b4) 19. f6 g6
"
271,14,5,1Be2,b'r1b1k2r/3p2p1/pp1q1p2/3PpP1p/2Pn4/1P2N3/P3B1PP/2RQ1R1K b kq -',"Alternative variation: 19. Nc2
"
272,14,6,2d6,b'r3k2r/1bqp2p1/pp1P1p2/4pP1p/2Pn4/1P2NB2/P5PP/2RQ1R1K b kq -',"Alternative variation: 21. Be4
Alternative variation: 21. Bxh5+ Ke7 22. Qg4 (22. Nc2 Nxc2 23. Rxc2 Rh7 24. Rd2 d6 25. Rd3 Rah8 26. Rh3)
Alternative variation: 21. Be4
"
273,14,7,2Qxf3,b'r3k2r/2qp2p1/pp1P1p2/4pP1p/2Pn4/1P2NQ2/P5PP/2R2R1K b kq -',"Alternative variation: 22. dxc7 Bxd1 23. Rcxd1 Rc8 24. Nd5
"
274,14,8,Kd7,b'r6r/3k2p1/pppP1p2/4pP1p/1PPn4/4N3/P5PP/2R2R1K w - -',"Alternative variation: 24... c5
"
275,14,9,3Rb3,b'r7/3k2p1/2pP1p2/1pP1pP1p/rP6/1R6/6PP/5R1K b - -',"Alternative variation: 31. h3 [ Con idea de Rh2 - Rg3 - Rh4 - Rh5]
Alternative variation: 31. Kg1
"
276,14,10,3Rg3,b'r7/3k2p1/2pP1p2/1pP1pP1p/1P6/r5R1/6PP/5R1K b - -',"Alternative variation: 32. Rxa3 Rxa3 33. h3 Rb3 34. Ra1 Rxb4 35. Ra7+ Kd8 36. Rc7 Rc4 37. Rxc6 b4 38. Rb6 Rxc5 39. Rxb4 Kd7 40. Rb7+ Kxd6 41. Rxg7 e4 42. g4 hxg4 43. hxg4 Re5 44. Kg2 Kd5 45. Kf2 
"
277,14,11,3Rc7,b'3k4/2R3p1/2pP1p2/1pP1pP1p/1r6/6P1/6PK/8 b - -',"Alternative variation: 38. Ra8+ Kd7 39. Ra7+ Kd8 40. Ra8+
"
278,14,12,4Rb7,b'3k4/1R4p1/3P1p2/2P1pP1p/2r5/1p4P1/6PK/8 b - -',"Alternative variation: 41. Rxg7 b2 (41... Rxc5 42. Rb7 Rc3 43. Rb6 Kd7) (41... Rb4 42. c6) 42. Rb7
Alternative variation: 41. c6 b2 42. Rd7+ Kc8 43. Rc7+ Kd8 44. Rd7+
"
279,14,13,4Kg3,b'8/6R1/3k1p2/2r2P2/4p1p1/6K1/6P1/8 b - -',"Alternative variation: 46. Rxg4 Re5 (46... Ke5 47. Rh4) 47. Kg1 e3 48. Kf1 Rxf5+ 49. Ke2
Alternative variation: 46. Rxg4 e3 47. Ra4 Re5
"
280,14,14,4Ke5,b'8/6R1/5p2/2r1kP2/4p1p1/6K1/6P1/8 w - -',"Alternative variation: 46... Rxf5
"
281,14,15,4Kxg4,b'8/6R1/5p2/2r1kP2/4p1K1/8/6P1/8 b - -',"Alternative variation: 47. Rh7
"
282,14,16,Kb6,b'8/8/1k3p1r/2R2K2/6P1/8/8/8 w - -',"Alternative variation: 70... Rh4 71. Rc3 Rh6 72. Re3 Kc7 73. Re6 Kd7 74. Rxf6
"
283,14,17,9g8=Q,b'6Q1/3k4/6K1/6R1/8/8/8/5r2 b - -',
284,15,0,c5,b'rnbqkbnr/pp3ppp/4p3/2pp4/3PP3/8/PPPN1PPP/R1BQKBNR w KQkq c6',4..Aggressive fighting response for blacj
285,15,1,Bxc5,b'rnbqk2r/pp3ppp/5n2/2bp4/8/5N2/PPPN1PPP/R1BQKB1R w KQkq -',6.  The exchange develops blacks bishop to a good square attacking f2
286,15,2,Bb6,b'r1bq1rk1/pp3ppp/1bn2n2/1B1p4/8/1N3N2/PPP2PPP/R1BQ1RK1 w - -',9 Black prefers to retreat on the same diagonal attacking f2
287,15,3,a6,b'r1bq1rk1/1p3ppp/pbn2n2/1B1p2B1/8/1N3N2/PPP2PPP/R2Q1RK1 w - -',10  I think white would be better off here to exchange But he retreats to d3 wasting yime
288,15,4,1g4,b'r2q1rk1/1p3ppp/pbn2n2/3p2Bb/6P1/1N1B1N1P/PPP2P2/R2Q1RK1 b - g3',White has now weakened his kingside  by pushing away the bishop
289,15,5,Qd6,b'r4rk1/1p3ppp/pbnq1nb1/3p2B1/6P1/1NPB1N1P/PP3P2/R2Q1RK1 w - -',Black now points his big gun toward the weakened kingside
290,15,6,1Bxf6,b'r4rk1/1p3ppp/pbnq1Bb1/3p4/6P1/1NPB1N1P/PP3P2/R2Q1RK1 b - -',15 White does not realize he made a fatal blunder.  I think my opponent thought black would play QxB but black finds a much better move Qg3+ winnning huge advantage.  The f2 pawn cannot take Q because he is pinned by Bishop on b6
291,15,7,1Rf3,b'r4rk1/1pb2ppp/p1n2B2/3p4/5PP1/1NPb1R1q/PP5N/R2Q3K b - -',19. Amother blunder by white allowing the rook pin
292,15,8,2Qxf3,b'r4rk1/1pb2ppp/p1n2B2/3p4/5PP1/1NP2Q1q/PP5N/R6K b - -',White now resignes after major material loss 
293,16,0,Bc4,b'rnbqkbnr/pppp1ppp/8/4p3/2B1P3/8/PPPP1PPP/RNBQK1NR b KQkq -',knights before bishops... except i really want to keep this bishop on this diagonal and black's knight on a5 ruins it.
294,16,1,Qf6,b'rnb1kbnr/pppp1ppp/5q2/4p3/2B1P3/8/PPPP1PPP/RNBQK1NR w KQkq -',hmm
295,16,2,Bc5,b'rnb1k1nr/pppp1ppp/5q2/2b1p3/2B1P3/5N2/PPPP1PPP/RNBQK2R w KQkq -',f2 is a serious target
296,16,3,Nh6,b'rnb1k2r/pppp1ppp/5q1n/2b1p3/2B1P3/5N2/PPPPQPPP/RNB1K2R w KQkq -',not certain what the plan is here for black
297,16,4,h3,b'rnb1k2r/pppp1ppp/5q1n/2b1p3/2B1P3/5N1P/PPPPQPP1/RNB1K2R b KQkq -',..but i don't want Ng4
298,16,5,a3,b'r1b1k2r/pppp1ppp/2n2q1n/2b1p3/2B1P3/P4N1P/1PPPQPP1/RNB1K2R b KQkq -',trying this out.. nice preventative move for Nb4
299,16,6,Nd4,b'r1b1k2r/pppp1ppp/5q1n/2b1p3/2BnP3/P4N1P/1PPPQPP1/RNB1K2R w KQkq -',this knight has to go
300,16,7,d3,b'r1b1k2r/pppp1ppp/5q1n/2b5/2BpP3/P2P3P/1PP1QPP1/RNB1K2R b KQkq -',i like this move.  black's bishop is going no where and f7 is still a viable attacking point
301,16,8,Qh5,b'r1b2rk1/pppp1ppp/5q1n/2b4Q/2BpP3/P2P3P/1PP2PP1/RNB1K2R b KQ -',i feel that this is a good square for my queen.  any thoughts?  attacking the bishop and a g6 blunder allows Qxh6.  plus nice parking spot until f7 is ready to go
302,16,9,1Bxh6,b'r1b2rk1/ppp2ppp/3p1q1B/2b4Q/2BpP3/P2P3P/1PP2PP1/RN2K2R b KQ -',open up the kings protection
303,16,10,1gxh6,b'r1b2rk1/ppp2p1p/3p1q1p/2b4Q/2BpP3/P2P3P/1PP2PP1/RN2K2R w KQ -',i think this will be the weak point for black moving forward
304,16,11,1O-O-O,b'r4rk1/ppp2p1p/3pbq1p/2b4Q/2BpP3/P2P3P/1PPN1PP1/2KR3R b - -',taunting black's queen for a free pawn... i would love it to open up on the f file.
305,16,12,1Qxh6,b'r4rk1/ppp2p1p/3p3Q/2b5/2NpP3/P2P3P/1PP2qP1/2KR3R b - -',if Qxg2 Rg1 and pin the queen.  also i can move Qg5! and fork the bishop but need that pawn on d6 gone
306,16,13,1e5,b'r4rk1/ppp4p/3p3Q/2b1Pp2/2Np3P/P2P2q1/1PP3P1/2KR3R b - -',i don't want black's rook active so keeping that pawn on f5 on the f file is key.  also Qe6! is a good place but I need black's queen off that diagonal because it's protecting the e5 and d6 squares which i intend to use.
307,16,14,Qxg2,b'r4rk1/ppp4p/7Q/2b1pp2/2Np3P/P2P3R/1PP3q1/2KR4 w - -',black is now in trouble
308,16,15,1Nxe5,b'r5k1/ppp2r1p/4Q3/2b1Np2/3p3P/P2P3R/1PP3q1/2KR4 b - -',i would black to take my rook
309,16,16,Re7,b'5k2/ppp1r2p/4Q3/2b2p2/3p3P/P2P4/1PP2q2/2K1R1R1 w - -',now it's a matting pattern from here on in.
