,gid,aid,move,fen,annotation
561,22,41,2Rfh3,b'6k1/pp3p1p/6pQ/q3p3/4n3/1Br4r/P4P1P/2RR2K1 w - -',"Rh3! traps the queen.  At this point white resigned (and resignation is not premature) but this was a fun game for me as well as a model cambridge springs game where everything worked!

So the moral is understand what the position is telling you don't waste moves and always HAVE A PLAN.  Umm... those are obvious morals.  Never mind.  Hope it was fun!"
562,23,0,Nf3,b'rnbqkbnr/pppppppp/8/8/8/5N2/PPPPPPPP/RNBQKB1R b KQkq -',I've gotta confess I was not feeling too good about seeing this.  I haven't faced 1. Nf3 before and so I figured my best option was to just do some safe kingside developing for awhile and wait for white to make a commitment.
563,23,1,g3,b'rnbqkb1r/pppppppp/5n2/8/8/5NP1/PPPPPP1P/RNBQKB1R b KQkq -',no commitment yet so I'm content to think about Nf6 g6 Bg7 and 0-0 and go from there.
564,23,2,Bg2,b'rnbqkb1r/pppppp1p/5np1/8/8/5NP1/PPPPPPBP/RNBQK2R b KQkq -',Still no reason to think otherwise...
565,23,3,d3,b'rnbq1rk1/ppppppbp/5np1/8/8/3P1NP1/PPP1PPBP/RNBQ1RK1 b - -',At this point I said to myself that if he's not going to make a bid for the center then *I will*. 
566,23,4,d5,b'rnbq1rk1/ppp1ppbp/5np1/3p4/8/3P1NP1/PPP1PPBP/RNBQ1RK1 w - d6',For better or worse I'm staking my claim.
567,23,5,c5,b'rnbq1rk1/pp2ppbp/5np1/2pp4/8/3P1NP1/PPP1PPBP/RNBQR1K1 w - c6',And this seemed a logical follow-up.  If he's going to give me a space advantage I'll gladly take it.
568,23,6,Nbd2,b'rnbq1rk1/pp2ppbp/5np1/2pp4/8/3P1NP1/PPPNPPBP/R1BQR1K1 b - -',Was he planning Nb3?  After all my c-pawn is defenseless with my dark-squared bishop on g7.
569,23,7,Nc6,b'r1bq1rk1/pp2ppbp/2n2np1/2pp4/8/3P1NP1/PPPNPPBP/R1BQR1K1 w - -',Still simple development seems best.
570,23,8,c3,b'r1bq1rk1/pp2ppbp/2n2np1/2pp4/8/2PP1NP1/PP1NPPBP/R1BQR1K1 b - -',Really giving me a free big center.  (Sound like an internet giveaway!)
571,23,9,e5,b'r1bq1rk1/pp3pbp/2n2np1/2ppp3/8/2PP1NP1/PP1NPPBP/R1BQR1K1 w - e6',So here we are -- and I don't know if he's going to strike back with e4 or let me have the center.
572,23,10,e4,b'r1bq1rk1/pp3pbp/2n2np1/2ppp3/4P3/2PP1NP1/PP1N1PBP/R1BQR1K1 b - e3',I like this move!  Things look very even and there's a lot of tension now.
573,23,11,d4,b'r1bq1rk1/pp3pbp/2n2np1/2p1p3/3pP3/2PP1NP1/PP1N1PBP/R1BQR1K1 w - -',Gives him c4 as a knight outpost but gives me a space advantage and blocks in his Bg2.  (Also blocks in my Bg7...)
574,23,12,1Nc4,b'r1bq1rk1/pp3pbp/2n2np1/2p1p3/2NpP3/2PP1NP1/PP3PBP/R1BQR1K1 b - -',As expected and threatening to win the e5 pawn.
575,23,13,1Bg4,b'r2q1rk1/pp3pbp/2n2np1/2p1p3/2NpP1b1/2PP1NP1/PP3PBP/R1BQR1K1 w - -',A nice tactical defense of the e-pawn as the pin on the knight is strong.
576,23,14,1h3,b'r2q1rk1/pp3pbp/2n2np1/2p1p3/2NpP1b1/2PP1NPP/PP3PB1/R1BQR1K1 b - -',and so white decides it must be broken.
577,23,15,1Bxf3,b'r2q1rk1/pp3pbp/2n2np1/2p1p3/2NpP3/2PP1bPP/PP3PB1/R1BQR1K1 w - -',Practically forced as Bh5 get embarrassed by g4 and any other move surrenders the e-pawn.
578,23,16,b5,b'r2q1rk1/p4pbp/2n2np1/1pp1p3/2NpP3/2PP1QPP/PP3PB1/R1B1R1K1 w - b6',And now this boots the knight giving black his space advantage after all!  (It's a nice feeling to set a goal and succeed!)
579,23,17,1Nd2,b'r2q1rk1/p4pbp/2n2np1/1pp1p3/3pP3/2PP1QPP/PP1N1PB1/R1B1R1K1 b - -',I was feeling good with a space advantage here even though I didn't have the 2 bishops and so I got a little careless.
580,23,18,1Bh6,b'r2q1rk1/p4p1p/2n2npb/1pp1p3/3pP3/2PP1QPP/PP1N1PB1/R1B1R1K1 w - -',Black's bishop didn't look like it had much scope so I prepared to exchange bishops when the knight moves.
581,23,19,1Qd1,b'r2q1rk1/p4p1p/2n2npb/1pp1p3/3pP3/2PP2PP/PP1N1PB1/R1BQR1K1 b - -',There was apparently nothing for the queen on the kingside except to block in white's own f-pawn.
582,23,20,1Rc8,b'2rq1rk1/p4p1p/2n2npb/1pp1p3/3pP3/2PP2PP/PP1N1PB1/R1BQR1K1 w - -',with the idea of an eventual c5 gaining even more space.
583,23,21,Qd7,b'2r2rk1/p2q1p1p/2n2npb/1pp1p3/3pP3/2PP2PP/PP1N1PBK/R1BQR3 w - -',"...and as I made this move I thought ""now just look out for h4 and Bh3"" and wasn't prepared when white played..."
584,23,22,1Nb3,b'2r2rk1/p2q1p1p/2n2npb/1pp1p3/3pP3/1NPP2PP/PP3PBK/R1BQR3 b - -',Threatening Nxc5 and Bxh6.  Of course I *forgot* about the Bc1.  Yes yes I did.  I'm rated over 1700 and I remembered pinning the knight but forgot about the bishop when the knight moved.  And so logically I played...
585,23,23,1c4,b'2r2rk1/p2q1p1p/2n2npb/1p2p3/2ppP3/1NPP2PP/PP3PBK/R1BQR3 w - -',?  This loses the exchange and a pawn as white demonstrates.
586,23,24,1axb3,b'2r2k2/p2q1p1p/2n2np1/1p2p3/3pP3/1PPP2PP/1P3PBK/R2QR3 b - -',"And now white has a large advantage.  I would say white has a won game here and just needs to avoid a blunder to convert this into a full point.

At this juncture I was pretty disillusioned and needed to come up with a plan."
587,23,25,1Ne7,b'2r2k2/p2qnp1p/5np1/1p2p3/3pP3/1PPP2PP/1P3PBK/R2QR3 w - -',Building up pressure on the c-pawn was the best I could come up with.
588,23,26,2Qd2,b'2r2k2/p2qnp1p/5np1/1p2p3/3pP3/1PPP2PP/1P1Q1PBK/R3R3 b - -',Qg5 would be dreadful right now!
589,23,27,2Nc6,b'2r2k2/p2q1p1p/2n2np1/1p2p3/3pP3/1PPP2PP/1P1Q1PBK/R3R3 w - -',I realized I needed to defend e5 in the event of Qg5 and was mad at myself for wasting a move.
590,23,28,2Qg5,b'2r2k2/p2q1p1p/2n2np1/1p2p1Q1/3pP3/1PPP2PP/1P3PBK/R3R3 b - -',The knight's gotta move.
591,23,29,2Ng8,b'2r2kn1/p2q1p1p/2n3p1/1p2p1Q1/3pP3/1PPP2PP/1P3PBK/R3R3 w - -',Hoping to regroup with Ne7.
592,23,30,2Qd2,b'2r2kn1/p2q1p1p/2n3p1/1p2p3/3pP3/1PPP2PP/1P1Q1PBK/R3R3 b - -',running before black plays f6.
593,23,31,2f4,b'2r2k2/p2qnp1p/2n3p1/1p2p3/3pPP2/1PPP2PP/1P1Q2BK/R3R3 b - f3',white is threatening to blow open the center with devastation for black after exf4.
594,23,32,2f6,b'2r2k2/p2qn2p/2n2pp1/1p2p3/3pPP2/1PPP2PP/1P1Q2BK/R3R3 w - -',necessary to keep lines closed.
595,23,33,2Ref1,b'2r2k2/p2qn2p/2n2pp1/1p2p3/3pPP2/1PPP2PP/1P1Q2BK/R4R2 b - -',Uncomfortable for black's king no doubt.
596,23,34,2Kg7,b'2r5/p2qn1kp/2n2pp1/1p2p3/3pPP2/1PPP2PP/1P1Q2BK/R4R2 w - -',I felt that this was forced.
597,23,35,2h4,b'2r5/p2qn1kp/2n2pp1/1p2p3/3pPP1P/1PPP2P1/1P1Q2BK/R4R2 b - -',Now this tactic I saw -- allowing the skewer of Bh3 would be bad news for black.
598,23,36,2Qd6,b'2r5/p3n1kp/2nq1pp1/1p2p3/3pPP1P/1PPP2P1/1P1Q2BK/R4R2 w - -',I had to keep my pieces active.
599,23,37,2Bh3,b'2r5/p3n1kp/2nq1pp1/1p2p3/3pPP1P/1PPP2PB/1P1Q3K/R4R2 b - -',And now the rook's got to move too.
600,23,38,2Rc7,b'8/p1r1n1kp/2nq1pp1/1p2p3/3pPP1P/1PPP2PB/1P1Q3K/R4R2 w - -',This keeps up some pressure on the c-pawn which I figured was my only chance for counterplay.  With white's pieces scattered and cramped he can't maneuver as easily as I can so my material disadvantage isn't as dreadful as it would seem on a more open board.
601,23,39,2f5,b'8/p1r1n1kp/2nq1pp1/1p2pP2/3pP2P/1PPP2PB/1P1Q3K/R4R2 b - -',"But white's coming after me and threatening to blow the game open.  I figured I had to try and strike back and hope to get lucky.

Boy anyone who's read my annotated games must notice this is a recurring theme!"
602,23,40,2b4,b'8/p1r1n1kp/2nq1pp1/4pP2/1p1pP2P/1PPP2PB/1P1Q3K/R4R2 w - -',"I can't even give this more than a ""?!"" because after 28. c4 black has nothing to play against."
603,23,41,2g4,b'8/p1r1n1kp/2nq1pp1/4pP2/1p1pP1PP/1PPP3B/1P1Q3K/R4R2 b - -',? for white and a chance at life for me!  Notice that the last 4 white moves have left white's king quite exposed...
604,23,42,2bxc3,b'8/p1r1n1kp/2nq1pp1/4pP2/3pP1PP/1PpP3B/1P1Q3K/R4R2 w - -',Not giving anyone a second chance to play c4.
605,23,43,3Qa2,b'8/p1r1n1kp/2nq1pp1/4pP2/4P1PP/1PpP3B/Q6K/R4R2 b - -',I was hoping white would be scared to play Qxc3 because of the discovered attack from the rook but in hindsight I think he should have.
606,23,44,3Nd4,b'8/p1r1n1kp/3q1pp1/4pP2/3nP1PP/1PpP3B/Q6K/R4R2 w - -',I may be down the exchange but having more space and the passed c3 pawn gave me a tremendous amount of hope...
607,23,45,3Rfc1,b'8/p1r1n1kp/3q1pp1/4pP2/3nP1PP/1PpP3B/Q6K/R1R5 b - -',?  This leaves white's king without defenders and so I knew it was time to go for broke.  After a day or so of calculating variations I decided to go for it...
608,23,46,3Nf3+,b'8/p1r1n1kp/3q1pp1/4pP2/4P1PP/1PpP1n1B/Q6K/R1R5 w - -',And it's pretty clear that Qxd3 is unavoidable.
609,23,47,3Kg3,b'8/p1r1n1kp/3q1pp1/4pP2/4P1PP/1PpP1nKB/Q7/R1R5 b - -',Aggressive but this steps into danger.  Kg2 looked safer to me.
610,23,48,3Qxd3,b'8/p1r1n1kp/5pp1/4pP2/4P1PP/1Ppq1nKB/Q7/R1R5 w - -',A quiet but dangerous move threatening a lot of things.
611,23,49,3Bf1,b'8/p1r1n1kp/5pp1/4pP2/4P1PP/1Ppq1nK1/Q7/R1R2B2 b - -',This was a nice try I thought to force the queen to move.
612,23,50,3Qxe4,b'8/p1r1n1kp/5pp1/4pP2/4q1PP/1Pp2nK1/Q7/R1R2B2 w - -',And now I've regained material equality.  I feel like a swindler already.
613,23,51,3Qg2,b'8/p1r1n1kp/5pp1/4pP2/4q1PP/1Pp2nK1/6Q1/R1R2B2 b - -',?  White appears to be threatening to win black's knight but black has an amazing shot that amazingly I found...
614,23,52,3Nxf5+,b'8/p1r3kp/5pp1/4pn2/4q1PP/1Pp2nK1/6Q1/R1R2B2 w - -',!  Do you know how hard it is to fight to regain material equality and then upon doing it to *immediately* sacrifice a piece?  I thought white would play Kh3 and have to contend with N5xh4 threatening the queen and a possible mate in the corner.
615,23,53,3gxf5,b'8/p1r3kp/5pp1/4pP2/4q2P/1Pp2nK1/6Q1/R1R2B2 b - -',?  But this allows black to win easily.
616,23,54,3Qf4+,b'8/p1r3kp/5pp1/4pP2/5q1P/1Pp2nK1/6Q1/R1R2B2 w - -',!  An easy move that maybe doesn't deserve an exclam but White has to choose between Kh3 Qxh4# and Kf2 losing the queen.
617,23,55,3Kf2,b'8/p1r3kp/5pp1/4pP2/5q1P/1Pp2n2/5KQ1/R1R2B2 b - -',Better to lose the queen than get mated...
618,23,56,3Nxh4+,b'8/p1r3kp/5pp1/4pP2/5q1n/1Pp5/5KQ1/R1R2B2 w - -',ouch.
619,23,57,Nxg2,b'8/p1r3kp/5pp1/4pP2/5q2/1Pp5/6n1/R1R2BK1 w - -',And just like that the tables have turned.
620,23,58,Qxf5,b'8/p1r3kp/5pp1/4pq2/8/1Pp5/6B1/R1R3K1 w - -',"And at this point I think the prospect of having to contend with four connected passed pawns was too much for white and he resigned.

This was a good game and as long as mistakes are possible victory is possible.  Hope you enjoyed it!

Ethan"
621,24,0,f3,b'rnbqk2r/ppp1ppbp/3p1np1/8/2PPP3/2N2P2/PP4PP/R1BQKBNR b KQkq -',The Kings Indian Sämisch ... I love to play this with both White and Black because it has a great offer of different strategies. And as always in a Kings Indian initiative is paramount.
622,24,1,Qb3,b'r1bq1rk1/1pp1ppbp/p1np1np1/8/2PPP3/1QN1BP2/PP2N1PP/R3KB1R b KQ -',So far we have followed theory but this move I can´t find anywhere in the books or databases. And in combination with long castling it doesn´t look sound. The Queen will come under fire giving Black some valuable tempi as we shall see.
623,24,2,1Ng3,b'1r1q1rk1/2pbppbp/2np1np1/1p6/3PP3/1QN1BPN1/PP4PP/1K1R1B1R b - -',Of course it is too dangerous to grab the pawn on b5.
624,24,3,1Rd3,b'1r1q1rk1/2pbppbp/3p1np1/8/3PP3/1n1RBPN1/1PQ1N1PP/1K3B1R b - -',The White Rook comes into action for the defence but look a the positions of the two Kings. White´s only have one pawn for cover while Black´s can sleep peacefully.
625,24,4,c5,b'1r1q1rk1/3bppbp/3p1np1/n1p5/3PP3/R3BPN1/1PQ1N1PP/1K3B1R w - c6',Defending the Knight and threatening Qb6-Qb4 with more power in the attack.
626,24,5,2d5,b'1r3rk1/4ppbp/1q1pbnp1/n1pP4/4P2P/4BPN1/RPQ1N1P1/1K3B1R b - -',A very natural response but this is a crucial moment. White´s Bishop on f1 is out of the game and so is Rh1. The two Knights are more or less away from where the action is so it wasn´t too dificult to find the sacrifice of a piece to open the lines for Black´s Bishops.
627,24,6,Bb3,b'1r3rk1/4ppbp/1q1p2p1/n1p5/7P/1bN1BPN1/RPQ3P1/1K3B1R w - -',"A ""zwischenzug"" to put the White Queen on a less favorable square since the Black Knight on a5 wins a tempo going to b3 later."
628,24,7,2Kxa2,b'1r3rk1/4ppbp/1q1p2p1/n1p5/7P/2N1BPN1/KP1Q2P1/5B1R b - -',24. Nxa2 Qxb2  25. Qxb2 Rxb2  and Black wins decisive material after either 26. Ka1 or 26. Kc1.
629,24,8,2Qb5,b'1r3rk1/4pp1p/1q1p2p1/1Qp5/7P/1nb1BPN1/KP4P1/5B1R b - -',Only move. 26. bxc3 is mate after Nc1  and Qb1  followed by Qb3 mate.
630,24,9,2Rc1,b'5rk1/4pp1p/3p2p1/1rp5/7P/1nb1BPN1/KP4P1/2R5 b - -',?? - but 28. bxc3 is no better: 28 - Nd4! (threatening Ra8#) 29. Bc1 (only move) Ra8  30. Ba3 Nc2 and curtains.
631,24,10,2Bxc1,b'5rk1/4pp1p/3p2p1/1rp5/7P/2b2PN1/KP4P1/2B5 b - -',Of course White should just resign but even chess-players believe in miracles ...
632,24,11,3Kb1,b'r5k1/4pp1p/3p2p1/1rp5/7P/5PN1/1B4P1/1K6 b - -',Everything wins but I had hoped for the cute alternative: 31. Ba3 c4! - when White can´t do anything against 32. - Rb3 and 33. - Raxa3 mate.
633,24,12,3Rab8,b'1r4k1/4pp1p/3p2p1/1rp5/7P/5PN1/1B4P1/1K6 w - -',White resigns but I would like to thank my opponent for many great games during the time on GameKnot - and thanks to the inventor of the Kings Indian!
634,25,0,e3,b'rnbqkbnr/pppppppp/8/8/8/4P3/PPPP1PPP/RNBQKBNR b KQkq -',I was White in this game. 1.e3 is not a common opening move but it is very flexible and solid.
635,25,1,d3,b'rnbqkbnr/ppp1pppp/8/3p4/8/3PP3/PPP2PPP/RNBQKBNR b KQkq -',My opening is considered unorthodox because I have blocked both bishops but I want to develop my bishops to d2 and e2. A lot of people say that it is a passive setup but I don't think playing agressive in the opening is necessary unless your opponent makes a mistake.
636,25,2,Bg4,b'rn1qkb1r/ppp1pppp/5n2/3p4/6b1/3PPN2/PPP2PPP/RNBQKB1R w KQkq -',I don't think this is a good square for the bishop because after Be2 the bishop is useless there and is subject to harassment by h3 later
637,25,3,e6,b'rn1qkb1r/ppp2ppp/4pn2/3p4/6b1/3PPN2/PPP1BPPP/RNBQK2R w KQkq -',Black is initiating a Torre setup where Black has ideas of pushing the queenside pawns for a queenside attack or Black can make the maneuvers c5 Nc6 Bd6 Bb8 Qd6 with a kingside attack in mind along the b8-h2 diagonal.
638,25,4,Bd2,b'rn1qkb1r/ppp2ppp/4pn2/3p4/6b1/3PPN2/PPPBBPPP/RN1QK2R b KQkq -',I calmly continue development without thinking about attacking. I don't have any weaknesses so I should be fine
639,25,5,a4,b'rn1qk2r/pp3ppp/3bpn2/2pp4/P5b1/2NPPN2/1PPBBPPP/R2QK2R b KQkq a3',I'm not sure if this move was necessary. I wanted to stop a future b5 and this was also a waiting move to see if Black would castle into my attack
640,25,6,O-O,b'rn1q1rk1/pp3ppp/3bpn2/2pp4/P5b1/2NPPN2/1PPBBPPP/R2QK2R w KQ -',Black has castled kingside which I think is a mistake because I can push my kingside pawns with tempo
641,25,7,Bh5,b'rn1q1rk1/pp3ppp/3bpn2/2pp3b/P7/2NPPN1P/1PPBBPP1/R2QK2R w KQ -',Black's other option is giving up the bishop pair to stall the advancing of my kingside pawns but both continuations look bad for Black
642,25,8,Nfd7,b'rn1q1rk1/pp1n1ppp/3bp1b1/2pp2P1/P7/2NPPN1P/1PPBBP2/R2QK2R w KQ -',Nh5 would place the knight on the dangerous diagonal where my queen and bishop are aimed
643,25,9,f6,b'rn1q1rk1/pp1n2pp/3bppb1/2pp2P1/P6P/2NPPN2/1PPBBP2/R2QK2R w KQ -',Black wants to get the bishop to a safe square while also challenging my pawnstorm but I think this is a mistake because it allows a pawn sacrifice
644,25,10,Bxg6,b'rn1q1rk1/pp1n2p1/3bppb1/2pp4/P7/2NPPN2/1PPBBP2/R2QK2R w KQ -',For compensation for the pawn I have open files toward Black's king and I can take advantage of Black's weak g6-square
645,25,11,Bh7,b'rn1q1rk1/pp1n2pb/3bpp2/2pp4/P6N/2NPP3/1PPBBP2/R2QK2R w KQ -',No better is Bf7 Bh5 because Black cannot take the bishop since after Qxh5 I have the dangerous threat of Ng6 similar to what happened in the game
646,25,12,1Bh5,b'rn1q1rk1/pp1n2pb/3bpp2/2pp3B/P6N/2NPP3/1PPB1P2/R2QK2R b KQ -',My pieces have nice control of the light squares and my missing pawn doesn't have any significance at the moment since there are still lots of pieces on the board
647,25,13,1Ne5,b'rn1q1rk1/pp4pb/3bpp2/2ppn2B/P6N/2NPP3/1PPB1P2/R2QK2R w KQ -',g5 is interesting but I think I can just play Ng6 and then f4 later and exploit my open g-file. Black's knight move doesn't really do much to help defend. 
648,25,14,Re8,b'rn1qr1k1/pp3npb/3bpp2/2pp3B/P4PQN/2NPP3/1PPB4/R3K2R w KQ -',Qd7 might have been a better way of defending the pawn
649,25,15,1Bg6,b'rn1qr1k1/pp3npb/3bppB1/2pp4/P4PQN/2NPP3/1PPB4/R3K2R b KQ -',I'm clearing way for my queen to come to h5 to continue the attack on the weak light squares and I'm threatening Bxh7  Kxh7 Nf5  followed by Qxg7#
650,25,16,2Nxg6,b'rn1qr1k1/pp3np1/3bppN1/2pp4/P4PQ1/2NPP3/1PPB4/R3K2R b KQ -',I'm intending to play Qh5 so Black should move the knight and play Kf7 to stop mates along the h-file.
651,25,17,2Bc7,b'rn1qr1k1/ppb2np1/4ppN1/2pp4/P4PQ1/2NPP3/1PPB4/R3K2R w KQ -',I thought Black would play Nh6 but after Qh5 the play is similar to my continuation of the game. I plan to castle queenside and bring my other rook to the g-file.
652,25,18,2Qh5,b'rn1qr1k1/ppb2np1/4ppN1/2pp3Q/P4P2/2NPP3/1PPB4/R3K2R b KQ -',Threatening Qh7#
653,25,19,2O-O-O,b'rn1qr1k1/ppb3p1/3nppN1/2pp3Q/P4P2/2NPP3/1PPB4/2KR3R b - -',I don't think Qh7  now is necessary. I'll just get my rook active on the g-file and continue the attack from there
654,25,20,2Qh7+,b'r2qr1k1/ppbn2pQ/3nppN1/2pp4/P4P2/2NPP3/1PPB4/2KR3R b - -',Now the g7-pawn is very weak. Once I get my rook to the g-file Black has a hard time defending.
655,25,21,2Rdg1,b'r2qr3/ppbn1kpQ/3nppN1/2pp4/P4P2/2NPP3/1PPB4/2K3RR b - -',Threatening Nd5  with Qxg7# to follow
656,25,22,2Rg8,b'r2q2r1/ppbn1kpQ/3nppN1/2pp4/P4P2/2NPP3/1PPB4/2K3RR w - -',This defends g7 but now Black's rook is out of play and soon my pieces will reach maximum attacking potential.
657,25,23,Kf8,b'r2q1krN/ppbn2pQ/3npp2/2pp4/P4P2/2NPP3/1PPB4/2K3RR w - -',The only move that doesn't lose material or get mated
658,25,24,2Rh6,b'r2q1krN/ppbn2pQ/3npp1R/2pp4/P4P2/2NPP3/1PPB4/2K3R1 b - -',Now to capitalize on the g7-weakness I will double my rooks on the g-file and attack the pawn until Black can no longer defend and obviously Black cannot take my rook.
659,25,25,2Qe8,b'r3qkrN/ppbn2pQ/3npp1R/2pp4/P4P2/2NPP3/1PPB4/2K3R1 w - -',Ne8 is another defensive try. Qe8 doesn't appear to do much.
660,25,26,Qe7,b'r4krN/ppbnq1pQ/3nppR1/2pp4/P4P2/2NPP3/1PPB4/2K3R1 w - -',Black's queen has wasted a tempo. Black could've reached this exact same position but with a knight on e8. I'm not sure if Black could've recovered if he hadn't wasted this tempo but either way my plan is still the same I will play e4 and f5 to open the dark diagonal so that my bishop can get to h6 to join the attack
661,25,27,2f5,b'r4krN/ppbnq1pQ/3nppR1/2pp1P2/P7/2NPP3/1PPB4/2K3R1 b - -',A clearance sacrifice
662,25,28,3dxe4,b'r4krN/ppbnq1pQ/4ppR1/2p2n2/P3P3/2N5/1PPB4/2K3R1 b - -',Black's knight is kicked away from defending h6 so my bishop comes in
663,25,29,Ne8,b'r3nkrN/ppbnq1pQ/4ppRB/2p5/P3P3/2N5/1PP5/2K3R1 w - -',It seems like Black has defended g7......
664,25,30,3Rg6xg7,b'r3nkrN/ppbnq1RQ/4pp1B/2p5/P3P3/2N5/1PP5/2K3R1 b - -',Now there is trouble because of the pin on whatever piece Black takes my rook with
665,25,31,3Ng6+,b'r3nk2/ppbnq1rQ/4ppNB/2p5/P3P3/2N5/1PP5/2K3R1 b - -',I force Black to blockade the queen's defense of g7 with his king
666,25,32,3Bxg7,b'r3n3/ppbnqkBQ/4ppN1/2p5/P3P3/2N5/1PP5/2K3R1 b - -',Now Black's queen is under attack and I have regained my piece. Black is lost after he moves his queen his king will perish from the checks
667,25,33,3Ne5+,b'r2q3B/ppbn1knQ/4pp2/2p1N3/P3P3/2N5/1PP5/2K3R1 b - -',I think this is the easiest way to win
668,25,34,Ke8,b'r2qk2B/ppbn2RQ/4p3/2p1p3/P3P3/2N5/1PP5/2K5 w - -',"If Kf6 then I have many mates to choose from
Rg8# Qg6# Rg6# Qh6# or Qh4#"
669,25,35,3Qf7#,b'r2q1k1B/ppbn1QR1/4p3/2p1p3/P3P3/2N5/1PP5/2K5 b - -',
670,26,0,Qc2,b'rnbq1rk1/ppp1p1bp/3p1np1/5p2/2PP4/2N2NP1/PPQ1PPBP/R1B1K2R b KQ -',White deviates from standard play here. I think there is nothing wrong with placing the queen on c2 but it is quiet and leaves the initiative to black.
671,26,1,Qe8,b'rnb1qrk1/ppp1p1bp/3p1np1/5p2/2PP4/2N2NP1/PPQ1PPBP/R1B1K2R w KQ -',Improving the queen she can now support queenside expansion or she can slip to f7 to pressure the f-file. It also prevents potential pins with the rook by a knight on e6 or with the knight on f6 if the e-pawn is pushed.
672,26,2,O-O,b'rnb1qrk1/ppp1p1bp/3p1np1/5p2/2PP4/2N2NP1/PPQ1PPBP/R1B2RK1 b - -',Probably had to get that move in anyhow
673,26,3,c6,b'rnb1qrk1/pp2p1bp/2pp1np1/5p2/2PP4/2N2NP1/PPQ1PPBP/R1B2RK1 w - -',copying white's positional play style blocking the long diagonal from the white bishop and protects the important d5 square
674,26,4,Nh4,b'rnb1qrk1/pp2p1bp/2pp1np1/5p2/2PP3N/2N3P1/PPQ1PPBP/R1B2RK1 b - -',White wants to initiate action probably planning an advance to e4 with ...fxe4 Nxe4 Nxe4 Bxe4 with now the bishop and the queen in line on the b1-h7 diagonal with the knight ready to be sacrified on g6
675,26,5,Qf7,b'rnb2rk1/pp2pqbp/2pp1np1/5p2/2PP3N/2N3P1/PPQ1PPBP/R1B2RK1 w - -',Delays black's intentions because he has to cover the c4 pawn before advancing to e4
676,26,6,Na6,b'r1b2rk1/pp2pqbp/n1pp1np1/5p2/2PP3N/1PN3P1/P1Q1PPBP/R1B2RK1 w - -',Here if White doesn't prevent Nb4 his queen has to leave the second rank and this is bad because his exchanges on e4 will let the black light squared bishop go to h3 attacking the rook and if the rook moves the queen takes on f2 (note that the e2 and the f5 pawns are out)
677,26,7,Nc7,b'r1b2rk1/ppn1pqbp/2pp1np1/5p2/2PP3N/PPN3P1/2Q1PPBP/R1B2RK1 w - -',Now black has full control on d5 and needs only a d6-d5 to cross out white's plan of e2-e4
678,26,8,1Bb2,b'r1b2rk1/ppn1pqbp/2pp1np1/5p2/2PP3N/PPN3P1/1BQ1PPBP/R4RK1 b - -',White makes good judgement as his dark long diagonal was very weak but now black has the full initiative
679,26,9,1d5,b'r1b2rk1/ppn1pqbp/2p2np1/3p1p2/2PP3N/PPN3P1/1BQ1PPBP/R4RK1 w - -',cutting short any hope of getting e4 in
680,26,10,1c5,b'r1b2rk1/ppn1pqbp/2p2np1/2Pp1p2/3P3N/PPN3P1/1BQ1PPBP/R4RK1 b - -',what else?
681,26,11,1Ng4,b'r1b2rk1/ppn1pqbp/2p3p1/2Pp1p2/3P2nN/PPN3P1/1BQ1PPBP/R4RK1 w - -',Black's counter attack; preparing e5. ...Nd7 here would have reduced options and let black defend d4. 14. h3 is not really a threat as we will see because the knight has an excellent sacrifying option
682,26,12,Nxf2,b'r1b2rk1/ppn1pqbp/2p3p1/2Pp1p2/3P3N/PPN3PP/1BQ1PnB1/R4RK1 w - -',as promised
683,26,13,1Kxf2,b'r1b2rk1/ppn1pqbp/2p3p1/2Pp1p2/3P3N/PPN3PP/1BQ1PKB1/R4R2 b - -',Taking with the rook would have been better; white would be left with slight material disadvantage but in a safe position and a spot for the second rook on f1 now the king is out open
684,26,14,Bxc5,b'r1b2rk1/ppn1pq1p/2p3p1/2bp1p2/7N/PPN1P1PP/1BQ2KB1/R4R2 w - -',already full compensation for the knight plus an excellent position for the bishop
685,26,15,1Nf3,b'r1b2rk1/ppn1pq1p/2p3p1/2bp1p2/8/PPN1PNPP/1BQ2KB1/R4R2 b - -',Maybe b4 would have complicated matters a little for black
686,26,16,1f4,b'r1b2rk1/ppn1pq1p/2p3p1/2bp4/5p2/PPN1PNPP/1BQ2KB1/R4R2 w - -',opening the f-file for a massive attack
687,26,17,Bxh3,b'r4rk1/ppn1p2p/2p3p1/2bp4/5q2/PPN1PN1b/1B2QKB1/R4R2 w - -',working about pieces pinned all around the king so that the black rook can capture the white knight without being captured by the white bishop
688,26,18,2Bg2,b'r4rk1/ppn1p2p/2p3p1/2bp4/8/PPN1PN2/1B2QKBq/R4R2 b - -',Retains the bishop but allows black a deadly continuation white shouldn't be able to recover from..
689,26,19,Bxe3+,b'5rk1/ppn1p3/2p3pK/3p3p/8/PPN1b1q1/1B2Q1B1/R4R2 w - -',... eventually winning the queen.
690,26,20,Qxe3+,b'5rk1/ppn1p3/2p3pK/3p3p/8/PPN1q3/1B4B1/R4R2 w - -',Now white has little reason to keep on playing except to wait for an error from black
691,26,21,Qxg2,b'5rk1/ppn1p3/2p5/3p3K/8/PPN5/1B4q1/R4R2 w - -',??? with just a little more effort 28. ... Qh2  29. Kg4 Qxg2  and the rest was history. Now the queen is lost with 29. Rg1
692,26,22,3Kh6,b'6k1/ppn1p3/2p4K/3p1r2/8/PPN5/1B4q1/R5R1 b - -',Here black drew. However the continuation that follows offered him an excellent position against white 
693,26,23,Rxg2,b'6k1/ppn1p3/2p4K/3p4/8/PPN5/1B4r1/R7 w - -',All white's moves to protect the bishop are ugly: Nd1 shuts the rook so does Bc1 Na4 gets removed by ...b5 Ra2 and Rb1 are not much better. Plus black has two passed pawns.
694,27,0,c6,b'rnbqkbnr/pp2pppp/2p5/3p4/2PP4/8/PP2PPPP/RNBQKBNR w KQkq -',...normally i would go in for a Benko but sure why not try something else..
695,27,1,Nc7,b'r2qkb1r/ppnnppp1/2p3p1/8/3PP3/2N5/PP3PPP/R1BQKB1R w KQkq -',...bit cramped but free h file..
696,27,2,1Qc2,b'r2qk2r/ppn1bpp1/1np1p1p1/8/3PP3/P1NBB3/1PQ2PPP/R3K2R b KQkq -',..white and black are developing quickly...i see a chance to disrupt Whites K side..with a probabale 0-0-0 following for white...
697,27,3,Qg5,b'2kr3r/ppn2pp1/2p1p1p1/6q1/Q2PP3/P2BP3/1P4PP/1K1R3R w - -',...interesting position now. White has an attack with the Q to a7 but black has mobility and dual threats to g2 and e3
698,27,4,Nxd4,b'3r3r/2k2pp1/1pp1p1p1/8/1Q1nP3/P3q3/1PB3PP/1K1R3R w - -',...pawn grabbing...!!
699,27,5,2Rhe1,b'3r3r/2k2pp1/1pp1p1p1/8/1Q1nP3/P3q3/1PB3PP/1K1RR3 b - -',...black is now meandering into Whites territory with another pawn to grab...
700,27,6,Rxh2,b'8/2k2pp1/1pp1p1p1/8/4P3/P7/1PK3Pr/3R4 w - -',..black is now 2 pawns up with a 4 v 2 K side majority...
701,27,7,gxf5,b'8/2k3p1/1pp5/4pp2/8/PP6/2KR2Pr/8 w - -',..now 3 v 1...
702,27,8,g6,b'8/2k5/1pp3p1/4pp2/8/PP6/2K2RPr/8 w - -',...e4 might have been another option with Rxg2 to follow...white cannot substantially threaten Black here so he resigns (Good man Damo ! )
703,28,0,Nd5,b'r1bqk1nr/pp1pppbp/2n3p1/2pN4/2P1P3/5N2/PP1P1PPP/R1BQKB1R b KQkq -',..thought this to be too early..Be2 seems natural so i gain a tempo with the next move.
704,28,1,Bd3,b'r1bqk2r/pp1pnpbp/2n1p1p1/2p5/2P1PN2/3B1N2/PP1P1PPP/R1BQK2R b KQkq -',..this cramps white and is now a target black just needs to keep development moving...
