,gid,aid,move,fen,annotation
599,17,5,O-O-O,b'2kr1bnr/pppq1ppp/2n1b3/4P3/2Pp4/5NP1/PP1NPPBP/R1BQK2R w KQ -',"7.Bg2 O-O-O 
I fiancetto my light squared Bishop to build up pressure on the centre (Xray on e4 d5 c6). Black castles long."
600,17,6,h5,b'2kr1bnr/pppq1pp1/2n1b3/4P2p/2Pp4/5NP1/PP1NPPBP/R1BQ1RK1 w - h6',"8.O-O h5 
I castle to defend my King. Black threatens my Kingside with his h-file pawn."
601,17,7,h4,b'2kr1bnr/pppq1pp1/2n1b3/4P3/2Pp3p/1N3NP1/PP2PPBP/R1BQ1RK1 w - -',"9.Nb3 h4 - Inaccuracy
This was an error and I lose the previous positional advantage I have. Computer analysis puts this at -0.12. The pawn on c4 is undefended Bxc4 puts me a pawn down. Qa4 would have been better. However Black has opted to continue his Kingside attack."
602,17,8,Nxe5,b'2kr1bnr/pppq1pp1/4b3/4n3/2Pp3N/1N4P1/PP2PPBP/R1BQ1RK1 w - -',"10.Nxh4 Nxe5
I need to get rid of that pawn doing so loses the defense of e5 which is then taken by Black. I have lost control of the centre and the Kingside."
603,17,9,Nxc4,b'2kr1bnr/pppq1pp1/4b3/8/2np1B1N/1N4P1/PP2PPBP/R2Q1RK1 w - -',"11.Bf4 Nxc4 
I develop the dark squared bishop threatening Bxe5 and looking to control the diagonal increasing the threat on Black's Queenside for a later attack."
604,17,10,Bd6,b'2kr2nr/pppq1pp1/3bb3/8/2np1B1N/1N4P1/PP2PPBP/1R1Q1RK1 w - -',"12.Rb1 Bd6  Mistake!
Worried about Nxb2 which would also threaten my Queen on d1 I rush to defend b2 with my rook. Computer analysis puts this at -0.64. However Bd6 was also a mistake this time on Black's part (+1.66). ( 13. Qxd4 b6 14. Bxd6 Qxd6 15. Qxg7 would have provided me a + 2 pawns advantage)."
605,17,11,Kb8,b'1k1r2nr/pppq1pp1/3bb3/8/2nQ1B1N/1N4P1/PP2PPBP/1R3RK1 w - -',"13.Qxd4 Kb8
I have noticed Black's error and taken the pawn that was threatening my position. Black's King defends against Qxa7."
606,17,12,Bxf4,b'1k1r2nr/pppq1pp1/4b3/8/2nQ1b1N/1N4P1/PP2PPBP/1R1R2K1 w - -',"14.Rfd1 Bxf4  Mistake!
Rbc1 is better. Qxg7 would have been too greedy as Bxf4 gxf4 weakens my Kingside defense. (14 Rbc1 Qc8 15. Bxd6 Nxd6 16. Qxg7 Nh6 would have won me the pawn after dealing with the Bishop threatening f4.). Black takes my Bishop."
607,17,13,Qxd1+,b'1k1r2nr/ppp2pp1/4b3/8/2n2Q1N/1N4P1/PP2PPBP/1R1q2K1 w - -',"15.Qxf4 Qxd1+ - Inaccuracy!
Better was Qxg7 (15. Qxg7 Qxd1+ 16. Rxd1 Rxd1+ 17. Bf1 Be5 18. Qf8+ Bc8 19. Qc5 Bh3 20. Qf8+ Bc8). Black goes for a sequence of exchanges while I am under check losing tempo with pressure building on my Kingside.

"
608,17,14,Nf6,b'1k5r/ppp2pp1/4bn2/8/2n2Q1N/1N4P1/PP2PP1P/3r1BK1 w - -',"16.Rxd1 Rxd1+ 17.Bf1 Nf6
This was forced. Black develops his knight to aid his attack on my Kingside."
609,17,15,Nd5,b'1k5r/ppp2pp1/4b3/3n4/2nN1Q1N/6P1/PP2PP1P/3r1BK1 w - -',"18.Nd4 Nd5  Blunder!
Computer scores this as -6.27. I should have gone with Nf5 to defend my King. Nd4 did have the aim of attacking the Bishop on e6 which was threatening Bh3 (can't take it with my Bishop due to the rook on d1) but I overlooked a quieter move which would have been more useful. Black threatens my Queen."
610,17,16,Bh3,b'1k5r/ppp2pp1/8/3n4/2nN3N/5QPb/PP2PP1P/3r1BK1 w - -',"19.Qf3 Bh3  Blunder!
I am now at -10.99. I should have attacked the King with Nc6+. If Black responds with bxc6 then I can reply Qxc4 putting my Queen in a position to better defend my King and threaten a King/Rook fork with Qb3+. I had also missed the threat of Bh3 as my Bishop is pinned by the Rook."
611,17,17,Nd2,b'1k5r/ppp2pp1/8/3n4/3N4/5QPb/PP1nPPNP/3r1BK1 w - -',"20.Ng2 Nd2  Blunder!
-23.92. I am clearly done for. Nd2 forks my Queen and the pinned Bishop. I have to lose my Queen to temporarily survive. If I try to save the Queen then Rxf1 is checkmate."
612,17,18,Nxf3+,b'1k5r/ppp2pp1/8/3n4/3N4/4NnPb/PP2PP1P/3r1BK1 w - -',"21.Ne3 Nxf3+ - Impending Checkmate
The game is lost I can not prevent mate."
613,17,19,2Nxf1,b'1k5r/ppp2pp1/8/8/8/6Pb/PP2PP1P/3r1NK1 b - -',
614,18,0,d4,b'rnbqkbnr/pppp1ppp/8/4p3/3PP3/8/PPP2PPP/RNBQKBNR b KQkq d3',Center game
615,18,1,exd4,b'rnbqkbnr/pppp1ppp/8/8/3pP3/8/PPP2PPP/RNBQKBNR w KQkq -',gambit accepted
616,18,2,c3,b'r1bqkbnr/pppp1ppp/2n5/8/3pP3/2P2N2/PP3PPP/RNBQKB1R b KQkq -',Usually I take but I wanted to try another variation.
617,18,3,dxc3,b'r1bqkbnr/pppp1ppp/2n5/8/4P3/2p2N2/PP3PPP/RNBQKB1R w KQkq -',Trading
618,18,4,Nxc3,b'r1bqkbnr/pppp1ppp/2n5/8/4P3/2N2N2/PP3PPP/R1BQKB1R b KQkq -',White has a big hole on the queen side but 3 pieces out against one for black
619,18,5,Bc4,b'r1bqkb1r/pppp1ppp/2n2n2/8/2B1P3/2N2N2/PP3PPP/R1BQK2R b KQkq -',Developing
620,18,6,Bxf7+,b'r1bqk2r/pppp1Bpp/2n5/2b1P3/6n1/2N2N2/PP3PPP/R1BQK2R b KQkq -',If 8. Kxf7 9. Ng5+ ... 10. Qxg4 with great menace on black's kingside and the black king cannot castle 
621,18,7,Kf8,b'r1bq1k1r/pppp1Bpp/2n5/2b1P3/6n1/2N2N2/PP3PPP/R1BQK2R w KQ -',Black doen't dare to  take
622,18,8,Bxf2+,b'r1bq1k1r/pppp1Bpp/2n5/4P1B1/6n1/2N2N2/PP3bPP/R2QK2R w KQ -',White othesaw this move
623,18,9,1Kd2,b'r1bq1k1r/pppp1Bpp/2n5/4P1B1/6n1/2N2N2/PP1K1bPP/R2Q3R b - -',Only choice not to block the h rook
624,18,10,1Be3+,b'r1bq1k1r/pppp1Bpp/2n5/4P1B1/6n1/2N1bN2/PP1K2PP/R2Q3R w - -',Black is right to trade and stop white's dangerous attack
625,18,11,1Bxe3,b'r1bq1k1r/pppp1Bpp/2n5/4P3/6n1/2N1BN2/PP1K2PP/R2Q3R b - -',B
626,18,12,Kxf7,b'r1bq3r/pppp1kpp/2n5/4P3/8/2N1KN2/PP4PP/R2Q3R w - -',Now both kings are unsafe black is one pawn ahead.
627,18,13,1Qd5+,b'r1bq3r/pppp1kpp/2n5/3QP3/8/2N1KN2/PP4PP/R6R b - -',Blunder. White still try to attack to keep the initiative but Rf1 would have been better because black would have to move his king anyway wether during  the 13th move or the 14th and wether on e7 or e8. white would occupate the open file by playing Ng5 menacing 15. Qd5 and 16. Qf7+#.
628,18,14,1Rhf1,b'r1bqk2r/pppp2pp/2n5/3QP3/8/2N1KN2/PP4PP/R4R2 b - -',Should have been done on the 13th move (the queen could have come on h5)
629,18,15,1Ke4,b'r1b1k2r/ppppq1pp/2n5/3QP3/4K3/2N2N2/PP4PP/R4R2 b - -',defensive move
630,18,16,1d6,b'r1b1k2r/ppp1q1pp/2np4/3QP3/4K3/2N2N2/PP4PP/R4R2 w - -',blocking the center
631,18,17,dxe5,b'r1bk3r/ppp3pp/8/4p3/3NK3/8/PP4PP/R4R2 w - -',Long trading sequence after which black is better (in this situation a bishop  is better than a knight and black is one pawn ahead)
632,18,18,3Nxh7,b'4k3/pb4pN/1p1p4/8/8/2K3P1/PP5P/8 b - -',White has regained his pawn but having a knight is a drawback. Furthermore it's too far away from the center. White's pawn are better but black's passed pawn will conctitute a serious menace obliging white to use at least one piece to prevent his promotion.
633,18,19,3Kd4,b'8/pb2k1pN/1p1p4/8/3K4/6P1/PP5P/8 b - -',White tries to bring his king on the center.
634,18,20,3Ke3,b'8/pb4pN/1p1pk3/8/8/4K1P1/PP5P/8 b - -',To prevent the black king to attack the two pawns on the right wing.
635,18,21,Kf6,b'5N2/p5p1/1pbp1k2/8/8/P3K1P1/1P5P/8 w - -',It seems a mistake
636,18,22,4Nf6,b'8/1b2k1p1/pp3N2/3pK1PP/8/P7/1P6/8 b - -',Blunder white oversaw the 46st move. b3 would have been better for white would have been blocked but could hope for the draw.
637,18,23,Bxf7,b'8/4Kb2/pp4kP/8/1P6/P2p4/8/8 w - -',
638,19,0,Nf3,b'rnbqkbnr/pppppppp/8/8/8/5N2/PPPPPPPP/RNBQKB1R b KQkq -',I start the game using the Reti opening.  This is my favorite opening du jour when I am playing white.  I start with Reti and then I try to parlay it into the Queens Gambit.  This is something that I have been doing for the last year or so.  I have pretty good success with it and it is a lot of fun.
639,19,1,d5,b'rnbqkbnr/ppp1pppp/8/3p4/8/5N2/PPPPPPPP/RNBQKB1R w KQkq d6',Black marches out the Queen Pawn.  This is a pretty standard response to Reti.  Of course it would not be a good idea to march out the King Pawn because my faithful steed would eat him for lunch.
640,19,2,d4,b'rnbqkbnr/ppp1pppp/8/3p4/3P4/5N2/PPP1PPPP/RNBQKB1R b KQkq d3',I know that the standard Reti opening says that white should go c4 here but I don't like doing that. I always like to immediately block an opponents pawn on the 5th rank.  If I don't block then there is always a chance that he might be able to push it to the 4th rank in the future and I hate being boxed it.  I don't like to have my mobility hindered.  
641,19,3,f5,b'rnbqkbnr/ppp1p1pp/8/3p1p2/3P4/5N2/PPP1PPPP/RNBQKB1R w KQkq f6',This is unusual and perhaps this is the beginning of the downfall for black but I don't see it as a big mistake.  It is just unorthodox.  I am not sure what he is trying to do.  Perhaps some sort of Kings Gambit.  In my opinion moving the f pawn is not a good idea because you are loosing some protection for your King.
642,19,4,c4,b'rnbqkbnr/ppp1p1pp/8/3p1p2/2PP4/5N2/PP2PPPP/RNBQKB1R b KQkq c3',"Now I parlay into the Queens Gambit which is really fun for me.  As I said before I have been doing this for about a year now and I really like it.  This does a lot of good things for white.  It opens up a path for the Queen to make a check.  It acts as a lure to pull the black pawn out of the center.  If he accepts the Gambit then I check with the Queen and immediately get back my lost Pawn.

One thing I don't like is the fact that the black Pawn on f remains unblocked. Maybe this is just my own idiosyncrasy."
643,19,5,dxc4,b'rnbqkbnr/ppp1p1pp/8/5p2/2pP4/5N2/PP2PPPP/RNBQKB1R w KQkq -',Black accepts the Gambit.  I am not smart enough to know if this is a good idea or not.  White can easily get the pawn back but then black can start attacking the Queen.  I don't think this is a blunder for black but maybe a contributing factor to the downfall.
644,19,6,Qa4+,b'rnbqkbnr/ppp1p1pp/8/5p2/Q1pP4/5N2/PP2PPPP/RNB1KB1R b KQkq -',"This is my standard response when black accepts the Gambit.  I check the King and also put the black Pawn in jeopardy. It is a fun trick although I know that it can be bad to bring out the Queen this early.  It give black the opportunity to start taking pot shots at her.  It can easily lead to a game of ""chase the queen."""
645,19,7,Bd7,b'rn1qkbnr/pppbp1pp/8/5p2/Q1pP4/5N2/PP2PPPP/RNB1KB1R w KQkq -',This is one of the standard responses for black.  He could have also blocked with the Knight.  Either way works fine.  Neither way prevents me from taking the Pawn back.
646,19,8,Qxc4,b'rn1qkbnr/pppbp1pp/8/5p2/2QP4/5N2/PP2PPPP/RNB1KB1R b KQkq -',I now have my Pawn back and the score is back to even.  My Queen is hanging out there and very vulnerable to attack.
647,19,9,e6,b'rn1qkbnr/pppb2pp/4p3/5p2/2QP4/5N2/PP2PPPP/RNB1KB1R w KQkq -',"This looks like a pretty good idea for black.  He opens up a path for both his Queen and his Bishop.  He also gives protection to that f pawn which was hanging out there by its lonesome.

Notice that white has both the d and e pawns in tact and black has lost his d pawn. According to the experts this is a really good thing for white although I am not smart enough at this point in my chess career to understand why."
648,19,10,d5,b'rn1qkbnr/pppb2pp/4p3/3P1p2/2Q5/5N2/PP2PPPP/RNB1KB1R b KQkq -',"I push my d pawn here.  This prevents the black Knight from coming out but of course black will consider swapping pawns with me.  If black does swap pawns then that black f pawn will be hanging out by its lonesome again.

This is a very aggressive move for white and if I was in a different mood I might not have done it.  It is likely that I will lose my d pawn which the experts say is a no no.  I guess I was in an ""easy come easy go"" type of mood.  Let's roll the dice.  You only live once."
649,19,11,exd5,b'rn1qkbnr/pppb2pp/8/3p1p2/2Q5/5N2/PP2PPPP/RNB1KB1R w KQkq -',So black takes my d pawn.  That is what I would have done also.  I don't see any blunder here.  Of course white will take the pawn back on the next move.
650,19,12,Qxd5,b'rn1qkbnr/pppb2pp/8/3Q1p2/8/5N2/PP2PPPP/RNB1KB1R b KQkq -',"As expected white takes the pawn back and the score is even.  The white Queen is very vulnerable to attack although she can easily tuck her tail and zip home for lunch if black threatens her.  Also the white King is vulnerable to check but it can be easily blocked.

The black f pawn is not threatened at this point because it is protected by the black Bishop."
651,19,13,Nc6,b'r2qkbnr/pppb2pp/2n5/3Q1p2/8/5N2/PP2PPPP/RNB1KB1R w KQkq -',OK this looks like a standard good move for black.  He brings out his Knight.  Very ordinary move and it looks like a fine move to me.  I don't see anything wrong with that.  Black is just doing normal development.  He does not threaten my Queen as I was expecting but this move looks OK to me.
652,19,14,Ne5,b'r2qkbnr/pppb2pp/2n5/3QNp2/8/8/PP2PPPP/RNB1KB1R b KQkq -',Another aggressive move for white.  I must be in a Monte Carlo type of mood.  Let's roll the dice.  This Knight is not protecting any pawns so lets put him into action.  The experts would say that white should develop more pieces here: bring out the other white Knight or the bishop or push the e pawn.  But I am in a strange mood today.
653,19,15,Nge7,b'r2qkb1r/pppbn1pp/2n5/3QNp2/8/8/PP2PPPP/RNB1KB1R w KQkq -',Black decides to threaton the Queen.  Looks like a good idea.  Let's get that Queen out of here.  Makes sense.  And while doing that black also adds protection to the f pawn.  Good idea in general. But alas this is a huge mistake.  Black did not notice the checkmate.  He should have swapped Knights with me although that would have left him in check but it could have been easily blocked.
654,19,16,Qf7#,b'r2qkb1r/pppbnQpp/2n5/4Np2/8/8/PP2PPPP/RNB1KB1R b KQkq -',Checkmate in 9 moves.  I am pretty proud of this but lets talk about what caused the downfall for black.  Moving that f pawn was strange but I don't think that was the big mistake.  I think the mistake was that black should have started attacking the white Queen as soon as possible.  Black kept ignoring the Queen and she ultimately had her way with him.  Of course black simply did not see the checkmate or he could have stopped it.  That was a giant blunder for sure.  But black should have chased her away long before she got to that position.
655,20,0,d5,b'rnbqkbnr/ppp1pppp/8/3p4/4P3/8/PPPP1PPP/RNBQKBNR w KQkq d6',En bilan une ouverture dsastreuse ds le 6me coup. Je m'en sors sur une erreur et une boulette de l'adversaire. C'est donc mme pas la peine de trop analyser. Hop au boulot ouverture.___je viens d eme rendre compte que c'est contre loopy que j'ai eu aussi la mme ouverture. Lui non plus il n'a pas boss :-))
656,20,1,Nf3,b'rnbqkbnr/pp2pppp/8/2ppP3/8/5N2/PPPP1PPP/RNBQKB1R b KQkq -',Et bien me voil dj  la fin de la thorie que je connais. Pas terrible il y a du boulot.
657,20,2,Bd7,b'r2qkbnr/pp1b1ppp/2n1p3/1BppP3/8/3P1N2/PPP2PPP/RNBQK2R w KQkq -',Flute je me rends compte que je peux jouer Qa5 (comme la partie prcdente). Quelle nouille ! je m'en veux sur le moment....mais j'ai une super excuse j'ai mal  la tte je suis sous antibio :-)
658,20,3,Be7,b'r2qk1nr/pp1bbppp/2n1p3/1BppP3/8/3P1N2/PPP2PPP/RNBQ1RK1 w kq -',je ne suis pas spcialement convaincu par ce coup. 6...f6 c'est peut-tre mieux. Bon je viens de regarder avec un module. 6...Nxe5 a m'aurai bien plu de penser  ce coup. C'est donc le coup que je reprendrais bien pour cette partie.
659,20,4,a4,b'r2qk1nr/pp1bbppp/2n1p3/1BppP3/P7/3P1N2/1PP2PPP/RNBQ1RK1 b kq a3',suite  ce coup son fou va forcment tre chang. je pense que c'est bien pour moi d'avoir la paire de fous.
660,20,5,c4,b'r2qk1nr/1p2bppp/p1b1p3/2ppP3/P1P5/3P1N2/1P3PPP/RNBQ1RK1 b kq c3',j'ai pas mal hsit avec 9...dxc en supposant la ligne 9...dxc 10.dxc Qxd1 11.Rxd1 Rd1 et je suis finalement parti sur 9...f6 qui  m'a mis dedans quelques coups plus tard.
661,20,6,fxe5,b'r2qk1nr/1p2b1pp/p1b1p3/2p1p3/P4B2/2NP1N2/1P3PPP/R2Q1RK1 w kq -',c'est la panique je ne sais pas comment rpondre je suis compltement touff les cavaliers blancs sont trs menaant. Je vais me prendre 13.Nxe5 la misre. Faut vraiment que je bosse cette ouverture.
662,20,7,1Bxe5,b'r2qk1nr/1p2b1pp/p1b1p3/2p1B3/P7/2NP1N2/1P3PPP/R2Q1RK1 b kq -',oooouuuuffff
663,20,8,1Ng5,b'r2qk2r/1p2b1pp/p1b1pn2/2p1B1N1/P7/2NP4/1P3PPP/R2Q1RK1 b kq -',e6 va ramasser.
664,20,9,1Ne2,b'r1q1k2r/1p1bb1pp/p3pn2/2p1B1N1/P7/1Q1P4/1P2NPPP/R4RK1 b kq -',Ca va tre difficile de mettre plus de pice pour dfendre e6 aprs Ne2-f4 alors je tente ma chance d'essayer de faire reculer les blancs. Je ne calcule pas trop on verra bien.
665,20,10,1Nh4,b'r1q2rk1/1p1bb1p1/p3pn1p/2p1B3/P6N/1Q1P4/1P2NPPP/R4RK1 b - -',L je crois que j'ai ma chance. Comment il va dfendre 2 pices en l'air ?
666,20,11,1Nf3,b'r1q2rk1/1p1bb1p1/p3p2p/2p1B3/P5n1/1Q1P1N2/1P2NPPP/R4RK1 b - -',Je pense qu'il s'est plant dans la dfense je vais avoir 2 pices mineures pour la tour. Mais surtout je fais un gros calcul car si il joue Bxg7 Qc3 et Bh8 il faut absolument que mon cavalier puisse revenir sur la diagonale a1-h8. Je pense que a va tenir non pas grce  mon cavalier mais grce  e6-e5.
667,20,12,2Qc3,b'r1q3k1/1p1bb1B1/p3p2p/2p5/P7/2QP4/1P2NnPP/R5K1 b - -',Et voil on est en plein dans la ligne dangereuse. j'espre avoir bien visualis. Un peu de stress l ! c'est ce que j'aime en live par rapport en diffr.
668,20,13,e5,b'r1q3k1/1p1bb1B1/p6p/2p1p3/P5n1/2QP3P/1P2N1P1/R5K1 w - -',Voil la fin de ma visualisation en voyant la position au prsent j'ai l'impression que je vais tenir. La dame blanche va m'embetter mais je suppose que je vais pouvoir contenir et changer cette pice.
669,20,14,Bxg4,b'r1q5/1p4k1/p4b1p/2p5/P3Q1b1/3P4/1P2N1P1/R5K1 w - -',J'ai un petit doute allez  la pche au pion ce n'est peut-tre pas le meilleur moment. Mais je pense que a va surtout affaiblir son potentiel d'attaque aile roi et aussi dnud son roi.
670,20,15,2Nf4,b'r1q5/1p4k1/p4b1p/2p5/P3QNb1/3P4/1P4P1/R5K1 b - -',Ralala il va me faire c***r avec son cav c'est sur.
671,20,16,Bf5,b'r1q5/1p4k1/p6p/2p2b2/P2bQN2/3P4/1P4P1/R6K w - -',pour les coups suivant je souhaite arriver  changer les dames.
672,20,17,3Rb1,b'r5k1/8/p1p4p/2p2b2/P2b1N2/3P4/1P4P1/1R5K b - -',Et voil maintenant je crois que les blancs n'ont plus rien. Mais c'est loin d'tre gagn pour autant. Juste jouer zen sans forcer les choses changer au maximum et surtout ce cav qui peut faire des fourchettes (que je pleure si a m'arrive  cette partie^^). et mettre une douce pression sur ses pions.
673,20,18,Bxd3,b'1r4k1/8/p1p4p/2p5/P4P2/1P1b4/8/1R5K w - -',hop plus de cav un pion en moins la maintenant je commence  me sentir serein (mais mfiant quand mme)
674,20,19,c4,b'6k1/8/p1p4p/8/P1p2P2/1r1b4/7K/3R4 w - -',l je pense que c'est compltement fini. Il va jouer au bout c'est sur. Alors juste  viter le pat.
675,20,20,Rb8,b'1r6/5k2/p1p4p/8/P1p2P2/3b4/6K1/6R1 w - -',histoire de voir si je peux changer les tours.
676,20,21,5Kd7,b'8/3K1k2/p4P1p/1r6/b7/2p5/8/8 b - -',pendant que j'avance mon pion je visualise le mat Re5+  la dcouverte puis Qc5
677,20,22,Qc5#,b'8/5k2/p2K1P1p/2q1r3/b7/8/8/8 w - -',
678,21,0,d5,b'rn1qkbnr/pbpppppp/1p6/3P4/4P3/8/PPP2PPP/RNBQKBNR b KQkq -',I haven't seen this opening played much in my games so I decided to give the bishop as little room as possible.
679,21,1,Bf4,b'rn1qkbnr/pb1ppppp/1p6/2pP4/4PB2/2N5/PPP2PPP/R2QKBNR b KQkq -',I've been in this position (or a variation of this position) in many of my recent matches mainly to see how people choose to defend the fork.
680,21,2,a6,b'rn1qkbnr/1b1ppppp/pp6/2pP4/4PB2/2N5/PPP2PPP/R2QKBNR w KQkq -',This is the most common defense I've seen.
681,21,3,1Nc6,b'r2qkb1r/1b1npppp/p1Np1n2/1p1P4/2p1PB2/2N5/PPP1BPPP/R2Q1RK1 b kq -',Now things start to get interesting.  I decided to make a push to open up the board.
682,21,4,Nb8,b'rn1qkb1r/4pppp/p1Pp1n2/1p6/2p1PB2/2N5/PPP1BPPP/R2Q1RK1 w kq -',After the trade it looks like I'm going to lose my forward pawn but...
683,21,5,1e5,b'rn1qkb1r/4pppp/p1Pp1n2/1p2P3/2p2B2/2N5/PPP1BPPP/R2Q1RK1 b kq -',I counter-threaten his knight.  I was hoping (though not exactly expecting) 13... dxc5 14. QxQ.
684,21,6,1Ng8,b'rn1qkbnr/4pppp/p1Pp4/1p2P3/2p2B2/2N5/PPP1BPPP/R2Q1RK1 w kq -',He decides to retreat his knight instead.
685,21,7,Bxb4,b'1n1qk1nr/r4ppp/p1P1p3/1p1pP3/1bp2B2/1P3B2/P1P2PPP/R2Q1RK1 w k -',Here is where things started to go bad for me.  I didn't notice the discovered attack on my knight so now I'm behind in material and have left my pawn unprotected.
686,21,8,2Qf3,b'3qk1nr/r3bppp/p1n1p3/3pP2B/2p2B2/P4Q2/2P2PPP/R4RK1 b k -',Here I was gunning for his rook.  I figured that I could bluff an attack while actually shooting at the rook but it didn't quite work like that.
687,21,9,2Nd4,b'3qk1nr/r3bppp/p3p3/3pP2B/2pn1B2/P4Q2/2P2PPP/R4RK1 w k -',So much for taking the rook...
688,21,10,Nb3,b'3qk1nr/r4ppp/p3p3/2bpP2B/2p2B2/Pn2Q3/2P2PPP/2R2RK1 w k -',Now things go from bad to worse.  I thought that he would play 23... Nxc2 to fork my queen and rook so I moved to protect the pawn which unwittingly opened up for this attack.
689,21,11,Nxc1,b'3qk1nr/r4ppp/p3p3/2bpP2B/2p2B2/P1Q5/2P2PPP/2n2RK1 w k -',I thought about resigning at this point but decided to keep playing and see what happened.
690,21,12,Qd4,b'4k1nr/r4ppp/p3p3/2bpP3/2pq4/P1Q5/2P1BPPP/2B2RK1 w k -',Now he starts looking to trade queens.
691,21,13,2Qa5,b'4k1nr/r4ppp/p3p3/Q1bpP3/2pq4/P7/2P1BPPP/2B2RK1 b k -',I decline because an even trade would have doomed me here.
692,21,14,2c3,b'4k2r/r3nppp/p3p3/Q1bpP3/2pq4/P1P5/4BPPP/2B2RK1 b k -',Now it's my turn to attack.
693,21,15,2Nc6,b'4k2r/r4ppp/p1n1p3/Q1bpP3/2pq4/P1P5/4BPPP/2B2RK1 w k -',Now I have a glimmer of hope.  This move was a mistake.  An even trade would've killed me but this is no longer an even trade.  Instead he just gifted me his bishop.
694,21,16,3dxc5,b'4k2r/r4ppp/p3p3/n1PpP3/2p5/P7/4BPPP/2B2RK1 b k -',Now material's much closer to even and I have a pawn behind his defenses. Good thing I didn't resign.
695,21,17,3Nb3,b'4k2r/r4ppp/p3p3/2PpP3/2p5/Pn6/4BPPP/2B2RK1 w k -',Now we start battling for the pawn.
696,21,18,Rb7,b'5rk1/1r3ppp/p3p3/n1PpP3/B1p5/P3B3/5PPP/5RK1 w - -',Again I didn't like this move.  It made c6 the obvious move for me and essentially took his rook out of his defense.
697,21,19,3Bd7,b'5rk1/2PB1ppp/p3p3/n2pP3/2p5/P3B3/r4PPP/5RK1 b - -',Now I can retake the material advantage with one move.  Just goes to show how quickly  games can turn from a losing position to a winning one.
698,21,20,3Bc5,b'5rk1/2PB1ppp/p3p3/n1BpP3/2p5/r7/5PPP/5RK1 b - -',Now he's lost either both rooks or the game.  At this point my opponent resigns and I was left in shock of how the game went.  Just another example to never give up!
699,22,0,Nf3,b'rnbqkbnr/pp1ppppp/8/2p5/4P3/5N2/PPPP1PPP/RNBQKB1R b KQkq -',The first time I try this variation
700,22,1,Nf6,b'r1bqkb1r/pp1ppppp/2n2n2/8/3NP3/8/PPP2PPP/RNBQKB1R w KQkq -',Black doesn't trade the knight.
701,22,2,g6,b'r1bqkb1r/pp1ppp1p/2n2np1/8/3NP3/2N5/PPP2PPP/R1BQKB1R w KQkq -',preparing the fiancheto
702,22,3,Nxc6,b'r1bqkb1r/pp1ppp1p/2N2np1/8/4P3/2N5/PPP2PPP/R1BQKB1R b KQkq -',So that black cannot attack the d knight with bishop and c knight
703,22,4,e5,b'r1bqkb1r/p2ppp1p/2p2np1/4P3/8/2N5/PPP2PPP/R1BQKB1R b KQkq -',Strong but dangerous move. The pawn will be hard to defend.
704,22,5,Nh5,b'r1bqkb1r/p2ppp1p/2p3p1/4P2n/8/2N5/PPP2PPP/R1BQKB1R w KQkq -',The black knight is on the side bad place but the white e pawn is a bit lonesome
705,22,6,Be2,b'r1bqkb1r/p2ppp1p/2p3p1/4P2n/8/2N5/PPP1BPPP/R1BQK2R b KQkq -',Black can hardly castle long because of the pawn structure. White's plan is to do the same on the other wing to prevent black to castle efficiently
706,22,7,Ng7,b'r1bqkb1r/p2pppnp/2p3p1/4P3/8/2N5/PPP1BPPP/R1BQK2R w KQkq -',Black chooses to retreat. I prefer that my opponent has a knight rather than a bishop on the g7 square.
707,22,8,Be3,b'r1bqkb1r/p2pppnp/2p3p1/4P3/8/2N1B3/PPP1BPPP/R2QK2R b KQkq -',As black's pawn structure is weak on the queenside white plans to castle long.
708,22,9,Nf5,b'r1bqkb1r/p2ppp1p/2p3p1/4Pn2/8/2N1B3/PPP1BPPP/R2QK2R w KQkq -',Not a very efficient move for it permits white to carry on developing and the knight will be forced to drawback if white plays g4
709,22,10,1Qd3,b'r1bqkb1r/p2ppp1p/2p3p1/4Pn2/8/2NQB3/PPP1BPPP/R3K2R b KQkq -',To enable the long castle
710,22,11,1Qxe3,b'r1bqkb1r/p2ppp1p/2p3p1/4P3/8/2N1Q3/PPP1BPPP/R3K2R b KQkq -',Now white has two pawns out against one pawn and 3 pieces for white who is far stronger in the center.
711,22,12,h5,b'r1bqk2r/p2pppb1/2p3p1/4P2p/8/2N1Q3/PPP1BPPP/2KR3R w kq h6',? Black should have castle. This move weakens black's king if he castle and it achieves little as white has castled long.
712,22,13,1f4,b'r1bqk2r/p2pppb1/2p3p1/4P2p/5P2/2N1Q3/PPP1B1PP/2KR3R b kq f3',Developing and setting pressure on the center
713,22,14,1Qc7,b'r1b1k2r/p1qpppb1/2p3p1/4P2p/5P2/2N1Q3/PPP1B1PP/2KR3R w kq -',Black probably planned to push the f or the d pawn (rather f than d I imagine) but it's not an immediate threat for white.
714,22,15,1h3,b'r1b1k2r/p1qpppb1/2p3p1/4P2p/5P2/2N1Q2P/PPP1B1P1/2KR3R b kq -',To prepare g4
715,22,16,1Qb7,b'r1b1k2r/pq1pppb1/2p3p1/4P2p/5P2/2N1Q2P/PPP1B1P1/2KR3R w kq -',Black looses one more move in developpement for a menace which is not immediate.
716,22,17,1g4,b'r1b1k2r/pq1pppb1/2p3p1/4P2p/5PP1/2N1Q2P/PPP1B3/2KR3R b kq g3',Black keeps on advancing on the king side.
717,22,18,1b3,b'1rb1k2r/pq1pppb1/2p3p1/4P2p/5PP1/1PN1Q2P/P1P1B3/2KR3R b k -',Black's menace on the b file is no more efficient.
718,22,19,1e6,b'1rb1k2r/pq1p1pb1/2p1p1p1/4P2p/5PP1/1PN1Q2P/P1P1B3/2KR3R w k -',This move was almost anavoidable but if white manages to bring a knight on d6 or f6 it will be bad for black.
719,22,20,1gxh5,b'1rb1k2r/pq1p1pb1/2p1p1p1/4P2P/5P2/1PN1Q2P/P1P1B3/2KR3R b k -',Opening a file on the king side. Now black cannot castle
720,22,21,1Rhg1,b'1rb1k2r/pq1p1pb1/2p1p3/4P2p/5P2/1PN1Q2P/P1P1B3/2KR2R1 b k -',Using the open file to attack the king side
721,22,22,1Qb4,b'1rb1k2r/p2p1pb1/2p1p3/4P2p/1q3P2/1PN1Q2P/P1P1B3/2KR2R1 w k -',Unefficient move.
722,22,23,2Kb1,b'1rb1k2r/p2p1pb1/2p1p3/4P2p/4NP2/qP2Q2P/P1P1B3/1K1R2R1 b k -',Black's menace on the kingside is no more efficient.
723,22,24,2d5,b'1rb1k2r/p4pb1/2p1p3/3pP2p/4NP2/qP2Q2P/P1P1B3/1K1R2R1 w k d6',attacking on the center
724,22,25,2Nd6+,b'1rb1k2r/p4pb1/2pNp3/3pP2p/5P2/qP2Q2P/P1P1B3/1K1R2R1 b k -',black probably hoped 21. exd6 Qb2 + mate
