,gid,aid,move,fen,annotation
290,13,4,Qe8,b'r1b1qrk1/1pp1npbp/p1n1p1p1/3pP1B1/3P4/P1NB1N2/1PPQ1PPP/R3K2R w KQ -',Freeing my knight.
291,13,5,Qe7,b'r1b2rk1/1pp1qpbp/p1n3pB/3pPp2/3P1Q2/P1N2N2/1PP2PPP/R3K2R w KQ -',? a very poorly thought out move. Accompishes nothing and gives away a pawn.
292,13,6,Qe8,b'r1b1qrk1/1pp2pbp/p1n3pB/3NPp2/3P1Q2/P4N2/1PP2PPP/R3K2R w KQ -',Like I said Qe7 was a mistake.
293,13,7,1Nf6+,b'r1b1qrk1/1pp2pbp/p1n2NpB/4Pp2/3P1Q2/P4N2/1PP2PPP/R3K2R b KQ -',Luckily my opponent hasn't his thinking cap on either and gives me a free knight. That pawn is pinned.
294,13,8,1Bxf8,b'r1b1qBk1/1pp2p1p/p1n2bp1/4Pp2/3P1Q2/P4N2/1PP2PPP/R3K2R b KQ -',"Oops. guess it was me who wasn't thinking again.
At this point I started thinking. The board is opening up in the center. And I really would like to save that dark squared bishop. And I spot a way to do that. "
295,13,9,1Nxd4,b'r1b1qBk1/1pp2p1p/p4bp1/4Pp2/3n1Q2/P4N2/1PP2PPP/R3K2R w KQ -',The immidiate threat here is Nxc2 forking king and rook. I was thinking he'd take the knight Nxd4 then Bxe5 forks knight and queen. Note that I had missed that Qe3 then would have made me loose material (2 pawns for a knight.) since I can't take the knight because I would have lost my queen. Actually here he can take my knight with his queen straight away. And I would have lost a knight for only one pawn. This is a really silly move. More to come.
296,13,10,1Kd1,b'r1b1qBk1/1pp2p1p/p4bp1/4Pp2/3n1Q2/P4N2/1PP2PPP/R2K3R b - -',My opponent is no more awake than I am.
297,13,11,1Ne6,b'r1b1qBk1/1pp2p1p/p3nbp1/4Pp2/5Q2/P4N2/1PP2PPP/R2K3R w - -',Trying to save face. Threatens his queen and delays the bishop exchange.
298,13,12,1Qh6,b'r1b1qBk1/1pp2p1p/p3nbpQ/4Pp2/8/P4N2/1PP2PPP/R2K3R b - -',Seems my opponent doesnt want the bishop exchange either. Maybe he is also thinking about having bishops in a fairly open game.
299,13,13,1Bb4,b'r1b1q1kb/1pp2p1p/p3n1pQ/4Pp2/1B6/P4N2/1PP2PPP/R2K3R b - -',Bishop trade averted. But badly. :-)
300,13,14,1a5,b'r1b1q1kb/1pp2p1p/4n1pQ/p3Pp2/1B6/P4N2/1PP2PPP/R2K3R w - -',Go back from whence you came devil bishop.
301,13,15,1Bc3,b'r1b1q1kb/1pp2p1p/4n1pQ/p3Pp2/8/P1B2N2/1PP2PPP/R2K3R b - -',This makes the white pawn on e5 extra important. I need it to stay where it is. And keeping it there becomes a major headache. It also locks down my king since I cannot move that f7 pawn.
302,13,16,2a4,b'r3q1kb/1ppb1p1p/4n1pQ/p3Pp2/P7/2B2N2/1PP2PPP/R2K3R b - -',this is a free pawn but...
303,13,17,2c5,b'r3q1kb/1p1b1p1p/4n1pQ/p1p1Pp2/P7/2B2N2/1PP2PPP/R2K3R w - c6',I need to keep his knight away from d4. I really don't want that pawn to move.
304,13,18,2Ke2,b'r3q1kb/1p1b1p1p/4n1pQ/p1p1Pp2/P7/2B2N2/1PP1KPPP/R6R b - -',I think this was just to link his rooks.
305,13,19,2Bc6,b'r3q1kb/1p3p1p/2b1n1pQ/p1p1Pp2/P7/2B2N2/1PP1KPPP/R6R w - -',This is the proof. I hadn't spotted the fact that the a4 pawn is loose.
306,13,20,2Qe3,b'r3q1kb/1p3p1p/2b1n1p1/p1p1Pp2/P7/2B1QN2/1PP1KPPP/R6R b - -',Here I finally saw the free pawn but now...
307,13,21,2b6,b'r3q1kb/5p1p/1pb1n1p1/p1p1Pp2/P7/2B1QN2/1PP1KPPP/R6R w - -',I needed to protect my own pawn. I had no Lightsquared bishop to fear.
308,13,22,2Rhd1,b'r3q1kb/5p1p/1pb1n1p1/p1p1Pp2/P7/2B1QN2/1PP1KPPP/R2R4 b - -',Grabbing the opened file. Will prove important.
309,13,23,2Bxa4,b'r3q1kb/5p1p/1p2n1p1/p1p1Pp2/b7/2B1QN2/1PP1KPPP/R2R4 w - -',Finally that pawn is mine.
310,13,24,2Ke1,b'r3q1kb/5p1p/1p2n1p1/pbp1Pp2/8/1PB1QN2/2P2PPP/R2RK3 b - -',This position feels fairly ok. I just need to extract my bishop from h4 and activate my queen a bit and I should have an almost equal game.
311,13,25,2Qc6,b'r5kb/5p1p/1pq1n1p1/pbp1Pp2/8/1PB1QN2/2P2PPP/R2RK3 w - -',Activating my queen along the long diagonal.
312,13,26,2Rd6,b'r5kb/5p1p/1pqRn1p1/pbp1Pp2/8/1PB1QN2/2P2PPP/R3K3 b - -',I didn't really understan this move since it doesnt make much difference.
313,13,27,2Qb7,b'r5kb/1q3p1p/1p1Rn1p1/pbp1Pp2/8/1PB1QN2/2P2PPP/R3K3 w - -',Queen is still on her diagonal.
314,13,28,2Rad1,b'r5kb/1q3p1p/1p1Rn1p1/pbp1Pp2/8/1PB1QN2/2P2PPP/3RK3 b - -',doubling up the rooks. But my knight is already locked in place. this only pins it harder.
315,13,29,2Bg7,b'r5k1/1q3pbp/1p1Rn1p1/pbp1Pp2/8/1PB1QN2/2P2PPP/3RK3 w - -',working the bishop out.
316,13,30,Bh6,b'r5k1/1q3p1p/1p1Rn1pb/pbp1PpN1/8/1PB1Q3/2P2PPP/3RK3 w - -',again I have to concetrate to keep my knight in place.
317,13,31,Qxg2,b'r5k1/5p1p/1p1Rn1pb/pbp1PpN1/7P/1PB1Q3/2P2Pq1/3RK3 w - -',This is a fairly brutal move. Forces white to set up a queen exchange.  Anything else is mate. (or serious material loss)
318,13,32,3Qg3,b'r5k1/5p1p/1p1Rn1pb/pbp1PpN1/7P/1PB3Q1/2P2Pq1/3RK3 b - -',he chooses g3 for the exchange.
319,13,33,Bf8,b'r4bk1/5p1p/1p1Rn1p1/pbp1PpN1/7P/1PB3P1/2P5/3RK3 w - -',Here is another bad call on my part. I looked only at moves where his rook escapes along the d-file...
320,13,34,3Rxb6,b'r4bk1/5p1p/1R2n1p1/pbp1PpN1/7P/1PB3P1/2P5/3RK3 b - -',...and overlooked this.
321,13,35,3Nd4,b'r4bk1/5p1p/1R4p1/pbp1PpN1/3n3P/1PB3P1/2P5/3RK3 w - -',?? This is where I lost all chances of a draw. For some dark reason I thought Bxd4 cxd4 Rxd4?? Bc5 forking his rooks. Off course...
322,13,36,3Rxb5,b'r4bk1/5p1p/6p1/pR2PpN1/3p3P/1P4P1/2P5/3RK3 b - -',"Rxb5.. Sometimes I just don't believe how truly blind one can be.
But I liked this game. Very much because it had some very nice possibilities
and it flowed so nice. Mistakes were made on both sides but the better player won in the end i think :-)"
323,13,37,3Kd3,b'4r3/5k1p/5pp1/pR1RPp2/7P/1PbK1NP1/2P5/8 b - -',
324,14,0,Nd2,b'rnbqkbnr/pp2pppp/2p5/3p4/3PP3/8/PPPN1PPP/R1BQKBNR b KQkq -',This is the modern way of handling the Caro-kann. White retains flexibility in how to proceed. For example He can immediately transpose into the Botvinnik-panov attack with C4 or maine line classical with Nxe4 if black plays dxe4.
325,14,1,Nd7,b'r1bqkbnr/pp1npppp/2p5/8/3PN3/8/PPP2PPP/R1BQKBNR w KQkq -',4. ...Nd7 is arguably Black's strongest defense. Although it does not offer much in the way of counter chances until the later stages of the middle game. Black plays this move so that he can develop his other Knight to F6 without fear of seriously weakening is king side pawn structure. This move also prepares for blacks major pawn breaks on e5 and c5. 
326,14,2,Ng5,b'r1bqkbnr/pp1npppp/2p5/6N1/3P4/8/PPP2PPP/R1BQKBNR b KQkq -',The idea of this move is to regroup the forces with the aim of occupying e5 with a knight the bishop being developed at d3 and without lose of tempo. The point is that black can not tolerate the knight on g5 for long and is force to assist the manoeuvre Ng5-f3-e5. where it will be supported by the other Knight. 
327,14,3,Ngf6,b'r1bqkb1r/pp1npppp/2p2n2/6N1/3P4/8/PPP2PPP/R1BQKBNR w KQkq -',Black can not play the immediate 5. ...h6 because of the possible sacrifice 6. Ne6! Qa5  7. Bd2 Qb6 8. Bd3 and now 8. ...fxe6 fails to 9. Qh5  Kd8 10. Ba5 winning the queen. 
328,14,4,e6,b'r1bqkb1r/pp1n1ppp/2p1pn2/6N1/3P4/3B4/PPP2PPP/R1BQK1NR w KQkq -',without completely his development it is practically impossible for black to drive the knight away
329,14,5,h6,b'r1bqkb1r/pp1n1pp1/2p1pn1p/6N1/3P4/3B1N2/PPP2PPP/R1BQK2R w KQkq -',Hind-sight being 20\20 I will not play this move again. Ne6 is still to dangerous. 
330,14,6,Nxe6,b'r1bqkb1r/pp1n1pp1/2p1Nn1p/8/3P4/3B1N2/PPP2PPP/R1BQK2R b KQkq -',The correct response that gives white a clear edge in the game. 
331,14,7,Qe7,b'r1b1kb1r/pp1nqpp1/2p1Nn1p/8/3P4/3B1N2/PPP2PPP/R1BQK2R w KQkq -',This is blacks most opportunistic defense. 8. ...fxe6 leads black into a seriously cramped game. Although 8. ...fxe6 is defensible as well. 
332,14,8,1Ne5,b'r1bk1b1r/pp1nq1p1/2p1pnBp/4N3/3P4/8/PPP2PPP/R1BQ1RK1 b - -',Although this move look dangerous it actually give black the advantage. By playing Ne5 white gives up control of e5 and allows black to free his position. Better is 11. C4 or 11. Bf4 to keep up the attack and keep black cramped. If it is clear that you have a permanent space advantage then avoiding trades is what you need to do. Eventually your opponent will be forced to create a weakness to exploit. 
333,14,9,1Bf7,b'r1bk1b1r/pp1n1Bp1/2p1p2p/4P3/1q6/4B3/PPP2PPP/R2Q1RK1 b - -',Bd4 is more accurate.
334,14,10,Nxe5,b'r1b2b1r/pp2k1p1/2p1p1Bp/4n3/1q6/4B3/PPP2PPP/R2Q1RK1 w - -',The point of the inaccuracy of Bf7 is that it allows black to grab the initiative via 15. ...Nxe5  
335,14,11,1Bd4,b'r1b2b1r/pp2k1p1/2p1p2p/4n2B/3B4/8/PqP2PPP/R2Q1RK1 b - -',"Qxb7?? Oops black got too greedy. White missed a golden opportunity to grab the win. 17. Bc5  wins by force. 

17. ...Kf6 18. Qd8  Kf5 19. g4  Nxg4 20. Qd3  Kf6 21. Qf3  Ke5 22. Rae1  Ne3 23. Rxe3  "
336,14,12,1Qb5,b'r1b2b1r/pp2k1p1/2p1p2p/1q2n2B/3B4/8/P1P2PPP/R2Q1RK1 w - -',phew I avoided mate. If Calojay reads this he will be kicking himself for sure!
337,14,13,Kf7,b'r1b2b1r/pp3kp1/2p1p2p/3qn3/P2B4/8/2P1BPPP/R2Q1RK1 w - -',I do not know why I made this move. It is a waste of time I should have played c5 or Nd7. 
338,14,14,2c4,b'r1b2b1r/pp3kp1/2p1p2p/3qn3/P1PB4/8/4BPPP/R2Q1RK1 b - c3',Calojay drops a pawn.
339,14,15,2Bxc4,b'r1b2b1r/pp3kp1/2p1p2p/3q4/P1BB4/8/5PPP/R2Q1RK1 b - -',when you are behind in material it is not wise to give more. you should avoid exchanges if possible. This just increases Black's advantage. 
340,14,16,2Qf3+,b'r1b2b1r/pp3kp1/4p2p/2pq4/P2B4/2R2Q2/5PPP/5RK1 b - -',What is a guy to do! you are already so far behind in material you might as well give it all way!
341,14,17,b6,b'r4bkr/p5p1/1pb1p2p/2p1B3/P7/6R1/5PPP/1R4K1 w - -',I had a bit of time so I played it safe. Now white has nothing in the way of counterattacks. 
342,14,18,2a5,b'r4bkr/p5p1/1pb1p2p/P1p1B3/8/6R1/5PPP/1R4K1 b - -',a further concession by white. This allows black to create two connected past pawns. 
343,14,19,Rc8,b'2r3kr/p5b1/4p2p/P7/bR6/2p3R1/5PPP/6K1 w - -',White Resigned there is no stopping the past pawn. 
344,15,0,c3,b'r1bqkbnr/pp1ppp1p/2n3p1/2p5/4P3/2P3P1/PP1P1PBP/RNBQK1NR b KQkq -',Sicilian Alapin's Variation (2.c3)  I play Sicilian alot but I rarely see this opening.  To me this seems like a too passive approach for myself... so I did not look forward to this game
345,15,1,Ng4,b'r2q1rk1/pb1p1pbp/1pn3p1/2p1p3/4P1n1/BPPP2P1/P1QNNPBP/R3K2R w KQ -',Probably my lowest point in this game.  I thought that he'd have to ruin his pretty king side structure to defend against this piece (I was thinking 11. h3) but apparently that was not the case
346,15,2,1Bh3,b'r2q1rk1/pb1p1pbp/1pn3p1/2p1p3/4P1n1/BPPP2PB/P1QNNP1P/R3K2R b KQ -',The wise counter from my able opponent
347,15,3,d6,b'r2q1rk1/pb3pbp/1pnp1np1/2p1p3/3PP3/BPP3PB/P1QNNP1P/R3K2R w KQ -',Similarly I felt nervous at this point... I need to learn how to deal with backwards pawns in the middle.  Or atleast I should atleast remember to avoid them.
348,15,4,1d5,b'r2qr1k1/pb3pbp/1pnp1np1/2pPp3/4P1P1/BPP4B/P1QNNP1P/R3K2R b KQ -',Another low point I was sure that he'd win at this point with a safe advanced pawn.  Castle queen side advance the C and F pawn to destroy my interior and I would be screwed.
349,15,5,1f3,b'r2qr1k1/pb2npbp/1p1p1np1/2pPp3/4P1P1/BPP2P1B/P1QNN2P/R3K2R b KQ -',Another reason why you don't advance the f pawn before you are secure.  His e pawn was well defended by 2 pieces and was at no risk.  
350,15,6,1Nexd5,b'r2qr1k1/pb3pbp/1p1p1np1/2pnp3/4P1P1/BPP2P1B/P1QNN2P/R3K2R w KQ -',A questionable sacrifice.  However given my situation I thought 2 center pawns were adequate booty for a badly placed knight
351,15,7,1Qd3,b'r2qr1k1/pb3pbp/1p1p2p1/2pnp3/6P1/BPPQ1P1B/P2NN2P/R3K2R b KQ -',The fatal mistake
352,15,8,1Nc4,b'r3r1k1/pb3pbp/1p1p2p1/2pnp3/2N3P1/BPPQ1P1q/P3N2P/R2K3R b - -',The next few moves I am very proud of because I contemplated them deeply.  It seemed like in every option I was up; however it was a very precarious situation.  
353,15,9,Nxe2,b'r3r1k1/pb3p1p/1p1p2pb/2p1p3/2N3P1/BPP2P2/P1K1n2P/6RR w - -',Gaining a knight for free while destroying his structure and setting up possible retaliatory attacks in the center.  
354,15,10,2Rhf1,b'3rr1k1/p4p1p/1p1p2pb/2p1p3/1PN3P1/B1P2b2/P1K1n2P/4RR2 b - -',At this point he resigned due to the obvious 26... Bg4 which would have secured me at a 7 piece advantage with a weak but sufficient pawn structure and support.  I would like to thank Alin for putting on a great game and having the better of me for most of the game.
355,16,0,a3,b'rn1qkb1r/pp3ppp/2p1pn2/3p1b2/1PPP4/P3PN2/5PPP/RNBQKB1R b KQkq -',Too much pawnmoves.
356,16,1,Qxe5,b'r3k2r/pp2bppp/2p2n2/2Ppqb2/1P6/P1N1P3/1B3PPP/R2QKB1R w KQkq -',Still equal but black become some breath.
357,16,2,Qe6,b'r4rk1/pp2bppp/2p1qn2/2Pp1b2/NP6/P3P3/1B1Q1PPP/R3KB1R w KQ -',Now black seems to be better.
358,16,3,Nxg3+,b'4rrk1/1p3ppp/p1p3q1/2Pp1b2/NP1B3b/P2BP1n1/4QP1P/R4R1K w - -',black must win. The bishop on d3 is over and a quality will lost.
359,16,4,Qf5,b'4rrk1/1p3ppp/p1p5/2Pp1q2/NP1B3P/P2bP2P/5Q2/R6K w - -',try to exchange...
360,16,5,Qg6,b'4r1k1/1p3rp1/p1p2pq1/2Pp3p/1P1B3P/P1NbP1QP/5R1K/8 w - -',Qh7 would be better...
361,16,6,g5,b'2Q5/1p2rr1k/p1p2p2/2Pp2pp/PP1Bq2P/4P1KP/1R6/8 w - g6',TERRIBLE MISTAKE!!! - Re8 would win the queen for a rook. I was stupid.
362,16,7,4Rxf6#,b'6Q1/1p2r1r1/p1p2Rk1/2Pp2pp/PP1Bq3/4P2P/7K/8 b - -',That was a winning position... :(
363,17,0,e4,b'rnbqkbnr/pppppppp/8/8/4P3/8/PPPP1PPP/RNBQKBNR b KQkq e3',"Here's the description from my mini-tournament which starts with the moves 1. e4 c5 2. d4!?

Ken Smith played this opening a lot... 1. e4 c5 2. d4!? which has a lot of interesting variations that aren't normally seen here on gameknot or anywhere for that matter. One time Bent Larsen was annotating a game where Smith's opponent played the French Defense and the annotations went: 1. e4 e6? (Better is 1... c5! which wins a pawn)"
364,17,1,cxd4,b'rnbqkbnr/pp1ppppp/8/8/3pP3/8/PPP2PPP/RNBQKBNR w KQkq -',The first move actually made in the game -- an obvious and natural one too.  This is a regular sicilian thus far with just a different move order.
365,17,2,Nf3,b'rnbqkbnr/pp1ppppp/8/8/3pP3/5N2/PPP2PPP/RNBQKB1R b KQkq -',White has the option of recapturing right away (3. Qxd4) developing with 3. Nf3 and daring white to try to hold onto the pawn with 3. ...e5 (as in this game) or going into the Smith-Morra gambit proper (3. c3) which looks a lot like the danish gambit (for those familiar with 1. e4 e5 2. d4!? exd4 3. c3).
366,17,3,Nc6,b'r1bqkbnr/pp1ppppp/2n5/8/3pP3/5N2/PPP2PPP/RNBQKB1R w KQkq -',Black decides against e5 and gives me the option to turn this into a standard sicilian game with 4. Nxd4.
367,17,4,c3,b'r1bqkbnr/pp1ppppp/2n5/8/3pP3/2P2N2/PP3PPP/RNBQKB1R b KQkq -',...but how boring would that be?  4. c3!? isn't the soundest gambit to be sure since it appears white is offering a pawn for just one tempo but if I can develop quickly and efficiently maybe I can turn this into an effective attack.  (That's the goal anyway!)
368,17,5,dxc3,b'r1bqkbnr/pp1ppppp/2n5/8/4P3/2p2N2/PP3PPP/RNBQKB1R w KQkq -',I approve of this move since allowing 5. cxd4 allows white to hit back in the center and regain his pawn -- this is black's best shot for an edge.
369,17,6,Bc4,b'r1bqkbnr/pp1ppppp/2n5/8/2B1P3/2p2N2/PP3PPP/RNBQK2R b KQkq -',!?  Very speculative -- offering a second pawn for one more tempo.  If black bites and plays cxb2 the white bishops will be extremely powerful but will they be worth two pawns?
370,17,7,e6,b'r1bqkbnr/pp1p1ppp/2n1p3/8/2B1P3/2p2N2/PP3PPP/RNBQK2R w KQkq -',Black isn't biting and in fact looks to be trying to reduce the influence of white's Bc4 with this move which gives him a paulsen-like setup.
371,17,8,O-O,b'r1bqkbnr/pp1p1ppp/2n1p3/8/2B1P3/2p2N2/PP3PPP/RNBQ1RK1 b kq -',Castling seems like a normal developing move here.  Now I'm still willing to allow cxb2 because my bishop will become very powerful on that long diagonal especially if black plays Bc5 or the like which e6 seemed to prepare.
372,17,9,a6,b'r1bqkbnr/1p1p1ppp/p1n1p3/8/2B1P3/2p2N2/PP3PPP/RNBQ1RK1 w kq -',I didn't understand this move initially until I realized that black was preparing to play b5 driving my bishop off of c4.  Well if he's going to be pushing pawns...
373,17,10,Nxc3,b'r1bqkbnr/1p1p1ppp/p1n1p3/8/2B1P3/2N2N2/PP3PPP/R1BQ1RK1 b kq -',Then I'm going to keep developing pieces!  My goal is to use my edge in development and slight space advantage to launch an attack down the open c- and half-open d-files.
374,17,11,Bc5,b'r1bqk1nr/1p1p1ppp/p1n1p3/2b5/2B1P3/2N2N2/PP3PPP/R1BQ1RK1 w kq -',Of course this is going to require a balance of defending as well as black is not without his own resources.
375,17,12,a3,b'r1bqk1nr/1p1p1ppp/p1n1p3/2b5/2B1P3/P1N2N2/1P3PPP/R1BQ1RK1 b kq -',Black may not like the looks of my bishop on c4 and I don't like the looks of his on c5.  This move prepares to knock the Bc5 into the corner.
376,17,13,d6,b'r1bqk1nr/1p3ppp/p1npp3/2b5/2B1P3/P1N2N2/1P3PPP/R1BQ1RK1 w kq -',?!  Now this move is perfectly fine and even makes it into the gameknot game DB (with a win for white) but it is not a good move here.  Why?  First it prevents the bishop from retreating to e7.  Second the new moves it allows Bd7 and Qd7 are not moves black is going to make!  Nge7 was my preferred move here as if I were black I'd want to neutralize white's developmental edge as soon as possible!
377,17,14,b4,b'r1bqk1nr/1p3ppp/p1npp3/2b5/1PB1P3/P1N2N2/5PPP/R1BQ1RK1 b kq b3',Forcing the bishop to a7 as Bb6 would block the b-pawn hampering the light-squared bishop and allow further harassment by either a5-a6 or Na5 or even a future Nd5.
378,17,15,Ba7,b'r1bqk1nr/bp3ppp/p1npp3/8/1PB1P3/P1N2N2/5PPP/R1BQ1RK1 w kq -',The best move given the circumstances.
379,17,16,1Bg5,b'r1bqk1nr/bp3ppp/p1npp3/6B1/1PB1P3/P1N2N2/5PPP/R2Q1RK1 b kq -',Bf4 is probably going to be preferred by many of you reading this but what I was thinking is that it was going to be most beneficial to provoke weaknesses in black's kingside since that's clearly where he's going to castle.  
380,17,17,1Nge7,b'r1bqk2r/bp2nppp/p1npp3/6B1/1PB1P3/P1N2N2/5PPP/R2Q1RK1 w kq -',This is probably the best and safest move as Nf6 would leave black exposed to a dangerous future e5 thrust and f6 weakens the light squares around black's king.
381,17,18,1Rc1,b'r1bqk2r/bp2nppp/p1npp3/6B1/1PB1P3/P1N2N2/5PPP/2RQ1RK1 b kq -',Putting a rook on this open file can't be a bad idea can it?  As it turns out this move never does much but I was happy to develop this piece to a good square for now.
382,17,19,1O-O,b'r1bq1rk1/bp2nppp/p1npp3/6B1/1PB1P3/P1N2N2/5PPP/2RQ1RK1 w - -',Totally consistent.  Black is nearly caught up in development and I can see that after b5 and Bb7 he'll have his development nearly completed and all I'll have to show for my pawn is a space advantage.  At this point I realized I was going to have to turn up the pressure if I wanted to get a (hopefully winning) attack going!
383,17,20,1Qe2,b'r1bq1rk1/bp2nppp/p1npp3/6B1/1PB1P3/P1N2N2/4QPPP/2R2RK1 b - -',Preparing to give the black queen some uncomfortable opposition with Rfd1!
384,17,21,1b5,b'r1bq1rk1/b3nppp/p1npp3/1p4B1/1PB1P3/P1N2N2/4QPPP/2R2RK1 w - b6',Of course this was coming...
385,17,22,1Bb3,b'r1bq1rk1/b3nppp/p1npp3/1p4B1/1P2P3/PBN2N2/4QPPP/2R2RK1 b - -',And of course I'm going to keep the 2nd rank free for the heavy pieces to maneuver.
386,17,23,1Bb7,b'r2q1rk1/bb2nppp/p1npp3/1p4B1/1P2P3/PBN2N2/4QPPP/2R2RK1 w - -',...and now black although cramped has a good solid game and it looks like I don't have enough for the pawn.
387,17,24,1Rfd1,b'r2q1rk1/bb2nppp/p1npp3/1p4B1/1P2P3/PBN2N2/4QPPP/2RR2K1 b - -',Nonetheless let's go ahead and continue with loading up on the open and half-open files and see if an attack develops!
388,17,25,1Qb8,b'rq3rk1/bb2nppp/p1npp3/1p4B1/1P2P3/PBN2N2/4QPPP/2RR2K1 w - -',Quite reasonably black's queen isn't going to stick around and find out what happens if the d-file gets opened!
389,17,26,1Rd3,b'rq3rk1/bb2nppp/p1npp3/1p4B1/1P2P3/PBNR1N2/4QPPP/2R3K1 b - -',And this is where I come up with a plan on how to break through -- build an Alekhine's gun on the d-file!  Get an Rd3 Rd2 and Qd1 and just ram it down black's throat!  Is this a good sound plan?  I'm not sure even now.  But I'm better developed and more maneuverable and it's better to have a speculative plan than no plan at all!
390,17,27,1Kh8,b'rq3r1k/bb2nppp/p1npp3/1p4B1/1P2P3/PBNR1N2/4QPPP/2R3K1 w - -',Black's clearly thinking about f6 which is impossible at the moment due to Bxe6 .
391,17,28,1Rcd1,b'rq3r1k/bb2nppp/p1npp3/1p4B1/1P2P3/PBNR1N2/4QPPP/3R2K1 b - -',In hindsight the Rc1 move earlier did keep the black queen off of c7 so maybe it did serve a purpose.  Still had I known I could've achieved this configuration a move earlier.  It's silly to harp on it now but the reason I'm critical of it is that when you're ahead in development you want to make every move count!  If black catches up in development then I've got nothing to show for the pawn.  At least I have more space.
392,17,29,1Rd8,b'rq1r3k/bb2nppp/p1npp3/1p4B1/1P2P3/PBNR1N2/4QPPP/3R2K1 w - -',...I see he's not going to give me the pawn back so freely and easily.
393,17,30,1Rd1d2,b'rq1r3k/bb2nppp/p1npp3/1p4B1/1P2P3/PBNR1N2/3RQPPP/6K1 b - -',Of course now he sees I'm planning Qd1 and does he have a good way to defend the pawn a third time?
394,17,31,1Ng6,b'rq1r3k/bb3ppp/p1npp1n1/1p4B1/1P2P3/PBNR1N2/3RQPPP/6K1 w - -',"I guess not.  So when I first saw this move I said ""ooh free rook!""  And then I said no no look if you play 18. Bxd8 he plays Nf4 and then what?  Well it looks like the complications favor white after 18. Bxd8 Nf4 19. Qd1 Nxd3 20. Rxd3 but I thought I could get a better position by reducing the effectiveness of a possible Nf4."
395,17,32,1Qd1,b'rq1r3k/bb3ppp/p1npp1n1/1p4B1/1P2P3/PBNR1N2/3R1PPP/3Q2K1 b - -',And in hindsight maybe Bxd8 was indeed better.  But this isn't terrible either.
396,17,33,1f6,b'rq1r3k/bb4pp/p1npppn1/1p4B1/1P2P3/PBNR1N2/3R1PPP/3Q2K1 w - -',Of course black's not going to let me get a free rook out of it!
397,17,34,1Be3,b'rq1r3k/bb4pp/p1npppn1/1p6/1P2P3/PBNRBN2/3R1PPP/3Q2K1 b - -',This is the best square I could find although Bh5 may not have been awful either.  Still exchanging the dark-squared bishops aren't so important when I'm going to be able to get away with Rxd6 shortly.
398,17,35,1Bxe3,b'rq1r3k/1b4pp/p1npppn1/1p6/1P2P3/PBNRbN2/3R1PPP/3Q2K1 w - -',Of course.
399,17,36,2fxe3,b'rq1r3k/1b4pp/p1npppn1/1p6/1P2P3/PBNRPN2/3R2PP/3Q2K1 b - -',"A tough move to find but much better than Rxe3 which disrupts the gun and doesn't prevent Nf4 like the text does.  I'm not worried about the isolated doubled pawns because I'm counting on having a successful attack!

So now the lines are drawn; I'm going to try to blow open the center and win material while black's going to defend and try to make it to a won endgame."
400,17,37,2Nge5,b'rq1r3k/1b4pp/p1nppp2/1p2n3/1P2P3/PBNRPN2/3R2PP/3Q2K1 w - -',There's a lot to consider here but this move forces the action.  If I can't do something positive I'm just going to wind up in an endgame down a pawn.
401,17,38,2Rd3xd6,b'rq1r3k/1b4pp/p1nRpp2/1p2n3/1P2P3/PBN1PN2/3R2PP/3Q2K1 b - -',So let's go for it!
402,17,39,2Ng4,b'rq1r3k/1b4pp/p1nRpp2/1p6/1P2P1n1/PBN1PN2/3R2PP/3Q2K1 w - -',An interesting try!  This threatens Nxe3 but also threatens the cheap Qxh2 if the Rd6 and Nf3 both move!
403,17,40,2Rd6xd8+,b'rq1R3k/1b4pp/p1n1pp2/1p6/1P2P1n1/PBN1PN2/3R2PP/3Q2K1 b - -',Forcing black to recapture with the knight giving me uncontested ownership of the d-file.
404,17,41,2Nxd8,b'rq1n3k/1b4pp/p3pp2/1p6/1P2P1n1/PBN1PN2/3R2PP/3Q2K1 w - -',Of course Qxd8 loses the queen for insufficient compensation.
405,17,42,2Rd3,b'rq1n3k/1b4pp/p3pp2/1p6/1P2P1n1/PBNRPN2/6PP/3Q2K1 b - -',The best way to defend e3 and still maintain all of my influence down the d-file.
406,17,43,2Qc7,b'r2n3k/1bq3pp/p3pp2/1p6/1P2P1n1/PBNRPN2/6PP/3Q2K1 w - -',Increasing the queen's scope and freeing the rook this maintains the threat on h2 if the knight on f3 moves.
407,17,44,2h3,b'r2n3k/1bq3pp/p3pp2/1p6/1P2P1n1/PBNRPN1P/6P1/3Q2K1 b - -',...and I finally can't stand it any more and I expel the knight.
408,17,45,2Nh6,b'r2n3k/1bq3pp/p3pp1n/1p6/1P2P3/PBNRPN1P/6P1/3Q2K1 w - -',Black doesn't want me to make his pawn structure suffer the same fate as mine after 24. ...Ne5 25. Nxe5 fxe5 so he retreats to h6.  Note that in some variations black can avoid a back-rank mate with Ng8 now.
409,17,46,2Rd7,b'r2n3k/1bqR2pp/p3pp1n/1p6/1P2P3/PBN1PN1P/6P1/3Q2K1 b - -',Forcing the queen to move.
410,17,47,2Qb6,b'r2n3k/1b1R2pp/pq2pp1n/1p6/1P2P3/PBN1PN1P/6P1/3Q2K1 w - -',This square keeps her as active as possible and threatens Qxe3 
411,17,48,2Qd3,b'r2n3k/1b1R2pp/pq2pp1n/1p6/1P2P3/PBNQPN1P/6P1/6K1 b - -',Parries the threat while keeping the battery on the d-file.
412,17,49,2Bc6,b'r2n3k/3R2pp/pqb1pp1n/1p6/1P2P3/PBNQPN1P/6P1/6K1 w - -',This excellent move forces white to commit to sacrificing the rook for knight and pawn at most.  So I decide to choose the path which gives me the most activity for it!
413,17,50,2Rd6,b'r2n3k/6pp/pqbRpp1n/1p6/1P2P3/PBNQPN1P/6P1/6K1 b - -',Basically forcing Nhf7 (as any other move leaves me ok) which puts me down an exchange.
414,17,51,2Nhf7,b'r2n3k/5npp/pqbRpp2/1p6/1P2P3/PBNQPN1P/6P1/6K1 w - -',...and of course he finds the proper defense.
415,17,52,2Bxe6,b'r2n3k/5npp/pqbRBp2/1p6/1P2P3/P1NQPN1P/6P1/6K1 b - -',This grabs me another pawn and after Nxd6 Qxd6 I'll have a knight and pawn for my rook plus a very threatening position.
416,17,53,2Nxd6,b'r2n3k/6pp/pqbnBp2/1p6/1P2P3/P1NQPN1P/6P1/6K1 w - -',...as expected...
417,17,54,2Qxd6,b'r2n3k/6pp/pqbQBp2/1p6/1P2P3/P1N1PN1P/6P1/6K1 b - -',And this is as planned.  Now I was hoping for Qxe3  here which looks good for black but after say 30. Kh1 Qxc3 31. Qf8 is checkmate!  So there's a lot going on in this position despite the exchange of some pieces.
418,17,55,2Nxe6,b'r6k/6pp/pqbQnp2/1p6/1P2P3/P1N1PN1P/6P1/6K1 w - -',Black chooses the safest route which is to simplify by exchanging pieces towards a won endgame.
