,gid,aid,move,fen,annotation
929,29,11,1Nxc2,b'rnbk3r/1pp2ppp/8/p3P3/2B5/5N2/PPn2PPP/RN3RK1 w - -',At first I did but in reality even though it appears so my last move was not an outright blunder.  For a while I thought my R was a goner until find my next move.
930,29,12,1Ng5,b'rnbk3r/1pp2ppp/8/p3P1N1/2B5/8/PPn2PPP/RN3RK1 b - -',"!! Like last time I nearly overlooked this which is why I thought I was going to lose the R without compensation.  But this move bails me out of trouble.  When I played this Mary said ""You have evil intentions.  You are cruel.""  So I said as per what Jack has also told me you have to find a way out."
931,29,13,1Nxa1,b'rnbk3r/1pp2ppp/8/p3P1N1/2B5/8/PP3PPP/nN3RK1 w - -',"Right after this she said ""At least I have a R in return.""  But the reality is that they wind up exchanged."
932,29,14,1Nxh8,b'rnb4N/1pp1k1pp/8/p3P3/2B5/8/PP3PPP/nN3RK1 b - -',"She said ""I've got nothing left.""  So I responded by saying you're only down a pawn.  In part that was the truth but I was also giving her the same advice that Jack gave me about not getting nervous.  That's because I'm actually implying that it's not as bad as it might appear."
933,29,15,1Be6,b'rn5N/1pp1k1pp/4b3/p3P3/2B5/8/PP3PPP/nN3RK1 w - -',So she develops.  The only problem however is that it allows me to liquidate while being up a pawn.  That's for the most part the problem.  But with just a pawn one could compensate if the opponent made mistakes.  I won't though because the idea is that you don't let your student get the advantage right back.  Instead they have to learn from their mistakes as what I learned when I first started training players.
934,29,16,1Re1,b'rn5N/1pp3pp/4k3/p3P3/8/8/PP3PPP/nN2R1K1 b - -',Now the idea is protecting my passed pawn and the way to do so is putting a R behind it.  It is passed since there are no pawns right in front or to the side of that said pawn.  And this happens to be an important since it's right in the center.
935,29,17,1Nc6,b'r6N/1pp3pp/2n1k3/p3P3/8/8/PP3PPP/nN2R1K1 w - -',She completes development put's more pressure on my passed pawn and is threatening to win piece.  So I have to make some difficult choices.
936,29,18,1Nc3,b'r6N/1pp3pp/2n1k3/p3P3/8/2N5/PP3PPP/n3R1K1 b - -',But after some careful considerations seeing what she's really up to I realize that the most important job is to prevent her from getting a free piece even if it means losing my passer.
937,29,19,1Rxh8,b'7r/1pp3pp/2n1k3/p3P3/8/2N5/PP3PPP/n3R1K1 w - -',So I take.
938,29,20,1Rxa1,b'7r/1pp3pp/2n1k3/p3P3/8/2N5/PP3PPP/R5K1 b - -',"She says ""Oh crumb"" so I said it's still an even exchange.  It's my way of implying ""Don't get nervous.""  Of course it is not even because she equalizes which is also why 15...Nc6 was a good move.  And that is the other reason I implied that."
939,29,21,1Re1,b'7r/1pp3pp/4k3/p3n3/8/2N5/PP3PPP/4R1K1 b - -',The only thing is that equalizing means that I get to pin her N.  And this pin is quite nasty as we're about to see.
940,29,22,1Rd8,b'3r4/1pp3pp/4k3/p3n3/8/2N5/PP3PPP/4R1K1 w - -',?? This is a blunder as I point out.  In it I said that best was 18...g5 to protect the N because of what I'm about to do.  The idea being is that if I then played 19.f4 we exchange the pawns but she doesn't lose a piece as is about to happen. 
941,29,23,1f4,b'3r4/1pp3pp/4k3/p3n3/5P2/2N5/PP4PP/4R1K1 b - f3',"So she said ""Yeah I see terrible.  You've got a good position.""  So I said that the idea is trying to get a better position which I learned as noted from GM Susan Polgar and applied it for this game to coach her."
942,29,24,1Kf5,b'3r4/1pp3pp/8/p3nk2/5P2/2N5/PP4PP/4R1K1 w - -',The idea was to attack my pawn in return.
943,29,25,2Rxe5+,b'3r4/1pp3pp/8/p3Rk2/5P2/2N5/PP4PP/6K1 b - -',I had a hard time deciding on whether to take my with my f pawn of R.  I decided to take this way with the idea being that once she captures my f pawn I'll liquidate by taking on a5 and that way I remain a piece up.  However better was 20.fxe5  That way it would promote once and for all and I'd win something much more valuable.  It would be a R for a pawn because my R stays behind the pawn.  So once I promote or even if I didn't once she took on the e file I'd grab her remaining R.  
944,29,26,g5,b'3r4/1pp4p/8/R5p1/5k2/2N5/PP4PP/6K1 w - g6',? I believe that the idea was to add a defender to the K.  However and I forgot to point this out.  The move played is a mistake.  21...Rd5?? is the worst as that loses the R.  And why I say that is the idea on how to protect.  Therefore best was 21...c6 to protect that pawn.  That's because the N can and will fork since she will be in check and she cannot take with 21...Rxd5?? due to my R on the same rank.  So once I check black will lose another pawn. 
945,29,27,2Nb5+,b'3r4/1p5p/3k4/RN4p1/8/8/PP4PP/6K1 b - -',"Now I run back.  The idea is once again ""Capitalizing my advantages.  I'm coming up with a plan for the endgame and it's similar to the Double Bishop and the N+B mate using those same strategies.  For those that were in the Chess Warriors team and took the test that strategy is the same which I posted in the KOH club about the endgames."
946,29,28,2Ra7,b'3r4/Rp2k2p/8/1N4p1/8/8/PP4PP/6K1 b - -',The idea here is to pin her b pawn.  No I'm not trying to win anything else yet but the idea is to put more pressure on the b file.
947,29,29,2Rd1+,b'8/Rp2k2p/8/1N4p1/8/8/PP4PP/3r2K1 w - -',Of course she gets out of it but as noted I'm coming up with endgame techniques as noted earlier with that link which are very similar to what I took in the quizzes that some know about and it's how you use some of those difficult ones for standard endgames as this is.
948,29,30,2Kf2,b'8/Rp2k2p/8/1N4p1/8/8/PP3KPP/3r4 b - -',It starts here.  So what do we need to keep in mind.  In an endgame the K is a powerful weapon.  In fact I'd say that it's about as powerful as the R.  Now in this case my goal is to try and centralize my monarch which means that I want it in the center and as close as possible to her K.  
949,29,31,2Rd2+,b'8/Rp2k2p/8/1N4p1/8/8/PP1r1KPP/8 w - -',I thought the idea was to win a pawn but that isn't so as I'd take back on b7 so it would be exchanged.  So her real aim is to simply put pressure on my monarch.
950,29,32,2Ke1,b'8/Rp2k2p/8/1N4p1/8/8/PP1r2PP/4K3 b - -',"So I get out by getting ""The Opposition"" which is also very important in an endgame as we learned about.  That's something that Jack also once emphasizes that when you have the advantage acheiving the opposition is very important.  However best was 27.Ke3 because not only do I still get the opposition but at the same time I'm centralizing my monarch much more since it's closer to her K.  With this move however it's further away which is something you generally don't want because when closer there's more pressure on the opponents K so that it has less room to maneuver."
951,29,33,2Rd7,b'8/Rp1rk2p/8/1N4p1/8/8/PP4PP/4K3 w - -',Adding a defender to her b pawn.
952,29,34,2Ra3,b'8/1p1rk2p/8/1N4p1/8/R7/PP4PP/4K3 b - -',However I decide to try and put a different pressure on her K.  In reality what I'm doing is applying the same technique to what I used against chicoboy.  And that's the only game where I had a very similar position to the N+B and K endgame against the lonely K where you figure out how to mate.  The only difference being is that I used my R and was able to beat him but I kept in mind that if his K moved the wrong way it would be mate.  And that would be very similar to the N+B mate except that you've used your R which is why I believe that in the endgame the K is as powerful as the R as they do more or less the same thing during that phase.
953,29,35,2Kd8,b'3k4/1p1r3p/8/1N4p1/8/R7/PP4PP/4K3 w - -',? I think she was worried about a check on e8 which I was also planning to do.  But as I tell her later on this was a mistake because it loses a pawn.  Therefore best was 28...h5  I now realize after looking at it that just as good was 28...h6  I forgot to tell her but had she played that and I responded now with 29.Rh3 she could protect that pawn with 29...Rh7  
954,29,36,2Rh3,b'3k4/1p1r3p/8/1N4p1/8/7R/PP4PP/4K3 b - -',"With that mistake which I tell her.  But just before that she said ""That's terrible""  So then I said just before what she should've played was that the only problem is the loss of a pawn.  Of course I know it's far worse then that as she's down a piece and a pawn but I wasn't going to tell her just how bad it was as Mary would get more nervous and therefore make more mistakes.  So the idea is don't overcoach and keep her calm.  That way her concentration is better and she doesn't make more mistakes.  And the idea is keeping things positives so that the student doesn't resign either as that's something I thought might happen as the idea is ""Fight til the end.""  By doing so you learn more. "
955,29,37,2Re7+,b'3k4/1p2r2p/8/1N4p1/8/7R/PP4PP/4K3 w - -',Although it seems odd this is what I wanted her to do as Mary will check to attack and gain a little confidence.  And even though I won't mistakes I want her to be calm and confident for learning purposes.  The idea is that by believing in yourself you can make it through a difficult time as I told reachforgoals during my first mentoring session with her.
956,29,38,3Kd2,b'3k4/1p2r2p/8/1N4p1/8/7R/PP1K2PP/8 b - -',But her last move now allows me to maintain the opposition and bring me one step closer to centralizing my K.
957,29,39,3Re5,b'3k4/1p5p/8/1N2r1p1/8/7R/PP1K2PP/8 w - -',Maintaining confidence by going after my N.
958,29,40,3Nc3,b'3k4/1p5p/8/4r1p1/8/2N4R/PP1K2PP/8 b - -',Now I almost made a blunder here and came close to playing 31.Nd6??  The problem is that Mary would compensate with a skewer after 31...Rd5 which is something I can't allow.  The idea being is that one shouldn't allow their student to compensate as you make it too easy.  Instead they have to learn from their mistakes so the only way is that you don't allow compensation and the way to do that is not make mistakes like that.
959,29,41,3Re6,b'3k4/1p5p/4r3/6p1/8/2N4R/PP1K2PP/8 w - -',"She said ""Have nothing left no good moves.""  So now I said it's not over yet.  In other words I'm implying that resignation is still premature because I believe Mary was implying resignation and the idea is what I noted that ""it's not over until it's over."""
960,29,42,3Rxh7,b'3k4/1p5R/4r3/6p1/8/2N5/PP1K2PP/8 b - -',Meanwhile I waist no time in grabbing that pawn that I noted.
961,29,43,3Rd6+,b'3k4/1p5R/3r4/6p1/8/2N5/PP1K2PP/8 w - -',"At first I thought that she was only doing this to get aggressive because of her position.  But in reality her goal was to pull a swindle and get a draw by rep.  So I must be very careful and believe it or not it almost worked.  Not to mention that I waisted time.  But the reason it didn't is because I remembered what happened in the B+N mate quiz.  And the idea is that you're supposed to be able to deliver check mate.  If you draw in any shape or form then you fail.  While most failed due to 50 move rule since there would be no captures and they couldn't check mate in 50 moves I failed because the N moved too much so the game ended in a draw by rep.  Well if I didn't play 35.Kc2 I'm pretty sure that the same thing would've happened.  And since I have a winning advantage and it's against a student so more then just ""the real deal"" allowing a draw would be terrible.  You can't just let your student off with a draw.  Instead if you're winning you must keep that advantage because if you don't the student won't learn as much.  And the idea is helping him or her learn from their mistakes in order to help them build develop and improve their games.  At least I saw what was going on in time and inhibited that chance of a draw by preventing another check."
962,29,44,Rf6,b'3k4/1p5R/5r2/6p1/8/2N5/PPK3PP/8 w - -',The idea is to be able to win a pawn with a fork.
963,29,45,3Rxb7,b'3k4/1R6/5r2/6p1/8/2N5/PPK3PP/8 b - -',And I allow it because when she takes this becomes an exchange as opposed to winning a pawn.  In addition I once again get the opposition and become one step closer to centralizing my K once I get out of check.
964,29,46,3b4,b'3k4/1R6/8/6p1/1P6/2NK4/P5rP/8 b - b3',No matter what I would've played my h pawn is gone.  But that is ok because I have two pawns that are better since they're passers.  With that being said I come up with other ideas and that's maintaining a pawn chain because as I learned not too long ago in endgames one thing that is essential is a pawn chain with passed pawns as it helps you promote.  I couldn't find the best examples and had made some mistakes as a couple of commentators in those annotations pointed.  But this game is the perfect example of what I was alluding as a similar example was shown I forgot exactly by who but it was either an IM or GM and his video was very good and instructive that I was able to apply it here.
965,29,47,3a4,b'3k4/1R6/8/6p1/PP6/2NK4/7r/8 b - a3',I also could've played 39.a3 with a pawn chain once and for all.  But the idea behind the chains is to protect one of the pawns.  But in this position I kept in mind that even if here the a pawn is just as much defended by my N.
966,29,48,3Rh3+,b'3k4/1R6/8/6p1/PP6/2NK3r/8/8 w - -',As expected.
967,29,49,4Kd4,b'3k4/1R6/8/6p1/PP1K4/2N4r/8/8 b - -',Maintaining the opposition in the process.  Now the only other way to keep my N safe was with 40.Kd2  But the reason I played this is because I'm one step closer to centralizing my K.  The idea there is that the opponents K is confined so now there is one less square that Mary has available for her K.  
968,29,50,4g4,b'3k4/1R6/8/8/PP1K2p1/2N4r/8/8 w - -',Now she has a passed pawn which I will not chance.
969,29,51,4Ke4,b'3k4/1R6/8/8/PP2K1p1/2N4r/8/8 b - -',So while I did mention centralizing your K that wasn't the idea here and forget the opposition.  With any other move it's likely that black would get her advantage and possibly win this game.  How do I know this?  A very similar position happened with amnita and it was just like this except that I did not have a pawn chains and the R's were not present.  But I just kept advancing pawns and by doing so she was able to promote.  Consequently not only did I lose my advantage but she got the edge and was able to pull a swindle because Amnita won what was a hopelessly lost game as some know about from that annotation.  Well I couldn't allow that.  And knowing that her pawn was closer to the promotion square then my pawns I just couldn't chance this one.
970,29,52,4g3,b'3k4/1R6/8/8/PP2K3/2N3pr/8/8 w - -',And she attempts to promote.
971,29,53,4Kf3,b'3k4/1R6/8/8/PP6/2N2Kpr/8/8 b - -',But I now stop it cold.  And she dare not discover check me with 42...g2+ as I'd win that remaining pawn with 43.Kxg2
972,29,54,4Kc8,b'2k5/1R6/8/8/PP6/2N2Kpr/8/8 w - -',To put pressure on my R.
973,29,55,4Rg7,b'2k5/6R1/8/8/PP6/2N2Kpr/8/8 b - -',But no matter how you look at it this is what I would've played regardless as now black must lose her pawn no matter what she plays.
974,29,56,Rh4,b'3k4/8/8/8/PP5r/2N2KR1/8/8 w - -',"She said ""I have no pawns left.""  So I said yes and I knew how dangerous the passed pawn was and couldn't underestimate.  The idea being of course what Jack said which I also said in that annotation with my mistake against anitam.  That is ""When you think that you have won or are in a winning position be very careful and do not underestimate your opponent.  Otherwise you might start making mistakes and losing the game.""  This especially applies here since as noted I was her trainer here and therefore could not allow Mary to get her advantage back for learning purposes.  That's also because as easy19 puts it ""Games that you win are bad for learning purposes.""  Now what he's alluding to is the person that's being trained and I strongly with his assessment for the reasons outlined earlier in part because this is what Jack has implied.  And that's why when I'm with him he'd rather play with me then have me play with Mary.  That way I also learn."
975,29,57,4b5,b'3k4/8/8/1P6/P6r/2N2KR1/8/8 b - -',Now I get achieve that pawn chain.  And part of it is that you advance one pawn at a time so that they're directly diagonal from each as they are here.  This way the opponent can't stop both passed pawns.  And usually as is with this position none of the passers are stoppable.  There will be rare occasions where you'd be able to stop one but can't do so for the other which is actually the idea behind it but usually none can be stopped which is even better.
976,29,58,4Rh5,b'3k4/8/8/1P5r/P7/2N2KR1/8/8 w - -',The idea which has occasionally worked is to stop one of the passed pawns.  However the N does and will prevent her from being able to do so. 
977,29,59,4Rg8+,b'3k2R1/8/8/1P5r/P7/2N2K2/8/8 b - -',I could've played 46.a5 but she might be able to refute this with 46...Ra7 and even if 47.a6 she can now play 47...Ra8 preventing those pawns from promoting.  Well I wasn't going to allow that so now the idea is forcing the K onto the 7th rank and that way things stay the same.  Except that I will be able to promote a pawn. 
978,29,60,4a5,b'6R1/4k3/8/PP5r/8/2N2K2/8/8 b - -',Having said that I now continue the advancement.
979,29,61,4Rh3+,b'6R1/4k3/8/PP6/8/2N2K1r/8/8 w - -',Now she checks just for thrills and giggles.  The idea being to maintain confidence and for as long as possible in this situation.  This makes me impressed that Mary followed my advice by remaining calm in the worst of situations.  And it also shows that she is improving her games.
980,29,62,4Rg3,b'8/4k3/8/PP6/8/2N2KRr/8/8 b - -',However instead of moving back I will prevent any more checks as that cost white time and the idea as I learned in the Double Bishop Mate as noted much earlier where I waisted time is that when you have a winning advantage you don't want to waist tempo.  Instead you want to get the job done.  Plus if I got out with my K she could continue checking me.  And if this happened the game could eventually end in a draw by rep.  Well as noted with a student I won't make a mistake that will allow him or her draw in a won position as the idea is helping the student learn from the mistakes. 
981,29,63,4Rh8,b'7r/4k3/8/PP6/8/2N2KR1/8/8 w - -',"She said ""Darn"" and I understand why.  This time I forgot what I said and it is worth noting that I only made two mistakes in the notation.  However I when it comes to remembering what I said I have a near pictogram memory.  That means that I can remember exactly what is said real said but not right after being said which would be pictogram but once it gets stored from working into long term memory which is a general weakness.  Once I remember however I won't forget and I remembered one of them very quickly.  This one however I didn't.   But what I think I said was something like don't give up hope yet.  Of course the idea being is that if I was to make a mistake there's still a chance that she'd be able to compensate.  So I still did not her to resign yet because she wouldn't learn as much.  And I'm not at all surprised with this move because with just a R there's no way that she would allow me to liquidate as noted since that would leave Mary with just her K.  I anticipated that as well which is another reason for playing with the idea being that now I gain time promote.  And at the very least that kind of thing will happen.   "
982,29,64,4b6,b'7r/4k3/1P6/P7/8/2N2KR1/8/8 b - -',So I continue advancing and maintain my pawn chain.
983,29,65,4Rf8+,b'5r2/4k3/1P6/P7/8/2N2KR1/8/8 w - -',And Mary does follow my earlier advice with this move as she's doing what she can to stay in.  This will help for a move or two.  Worth noting is that when I was in this situation got nervous and followed Jack's advice which I gave I'd do so by placing my opponent in check as I do so.
984,29,66,5Ke4,b'5r2/4k3/1P6/P7/4K3/2N3R1/8/8 b - -',But getting out means that I prevent another check and therefore prevent further loss of tempo by once again maintaining the opposition.  And this is another reason that the opposition is essential during the endgame.
985,29,67,5Ra8,b'r7/4k3/1P6/P7/4K3/2N3R1/8/8 w - -',Doing whatever she can to stay in and aiming for my a5 pawn.  If Mary finds the right move she'll be to capture it and therefore stop one of my passers.
986,29,68,5b7,b'r7/1P2k3/8/P7/4K3/2N3R1/8/8 b - -',Keeping that in mind however instead of continuing like a normally would with 51.a6 with the idea being of course the pawn chain I play this.  The reason is that even if she takes I promote instantly.  And if black defends with 51...Rb8 I will play then continue that pawn chain with the immediate 52.a6 so that no matter what she does one pawn will promote.  And that variation that I provided with 51...Rb8 52.a6 is the main reason why a pawn chain is vital.  The idea being is that it will generally enable one to Q.
987,29,69,5Kd7,b'r7/1P1k4/8/P7/4K3/2N3R1/8/8 w - -',"?? As I told her this is an outright blunder.  Best was 51...Rxa5 getting a pawn in return.  But what I forgot to say was what someone once told me which was ""Almost any move was better then this.""  The reason being is because of what I'm about to play.  Now Mary took a quick break but right after coming back she forgot that I had played 51.b7  However even for me the position is resignable. "
988,29,70,5bxa8=Q,b'Q7/3k4/8/P7/4K3/2N3R1/8/8 b - -',"At this point seeing that black is only left the K as opposed to what I have she resigned.  This time as I agree because of what I said a move earlier that at this point resignation is no longer premature.  I would feel differently if I only had a Q+K in this position with her lonely K as then there would be a chance for Mary to get a draw.  That's because if I played things wrong the game would end in a stalemate.  But with this much material from white there's no way that it could happen because no matter how you look at it sooner or later a checkmate becomes inevitable.  In the end I told Mary that she played extremely well in this game.  And this is where Mary implied that I was a very good trainer by thanking me for taking the time coach her with a smile. And I agree with Jack in the fact that she's really improving as I've noticed this myself.  She only made two or three mistakes as I told her though in reality I miscounted one but that was enough to lose the game.  So the morals of this game are first ""don't give things away"" as Jack puts it because doing so could mean disaster as things go downhill after as I also remember from my game against elyhim where I blundered a pawn and lost.  And as Dan Hesiman puts it ""It only takes one bad move to lose a game. So be careful on every move.""  That applies here because after Mary blundered her N not too long after things went downhill.  In addition I learned something which I also mentioned earlier.  In chess and life there are sudden changes.  And when this happens you have to pretend that it didn't happen and things are normal.  By doing so you play as you normally and therefore don't overlook or calculate anything.  With this being I thank Jack Stockel for being the coach that he is setting a good example for others and bringing in the chess boards regardless.  That is because without it this game would not have been possible."
989,30,0,Qe7,b'r3k2r/1pp1qpp1/p1nbbn1p/3pp3/6PP/1PN1PP1N/PBPPQ3/2KR1B1R w kq -',Menacing a bayonnet attack and enabling black to castle both sides.
990,30,1,1g5,b'r3k2r/1pp1qpp1/p1nbbn1p/3pp1P1/7P/1PN1PP1N/PBPPQ3/2KR1B1R b kq -',Good attack probably a bit to hearly (11.Rg1 would have prepared it)
991,30,2,1Bg2,b'r3k2r/1ppnqpp1/p1nbb2p/3pp1P1/7P/1PN1PP1N/PBPPQ1B1/2KR3R b kq -',Mistake. It menaces a further e4 but doesn't prevent black's counterattack on g5
992,30,3,1O-O-O,b'2kr3r/1ppnqpp1/p1nbb2p/3pp1P1/7P/1PN1PP1N/PBPPQ1B1/2KR3R w - -',Black castle on his strong side.
993,30,4,1Nf2,b'2kr3r/1ppnqpp1/p1nbb2p/3pp1P1/7P/1PN1PP2/PBPPQNB1/2KR3R b - -',Black has now as this is the case in this kind of openning (hypermodern chess if I'm correct) a far better control on the center and white an advance on one side. but this is a blunder which will cost white's 1 pawn and this advance.
994,30,5,1h5,b'2kr3r/1ppnqpp1/p1nbb3/3pp1pP/8/1PN1PP2/PBPPQNB1/2KR3R b - -',Mistake white should have taken the pawn. Now black will have it for free.
995,30,6,gxh6,b'2kr3r/1pp1qp2/p1nbbn1p/3pp1p1/8/1PN1PP2/PBPPQNB1/2KR3R w - -',Now white's advance on the kingside is broken. The no mans land between the 2 armies is on white side of the board : black controls more space. The next assault is about to begin.
996,30,7,1d4,b'2kr3r/1pp1qp2/p1nbbn1p/3pp1p1/3P4/1PN1PP2/PBP1QNB1/2KR3R b - d3',White carrieson attacking not such a bad idea because he doesn 't have to let the initiative to black who has material advantage and several attacking options with the centralised bishops and knights (right or left side and center)
997,30,8,1exd4,b'2kr3r/1pp1qp2/p1nbbn1p/3p2p1/3P4/1PN2P2/PBP1QNB1/2KR3R b - -',Now the next black's plan is to take control of the e file.
998,30,9,1Bf4+,b'2kr3r/1pp1qp2/p1n1bn1p/3p2p1/3P1b2/1PN2P2/PBP1QNB1/2KR3R w - -',I doubt it's such a good move for 18. Nd3 could be efficient against it.
999,30,10,1Kb1,b'2kr3r/1pp1qp2/p1n1bn1p/3p2p1/3P1b2/1PN2P2/PBP1QNB1/1K1R3R b - -',Forced if white doesn't want to lose material
1000,30,11,1Na4,b'2k1r2r/1pp1qp2/p1n1bn1p/3p2p1/N2P1b2/1P3P2/PBP1QNB1/1K1R3R b - -',weak moves. It enables the DSB to protect d4 which is exposed but which black can harly attack... but it doesn't prevent black's plan. Nd3 would have been better to menace the dangerous black DSB.
1001,30,12,1Bf5,b'2k1r2r/1pp1qp2/p1n2n1p/3p1bp1/N2P1b2/1P3P2/PBP1QNB1/1K1R3R w - -',... At this point I hesitated because Qb4?! or Qd6 might have been better.
