,gid,aid,move,fen,annotation
258,7,6,Qa5+,b'rn2kbnr/pp3ppp/3p4/q3P3/4P3/5P2/PP3P1P/RNBQKB1R w KQkq -',Black wants to save his opportunity for castle but that just leads to development for me. 
259,7,7,Bc3,b'rn2kbnr/pp3ppp/3p4/4q3/4P3/2B2P2/PP3P1P/RN1QKB1R b KQkq -',A key move. Places my bishop on a big diagonal while saving my b2 pawn. 
260,7,8,1Rg1,b'rn2kbnr/pp3ppp/3p4/2q5/4P3/2B2P2/PP3P1P/RN1QKBR1 b Qkq -',By attacking on g7 I aim to fix black's pieces and interfere their development. F6 just leads to even slower development so there is only one move left. 
261,7,9,1Nf6,b'rn2kb1r/pp3ppp/3p1n2/2q5/4P3/2B2P2/PP3P1P/RN1QKBR1 w Qkq -',Notice how black couldn't develop his bishop on e7 or after g6 on g7 cause I would take either on g7 or f6. 
262,7,10,1Rc1,b'r3kb1r/pp3ppp/2np1n2/2q5/4P3/2B2P2/PP1N1P1P/2RQKBR1 b kq -',I treat Bxf6 with tempo. 
263,7,11,Qc7,b'r3kb1r/ppq2ppp/2np1n2/8/2N1P3/2B2P2/PP3P1P/2RQKBR1 w kq -',Black is underdeveloped while my pieces are quite positioned. I hadn't decided where to place my f1 bishop. Then it came to my mind that my rook stands good against my opponents queen. I decided to try to open the c file and see what happens. 
264,7,12,O-O-O,b'2kr1b1r/ppq2ppp/2np1n2/8/1PN1P3/2B2P2/P4P1P/2RQKBR1 w - -',Well it wasn't clear how castle king-side would happen so that seems to be the thing. However I think that 14.. a6 needed more attention. Maybe 15. a4 b5 16. Na5
265,7,13,1Bh3+,b'2kr1b1r/ppq2ppp/2np1n2/8/1PN1P3/2B2P1B/P4P1P/2RQK1R1 b - -',Developed with tempo and on a big diagonal. Also now all my pieces except my g1 rook are turned to the queenside. 
266,7,14,1b5,b'1k1r1b1r/ppq2ppp/2np1n2/1P6/2N1P3/2B2P1B/P4P1P/2RQK1R1 b - -',Continuing my plan. 
267,7,15,1d5,b'1k1r1b1r/ppq2ppp/2n2n2/1P1p4/2N1P3/2B2P1B/P4P1P/2RQK1R1 w - -',Surprise! Still it isn't clear if that would lead to developing the f8 bishop. Usually opening the center is bad when underdeveloped. But a precise game is needed to opose that move. 
268,7,16,dxc4,b'1k1r1b1r/ppq2ppp/2P2n2/8/2p1P3/2B2P1B/P4P1P/2RQK1R1 w - -',Now it seems that I should move my queen and lose the c6 pawn. But thats the cost for a good queen-side attack. 
269,7,17,1Qa4,b'1k1r1b1r/ppq2ppp/2P2n2/8/Q1p1P3/2B2P1B/P4P1P/2R1K1R1 b - -',"Now if 18... bxc6 19. Ba5 
So the move seems to be 18... Qxc6 with unclear game. "
270,7,18,1Qxh2,b'1k1r1b1r/pp3ppp/2P2n2/8/Q1p1P3/2B2P1B/P4P1q/2R1K1R1 w - -',But that forces the ending. Eating pawns when under attack might be bad for your health. 
271,7,19,Qc7,b'1k1r1b1r/ppq2ppp/2P2n2/1Q6/2p1P3/2B2P1B/P4P2/2R1K1R1 w - -',"If 19... b6 20. Be5+ and black loses his queen. 
If 19... Qxg1+ 20. Ke2 and the mate is hardly evadable. Even if so the blacks queen is dead. "
272,7,20,Bd6,b'1k1r3r/ppq2ppp/2Pb1n2/1Q2B3/2p1P3/5P1B/P4P2/2R1K1R1 w - -',Only move. 
273,7,21,2Rxc4,b'1k1r3r/ppq2ppp/2Pb1n2/1Q2B3/2R1P3/5P1B/P4P2/4K1R1 b - -',"The pawn is returned but there is something more. 
If 21... b6 22. Bxd6 Rxd6 (22... Qxd6 23. c7+) 23. e5 "
274,7,22,2Bxe5,b'1k1r3r/ppq2ppp/2P2n2/1Q2b3/2R1P3/5P1B/P4P2/4K1R1 w - -',It's all calculated. 
275,7,23,2cxb7,b'1k1r3r/pPq2ppp/5n2/1Q2b3/2R1P3/5P1B/P4P2/4K1R1 b - -',After black move his queen there will be Rc8+ and promoting with double check. The rest is just dying. 
276,7,24,2Kxg1,b'1k5r/pPq2ppp/5n2/1Q6/2R1P3/2b2P1B/P4P2/6K1 b - -',Black resigned. 
277,8,0,Ng5,b'r1bqk2r/pppp2pp/2n2n2/2b1pPN1/2B5/2N5/PPPP1PPP/R1BQK2R b KQkq -',Here white is prepared to launch an attack on the Kingside with his Queen two minor pieces and his f pawn.  I'll try to fight him off...this is going to be messy...
278,8,1,fxg6,b'r1bqk2r/ppp4p/2n3P1/2bnp1NQ/2B5/8/PPPP1PPP/R1B1K2R b KQkq -',How in the world do I defend against this? His pawn to g7 will win my Rook and the pawn will promote.  
279,8,2,Bxf2+,b'r1bqk2r/ppp4p/2n3P1/3np1NQ/2B5/8/PPPP1bPP/R1B1K2R w KQkq -',Sometimes the best defense is a good offense...
280,8,3,1Kg1,b'r1b1k2r/ppp4p/2n2qP1/3np1NQ/2B5/8/PPPP2PP/R1B3KR b kq -',Gotta move my King...I'm losing serious material here...
281,8,4,1Bxd5,b'r1b4r/ppp1k1qN/2n3P1/3Bp2Q/8/8/PPPP2PP/R1B3KR b - -',Yep...serious material and my King is open..forward!
282,8,5,Kd6,b'r1b4r/ppp3qN/3k2P1/3Bp1Q1/3n4/8/PPPP2PP/R1B3KR w - -',A Queen trade on f6 would probably would have won him the game...
283,8,6,1Bf3,b'r1b4r/ppp3qN/3k2P1/4p1Q1/3n4/5B2/PPPP2PP/R1B3KR b - -',???  Bishop to g7 would have been much better for White...
284,8,7,1Rxh7,b'r1b5/ppp3qr/3k2P1/4p1Q1/3n4/5B2/PPPP2PP/R1B3KR w - -',Losing more material...
285,8,8,Nxf3+,b'r1b4Q/ppp5/3k4/4p1q1/8/5n2/PPPP2PP/R1B3KR w - -',But getting some back...White's g pawn is pinned.
286,8,9,Kc6,b'r1b2Q2/ppp5/2k5/4p1q1/8/8/PPPn1KPP/R1B4R w - -',He's out of checks...
287,8,10,2Bxd2,b'r1b2Q2/ppp5/2k5/4p1q1/8/8/PPPB1KPP/R6R b - -',?? He should have retreated his Queen to defend.  My plan now is to force his King to a white square...then I can check him with the Bishop and attack his Queen at the same time with Rook...AKA discovered check....
288,8,11,2Kg3,b'r1b2Q2/ppp5/2k5/4p3/8/6K1/PPPq2PP/R6R b - -',I have to keep checking him so that his Queen has no opportunity to defend...eg. If I play Queen to e3 check he can block with his Queen...must avoid!
289,8,12,Qd4+,b'r1b2Q2/ppp5/2k5/4p3/3q4/6P1/PPP2K1P/R6R w - -',I got him!
290,8,13,Qe3+,b'r1b2Q2/ppp5/2k5/4p3/8/4q1P1/PPP4P/R3K2R w - -',King to f1 allows mate...King to d1 is not any better really...hello white square!
291,8,14,Bg4+,b'r4Q2/ppp5/2k5/4p3/6b1/4q1P1/PPP4P/R2K3R w - -',Destruction...
292,8,15,2Qf3+,b'r7/ppp5/2k5/4p3/6b1/4qQP1/PPP4P/R2K3R b - -',The only way out of check...
293,8,16,2Bxf3#,b'r7/ppp5/2k5/4p3/8/4qbP1/PPP4P/R2K3R w - -',
294,9,0,c4,b'rnbqkbnr/pppppppp/8/8/2P5/8/PP1PPPPP/RNBQKBNR b KQkq c3',English opening 
295,9,1,d4,b'r1bq1rk1/1p1pbppp/p1n2n2/2p1p3/2PPP3/P1N2N2/1P2BPPP/R1BQ1RK1 b - d3',All even to here and then I push d pawn
296,9,2,1Nd5,b'r1bq1rk1/1p1pbppp/p1n2n2/3Np3/2PpP3/P4N2/1P2BPPP/R1BQ1RK1 b - -',Following the capture of my d4 pawn I move my c knight to d5 
297,9,3,1Bd2,b'r1bq1rk1/1p1pbppp/p1n5/3np3/2PpP3/P4N2/1P1BBPPP/R2Q1RK1 b - -',As usual instead of retaking the knight following my knight's capture I move my bishop to d2.  Aaargh I infuriate myself. 
298,9,4,hxg5,b'r1bq1rk1/1p1pbpp1/p1n2n2/4p1p1/2PpP3/P4B2/1P1B1PPP/R2Q1RK1 w - -',Same again I move my knight over to g5 and ignore the threat to my knight by pawn at h6 and move LB to f3 !!!??
299,9,5,bxc4,b'r1bq1rk1/3pbppn/p1n5/4p3/2ppP3/P4B2/1P1B1PPP/2RQ1RK1 w - -',I now see a threat to my pawn at c4 and move my rook across to c1 in time to capture pawn taking my pawn
300,9,6,Nf6,b'r4rk1/1bqpbpp1/p1n2n2/4p3/Q1RpP3/P7/1P1B1PPP/3B1RK1 w - -',Black is preparing his forces on the queen side following my rook's move up to c4 and I follow suit.
301,9,7,2f4,b'r2qnrk1/1b1pbpp1/p1n5/4p1B1/2RpPP2/P2Q4/1P4PP/3B1RK1 b - f3',I now decide to pursue a king side attack as I had intended. Protecting my pieces before battle commences.
302,9,8,2Qxf3,b'r2qn1k1/1b1pb1p1/p1n5/4p1P1/2RpP3/P4Q2/1P4PP/3B2K1 b - -',I have a reduced force but lots of space to attack on king side 
303,9,9,2Bb3+,b'2rq2k1/1b1pb1p1/p1nn4/2R1p1P1/3pP3/PB3Q2/1P4PP/6K1 b - -',I now bring my LB up to check the king at b3.  White queen is in support at f3
304,9,10,3Qh3#,b'2rq4/1b1pbBpk/p1n5/2R1p1P1/3pP3/P6Q/1P4PP/6K1 b - -',White's LB takes knight at f7 and king moves out of check to h7 and queen moves across to checkmate at h3
305,10,0,e4,b'rnbqkbnr/pppppppp/8/8/4P3/8/PPPP1PPP/RNBQKBNR b KQkq e3',So I start with my usual.
306,10,1,e5,b'rnbqkbnr/pppp1ppp/8/4p3/4P3/8/PPPP1PPP/RNBQKBNR w KQkq e6',Like many players Reuben likes the KPG.  And as you might guess yes this will become the Ruy Lopez.
307,10,2,a6,b'r1bqkbnr/1ppp1ppp/p1n5/1B2p3/4P3/5N2/PPPP1PPP/RNBQK2R w KQkq -',The most common response.  So I answer with the main retreat square on a4.  Obviously I won't take his Nc6 although it did come into consideration.  The reason I don't is because tactical-abyss has said that in the Ruy Lopez doubled pawns are of no asset since the major pieces haven't been exchanged.  Plus a B is worth more then a N here so I really need my LSB.
308,10,3,d6,b'r1bqkbnr/1pp2ppp/p1np4/4p3/B3P3/5N2/PPPP1PPP/RNBQK2R w KQkq -',I anticipated 4...b4 in which I would've answered with 5.Bb3  This move however is understandable as Reuben is getting one step closer to controlling the center by advancing the other center pawn so that he can bring his Bc8 into play.  In this case it's a little nasty because it will mean pinning my Nf3.  But before he can do this I will castle which is generally something that I like to do anyhow.
309,10,4,Nc3,b'r2qkbnr/1pp2ppp/p1np4/4p3/B3P1b1/2N2N2/PPPP1PPP/R1BQ1RK1 b kq -',The pin is of no immediate concern for if 6...Bxf3 I'll take back with my Q.  In doing so I think my position would be a little stronger which is why Reuben doesn't take here.
310,10,5,Nf6,b'r2qkb1r/1pp2ppp/p1np1n2/4p3/B3P1b1/2N2N2/PPPP1PPP/R1BQ1RK1 w kq -',Instead he continues developing.
311,10,6,d3,b'r2qkb1r/1pp2ppp/p1np1n2/4p3/B3P1b1/2NP1N2/PPP2PPP/R1BQ1RK1 b kq -',And I'm preparing to complete development because the plan is to bring my Bc1 into play.  I also looked at the possibility of 7.d4 with the idea being 7...exd4 8.Nxd4 Nxd4 9.Qxd4 with a better looking position.  But I almost overlooked one thing.  The plan would not have worked because instead of 7...exd4 black could play 7...b5 and after 8.Bb3 I'd lose a piece for a pawn after 8...exd4 9.Nxd4 Nxd4 10.Qxd4 c5 as now my Q must retreat which would allow 11...c4  I remember due to a Homework assignment from stalhandske (during a consultation game) where I suggested a move that would've been a blunder for the same reason.  Then I made a similar blunder in another game so I wasn't going to allow history to repeat itself.  The real idea is learning from your mistakes.  But with this move I'm still preparing to complete my development and in the process I get a pawn chain (which is very useful). 
312,10,7,d5,b'r2qkb1r/1pp2ppp/p1n2n2/3pp3/B3P1b1/2NP1N2/PPP2PPP/R1BQ1RK1 w kq -',I guess that Reuben wants to exchange.  And I'll accept.  What's important to note is that I did consider 8.Nxd5 but this would cost me a pawn after 8...Nxd5 9.exd5 Qxd5  Well what's important is not to give things away even a pawn unless you have a good reason for doing so.  A perfect example was my most recent loss against Jack Stockel by making a mistake that lost a pawn in the long run.
313,10,8,h3,b'r2qkb1r/1pp2ppp/p1n5/3np3/B5b1/2NP1N1P/PPP2PP1/R1BQ1RK1 b kq -',But now I go after his LSB.  I thought that I'd get tempo here but it doesn't work that way.
314,10,9,Nxc3,b'r2qkb1r/1pp2ppp/p1n5/4p3/B5b1/2nP1N1P/PPP2PP1/R1BQ1RK1 w kq -',That's because Reuben decides to give me that.  But since my Nf3 is pinned I won't take his LSB yet.  Instead I will force a variety of exchanges by capturing on c6.
315,10,10,h5,b'r2qkb1r/2p2pp1/p1p5/4p2p/6b1/2PP1N1P/P1P2PP1/R1BQ1RK1 w kq h6',Trying to get an open h file.  I figured it out because I considered capturing his LSB at once.  But then as usual I asked myself why Reuben gave it away and if he blundered or not.  I did a ton of Homework involving both visualization and analyze the board.  By studying this I figured out that this was not a blunder after all.  The idea being is that I'd lost a pawn or get mated.  The idea being is that 12.hxg3 12...hxg3 now he has a threat against me one way or another.  If I move my Nf3 he can immediately play 13...Qh5 which would guarantee a mate in one with 14...Qh2# or 14...Qh1#  And if I give up my N and respond with 14.Qxf3 or 14.gxf3 he'll answer with 14...Qh3 resulting in the same thing since my Nf3 is no longer around.  I remember from previous mistakes but espeically from a loss against my OTB coach as well as the most recent mistake against Dave.  With Jack he gave away a pawn with how much more offenders he had.  So when I got greedy he was able to trap and win my Q.  Same story with Dave but it gets worse.  I took a pawn and with a discovered check he was able to get my Q.  Later on he my K was exposed and I couldn't castle due to a discovered check by castling Q side.  Later on I realized what my position was like and that he likely had a mating sequence forcing me to resign in less then 15 moves.  Knowing that since Jack accurately said that I didn't take enough time to study this time I was really going to do my Homework.
316,10,11,1Bb2,b'r2qkb1r/2p2pp1/p1p5/4p2p/6b1/2PP1N1P/PBP2PP1/R2Q1RK1 b kq -',So I complete my development.
317,10,12,1Rb8,b'1r1qkb1r/2p2pp1/p1p5/4p2p/6b1/2PP1N1P/PBP2PP1/R2Q1RK1 w k -',Hitting my B.
318,10,13,1Bc1,b'1r1qkb1r/2p2pp1/p1p5/4p2p/6b1/2PP1N1P/P1P2PP1/R1BQ1RK1 b k -',So I protect.  13.Ba3 also came into consideration but it wouldn't work due to his Bf8.
319,10,14,1Bc5,b'1r1qk2r/2p2pp1/p1p5/2b1p2p/6b1/2PP1N1P/P1P2PP1/R1BQ1RK1 w k -',Likewise Reuben completes his development.
320,10,15,1Re1,b'1r1qk2r/2p2pp1/p1p5/2b1p2p/6b1/2PP1N1P/P1P2PP1/R1BQR1K1 b k -',So I hit his e pawn.  But the main reason behind this move wasn't to attack but rather centralize one of my R's.  The idea being is that attacking the center is a way of controlling.  The way to do this is by centralizing a Rook as I learned in a recent annotation.
321,10,16,1Bd6,b'1r1qk2r/2p2pp1/p1pb4/4p2p/6b1/2PP1N1P/P1P2PP1/R1BQR1K1 w k -',And he protects.
322,10,17,1d4,b'1r1qk2r/2p2pp1/p1pb4/4p2p/3P2b1/2P2N1P/P1P2PP1/R1BQR1K1 b k -',In this position the loss of a piece is no longer a concern so I go for it at once by pushing d3-d4  One of the reasons being is that despite doubled pawns I have a solid pawn chain.  
323,10,18,1Qe7,b'1r2k2r/2p1qpp1/p1pb4/4p2p/3P2b1/2P2N1P/P1P2PP1/R1BQR1K1 w k -',"Adding an extra defender to his e5.  The only problem is that it leaves Reuben vulnerable to a pin.  For those that are wondering I won't use analyze the board as much.  In fact it temporarily stop soon but this will be substituted for visualization which is how I also find the right moves.  And as you might have guessed visualizing this outside (AFK) is an equivalent to playing blindfolded chess.  For those that are wondering I learned how to do this from GM Susan Polgar in her video ""My Genius Brain.""  It shows how she does this which is by picturing chess positions in her brain.  In fact she defeated an opponent who challenged her from visualization.  The only difference is that she can picture hundreds of positions whereas the max I can do is 5 or 6.  But this is the main way that I have surpassed a 1300 rating."
324,10,19,1Bf4,b'1r2k2r/2p1qpp1/p1pb4/4p2p/3P1Bb1/2P2N1P/P1P2PP1/R2QR1K1 b k -',With that being said I go right after his Q.  Yes I do keep in mind that he would not dare play 16...exf4?? since I'd take his Queen immediately.  
325,10,20,1f6,b'1r2k2r/2p1q1p1/p1pb1p2/4p2p/3P1Bb1/2P2N1P/P1P2PP1/R2QR1K1 w k -',! Best.  To think long term and protect the Q though I anticipated 16...g5 in which case I'd respond with 17.Bxe5 after which I'd win a R with a discovered check.  17...Qd7 18.Bxh8+  This move protects that.  But given that his f file is blocked (as now he can't play ...Qh4 (even if my Nf3 weren't around) I can win a piece at once.  BTW right after my next move I stop the analyze the board at once and switch to visualization as noted earlier.
326,10,21,hxg4,b'1r2k2r/2p1q1p1/p1pb1p2/4p3/3P1Bp1/2P2N2/P1P2PP1/R2QR1K1 w k -',As expected he takes back.
327,10,22,1dxe5,b'1r2k2r/2p1q1p1/p1pb1p2/4P3/5Bp1/2P2N2/P1P2PP1/R2QR1K1 b k -',Interested in how he'll respond I answer with this move.
328,10,23,1gxf3,b'1r2k2r/2p1q1p1/p1pb1p2/4P3/5B2/2P2p2/P1P2PP1/R2QR1K1 w k -',?? I figured that Reuben would capture here.  But this is a super blunder because not only will I take his DSB but in the process I will at the very least win his Q for a R.  It's important to note that in addition to visulization I also used memory techniques.  It happened years ago but after making a mistake in a training game with ubermensch43 I made a grave mistake.  In doing so he was able to get the same pin which likewise won the Q for a R.  After which I resigned and I did annotate that game as it happened before reaching my lowest rating.  Although that training wasn't a good experience the idea was and is applying what I've learned and using my towards my game as I did here.  With that being said the only move that would've prevented black from losing his Q was 18...Qd8 in which case I'd play 19.Nd4 (leaving him a minor piece down.)  Still bad but it's better then losing the Q.  But best was 18...Qf8! (preventing ruinous loss of material.  He would be down two pawns but not more.)  19.exd6 gxf3 20.dxc7 Rc8 21.Qxf3 or 21.gxf3
329,10,24,fxg2,b'1r2k2r/2p1q1p1/p1pP1p2/8/5B2/2P5/P1P2Pp1/R2QR1K1 w k -',?? But with this capture memory techniques are obsolete.  Best was 19...Qxe1+ 20.Qxe1+ and he would've had a R.  But with this move I have a free Q as he'll be placed in check when with my next move.  Not only that but I will grab his g2 winning another pawn.
330,10,25,g5,b'1r3k1r/2p1R3/p1pP1p2/6p1/5B2/2P5/P1P2PK1/R2Q4 w - g6',?? Ok this is where I start going back to analyze the board.  This looks good as it appears to gain tempo.  And normally I would pull back but I looked at two scenarios.  I realized that most likely he wanted my B.  So I am willing to sac that for a pawn.  If he grabs it I have a mate.  It's important to note that I remembered what I learned from GM Damios Lemos about positional sacs.  This is where you sacrifice a piece for mate or something similar that forces a win.  Preventing mate will mean the loss of a pawn.
331,10,26,2Bxg5,b'1r3k1r/2p1R3/p1pP1p2/6B1/8/2P5/P1P2PK1/R2Q4 b - -',With that being said I take.  I also looked at other lines such as black taking on d6.  But if 22...cxd6?? 23.Qxd6 and I'd still mate.  If he played for example 23...fxg5 24.Qf3+ Kg8 (forced) 25.Qf7# or 25.Qg7# are both mate.  That same thing would happen if black were to retreat his Rb8 on his 23rd move.  And if 23...Kg8 24.Qb8# is also mate.  Therefore black's only option is 22...Kg8 which prevents mate.  But I would Queen and Reuben would in addition lose a R in the process.  23.d7 Rd8 24.Re8+ Kg7 25.Rxh8 Kxh8 26.Qh5+ Kg7 27.Qe8 Rxe8 28.dxe8=Q.  
332,10,27,2fxg5,b'1r3k1r/2p1R3/p1pP4/6p1/8/2P5/P1P2PK1/R2Q4 w - -',?? However this was the first thing I looked at.  And by playing this he made the same mistake that I mentioned when looking at 12.hxg4 because I will mate at once.  As noted above as bad as it looks 22...Kg8 was needed.
333,10,28,2Qf7#,b'1r4kr/2p1RQ2/p1pP4/6p1/8/2P5/P1P2PK1/R7 b - -',"One lesson to be learned is to evaluate carefully before deciding to take anything.  Asking yourself why your opponent gave it away is important.  If you just decide to grab without analyzing it can mean disaster we saw this on both sides.  But the main moral is based on what shamash said.  ""It's not about how much you learn but applying what you've learned and using them towards your game.""  By remembering this moral I was able to plan the variations that led to that nasty pin which won black's Queen.  And I remembered about the positional sacs which I used to deliver this mate."
334,11,0,e4,b'rnbqkbnr/pppppppp/8/8/4P3/8/PPPP1PPP/RNBQKBNR b KQkq e3',By mistake I played this. Mistake for my standards... :)
335,11,1,e6,b'rnbqkbnr/pppp1ppp/4p3/8/4P3/8/PPPP1PPP/RNBQKBNR w KQkq -',French! I'm scared about it because it has so much theory behind...
336,11,2,Nf3,b'rnbqkbnr/pp3ppp/4p3/2ppP3/3P4/5N2/PPP2PPP/RNBQKB1R b KQkq -',I think Ne2 is the modern move.
337,11,3,c3,b'r1bqkbnr/pp3ppp/2n1p3/2ppP3/3P4/2P2N2/PP3PPP/RNBQKB1R b KQkq -',...anyway the usual attack/defence...
338,11,4,Bd7,b'r2qkbnr/pp1b1ppp/2n1p3/2ppP3/3P4/2P2N2/PP3PPP/RNBQKB1R w KQkq -',Passive but how can it be bad?
339,11,5,Be3,b'r2qkbnr/pp1b1ppp/2n1p3/2ppP3/3P4/2P1BN2/PP3PPP/RN1QKB1R b KQkq -',"I know this is offbeat but ""threatening"" is the only way for me to keep the game in control. dxc5 is threatened. "
340,11,6,Qc7,b'r3kbnr/ppqb1ppp/2n1p3/2ppP3/3P4/2P1BN2/PP3PPP/RN1QKB1R w KQkq -',Probably planning something... yes: If dxc Nxe5. 
341,11,7,Na3,b'r3kbnr/ppqb1ppp/2n1p3/2ppP3/3P4/N1P1BN2/PP3PPP/R2QKB1R b KQkq -',Another offbeat move but I'm threatening Nb5. 
342,11,8,a6,b'r3kbnr/1pqb1ppp/p1n1p3/2ppP3/3P4/N1P1BN2/PP3PPP/R2QKB1R w KQkq -',Ok. Now notice how this move sets an attack (instead of a defence) on the white squares.
343,11,9,Qa4,b'r3kbnr/1pqb1ppp/p1n1p3/2ppP3/Q2P4/N1P1BN2/PP3PPP/R3KB1R b KQkq -',It seems a mistake since now black's N can take anywhere due to the discovered attack on my Q. But...
344,11,10,Nb5,b'r3kbnr/1pqb1ppp/p3p3/1Nppn3/Q2P4/2P1BN2/PP3PPP/R3KB1R b KQkq -',he can't take because of QxR+. If BxN BxB+ and it's the same.
345,11,11,Qb6,b'r3kbnr/1p1b1ppp/pq2p3/1Npp4/Q2P4/2P1BP2/PP3P1P/R3KB1R w KQkq -',I got myself into a trap. The N can't retire and now BxN is possible. But...
346,11,12,Bxc5,b'r3k1nr/1p1b1ppp/pq2p3/1Nbp4/Q7/2P1BP2/PP3P1P/R3KB1R w KQkq -',Unfortunately I can't force the BQ far from c7's guard... I thought I was lost. 
347,11,13,1b4,b'r3k1nr/1p1b1ppp/p3p3/1Nqp4/QP6/2P2P2/P4P1P/R3KB1R b KQkq b3',Last resource but now just by retiring the Q I have no way out. Of course but... where to retire the Q? Nowhere to prevent a N's check. He can take it... the next move. 
348,11,14,1Bxb5,b'r3k1nr/1p3ppp/p3p3/1bqp4/QP6/2P2P2/P4P1P/R3KB1R w KQkq -',"Now I have to defnd c3 (I saw it will become weak but this was a hot game and I wasn't thinking in long-term strategy: I just need not to allow Qxc3+ winning the R. I'm lost anyway when BxQ bxQ and... I'm a piece under with very few chances to even draw the game. BUT: when you go out of normal sequences (Na3 for Nb5 as an example) and the opponent is not ""seeing"" the consequences of an ""odd move""... it is more difficult for him to keep the reasoning ""on"". This works for blitzes only of course... "
349,11,15,1Qa3,b'r3k1nr/1p3ppp/p3p3/1bqp4/1P6/Q1P2P2/P4P1P/R3KB1R b KQkq -',I'm still a piece under and that's all. Just retiring the Q and black would have won. But...
350,11,16,1Bxf1,b'r3k1nr/1p3ppp/p3p3/2qp4/1P6/Q1P2P2/P4P1P/R3Kb1R w KQkq -',He forgot about his Q. 
351,11,17,1bxc5,b'r3k1nr/1p3ppp/p3p3/2Pp4/8/Q1P2P2/P4P1P/R3Kb1R b KQkq -',Can you believe? I am ONLY +2 despite black's blunder!
352,11,18,1Rg1,b'r3k1nr/1p3ppp/p3p3/1bPp4/8/Q1P2P2/P4P1P/R3K1R1 b Qkq -',...no point in castling of course. Another weakness targeted...
353,11,19,1g6,b'r3k1nr/1p3p1p/p3p1p1/1bPp4/8/Q1P2P2/P4P1P/R3K1R1 w Qkq -',...weakening the black squares so...
354,11,20,1Qb2,b'r3k1nr/1p3p1p/p3p1p1/1bPp4/8/2P2P2/PQ3P1P/R3K1R1 b Qkq -',setting a double threat. Of course you can see it... do you?
355,11,21,1Nf6,b'r3k2r/1p3p1p/p3pnp1/1bPp4/8/2P2P2/PQ3P1P/R3K1R1 w Qkq -',He didn't!
356,11,22,1c4,b'r3k2r/1p3p1p/p3pnp1/1bPp4/2P5/5P2/PQ3P1P/R3K1R1 b Qkq -',Lucky me... I don't recommend my game of course but this time it worked. :-)
357,12,0,Qxc3,b'rn2k2r/pp3ppp/2p1pn2/8/3P1Bb1/2q2N2/P1P1BPPP/R2QR1K1 w kq -',A bit of a risky pawn to take maybe...
358,12,1,1Bxh7+,b'1r3rk1/p4ppB/1pp1pn2/q7/3P2b1/1R3N2/P1P2PPP/3QR1K1 b - -',Now it livens up
359,12,2,Qd2,b'1r3r2/p4ppk/1pp1pn2/4R3/3P4/1R3Q2/P1Pq1PPP/6K1 w - -',Material up but now gets tricky
360,12,3,Kg6,b'1r3r2/p2n1pp1/1pp1p1k1/7R/3P2P1/1R3Q2/P1Pq1P1P/6K1 w - -',I am sure that coming out is better than going back
361,12,4,Kf6,b'1r3r2/p2n1pp1/1pp1pk2/7R/3PQ1P1/1R6/P1Pq1P1P/6K1 w - -',Yes out in the open!
362,12,5,g6,b'1r3r2/p2nkp2/1pp1p1p1/6PR/3P3Q/1R6/P1Pq1P1P/6K1 w - -',Now I feel a bit safer - but no so....
363,12,6,Rbd8,b'3r1r2/p2nkp1R/1p2p1p1/2p3q1/3PQ3/3R4/P4P1P/5K2 w - -',Lots of material up - but now it gets dangerous
364,12,7,e5,b'3r1r2/p2nkp1R/1p4p1/2pPp1q1/4Q3/3R4/P4P1P/5K2 w - -',A bad call
365,12,8,Qf6,b'3rkr2/p2n1p1R/1p1P1qp1/2p1p3/4Q3/6R1/P4P1P/5K2 w - -',Now I am in trouble
366,12,9,fxg6,b'3rkr2/p2n3R/1p1P1qp1/2p1p3/4Q3/8/P4P1P/5K2 w - -',I think it is the only defence
367,12,10,Rf7,b'3rk3/p2n1r1R/1p1P1qQ1/2p1p3/8/8/P4P1P/5K2 w - -',Again the only way out?
368,12,11,Ne4,b'3rk3/p4q2/1p1P4/2p1p3/4n3/8/P2Q1P1P/5K2 w - -',At last is is calming down and I can use the material
369,12,12,Qe4+,b'4k3/p7/1p6/2p1p3/2Q1q3/2n5/P4PKP/3r4 w - -',At last - White resigns
370,13,0,e4,b'rnbqkbnr/pppppppp/8/8/4P3/8/PPPP1PPP/RNBQKBNR b KQkq e3',So I start with my usual.
371,13,1,Nf6,b'rnbqkb1r/pppppppp/5n2/8/4P3/8/PPPP1PPP/RNBQKBNR w KQkq -',I was surprised to see him respond with the Reti Defense.  The most common move is 1..e5 or 1...c5  However there is nothing wrong with what Mike played.  And I view it as in book as he is developing whilst threatening e4.
372,13,2,Nc3,b'rnbqkb1r/pppppppp/5n2/8/4P3/2N5/PPPP1PPP/R1BQKBNR b KQkq -',So I develop and protect.
373,13,3,e6,b'rnbqkb1r/pppp1ppp/4pn2/8/4P3/2N5/PPPP1PPP/R1BQKBNR w KQkq -',Now we have a similar position to what we see in the French Defense.  The only reason it hasn't transposed into that is because you don't see Nc3.  But the other moves are part of it.
374,13,4,d4,b'rnbqkb1r/pppp1ppp/4pn2/8/3PP3/2N5/PPP2PPP/R1BQKBNR b KQkq d3',However I am using the same methods that I'd use in the Caro Kann and French.  As the idea is that in the opening when black only advances one square white should answer with d4.
375,13,5,Bb4,b'rnbqk2r/pppp1ppp/4pn2/8/1b1PP3/2N5/PPP2PPP/R1BQKBNR w KQkq -',Pinning my Nc3 and going after my e4 in the process.  The threat is 4...Bxc3 5.bxc3 Nxe4 and without my N he'd get a pawn.
376,13,6,Bd3,b'rnbqk2r/pppp1ppp/4pn2/8/1b1PP3/2NB4/PPP2PPP/R1BQK1NR b KQkq -',Believe it or not I came close to making that mistake.  That's because I was inclined to break the pin with 4.Bd2  But after my blunder against knightrider62 (when mentoring her) I wasn't going to make the same mistake here.  The idea being is that you shouldn't give your student an early advance as kenneth_fiore_3 pointed out when annotating my training sessions with Mary and Gus.
377,13,7,Nc6,b'r1bqk2r/pppp1ppp/2n1pn2/8/1b1PP3/2NB4/PPP2PPP/R1BQK1NR w KQkq -',Not surprised to see this as Mike is not only continuing to develop but he is threatening my d4 pawn in the process.
