,gid,aid,move,fen,annotation
601,29,29,4Qh7,b'5k2/7Q/6R1/5p1p/5P2/8/2P4K/8 b - -',And mate next.
602,29,30,4h4,b'5k2/7Q/6R1/5p2/5P1p/8/2P4K/8 w - -',Still no resignation!
603,29,31,5Rg8#,b'5kR1/7Q/8/5p2/5P1p/8/2P4K/8 b - -',So checkmate.
604,30,0,Nf6,b'rnbqkb1r/pp2pppp/2p2n2/8/2BP4/6N1/PPP2PPP/R1BQK1NR w KQkq -',Non-standard.  Black should try to either block or attack the bishop with e6 or b5 although this does develop the knight.
605,30,1,Nf3,b'rnbqkb1r/pp2pppp/2p2n2/8/2BP4/5NN1/PPP2PPP/R1BQK2R b KQkq -',Preparing to castle with knights doubled king-side.
606,30,2,Bg4,b'rn1qkb1r/pp2pppp/2p2n2/8/2BP2b1/5NN1/PPP2PPP/R1BQK2R w KQkq -',Pins the knight looking to capture and double White's KBP.
607,30,3,gxf3,b'rn1qkb1r/pp2pppp/2p2n2/8/2BP4/5PNP/PPP2P2/R1BQK2R b KQkq -',Why not Qxf3?  The doubled pawn is weak.
608,30,4,Nbd7,b'r2qkb1r/pp1n1ppp/2p1pn2/6B1/2BP4/5PNP/PPP2P2/R2QK2R w KQkq -',Rather than bring the Queen out early Black chooses to reinforce with a knight.  Be7 is perhaps stronger as it allows Black to castle.
609,30,5,1Ne4,b'r2qkb1r/pp1n1ppp/2p1pn2/6B1/2BPN3/5P1P/PPP2P2/R2QK2R b KQkq -',White strengthens his attack; the knight is pinned.
610,30,6,1Nd6+,b'r2qk2r/pp1n1ppp/2pNpb2/8/2BP4/5P1P/PPP2P2/R2QK2R b KQkq -',Temporarily wins a pawn.
611,30,7,Qb4+,b'r6r/p3kppp/2p1pb2/2P5/1qB5/5P1P/PPP2P2/R2QK2R w KQ -',Unnecessary but a check often causes mistakes.
612,30,8,Qxc5,b'r6r/p3kppp/2p1pb2/2q5/2B5/2P2P1P/PP3P2/R2QK2R w KQ -',The temptation is to take the Bishop but that leaves 18. Qd6  open to White.  White gets two pawns for his Bishop and can seize the d-file.  It might not work but Black would prefer to avoid the possibility.
613,30,9,2O-O,b'r2r4/p3kppp/2p1p3/4b3/8/1BP2P1P/PP3P2/R4RK1 b - -',So far Black is simplifying to take advantage of the doubled pawn.  Although Black has an isolated QBP the disadvantages should at worst cancel.  White connects his rooks and attempts to secure his King.
614,30,10,Rxe2,b'8/p3k1pp/1bprp3/5p2/1PB5/2P2P1P/P3rPK1/1R6 w - -',Winning a pawn.
615,30,11,Rxf2+,b'8/p3k1pp/1bp1p3/5p2/1PB5/2P2P1P/5r2/1R3K2 w - -',And another one.
616,30,12,3Kd3,b'8/p3k1pp/2p5/4p3/1PB2p2/2PKbr2/4R3/8 b - -',Four pawns up Black wants the Rooks off the board.
617,30,13,3Rxf2,b'8/p3k1pp/2p5/4p3/1PB2p2/2PKb3/5R2/8 b - -',And White obliges.
618,30,14,3Bxf2,b'8/p3k1pp/2p5/4p3/1PB2p2/2PK4/5b2/8 w - -',For Black it should now merely be a matter of pushing pawns up the board.
619,30,15,4Bxc6,b'8/p6p/2B2k2/4p3/1P2Kpp1/2P5/5b2/8 b - -',With the pawn advantage Black is willing to sacrifice the Bishop if necessary to prevent the White pawns from Queening rather than waste a move trying to save the pawn.
620,30,16,f3+,b'8/p6p/8/2P2k2/1P2p3/5pp1/5bK1/3B4 w - -',Pushing the King back.
621,30,17,g2+,b'8/p6p/8/2P2k2/1P2p3/5p2/5bp1/3B1K2 w - -',A potentially fatal mistake.  After 51. Kxf2 Kf4 52. Bxf3 ensures that Black is unable to Queen either pawn before White can Queen the c pawn.  Much better is 50. ... Kf4.  Then if 51. Bxf3 Kxf3 52. c6 g2#; or if 51. c6 e3 52. c7 g2# (52. Bxf3 Kfx3 53. c7 g2# lasts one more move).
622,30,18,5c6,b'8/p6p/2P5/8/1P2pk2/5p2/5Kp1/3B4 b - -',However White advances the c pawn prematurely sealing his own fate.
623,30,19,5Kg1,b'8/p6p/2P5/8/1P3k2/4pp2/6p1/3B2K1 b - -',53. Ke1 loses as follows: 53. ... f2  54. Ke2 f1=Q#.
624,30,20,5c7,b'8/p1P4p/8/8/1P6/4ppk1/6p1/3B2K1 b - -',54. Bxf3 Kxf3 holds longer.  Play then could proceed 55. c7 e2 56. c8=Q e1=Q  57. Kh2  Qh1#.  If 55. Kh2 e2 56. c7 e1=Q  57. c8=Q Qh1# (on 56. Kh3 g1=Q with mate next move).
625,30,21,5f2#,b'8/p1P4p/8/8/1P6/4p1k1/5pp1/3B2K1 w - -',
626,31,0,e4,b'rnbqkbnr/pppppppp/8/8/4P3/8/PPPP1PPP/RNBQKBNR b KQkq e3',This is my first game playing in gameknot.
627,31,1,Bc4,b'r1bqkbnr/pppp1ppp/2n5/4p3/2B1P3/5N2/PPPP1PPP/RNBQK2R b KQkq -',Very common postion.
628,31,2,a6,b'r1bqkbnr/1ppp1ppp/p1n5/4p3/2B1P3/5N2/PPPP1PPP/RNBQK2R w KQkq -',Hmmm... Very strange move.
629,31,3,d4,b'r1bqkbnr/1ppp1ppp/p1n5/4p3/2BPP3/5N2/PPP2PPP/RNBQK2R b KQkq d3',So I tried to get the centre while my opponent was losing his time.
630,31,4,Nf6,b'r1bqkb1r/2pp1ppp/p1n2n2/1p2p3/3PP3/1B3N2/PPP2PPP/RNBQK2R w KQkq -',Now he is dead.
631,31,5,dxe5,b'r1bqkb1r/2pp1ppp/p1n2n2/1p2P3/4P3/1B3N2/PPP2PPP/RNBQK2R b KQkq -',Other alternative is 6.Nxe5 then 6... Nxe5 7.dxe5 Nxe4 and 8. Qd4 is very strong.
632,31,6,Nb4,b'r1bqkb1r/2pp1ppp/p7/1p1QP3/1n2n3/1B3N2/PPP2PPP/RNB1K2R w KQkq -',There was no good move he was already dead.
633,31,7,Qxf7#,b'r1bqkb1r/2pp1Qpp/p7/1p2P3/1n2n3/1B3N2/PPP2PPP/RNB1K2R b KQkq -',Checkmate. My first game won in 8 moves.
634,32,0,e4,b'rnbqkbnr/pppppppp/8/8/4P3/8/PPPP1PPP/RNBQKBNR b KQkq e3',We are all taught how to exploit basic tactical conditions that allow us to deliver the knock-out shot in our games.  And we always see these positions from the winner's point of view.  The question I want to pose in this game annotation is the reverse  scenario:  How is it that the losing player - the player who receives the knock-out - allows the conditions for such a tactical shot to arise?  On move 32 Black delivers the tactical shot that for all intents and purposes ends the game.  But what were the oversights by the losing player (me) that allowed it?  That is what is the anatomy of a tactical oversight?
635,32,1,d6,b'rnbqkbnr/ppp1pppp/3p4/8/4P3/8/PPPP1PPP/RNBQKBNR w KQkq -',This game was from a Pirc mini-tourney.
636,32,2,f3,b'rnbqkbnr/ppp1pp1p/3p2p1/8/3PP3/5P2/PPP3PP/RNBQKBNR b KQkq -',My preferred move for White.
637,32,3,Bd5,b'r2qk1nr/2pbppbp/p1np2p1/1p1B4/3PP3/4BP2/PPP1N1PP/RN1QK2R b KQkq -',"I have no love for the ""two bishops"" especially when one of them has lots of pawns on its own color complex."
638,32,4,Bxc6,b'r2qk2r/2pbppbp/p1Bp1np1/1p6/3PP3/4BP2/PPP1N1PP/RN1QK2R b KQkq -',Takes.
639,32,5,Bxc6,b'r2qk2r/2p1ppbp/p1bp1np1/1p6/3PP3/4BP2/PPP1N1PP/RN1QK2R w KQkq -',Takes.
640,32,6,1Nd2,b'r2qk2r/2p1ppbp/p1bp1np1/1p6/3PP3/4BP2/PPPNN1PP/R2QK2R b KQkq -',This knight is going to support an expected pawn exchange on c4.  
641,32,7,1O-O,b'r2q1rk1/2p1ppbp/p1bp1np1/1p6/3PP3/4BP2/PPPNN1PP/R2QK2R w KQ -',Black is developed.
642,32,8,1c4,b'r2q1rk1/2p1ppbp/p1bp1np1/1p6/2PPP3/4BP2/PP1NN1PP/R2QK2R b KQ c3',White tries to open the c-file.  This was my strategic aim throughout the game.
643,32,9,1bxc4,b'r2q1rk1/2p1ppbp/p1bp1np1/8/2pPP3/4BP2/PP1NN1PP/R2QK2R w KQ -',Takes.
644,32,10,1Nxc4,b'r2q1rk1/2p1ppbp/p1bp1np1/8/2NPP3/4BP2/PP2N1PP/R2QK2R b KQ -',Takes.
645,32,11,1Rc1,b'r2q1rk1/2p1ppbp/p2p1np1/1b6/2NPP3/4BP2/PP2N1PP/2RQK2R b K -',Now White has the c-file.
646,32,12,1Rb8,b'1r1q1rk1/2p1ppbp/p2p1np1/1b6/2NPP3/4BP2/PP2N1PP/2RQK2R w K -',Black is hoping for some action on the b-file but...
647,32,13,1b3,b'1r1q1rk1/2p1ppbp/p2p1np1/1b6/2NPP3/1P2BP2/P3N1PP/2RQK2R b K -',...White has more space to work with in this sector of the board so he defends the b-pawn by simply advancing it one square.  White has no intention of recapturing with it should black take the knight.
648,32,14,1Rxc4,b'1r1q1rk1/2p1ppbp/p2p1np1/8/2RPP3/1P2BP2/P3N1PP/3QK2R b K -',There.  The c-file is mine and I now bear down on the backward c7 pawn.  So far so good.
649,32,15,1d5,b'1r1q1rk1/2p1ppbp/p4np1/3p4/2RPP3/1P2BP2/P3N1PP/3QK2R w K -',Black forces a central pawn exchange.
650,32,16,1exd5,b'1r1q1rk1/2p1ppbp/p4np1/3P4/2RP4/1P2BP2/P3N1PP/3QK2R b K -',Takes.
651,32,17,1Nxd5,b'1r1q1rk1/2p1ppbp/p5p1/3n4/2RP4/1P2BP2/P3N1PP/3QK2R w K -',Takes.
652,32,18,1Bf2,b'1r1q1rk1/2p1ppbp/p5p1/3n4/2RP4/1P3P2/P3NBPP/3QK2R b K -',This bishop is doing its job for now as a defensive support to my central d-4 pawn.
653,32,19,1Bh6,b'1r1q1rk1/2p1pp1p/p5pb/3n4/2RP4/1P3P2/P3NBPP/3QK2R w K -',Black tries tactics on the e3 square.
654,32,20,1O-O,b'1r1q1rk1/2p1pp1p/p5pb/3n4/2RP4/1P3P2/P3NBPP/3Q1RK1 b - -',I ignore any invasion on e3.  Finally my king is tucked away.
655,32,21,1Be3,b'1r1q1rk1/2p1pp1p/p5p1/3n4/2RP4/1P2bP2/P3NBPP/3Q1RK1 w - -',Black was hoping for a re-capture here so as to fork both of white's rooks and his queen with the d5 knight.
656,32,22,1Qd3,b'1r1q1rk1/2p1pp1p/p5p1/3n4/2RP4/1P1QbP2/P3NBPP/5RK1 b - -',White supports e3.
657,32,23,1Bxf2+,b'1r1q1rk1/2p1pp1p/p5p1/3n4/2RP4/1P1Q1P2/P3NbPP/5RK1 w - -',Black takes the defensive bishop off the board.
658,32,24,2Kxf2,b'1r1q1rk1/2p1pp1p/p5p1/3n4/2RP4/1P1Q1P2/P3NKPP/5R2 b - -',White takes with the king as taking with the rook was awkward.
659,32,25,2e6,b'1r1q1rk1/2p2p1p/p3p1p1/3n4/2RP4/1P1Q1P2/P3NKPP/5R2 w - -',This move supports the d5 knight.  Black has his own positional trump now.   This knight is almost immovable and like an eagle it has a massive wing span hitting many of the weak squares in White's camp (e3 & c3 in particular) and on the queenside (b4 and b6).  It will use these latter squares as pivot points for some nice tactics later on.  
660,32,26,2g3,b'1r1q1rk1/2p2p1p/p3p1p1/3n4/2RP4/1P1Q1PP1/P3NK1P/5R2 b - -',A queen check at h4 was threatened after which White may as well have resigned.  Good defensive move by White.
661,32,27,2Qd6,b'1r3rk1/2p2p1p/p2qp1p1/3n4/2RP4/1P1Q1PP1/P3NK1P/5R2 w - -',Going for the weak squares on the queenside (squares a3 b2 etc.)
662,32,28,2Rfc1,b'1r3rk1/2p2p1p/p2qp1p1/3n4/2RP4/1P1Q1PP1/P3NK1P/2R5 b - -',White ignores any queen voyage to the queen side as the c4 rook has unfettered access to the a-file.  This is enough to repel any invasion by the queen as will be shown.
663,32,29,2Nb4,b'1r3rk1/2p2p1p/p2qp1p1/8/1nRP4/1P1Q1PP1/P3NK1P/2R5 w - -',Forks the queen and the a2 pawn.
664,32,30,2Qd2,b'1r3rk1/2p2p1p/p2qp1p1/8/1nRP4/1P3PP1/P2QNK1P/2R5 b - -',Defends a2.
665,32,31,2Nd5,b'1r3rk1/2p2p1p/p2qp1p1/3n4/2RP4/1P3PP1/P2QNK1P/2R5 w - -',The knight comes back to its d5 outpost.
666,32,32,2Nc3,b'1r3rk1/2p2p1p/p2qp1p1/3n4/2RP4/1PN2PP1/P2Q1K1P/2R5 b - -',White tries to challenge black knight's central dominance.
667,32,33,2c6,b'1r3rk1/5p1p/p1pqp1p1/3n4/2RP4/1PN2PP1/P2Q1K1P/2R5 w - -',Black supports it further and indicates that any exchange of the knight will entail a repair-job to his queenside pawn structure.
668,32,34,2Ne4,b'1r3rk1/5p1p/p1pqp1p1/3n4/2RPN3/1P3PP1/P2Q1K1P/2R5 b - -',White hits the black queen with his knight.  More prudent would have been to get the Black knight off the board.  White is over-playing is hand and trying to play for finesse that has little yield.
669,32,35,2Qa3,b'1r3rk1/5p1p/p1p1p1p1/3n4/2RPN3/qP3PP1/P2Q1K1P/2R5 w - -',The queen invades the queenside but...
670,32,36,2Ra4,b'1r3rk1/5p1p/p1p1p1p1/3n4/R2PN3/qP3PP1/P2Q1K1P/2R5 b - -',It is repelled and White wins a pawn.  Now White's advantage appears to be palpable.  But this is the point of the game in which the advantage starts to turn over to Black...
671,32,37,2Qe7,b'1r3rk1/4qp1p/p1p1p1p1/3n4/R2PN3/1P3PP1/P2Q1K1P/2R5 w - -',The queen retreats and Whit is suddenly up a pawn after the capture on a6.  
672,32,38,2Rxa6,b'1r3rk1/4qp1p/R1p1p1p1/3n4/3PN3/1P3PP1/P2Q1K1P/2R5 b - -',"The a6 pawn falls and White is both up a pawn.  However he is ""cruising for a bruising"".  This pawn capture begins a series of moves in which White's position slowly unravels leading up to the 32nd move knock-out.  "
673,32,39,2Nb4,b'1r3rk1/4qp1p/R1p1p1p1/8/1n1PN3/1P3PP1/P2Q1K1P/2R5 w - -',Black hits the rook with his knight.
674,32,40,2Ra4,b'1r3rk1/4qp1p/2p1p1p1/8/Rn1PN3/1P3PP1/P2Q1K1P/2R5 b - -',White brings the rook back intending eventually to re-position it on c4 where it can bear down on the isolated c6 pawn.
675,32,41,2Rfd8,b'1r1r2k1/4qp1p/2p1p1p1/8/Rn1PN3/1P3PP1/P2Q1K1P/2R5 w - -',Good move - Black logically gets his other rook out opposite white's queen.  This was a great move to challenge the resiliency of white's position.  The knock-out is slowly approaching but White for  some reason does not detect it.
676,32,42,2Nc5,b'1r1r2k1/4qp1p/2p1p1p1/2N5/Rn1P4/1P3PP1/P2Q1K1P/2R5 b - -',Instead of consolidating his position White tries for tangential tactics.  Here he tries to cut off communication between the Black knight and the black queen.  Better may have been to simply move the queen to e3. 
677,32,43,2Nd5,b'1r1r2k1/4qp1p/2p1p1p1/2Nn4/R2P4/1P3PP1/P2Q1K1P/2R5 w - -',The knight returns to its d5 outpost.
678,32,44,3Re1,b'1r1r2k1/4qp1p/2p1p1p1/2Nn4/R2P4/1P3PP1/P2Q1K1P/4R3 b - -',The intention was logical:  To simply blockade the advance of the e6 pawn which white surmised would undermine the d4 pawn which supported the c5 knight.   However White's position is starting to come apart at the seams.  Simultaneously playing offence one move and defence the next move White is opening himself up for the decisive shot.   In this position the white Queen is undefended and the a4 rook  is off sides.  Notice how the centralized d5 knight prevents white from blockading the e pawn with the queen?  The knight controls the e3 square and it threatens a queen-rook fork at c3 should white move his queen to e2.
679,32,45,3Kg7,b'1r1r4/4qpkp/2p1p1p1/2Nn4/R2P4/1P3PP1/P2Q1K1P/4R3 w - -',Black wanted to avoid any Qh6 ideas by White.
680,32,46,3h4,b'1r1r4/4qpkp/2p1p1p1/2Nn4/R2P3P/1P3PP1/P2Q1K2/4R3 b - h3',"Another mistake which accounts for the ""anatomy of the tactical oversight"" (move 32).  Instead of bringing his pieces back into contact with one another White tries for more tangential offence.  The text move was meant to secure g5 for the queen so as to force an exchange of queens at g5 or to mobilize the queen to e5.  "
681,32,47,3Nb6,b'1r1r4/4qpkp/1np1p1p1/2N5/R2P3P/1P3PP1/P2Q1K2/4R3 w - -',Black rightly sees that White's queen is not protected.  But why did I not see this?  Because I was focused on (1) blockading the e6 pawn; (2) mobilizing the queen to g5; and (3) cutting off the c5 knight from the e7 queen - all great ideas in isolation but disastrous when combined together!   
682,32,48,3Rb4,b'1r1r4/4qpkp/1np1p1p1/2N5/1R1P3P/1P3PP1/P2Q1K2/4R3 b - -',In all of my multi-tasking all I see is the attack on my rook...
683,32,49,3Qxc5,b'1r1r4/5pkp/1np1p1p1/2q5/1R1P3P/1P3PP1/P2Q1K2/4R3 w - -',Knock-out!  The knight falls and the d2 pawn is pinned on the d-file.
684,32,50,3dxc5,b'1r1r4/5pkp/1np1p1p1/2P5/1R5P/1P3PP1/P2Q1K2/4R3 b - -',Making the most of a bad situation.
685,32,51,3Rxd2+,b'1r6/5pkp/1np1p1p1/2P5/1R5P/1P3PP1/P2r1K2/4R3 w - -',Check!
686,32,52,3Ke3,b'1r6/5pkp/1np1p1p1/2P5/1R5P/1P2KPP1/P2r4/4R3 b - -',making the most of it...
687,32,53,3Rxa2,b'1r6/5pkp/1np1p1p1/2P5/1R5P/1P2KPP1/r7/4R3 w - -',Takes.  And the rest of the game is a pathetic standing-eight count followed by lots of groggy bleeding.  Congratulations to Gurudela for showing me some valuable lessons relating to why I allowed a solid position to fall victim to a fine yet clearly observable tactical shot.  I hope these annotations make sense to the reader.  I am still pondering where I went wrong so please add any comments if you feel inclined.
688,32,54,e5,b'8/5p2/6p1/4p2p/3k3P/r4rPK/2R5/6R1 w - -',
689,33,0,Nc6,b'r1bqkbnr/pppp1ppp/2n5/4p3/4P3/5N2/PPPP1PPP/RNBQKB1R w KQkq -',my favourite defence to knight f3
690,33,1,Bb5,b'r1bqkbnr/pppp1ppp/2n5/1B2p3/4P3/5N2/PPPP1PPP/RNBQK2R b KQkq -',wanting to keep my kings pawn i played d3
691,33,2,Bd7,b'r2qkbnr/pppb1ppp/2np4/1B2p3/3PP3/5N2/PPP2PPP/RNBQK2R w KQkq -',releasing the pin
692,33,3,Nf6,b'r2qkb1r/pppb1ppp/2np1n2/1B2p3/3PP3/2N2N2/PPP2PPP/R1BQK2R w KQkq -',developing our minor pieces...
693,33,4,Bg5,b'r2qkb1r/pppb1ppp/2np1n2/1B2p1B1/3PP3/2N2N2/PPP2PPP/R2QK2R b KQkq -',pinning my other knight
694,33,5,h6,b'r2qkb1r/pppb1pp1/2np1n1p/1B2p1B1/3PP3/2N2N2/PPP2PPP/R2QK2R w KQkq -',wanting to make the bishop retreat i played this move
695,33,6,Be7,b'r2qk2r/pppbbpp1/2np1n1p/1B2p3/3PP2B/2N2N2/PPP2PPP/R2QK2R w KQkq -',releasing the pin
696,33,7,Nxe5,b'r2qk2r/pppbbpp1/3p1n1p/1B2n3/4P2B/2N2N2/PPP2PPP/R2QK2R w KQkq -',"perhaps i should have played d3 e4
"
697,33,8,O-O,b'r2qk2r/pppbbpp1/3p1n1p/1B2n3/4P2B/2N2N2/PPP2PPP/R2Q1RK1 b kq -',castling surprised me because i thought that he might take my knight on e4
698,33,9,c6,b'r2qk2r/pp1bbpp1/2pp1n1p/1B2n3/4P2B/2N2N2/PPP2PPP/R2Q1RK1 w kq -',releasing the pin on my bishop...
699,33,10,Nxe4,b'r2qk2r/pp1bbpp1/2pp3p/4n3/4n2B/2N2N2/PPP1BPPP/R2Q1RK1 w kq -',i took this pawn to take his bishop on h4 while gaining a centre pawn
700,33,11,Nxf3+,b'r2qk2r/pp1bbpp1/2pp3p/8/4N2B/5n2/PPP1BPPP/R2Q1RK1 w kq -',i played this move just to exchange pieces a little
701,33,12,Bxh4,b'r2qk2r/pp1b1pp1/2pp3p/8/4N2b/5B2/PPP2PPP/R2Q1RK1 w kq -',the bishop is taken
702,33,13,1Nxd6+,b'r2qk2r/pp1b1pp1/2pN3p/8/7b/5B2/PPP2PPP/R2Q1RK1 b kq -',"a good move which i seemed to have overlooked
this now prevents me from castling"
703,33,14,1Nxb7,b'r2q1k1r/pN1b1pp1/2p4p/8/7b/5B2/PPP2PPP/R2Q1RK1 b - -',"again a good move
now i am behind on material and position "
704,33,15,Qb6,b'r4k1r/p4pp1/1qp4p/2N2b2/7b/5B2/PPP2PPP/R2QR1K1 w - -',i played this move in the hope of him moving his knight so i could fork his king and rook with my bishop
705,33,16,1Qd6+,b'r4k1r/p4pp1/1qpQ3p/2N2b2/7b/5B2/PPP2PPP/R3R1K1 b - -',forcing me to play king g8
706,33,17,1Bxc6,b'r5kr/p4pp1/1qBQ3p/2N2b2/7b/8/PPP2PPP/R3R1K1 b - -',threatening the rook on a8 while setting up re1-e8
707,33,18,1Rc8,b'2r3kr/p4pp1/1qBQ3p/2N2b2/7b/8/PPP2PPP/R3R1K1 w - -',threatening the bishop on c3
708,33,19,Rxc6,b'6kr/p4pp1/1qr4p/2N1Qb2/7b/8/PPP2PPP/R3R1K1 w - -',i took the bishop because the next move i can take his knight
709,33,20,g6,b'6kr/p4p2/1qr3pp/2N2Q2/7b/8/PPP2PPP/R3R1K1 w - -',"stopping checkmate by re8 while keeping the threat on the knight because his queen has to 
retreat"
710,33,21,Rxe8,b'4r3/p4pk1/1qr2bpp/2N5/4Q3/8/PPP2PPP/R5K1 w - -',swapping pieces 
711,33,22,Qxc5,b'4Q3/p4pk1/2r2bpp/2q5/8/8/PPP2PPP/R5K1 w - -',finally i take the knight
712,33,23,Bh4,b'4Q3/p4pk1/2r3pp/2q5/7b/2P5/PP3PPP/R5K1 w - -',threatening queen f2
713,33,24,2g3,b'4Q3/p4pk1/2r3pp/2q5/7b/2P3P1/PP3P1P/R5K1 b - -',blocked
714,33,25,2Rf6,b'4Q3/p4pk1/5rpp/2q5/7b/2P3P1/PP3P1P/R5K1 w - -',"again threatening queen f2 letting him take my bishop 
a plan was forming in my mind"
715,33,26,Qxf2+,b'4Q3/p4pk1/5rpp/8/7P/2P5/PP3q1P/R5K1 w - -',there we go queen f2
716,33,27,3Kh1,b'4Q3/p4pk1/5rpp/8/6qP/2P5/PP5P/R6K b - -',the only move
717,33,28,3Rf2,b'4Q3/p4pk1/6pp/8/6qP/2P5/PP3r1P/R6K w - -',threatening mate on g2 
718,33,29,3Qe5+,b'8/p4pk1/6pp/4Q3/6qP/2P5/PP3r1P/R6K b - -',a desperado check
719,33,30,3Qd5,b'8/p4p1k/6pp/3Q4/6qP/2P5/PP3r1P/R6K b - -',blocking mate on g2
720,33,31,3Qh3,b'8/p4p1k/6pp/3Q4/7P/2P4q/PP3r1P/R6K w - -',at this point white resigned because there was no way of stopping mate
721,34,0,d4,b'rnbqkbnr/pppppppp/8/8/3P4/8/PPP1PPPP/RNBQKBNR b KQkq d3',Well I am black in this game
722,34,1,c5,b'rnbqkb1r/pp1ppppp/5n2/2p5/3P4/4P3/PPP2PPP/RNBQKBNR w KQkq c6',? I am not sure if this is the proper way to start the Benoni. Please write a  comment to let me know. 
723,34,2,c3,b'rnbqkb1r/pp1ppppp/5n2/2p5/3P4/2P1P3/PP3PPP/RNBQKBNR b KQkq -',?? a dubious move. White is allowing me to develop
724,34,3,d5,b'rnbqkb1r/1p3ppp/p3pn2/2pp4/3P4/2P1PN2/PP1N1PPP/R1BQKB1R w KQkq d6',!! I give myself 2 explanation marks.  I am playing a reverse queen's gambit.  White has been developing very timid and now I set claim in the center.  Notice My d5 pawn never gets captured
725,34,4,a3,b'r1bqkb1r/1p3ppp/p1n1pn2/2pp4/3P4/P1P1PN2/1P1NBPPP/R1BQK2R b KQkq -',??? very timid
726,34,5,Bd6,b'r1bqk2r/1p3ppp/p1nbpn2/2pp4/3P4/P1P1PN2/1P1NBPPP/R1BQK2R w KQkq -',I did not want to move my queen or light squared bishop yet and I was planing to castle. please grade my move 
727,34,6,Bd6,b'r1bqk2r/1p3ppp/p1nbpn2/3p4/1P6/P1P1PN2/3NBPPP/R1BQK2R w KQkq -',?? after playing the game I think I should have played Ba7...
728,34,7,Bd7,b'r2qk2r/1p1b1ppp/p1nbpn2/3p4/1P6/P1P1PN2/1B1NBPPP/R2QK2R w KQkq -',A quiet move
729,34,8,1O-O,b'r2qk2r/1p1b1ppp/p1nbpn2/3p4/1P6/P1P1PN2/1B1NBPPP/R2Q1RK1 b kq -',At first I was stumped on how to continue playing the game but I myself being a Queen's gambit player soon seen a mirror image and played a move that I play as white
730,34,9,1g5,b'r2qk2r/1p1b1p1p/p1nbpn2/3p2p1/1P6/P1P1PN2/1B1NBPPP/R2Q1RK1 w kq g6',!!! My favorite gambit. I usually play this move as white against black (g4). If anyone knows the name of this move inform me 
731,34,10,1c4,b'r2qk2r/1p1b1p1p/p1nbpn2/3p2p1/1PP5/P3PN2/1B1NBPPP/R2Q1RK1 b kq -',!? white has now moved this pawn twice
732,34,11,1g4,b'r2qk2r/1p1b1p1p/p1nbpn2/3p4/1PP3p1/P3PN2/1B1NBPPP/R2Q1RK1 w kq -',continuing the attack
733,34,12,Rg8,b'r2qk1r1/1p1b1p1p/p1nbpn2/3p4/1PPN2p1/P3P3/1B1NBPPP/R2Q1RK1 w q -',side steping the pin by Bb2 and protecting the g pawn
734,34,13,1g3,b'r2qk1r1/1p1b1p1p/p1nbpn2/3p4/1PPN2p1/P3P1P1/1B1NBP1P/R2Q1RK1 b q -',?! I am still playing this gambit a move behind.  He should have captured my pawn on d5
735,34,14,bxc6,b'r2qk1r1/3b1p2/p1pbpn2/3p3p/1PP3p1/P3P1P1/1B1NBP1P/R2Q1RK1 w q -',Reducing minor pieces; I reinforcing my center now if he captures my d pawn I recapture with my c pawn
736,34,15,O-O-O,b'2kr2r1/3b1p1Q/p1pbpq2/3p4/1PP3pp/P3P1P1/3NBP1P/R4RK1 w - -',? I do not know what to think of this move. King-e7 would also work
737,34,16,2Qa4,b'2kr2r1/3b1p2/p1pbp2q/3p4/QPP3p1/P3P1P1/3NB2P/R4RK1 b - -',!! Now do you see why I should have played ke7.  Double edge sword play.  My king being all lonesome and cramped needed to run 
738,34,17,2Kh1,b'2kr2r1/3b1p2/p1pbp3/3p4/QPP3p1/P3q1P1/3NB2P/R4R1K b - -',Capturing any piece would leave my king open to check and even draw
739,34,18,2Rdf8,b'2k2rr1/3b1p2/p1pbp3/3p4/QPP3p1/P3q1P1/3NB2P/R4R1K w - -',!!! opening space and protecting a vital pawn. WATCH THIS PAWN
740,34,19,Kd8,b'3k1rr1/3b1p2/Q1pbp3/3p4/1PP3p1/P3q1P1/3NB2P/R4R1K w - -',Moving towards e7
741,34,20,2c5,b'3k1rr1/3b1p2/Q1pbp3/2Pp4/1P4p1/P3q1P1/3NB2P/R4R1K b - -',!?
742,34,21,2Bxg3,b'3k1rr1/3b1p2/Q1p1p3/2Pp4/1P4p1/P3q1b1/3NB2P/R4R1K w - -',!! I know how to sacrifice my pieces
743,34,22,2Nb3,b'3k1r1r/3b1p2/2p1p3/2Pp4/1P4p1/PN1B2b1/7P/R4R1K b - -',?
744,34,23,f5,b'3k1r2/3b4/2p1p3/2Pp1p2/1P4p1/PN1B2b1/7r/R4RK1 w - f6',!!! The winning move. Notice how white is unable to protect himself or any counter attack? Sure the A and B files are open but the pawns will not promote in time!
745,34,24,3Rab1,b'3k3r/3b4/2p1p3/P1Ppbp2/1P4p1/1N1B4/7r/1R3RK1 b - -',???
746,34,25,Rg2#,b'3k3r/P2b4/2p1p3/2Ppb3/1P4p1/1N1B1p2/6r1/1R3RK1 w - -',
747,35,0,e4,b'rnbqkbnr/pppppppp/8/8/4P3/8/PPPP1PPP/RNBQKBNR b KQkq e3',As far as I know my greatest drawback in chess is my opening skills/repertoire. I don't have any :-) The sad thing for me is that this is the only part of chess I find not interesting at all to study... And here too I start off with one pawn down
748,35,1,c3,b'rnb1kbnr/pp3ppp/4p3/3q4/3p4/2PB1N2/PP3PPP/RNBQK2R b KQkq -',Lost one pawn...
749,35,2,dxc3,b'rnb1kbnr/pp3ppp/4p3/3q4/8/2pB1N2/PP3PPP/RNBQK2R w KQkq -',but at least getting ahead in development of the pieces
750,35,3,1Bd4,b'r4rk1/npqbbppp/p3pn2/8/3B4/P1NB1N2/1PQR1PPP/3R2K1 b - -',Here I felt good about my position. Fully developed seemingly control of center and both B's and Q pointing towards the king
751,35,4,1Bc6,b'r4rk1/npq1bppp/p1b1pn2/8/3B4/P1NB1N2/1PQR1PPP/3R2K1 w - -',Here I saw the plan of equalizing in material and in addition weakening the black king side. My worries was to protect Nf3 so I didn't end up weakening by king side as well and I did found it ( I think)
752,35,5,Be5,b'r1q2r1k/np3p2/p1bRp1p1/4b3/4B3/P1N2N2/1PQ2PPP/3R2K1 w - -',I guess black overlooked something tactical here because later he didn't show anything for the sacrificing of the bishop
753,35,6,Nb5,b'r1q2r1k/1p3p2/p2Rp1p1/1n2N3/4Q3/P1N5/1P3PPP/3R2K1 w - -',"Again I spent a lot of time calculating. My first idea was Nxg6 because I assumed he will take my knight and I will win... But then I did see a better move for black Kg7 and I would most likely have sacrificed my knight for a pawn and lost my advantage in the game. Then I found a better one: 
25. Nxf7  Then if ...Kg7 a suggestion like this follows (or a quicker mate):
26. Rxe6 Rxf7 27. Qxg6  Kf8 28. Qh6  Rg7 29. Rf6  Ke7 30. Qxg7  
So I felt very comfortable about Nxf7  actually this being a winning move for me. 25... Kg8 is a quick loss for black and taking back with the rook is also a loss by losing heavy material as the rest of the game shows"
754,35,7,2Qxd8,b'3Q4/1p3rk1/p3p1p1/1n6/8/P1N5/1P3PPP/6K1 b - -',Thanks for the game! As a curiosity I lost the other game vs. jeb123 in 7 moves bd=8497434  which only emphasize my poor skills in the opening game
755,36,0,1e5,b'r2q1rk1/1p1nppbp/p1pp1np1/4P3/2PP4/2N2QPP/PP3PB1/R1B2RK1 b - -',? This is something of a blunder costing me a pawn and giving black's knights access to central squares which can threaten my queen.  I wasn't thinking when I played it but I recover well:
756,36,1,1d5,b'r2q1rk1/1p1nppbp/p1p2np1/3Pp3/2P5/2N2QPP/PP3PB1/R1B2RK1 b - -',My QB on the long diagonal is made more powerful by having pawns clear the way.
757,36,2,1b3,b'r2q1rk1/1p2pp1p/pn3bp1/4p3/2P5/1P3QPP/P4PB1/R1B2RK1 b - -',?  Again I'm wandering into traps.  To save the threatened pawn an offensive is in order - 15. c5 and my attack would have gained momentum.
758,36,3,1e4,b'r2q1rk1/1p2pp1p/pn3bp1/8/2P1p3/1P3QPP/P4PB1/R1B2RK1 w - -',Black's capitalizing on my blunder.
759,36,4,Rab8,b'1r3rk1/1P1nppbp/6p1/8/8/1P2B1PP/P4PB1/5RK1 w - -',? If 23. ... Rxa2 I probably would have resigned in short order but this gives me an exchange in return and fine attacking chances.  I have three passed pawns (one set doubled but still passed) threatening to crown right under the influence of my bishops.
760,36,5,3b4,b'1r6/1PR1ppkp/6p1/P1n5/1P1b4/6PP/5PB1/6K1 b - -',Perhaps a blunder after 31. ... Na6 32. Rxe7 Nxb4 but my pawn is doubled to begin with.
761,36,6,3Rc2,b'1r6/bP3pk1/6pp/P7/6P1/3n3P/2R2PB1/6K1 b - -',Guarding f2.  I was concerned about Ne1 but it works out about the same way as the line played.
762,36,7,4f3,b'1r6/1P3p2/P2k2pp/2b5/4K1P1/5P1P/2R5/8 b - -',"Black tries to establish a ""bridge"" under which his king can attack my passed pawns.  I simply move my pieces to light squares where the bishop can not attack them."
