,gid,aid,move,fen,annotation
690,24,16,g5,b'2kr1b1r/pppqnp2/2n1p2p/1B1pPbp1/3P3B/2N2N2/PPP2PPP/R2Q1RK1 w - g6',pawn to g5 to finishing moving the bishop out of my way.
691,24,17,1Bg3,b'2kr1b1r/pppqnp2/2n1p2p/1B1pPbp1/3P4/2N2NB1/PPP2PPP/R2Q1RK1 b - -',bishop retreats but now is protecting e5 pawn and has a good look towards my king.
692,24,18,1Bg6,b'2kr1b1r/pppqnp2/2n1p1bp/1B1pP1p1/3P4/2N2NB1/PPP2PPP/R2Q1RK1 w - -',I retreat my LSB to g6 for now.
693,24,19,1Na4,b'2kr1b1r/pppqnp2/2n1p1bp/1B1pP1p1/N2P4/5NB1/PPP2PPP/R2Q1RK1 b - -',knight moves to the side of the board advancing forward queenside.
694,24,20,1Nf5,b'2kr1b1r/pppq1p2/2n1p1bp/1B1pPnp1/N2P4/5NB1/PPP2PPP/R2Q1RK1 w - -',I bring out my pesky LSB to f5 for attack on king side.
695,24,21,1Nc5,b'2kr1b1r/pppq1p2/2n1p1bp/1BNpPnp1/3P4/5NB1/PPP2PPP/R2Q1RK1 b - -',?white moves  knight to c5.  I have by  DSB on f8.
696,24,22,1Bxc5,b'2kr3r/pppq1p2/2n1p1bp/1BbpPnp1/3P4/5NB1/PPP2PPP/R2Q1RK1 w - -',?I take the knight But there is a  golden pawn on d4 to take me. I saw the pesky knight and wanted it gone and didn't notice it was not free!. It happens. Will have to see what happens next.
697,24,23,1dxc5,b'2kr3r/pppq1p2/2n1p1bp/1BPpPnp1/8/5NB1/PPP2PPP/R2Q1RK1 b - -', white takes my DSB with a pawn!
698,24,24,1a6,b'2kr3r/1ppq1p2/p1n1p1bp/1BPpPnp1/8/5NB1/PPP2PPP/R2Q1RK1 w - -',move up pawn to a6 to kick back the LSB.
699,24,25,1Ba4,b'2kr3r/1ppq1p2/p1n1p1bp/2PpPnp1/B7/5NB1/PPP2PPP/R2Q1RK1 b - -',LSB retreats.
700,24,26,1d4,b'2kr3r/1ppq1p2/p1n1p1bp/2P1Pnp1/B2p4/5NB1/PPP2PPP/R2Q1RK1 w - -',marching my center pawn towrds the queen on d1. It has 3 protectors 2 knights and my queen. but the 1 knight on c6 is stuck in the mud untill I move my queen. 
701,24,27,1Nd2,b'2kr3r/1ppq1p2/p1n1p1bp/2P1Pnp1/B2p4/6B1/PPPN1PPP/R2Q1RK1 b - -',white knight retreats
702,24,28,1Nxg3,b'2kr3r/1ppq1p2/p1n1p1bp/2P1P1p1/B2p4/6n1/PPPN1PPP/R2Q1RK1 w - -',I use my knight to capture whites DSB on on g3 and am most likely7 to be taken with a pawn from the king's side and this will weaken the kings safe hiding fort
703,24,29,1fxg3,b'2kr3r/1ppq1p2/p1n1p1bp/2P1P1p1/B2p4/6P1/PPPN2PP/R2Q1RK1 b - -',pawn takes with f2 pawn which not only takes my knight but also gives white a good look of the f file 
704,24,30,1d3,b'2kr3r/1ppq1p2/p1n1p1bp/2P1P1p1/B7/3p2P1/PPPN2PP/R2Q1RK1 w - -',I push up pawn to d3 and attack c2 pawn and e2 
705,24,31,1c3,b'2kr3r/1ppq1p2/p1n1p1bp/2P1P1p1/B7/2Pp2P1/PP1N2PP/R2Q1RK1 b - -',white refuses to take my pawn! That is fine with me
706,24,32,1Qd5,b'2kr3r/1pp2p2/p1n1p1bp/2PqP1p1/B7/2Pp2P1/PP1N2PP/R2Q1RK1 w - -',I move queen up to d5 and now have a nice view of g2
707,24,33,1b4,b'2kr3r/1pp2p2/p1n1p1bp/2PqP1p1/BP6/2Pp2P1/P2N2PP/R2Q1RK1 b - b3',white thinks taking a fast double pawn move to b4 is  the best move
708,24,34,1Nxe5,b'2kr3r/1pp2p2/p3p1bp/2Pqn1p1/BP6/2Pp2P1/P2N2PP/R2Q1RK1 w - -',I take a pawn with my pesky night and now have a outpost on e5 with 5 different moves from this spot. That is why I call my knights pesky.
709,24,35,1Re1,b'2kr3r/1pp2p2/p3p1bp/2Pqn1p1/BP6/2Pp2P1/P2N2PP/R2QR1K1 b - -',simple counter move rook to e1 attacking the efile!
710,24,36,1f6,b'2kr3r/1pp5/p3ppbp/2Pqn1p1/BP6/2Pp2P1/P2N2PP/R2QR1K1 w - -',I protect my knight with a pawn and now have 6 different places to move.
711,24,37,2Nf3,b'2kr3r/1pp5/p3ppbp/2Pqn1p1/BP6/2Pp1NP1/P5PP/R2QR1K1 b - -',white looks to trade knights by moving to f3.
712,24,38,2d2,b'2kr3r/1pp5/p3ppbp/2Pqn1p1/BP6/2P2NP1/P2p2PP/R2QR1K1 w - -',I move up the passed pawn to d2 now breating down the white rook on e2
713,24,39,2Rf1,b'2kr3r/1pp5/p3ppbp/2Pqn1p1/BP6/2P2NP1/P2p2PP/R2Q1RK1 b - -',Rook moves to f1 out of the away of my attacking pawn on d2
714,24,40,2Bd3,b'2kr3r/1pp5/p3pp1p/2Pqn1p1/BP6/2Pb1NP1/P2p2PP/R2Q1RK1 w - -',LSB to d3 I'm now attacking the rook and have white in some end of the game realization
715,24,41,2Rf2,b'2kr3r/1pp5/p3pp1p/2Pqn1p1/BP6/2Pb1NP1/P2p1RPP/R2Q2K1 b - -',white moves rook to f2 away from my attacking LSB 
716,24,42,2Nxf3+,b'2kr3r/1pp5/p3pp1p/2Pq2p1/BP6/2Pb1nP1/P2p1RPP/R2Q2K1 w - -',knight to f3 for a check
717,24,43,2gxf3,b'2kr3r/1pp5/p3pp1p/2Pq2p1/BP6/2Pb1PP1/P2p1R1P/R2Q2K1 b - -',pawn takes knight.
718,24,44,2Bc4,b'2kr3r/1pp5/p3pp1p/2Pq2p1/BPb5/2P2PP1/P2p1R1P/R2Q2K1 w - -',I pull back DSB to c4
719,24,45,2Kg2,b'2kr3r/1pp5/p3pp1p/2Pq2p1/BPb5/2P2PP1/P2p1RKP/R2Q4 b - -',white moves King to g2.
720,24,46,2Qd3,b'2kr3r/1pp5/p3pp1p/2P3p1/BPb5/2Pq1PP1/P2p1RKP/R2Q4 w - -',I move Queen to d3
721,24,47,2Bc2,b'2kr3r/1pp5/p3pp1p/2P3p1/1Pb5/2Pq1PP1/P1Bp1RKP/R2Q4 b - -',LSB moves to c2 to scare off my queen to a dark square maybe.
722,24,48,2Qxc3,b'2kr3r/1pp5/p3pp1p/2P3p1/1Pb5/2q2PP1/P1Bp1RKP/R2Q4 w - -',I move queen to c3
723,24,49,2a3,b'2kr3r/1pp5/p3pp1p/2P3p1/1Pb5/P1q2PP1/2Bp1RKP/R2Q4 b - -',white moves pawn to a3
724,24,50,2e5,b'2kr3r/1pp5/p4p1p/2P1p1p1/1Pb5/P1q2PP1/2Bp1RKP/R2Q4 w - -',I advance a pawn to e5
725,24,51,2Bf5+,b'2kr3r/1pp5/p4p1p/2P1pBp1/1Pb5/P1q2PP1/3p1RKP/R2Q4 b - -',white checks with LSB to f5
726,24,52,2Kb8,b'1k1r3r/1pp5/p4p1p/2P1pBp1/1Pb5/P1q2PP1/3p1RKP/R2Q4 w - -',king is moved to b8
727,24,53,2Be4,b'1k1r3r/1pp5/p4p1p/2P1p1p1/1Pb1B3/P1q2PP1/3p1RKP/R2Q4 b - -',LSB is active and moves to e4.
728,24,54,2Bb3,b'1k1r3r/1pp5/p4p1p/2P1p1p1/1P2B3/Pbq2PP1/3p1RKP/R2Q4 w - -',I move my LSB to b3 and attack whites queen! this is enough for white who resigns. Did white resign too early? I think I was going to checkmate white soon. The passed pawn was up for promotion and was going  to either take the queen or get promoted onn d1. depending on how white would have played. I think when you resign the game and your not losing you are only huirting yourself. Does anyone think they could take white from here and win?
729,25,0,e4,b'rnbqkbnr/pppppppp/8/8/4P3/8/PPPP1PPP/RNBQKBNR b KQkq e3',My opponent suggested me to play the Reti as it's quite an easy system to learn and the basic moves are virtually the same whatever Black plays against it. I have tried it in a few games but it didn't really fit my style (by the way both games transposed into other openings: one game into a rare kind of Queen's Indian and the other into a symmetrical English). After all I decided to stick with e4 (but I still try other moves sometimes) only on GK though.
730,25,1,b5,b'rnbqkbnr/p1pppppp/8/1p6/4P3/8/PPPP1PPP/RNBQKBNR w KQkq b6',?! Obviously an incorrect pawn sac but who can prove that against a master? At least it got us out of the databases almost immediately.
731,25,2,Bb7,b'rn1qkbnr/pbpppppp/8/1B6/4P3/8/PPPP1PPP/RNBQK1NR w KQkq -',So here it is... The compensation consists of a bishop on the strong a8-h1 diagonal with pressure on the e4 pawn (and eventually the g2 pawn and h1 rook) and a misplaced bishop for White on b5 which needs to move again (it does little at this square). I do not really trust the computer in this kind of positions but the GK engine gives White an edge of almost +2 (winning for White). My own engine (Fritz) gives me +1.25 which is also a large advantage. I think it's less than that but the compensation is probably not enough. Still you can try it against a much weaker player.
732,25,3,g6,b'rn1qkbnr/pbpppp1p/6p1/1B6/4P3/2N5/PPPP1PPP/R1BQK1NR w KQkq -',In hypermodern style Black wants to complete another fianchetto.
733,25,4,d4,b'rn1qkbnr/pbpppp1p/6p1/1B6/3PP3/2N5/PPP2PPP/R1BQK1NR b KQkq d3',So I take the center as was my strategy in this part of the game. Of course I knew Black would try to destroy the center from the flanks but I had adopted this strategy from my first move on and so I thought I needed to stick with it.
734,25,5,Nf6,b'rn1qkb1r/pbpppp1p/5np1/1B6/3PP3/2N5/PPP2PPP/R1BQK1NR w KQkq -',Putting more pressure on the center and almost forcing my reply. We can see now that Black has got the initiative by his first move.
735,25,6,Bd3,b'rn1qkb1r/pbpppp1p/5np1/8/3PP3/2NB4/PPP2PPP/R1BQK1NR b KQkq -',I would like to be able to kick the knight but unfortunately 5.e5?? walks into 5...Bxg2 winning the rook on h1. Also I thought this bishop needed to move another time anyway so I decided to do it now rather than to defend with 5.Qe2 (the queen may be better placed on another square).
736,25,7,d6,b'rn1qkb1r/pbp1pp1p/3p1np1/8/3PP3/2NB4/PPP2PPP/R1BQK1NR w KQkq -',Probably planning ...Nbd7 and inhibiting an e5 advance (which would be possible after Nf3).
737,25,8,Nf3,b'rn1qkb1r/pbp1pp1p/3p1np1/8/3PP3/2NB1N2/PPP2PPP/R1BQK2R b KQkq -',Developing normally but I like to play f4 against hypermodern systems and this stops that. I think I hesitated to make such a move because I knew how strong my opponent was and how such an opponent could create a kingside attack out of the blue. I know it's never a good strategy to play too defensively but it's simply something that happens almost unconsciously. Anyway this move isn't bad but simply less challenging than 6.f4. There were other options as well for example 6.Be3.
738,25,9,Be3,b'rn1q1rk1/pbp1ppbp/3p1np1/8/3PP3/2NBBN2/PPP2PPP/R2Q1RK1 b - -',I thought this was the best placement for the bishop since it helps defending the center but is nevertheless actively posted. However it does block a file for the rook (and possibly queen) and does not prevent a counterpunch in the center like ...e5.
739,25,10,Qd2,b'r2q1rk1/pbpnppbp/3p1np1/8/3PP3/2NBBN2/PPPQ1PPP/R4RK1 b - -',This seemed like the best place for the queen because it prepares an eventual Bh6 exchanging Black's strong dark-squared bishop. this is also the best place to assist in a kingside attack and she is also nicely placed when the center opens up.
740,25,11,Rc8,b'2rq1rk1/pbpnppbp/3p1np1/8/3PP3/2NBBN2/PPPQ1PPP/R4RK1 w - -',This move looked a bit weird to me. I thought it was possibly to prepare a ...c5 push. Now I think I need to make something happen as my whole army except for the rook on a1 is developed.
741,25,12,1e5,b'2rq1rk1/pbpnppbp/3p1np1/4P3/3P4/2NBBN2/PPPQ1PPP/R4RK1 b - -',!? I wanted to play either 10.e5 or 10.d5 and decided this was the best of those. The computer does not mark this as an inaccuracy but its evaluation drops half a point indicating it was not the best move in the position. I'm not quite sure what was better though. 10.d5 one of the suggestions of the computer doesn't look very good either it locks up the center completely opens up the a1-h8 diagonal and gives Black the opportunity to strike at Whites center with a move like ...c6. Besides that it creates a hole on e5 which can be exploited by a Black knight (not just yet but after the knight on f6 has moved). However it does discover an attack on the a7 pawn (I may have missed that). Another suggestion of my computer is 10.Bg5 indicating my bishop was not ideally placed on e3 but it's hard to play such a move after you have played Be3 2 moves ago.
742,25,13,Ng4,b'2rq1rk1/pbpnppbp/6p1/4P3/6n1/2NBBN2/PPPQ1PPP/R4RK1 w - -',Now my center comes under heavy pressure. I had not considered this move dangerous in my evaluations somehow but now it seems as if my e5 pawn is already lost (three attackers and one defender).
743,25,14,1Bf4,b'2rq1rk1/pbpnppbp/6p1/4P3/5Bn1/2NB1N2/PPPQ1PPP/R4RK1 b - -',? Now this is a real mistake. I had completely missed the nice 12.e6! which would be a very interesting pawn sac (not really actually since I would lose that pawn anyway) which both the GK computer and my own Fritzs give. After 12...fxe6 I could attack the weak Black kingside with moves like Ng5 and Bc4. After 12...Nxe3? the line 13.exd7 Nxf1 14.dxc8=Q Nxd2 15.Qxb7 wins a piece for a pawn for me. The computer suggests 12...Nde5 as the best move for Black. I played 12.Bf4 to preserve my bishop pair and because I thought I wouldn't save that pawn either but when a pawn is lost it's usually worth it to look for the best way to lose it.
744,25,15,1Bxf3,b'2rq1rk1/p1pnppbp/6p1/4P3/5Bn1/2NB1b2/PPPQ1PPP/R4RK1 w - -',Before taking on e5 Freddy first demolishes my kingside pawn structure.... Ouch this is even worse than a pawn structure with f4 (as mentioned at move 6) where you have a hole on the a7-g1 diagonal...
745,25,16,1Qe3,b'2rq1rk1/p1pnppbp/6p1/4n3/5B2/2NBQP2/PPP2P1P/R4RK1 b - -',I'm not sure about my reasoning behind this move but I needed to defend f3 and apparently I didn't want to retreat my bishop. However I still give up my bishop pair which I wanted to preserve 2 moves ago... My computer thinks 14.Be2 is the best move and I tend to agree.
746,25,17,1b3,b'1r1q1rk1/p1pnppbp/6p1/4n3/5B2/1PNBQP2/P1P2P1P/R4RK1 b - -',? A bad move which weakens the a1-h8 diagonal. I should have known that and play the more cautious 15.Rab1.
747,25,18,Rb4,b'3q1rk1/p1pnppbp/6p1/8/1r3B2/1PNQ1P2/P1P2P1P/R4RK1 w - -',!? A very agressive move by Black attacking my bishop and taking over some squares on my half of the board.
748,25,19,1Nd5,b'3q1rk1/p1pnppbp/6p1/3N4/1r3B2/1P1Q1P2/P1P2P1P/R4RK1 b - -',?? Now this is a tactical oversight by me. I wanted to defend my bishop in a clever way but had completely overlooked...
749,25,20,1Rd4,b'3q1rk1/p1pnppbp/6p1/3N4/3r1B2/1P1Q1P2/P1P2P1P/R4RK1 w - -',This simple double attack.
750,25,21,1Qb5,b'3q1rk1/p1pnppbp/6p1/1Q1N4/3r1B2/1P3P2/P1P2P1P/R4RK1 b - -',This seems to save both pieces but now comes the very strong...
751,25,22,1Ne5,b'3q1rk1/p1p1ppbp/6p1/1Q1Nn3/3r1B2/1P3P2/P1P2P1P/R4RK1 w - -',! My knight is attacked twice and defended once and there's also the threat of 19...c6. White has to lose material.
752,25,23,2Nxe7+,b'3q1rk1/p3Npbp/2p3p1/1Q2n3/3r1B2/1P3P2/P1P2P1P/3R1RK1 b - -',?? I don't know what I was thinking. Apparently I thought that this was the best way to lose my piece but now I'm losing two pieces instead of one. If I would have played 20.Nf6+ Bxf6 I could have followed up with 21.Qe2 and my bishop on f4 does not fall since the rook on d4 is pinned. Now I allow Black to unpin the rook and after this there are two pieces hanging the queen and the bishop.
753,25,24,2Kg2,b'5rk1/p3qpbp/2p3p1/4n3/5r2/1P3P2/P1P1QPKP/3R1R2 b - -',? I try to defend everything I have but to no avail. There's a quite obvious check which drives the king away from its defence of the f3 pawn and which brings yet another attacker to my kingside with tempo. I told easy19 that I would normally resign in these circumstances but I played on because easy19 thinks you learn the most when you play out your games until mate. And indeed the mating attack is quite instructive. If everyone would consider it normal I would also play games out until the end but as some people think it's disrespectful to let them prove they can mate you I normally resign before they can mate me.
754,25,25,Qh5,b'5rk1/p4pbp/2p3p1/4n2q/5r2/1P3P2/P1P1QP1P/3R1R1K w - -',! Threatening a lot of things including 24...Nxf3 followed by 25...Qxh2#.
755,25,26,2Rfg1,b'5rk1/p4pbp/2p3p1/4n2q/5r2/1P3P2/P1P1QP1P/3R2RK b - -',To be able to defend h2 next turn.
756,25,27,2Rh4,b'5rk1/p4pbp/2p3p1/4n2q/7r/1P3P2/P1P1QP1P/3R2RK w - -',Instead of playing the obvious 24...Nxf3 (which would also win but walk into a pin) Black decides to threaten mate again this time with 25...Rxh2#.
757,25,28,2Qxf3,b'5rk1/p4pbp/2p3p1/7q/7r/1P3Q2/P1P2PRP/3R3K b - -',Forced if I don't want to be checkmated on h2.
758,25,29,2Rxh2+,b'5rk1/p4pbp/2p3p1/7q/8/1P3Q2/P1P2PRr/3R3K w - -',! A nice combination (the rook is won back immediately of course).
759,25,30,2Kg1,b'5rk1/p4pbp/2p3p1/8/8/1P3q2/P1P2P1R/3R2K1 b - -',28.Rg2 lasts a little bit longer but White is obviously still lost.
760,25,31,Rd8,b'3r2k1/p4pbp/2p3p1/8/6q1/1P6/P1P2P1R/7K w - -',Mate is inevitable now.
761,25,32,3Rg2,b'3r2k1/p4pbp/2p3p1/8/6q1/1P6/P1P2PR1/7K b - -',31.Rh5! lasts one move longer (it frees the h2 square as a flight square for the king): 31...Qf3+ 32.Kh2 Rd1 and 33...Rh1# is inevitable.
762,25,33,Qh3#,b'6k1/p4pbp/2p3p1/8/8/1P5q/P1P2P2/3r2RK w - -',And that's the end. An instructive game well played by the  master. The complications in the middlegame were too much to handle for my brain so I lost my way quite quickly and was given a lesson in tactical play by master Freddy. Easy19 thanks for the game. Readers thanks for reading. Please leave any comments or criticism I hope you liked the game.
763,26,0,f6,b'rnbqkbnr/pppp2pp/5p2/4p3/4P3/5N2/PPPP1PPP/RNBQKB1R w KQkq -',hmmm not the best continuation. It opens up the king and locks up the knight on g8.
764,26,1,Nc3,b'rnbqkbnr/pppp2pp/5p2/4p3/4P3/2N2N2/PPPP1PPP/R1BQKB1R b KQkq -',Not the best move for me either. I think I should have played d4.
765,26,2,d3,b'rnbqkbnr/pp1p2pp/2p2p2/4p3/4P3/2NP1N2/PPP2PPP/R1BQKB1R b KQkq -',Again I think it would be better to play d4
766,26,3,Bb4,b'rnbqk1nr/pp4pp/2p2p2/3pp3/1b2P3/1PNP1N2/P1P2PPP/R1BQKB1R w KQkq -',This stopped me from going Bb2.
767,26,4,Qb6,b'rnb1k1nr/pp4pp/1qp2p2/3pp3/1b2P3/1PNP1N2/P1PB1PPP/R2QKB1R w KQkq -',Not so sure why he played this.
768,26,5,g4,b'rnb1k1nr/pp4pp/1qp2p2/3pp3/1b2P1P1/1PNP1N2/P1PB1P1P/R2QKB1R b KQkq g3',I think I blacked out or something. What a bad move!
769,26,6,Bc5,b'rnb1k1nr/pp4pp/1qp2p2/2bpp3/4P1P1/1PNP1N2/P1PB1P1P/R2QKB1R w KQkq -',A blunder and I punished him badly.
770,26,7,Na4,b'rnb1k1nr/pp4pp/1qp2p2/2bpp3/N3P1P1/1P1P1N2/P1PB1P1P/R2QKB1R b KQkq -',Na4 and he resigned. His bishop is lost. The game would be on like this: 8...Bxf2 9.Ke2 Qc7 10.Kxf2. He would lose later on. Thank you for watching!
771,27,0,f5,b'rnbqkbnr/ppppp1pp/8/5p2/2P5/8/PP1PPPPP/RNBQKBNR w KQkq f6',Oh ho! Really?? Let's see what happens when I play ...
772,27,1,g4,b'rnbqkbnr/ppppp1pp/8/5p2/2P3P1/8/PP1PPP1P/RNBQKBNR b KQkq g3',... the Krejcik Gambit! ...I don't know: technically this may not be the Krejcik because that's a gambit against the Dutch. By opening 1. c4 White keeps the option of playing his d-pawn to the 3rd rank and with his Bishop on g2 (buck-nekkid fianchetto though it may be) the opening becomes more like the English. If the t-crossers and i-dotters insist on the purity of 1. d4 f5  2. g4!? as the Krejcik then let's by all means call 1. c4 f5  2. g4!? the Avocet Gambit.  ;-)
773,27,2,bxc3,b'r1bqk2r/pppp2pp/2n1pn2/8/2PPP3/2P4N/P4PB1/R1BQK2R b KQkq -',"I might venture something clich here like  ""so far so book"" but to tell the truth I'm not sure if there even *is* a ""book"" for this particular variation of this opening! Every time I play the ""Krejcik/Avocet Gambit"" I'm doing it mostly ""by ear."""
774,27,3,Qe7,b'r1b1k2r/ppp1q1pp/2n2n2/3pP3/3P4/2P4N/P4PB1/R1BQK2R w KQkq -',At this point I'm already sketching plans to exploit the check on h5 and win Black's weakling on d5.
775,27,4,h6,b'r1b1k2r/ppp1q1p1/2n2n1p/3pP1B1/3P4/2P4N/P4PB1/R2QK2R w KQkq -',Oh yes there's my diagonal.
776,27,5,1Bxf6,b'r1b1k2r/ppp1q1p1/2n2B1p/3pP3/3P4/2P4N/P4PB1/R2QK2R b KQkq -',?! - This is actually not the best move the result of my ide fixe about getting the Queen check on h5. Mo' nastier was 13. Nf4! threatening both the scary fork on g6 and Black's little soldier on d5. If 13. ...Qf7 to stop the fork then 14. Nd5 snags the button outright and Black still can't capture on g5 because of Rxh8. ...Sigh. Missing things like this OTB is why I'm not a Master.
777,27,6,exf4,b'r6r/ppp1k3/2B4p/5b2/3P1p2/2P5/P4P2/2KR3R w - -',I certainly would have considered 19. ...bc6 opening lines.
778,27,7,Be6,b'r6r/ppp5/3kb2p/8/3PBp2/2P2P2/P7/2K1R2R w - -',Somewhat of a critical point in the game. Black has weathered White's misplayed storm and is a passed pawn to the good. White has better development and more active pieces but no clear attacking chances. ...What to do?
779,27,8,2Rh4,b'r6r/ppp5/3kb2p/8/3PBp1R/2P2P2/P7/2K1R3 b - -',Well first I want to truss up Black's undeveloped Rooks binding them to a passive defense of his K-side pawns; then I want to quickly push my a-pawn in a minority attack maneuver to limit Black's desire to push his own pawns on the Q-side and finally I want to start pushing my c- and d-pawns to make his life in the center miserable.
780,27,9,2Re2,b'7r/pp6/2pkbr1p/8/3PBp1R/P1P2P2/2K1R3/8 b - -',To stop silliness like ...Rg8-g2.
781,27,10,Rhf8,b'5r2/pp6/2pk1r1p/8/3PRp1R/P1PK1P2/8/8 w - -',Black's King is cut off and both his Rooks are now bolted to the floor until I feel like letting them go. Time for phase 2.
782,27,11,3Rh5,b'8/p4r2/1ppk1r1p/7R/P2P1p2/2PK1P2/4R3/8 b - -',A little finesse: White now not only covers the Black h-pawn he also looks to the Q-side from a distance.
783,27,12,3a5,b'8/p7/1pp1kr1p/P6R/2PP1p2/3K1P2/8/8 b - -',! - Suddenly White has a little sump'n-sump'n going on that draws the sting out of any plans Black may have had for his Q-side pawns.
784,27,13,3Rg6,b'8/p7/1pp1k1rp/P6R/2PP1p2/3K1P2/8/8 w - -',? - Not even pesky.
785,27,14,Rg5,b'8/8/1pp2k1p/4R1r1/2PPKp2/5P2/8/8 w - -',! - tempting White to exchange.
786,27,15,3Re8,b'4R3/8/1pp2k1p/6r1/2PPKp2/5P2/8/8 b - -',! - After 39. Rg5?? Black wins having a passer on the h-file and being able to force one on the b-file. But now it's White who's looking good with all his pawns covered while Black's Q-side pawns are weaker than kittens.
787,27,16,4d5,b'4R3/8/1p3k1p/2pP2r1/2P1Kp2/5P2/8/8 b - -',What else?
788,27,17,Kf7,b'8/5k2/1R6/2pP2r1/2P1Kp1p/5P2/8/8 w - -',More accurate but not much more help was 42. ...Kg7 to keep Black's Rook from going to the h-file.
789,27,18,4Ke5,b'8/5k2/8/2pPK3/r1P4R/5P2/8/8 b - -',"""Conan! What is best in life??""

""To crush your enemies see them driven before you and to hear the lamentation of their women!""



...Okay maybe that's a little too over the top; but suffice it to say Black's finished at this point."
790,27,19,4Kd5,b'4k3/8/3P4/2pK4/2P2R2/r4P2/8/8 b - -',"Some chess giant once said ""The best move is not always the right move."" This is one of those cases. The ""best move"" here is 49. Ke6 but I wanted to provoke Black into completely misposting his Rook first."
791,27,20,5Ke6,b'4k3/8/3PK3/r1p5/2P2R2/5P2/8/8 b - -',Now Black has lost his chance to check me - the point of my 49th move.
792,27,21,5Ra3,b'4k3/8/3PK3/2p5/2P2R2/r4P2/8/8 w - -',Too late.
793,27,22,5d7+,b'4k3/3P4/4K3/2p5/2P2R2/r4P2/8/8 b - -',White forces a new Queen after 51. ...Kd8  52. Rf8 Kc7  53. d8=Q+ so Black resigns.
794,28,0,e4,b'rnbqkbnr/pppppppp/8/8/4P3/8/PPPP1PPP/RNBQKBNR b KQkq e3',The only way to get better at a game is to review your mistakes. I lost so I must have made some; Thus I am annotating this game. Feel free to give any constructive criticism for a move you thought was bad or could have been done better. I'd appreciate it.
795,28,1,b6,b'rnbqkbnr/p1pppppp/1p6/8/4P3/8/PPPP1PPP/RNBQKBNR w KQkq -',This was before I learned how to play the sicilian properly. I would have played c5 instead of b6.
796,28,2,d4,b'rnbqkbnr/p1pppppp/1p6/8/3PP3/8/PPP2PPP/RNBQKBNR b KQkq d3',Trying to control the center...
797,28,3,Bb7,b'rn1qkbnr/pbpppppp/1p6/8/3PP3/8/PPP2PPP/RNBQKBNR w KQkq -',Attacking an undefended pawn.
798,28,4,Bd3,b'rn1qkbnr/pbpppppp/1p6/8/3PP3/3B4/PPP2PPP/RNBQK1NR b KQkq -',Defending the pawn and developing...
799,28,5,Nc6,b'r2qkbnr/pbpppppp/1pn5/8/3PP3/3B4/PPP2PPP/RNBQK1NR w KQkq -',Also developing while attacking a pawn.
800,28,6,c3,b'r2qkbnr/pbpppppp/1pn5/8/3PP3/2PB4/PP3PPP/RNBQK1NR b KQkq -',He defends it.
801,28,7,d5,b'r2qkbnr/pbp1pppp/1pn5/3p4/3PP3/2PB4/PP3PPP/RNBQK1NR w KQkq d6',Challenging the center control...
802,28,8,e5,b'r2qkbnr/pbp1pppp/1pn5/3pP3/3P4/2PB4/PP3PPP/RNBQK1NR b KQkq -',He presses the pawn.
803,28,9,e6,b'r2qkbnr/pbp2ppp/1pn1p3/3pP3/3P4/2PB4/PP3PPP/RNBQK1NR w KQkq -',Opening the queen up.
804,28,10,Nf3,b'r2qkbnr/pbp2ppp/1pn1p3/3pP3/3P4/2PB1N2/PP3PPP/RNBQK2R b KQkq -',Developing and preparing to castle.
805,28,11,h6,b'r2qkbnr/pbp2pp1/1pn1p2p/3pP3/3P4/2PB1N2/PP3PPP/RNBQK2R w KQkq -',To end all thoughts of Bg5 or Ng5.
806,28,12,h4,b'r2qkbnr/pbp2pp1/1pn1p2p/3pP3/3P3P/2PB1N2/PP3PP1/RNBQK2R b KQkq h3',? I thought that pressing pawns where you castle is bad...am I wrong?
807,28,13,Qd7,b'r3kbnr/pbpq1pp1/1pn1p2p/3pP3/3P3P/2PB1N2/PP3PP1/RNBQK2R w KQkq -',I planned on castling queen-side so I moved the queen there.
808,28,14,b4,b'r3kbnr/pbpq1pp1/1pn1p2p/3pP3/1P1P3P/2PB1N2/P4PP1/RNBQK2R b KQkq b3',Seems normal.
809,28,15,a6,b'r3kbnr/1bpq1pp1/ppn1p2p/3pP3/1P1P3P/2PB1N2/P4PP1/RNBQK2R w KQkq -',To prevent b5.
810,28,16,h5,b'r3kbnr/1bpq1pp1/ppn1p2p/3pP2P/1P1P4/2PB1N2/P4PP1/RNBQK2R b KQkq -',...?
811,28,17,Bxb4,b'r3k1nr/1bpq1pp1/ppn1p2p/3pP2P/1b1P4/2PB1N2/P4PP1/RNBQK2R w KQkq -',Thinking back I think this was a mistake. I thought I could press the pawns through... but couldn't.
812,28,18,1cxb4,b'r3k1nr/1bpq1pp1/ppn1p2p/3pP2P/1P1P4/3B1N2/P4PP1/RNBQK2R b KQkq -',obvious response
813,28,19,1Nxb4,b'r3k1nr/1bpq1pp1/pp2p2p/3pP2P/1n1P4/3B1N2/P4PP1/RNBQK2R w KQkq -',Again obvious.
814,28,20,1Ba3,b'r3k1nr/1bpq1pp1/pp2p2p/3pP2P/1n1P4/B2B1N2/P4PP1/RN1QK2R b KQkq -',Attacking my knight while developing.
815,28,21,1Nxd3+,b'r3k1nr/1bpq1pp1/pp2p2p/3pP2P/3P4/B2n1N2/P4PP1/RN1QK2R w KQkq -',I think this was best.
816,28,22,1Qxd3,b'r3k1nr/1bpq1pp1/pp2p2p/3pP2P/3P4/B2Q1N2/P4PP1/RN2K2R b KQkq -',Only good choice.
817,28,23,1Rc8,b'2r1k1nr/1bpq1pp1/pp2p2p/3pP2P/3P4/B2Q1N2/P4PP1/RN2K2R w KQk -',Preparing to press the pawns.
818,28,24,1O-O,b'2r1k1nr/1bpq1pp1/pp2p2p/3pP2P/3P4/B2Q1N2/P4PP1/RN3RK1 b k -',He castles. Possibly to get the f Rook involved and/or king safety.
819,28,25,1c5,b'2r1k1nr/1b1q1pp1/pp2p2p/2ppP2P/3P4/B2Q1N2/P4PP1/RN3RK1 w k c6',Charge!
820,28,26,1Qb3,b'2r1k1nr/1b1q1pp1/pp2p2p/2ppP2P/3P4/BQ3N2/P4PP1/RN3RK1 b k -',Attacking the undefended b pawn.
821,28,27,1Qb5,b'2r1k1nr/1b3pp1/pp2p2p/1qppP2P/3P4/BQ3N2/P4PP1/RN3RK1 w k -',I think this might have been a mistake.
822,28,28,1dxc5,b'2r1k1nr/1b3pp1/pp2p2p/1qPpP2P/8/BQ3N2/P4PP1/RN3RK1 b k -',He's up. Why not trade off?
823,28,29,1bxc5,b'2r1k1nr/1b3pp1/p3p2p/1qppP2P/8/BQ3N2/P4PP1/RN3RK1 w k -',I think this was the best response.
824,28,30,1Nc3,b'2r1k1nr/1b3pp1/p3p2p/1qppP2P/8/BQN2N2/P4PP1/R4RK1 b k -',Developing while attacking my queen.
825,28,31,1Qxb3,b'2r1k1nr/1b3pp1/p3p2p/2ppP2P/8/BqN2N2/P4PP1/R4RK1 w k -',Was this the best choice?
826,28,32,1axb3,b'2r1k1nr/1b3pp1/p3p2p/2ppP2P/8/BPN2N2/5PP1/R4RK1 b k -',Naturally.
827,28,33,1Ne7,b'2r1k2r/1b2npp1/p3p2p/2ppP2P/8/BPN2N2/5PP1/R4RK1 w k -',Trying to develop...
