,gid,aid,move,fen,annotation
310,16,17,3Rxf2,b'4k3/ppp4Q/8/2b2p2/3p3P/P2P4/1PP2R2/2K5 b - -',"i couldn't find a matting pattern so i choose to take material.. black resigns here. 

any feedback would be appreciated."
311,17,0,b4,b'rnbqkbnr/pppppppp/8/8/1P6/8/P1PPPPPP/RNBQKBNR b KQkq b3',I am not familiar with my opponentso i decide to make a surprise opening
312,17,1,e5,b'rnbqkbnr/pppp1ppp/8/4p3/1P6/8/P1PPPPPP/RNBQKBNR w KQkq e6',"common replyi ussualy hope for another variation
"
313,17,2,a3,b'rnbqkbnr/pppp1ppp/8/4p3/1P6/P7/2PPPPPP/RNBQKBNR b KQkq -',try to not to use the exchange variation futhermoreit will give an advantage for black in development
314,17,3,a6,b'rnbqkbnr/1ppp1ppp/p7/4p3/1P6/P7/2PPPPPP/RNBQKBNR w KQkq -',surprised a good reply  try to free it knight for developmentstop me to futher to b5 variation
315,17,4,e3,b'rnbqkbnr/1ppp1ppp/p7/4p3/1P6/P3P3/2PP1PPP/RNBQKBNR b KQkq -',preparing to free my bishop and make my bishop freely in f1 to a6 diagonal
316,17,5,d5,b'rnbqkbnr/1pp2ppp/p7/3pp3/1P6/P3P3/2PP1PPP/RNBQKBNR w KQkq d6',black try to control the center with its 2 connncted pawn in the center..
317,17,6,Bb2,b'rnbqkbnr/1pp2ppp/p7/3pp3/1P6/P3P3/1BPP1PPP/RN1QKBNR b KQkq -',not an effective move but still playable..in case if the opponent use bd3 move it got advantage in the center for a period of time.
318,17,7,e4,b'rnbqkbnr/1pp2ppp/p7/3p4/1P2p3/P3P3/1BPP1PPP/RN1QKBNR w KQkq -',i  slightly got an advantage heredue to his pawn advance
319,17,8,Nc3,b'rnbqkbnr/1pp2ppp/p7/3p4/1P2p3/P1N1P3/1BPP1PPP/R2QKBNR b KQkq -',not an effective move but still playableif the opponent try to advance his pawnd5nxe4but if so the continuation still good for both sides
320,17,9,Nf6,b'rnbqkb1r/1pp2ppp/p4n2/3p4/1P2p3/P1N1P3/1BPP1PPP/R2QKBNR w KQkq -',as expected trying to covering his conneccted pawn in the center
321,17,10,d3,b'rnbqkb1r/1pp2ppp/p4n2/3p4/1P2p3/P1NPP3/1BP2PPP/R2QKBNR b KQkq -',freeing the tension on the center
322,17,11,Bxd3,b'rnbqkb1r/1pp2ppp/p4n2/3p4/1P6/P1NBP3/1BP2PPP/R2QK1NR b KQkq -',logical reply
323,17,12,c6,b'rnbqkb1r/1p3ppp/p1p2n2/3p4/1P6/P1NBP3/1BP2PPP/R2QK1NR w KQkq -',try to play from sidebut i was hoping a c5 moves
324,17,13,Nf3,b'rnbqkb1r/1p3ppp/p1p2n2/3p4/1P6/P1NBPN2/1BP2PPP/R2QK2R b KQkq -',fasten my development
325,17,14,h6,b'rnbqkb1r/1p3pp1/p1p2n1p/3p4/1P6/P1NBPN2/1BP2PPP/R2QK2R w KQkq -',i was thinking for this moves why ge should delay his development with a waste moves 
326,17,15,O-O,b'rnbq1rk1/1p3pp1/p1pb1n1p/3p4/1P6/P1NBPN2/1BP2PPP/R2QR1K1 w - -',"both side use a logical moves to fasten their development
"
327,17,16,1Ne2,b'rnbq1rk1/1p3pp1/p1pb1n1p/3p4/1P6/P2BPN2/1BP1NPPP/R2QR1K1 b - -',try to give a more protection to my king side
328,17,17,1Nbd7,b'r1bq1rk1/1p1n1pp1/p1pb1n1p/3p4/1P6/P2BPN2/1BP1NPPP/R2QR1K1 w - -',"i think he do sohahhaha
"
329,17,18,1c5,b'r1bq1rk1/1pbn1pp1/p1p2n1p/2Pp4/1P6/P2BPN2/1B2NPPP/R2QR1K1 b - -',i take a time to make this movesswheteher to takes the d5 pawn or noti advance this pawn to make his bishop diagonal narrowand inactive
330,17,19,1Re8,b'r1bqr1k1/1pbn1pp1/p1p2n1p/2Pp4/1P6/P2BPN2/1B2NPPP/R2QR1K1 w - -',a good moves from my opponent
331,17,20,1Ng3,b'r1bqr1k1/1pbn1pp1/p1p2n1p/2Pp4/1P6/P2BPNN1/1B3PPP/R2QR1K1 b - -',a full protection for my kinghahha god save the king
332,17,21,1a5,b'r1bqr1k1/1pbn1pp1/2p2n1p/p1Pp4/1P6/P2BPNN1/1B3PPP/R2QR1K1 w - -',a good movess try to free its rookand make it active
333,17,22,1Qc2,b'r1bqr1k1/1pbn1pp1/2p2n1p/p1Pp4/1P6/P2BPNN1/1BQ2PPP/R3R1K1 b - -',make my queen play a major role here
334,17,23,1Bxa1,b'2bqr1k1/1pbn1pp1/2p2n1p/2Pp4/1P6/3BPNN1/2Q2PPP/B3R1K1 b - -',im not sure of its continuationwhether it best moves or notbut someething for surethe board give a picture still level on both sides
335,17,24,1Nb8,b'1nbqr1k1/1pb2pp1/2p2n1p/2Pp4/1P6/3BPNN1/2Q2PPP/B3R1K1 w - -',i was thinking of this movesswhat the moves intendmaybe to take my pawns on b4yaphis queenside pawns seem strong
336,17,25,Qg5,b'1nb1r1k1/1pb2pp1/2p4p/2Pp2qN/1P6/3BPN2/2Q2PPP/4R1K1 w - -',a big blunder from my opponenti win this game onwardsi think you all know the continiationafter wards
337,17,26,2f4,b'1nb1r1k1/1pb2pp1/2p5/2Pp2pN/1P3P2/3BP3/2Q3PP/4R1K1 b - f3',try to weaken his king sideand obstacles on kiing side
338,17,27,Rd8,b'1nbr1k2/1pb2ppB/2p5/2Pp3N/1P6/4R3/2Q2KPP/8 w - -',not a very good replyblack should cover with his bishop
339,17,28,Bxh2,b'1nbr1k2/1p3pp1/2p5/2Pp3N/1P6/3BR3/2Q2KPb/8 w - -',opps seem i miss my pawns
340,17,29,2Bf5,b'1nbr1k2/1p3pp1/2p5/2Pp1B1N/1P6/4R3/2Q2KPb/8 b - -',try to exchange coz im seeing an opportunity to check mate
341,17,30,2Na6,b'2br1k2/1p3pp1/n1p5/2Pp1B1N/1P6/4R3/2Q2KPb/8 w - -',"not a good reply coz that thread i could refute easily
"
342,17,31,Rxc8,b'2r2k2/1p3pp1/n1p5/2Pp3N/1P6/4R3/2Q2KPb/8 w - -',black should make his king to g8 to save its king
343,17,32,2Qh7,b'2r2k2/1p3ppQ/n1p5/2Pp3N/1P6/4R3/5KPb/8 b - -',finallymate in 2that alll for todayi hope you all enjoy and get a benefits from my games
344,18,0,d5,b'rnbqkb1r/ppp2ppp/5n2/3pp3/4PP2/2N5/PPPP2PP/R1BQKBNR w KQkq d6',Lasker countergambits Hromadka's Vienna Gambit. Now the game gets interesting fast.
345,18,1,fxe5,b'rnbqkb1r/ppp2ppp/5n2/3pP3/4P3/2N5/PPPP2PP/R1BQKBNR b KQkq -',Not only capturing the Pawn but attacking the Knight...
346,18,2,Nxe4,b'rnbqkb1r/ppp2ppp/8/3pP3/4n3/2N5/PPPP2PP/R1BQKBNR w KQkq -',...forcing this recapture.
347,18,3,Qf3,b'rnbqkb1r/ppp2ppp/8/3pP3/4n3/2N2Q2/PPPP2PP/R1B1KBNR b KQkq -',Hromadka immediately pressures the weak spot at KB7.
348,18,4,Nc6,b'r1bqkb1r/ppp2ppp/2n5/3pP3/4n3/2N2Q2/PPPP2PP/R1B1KBNR w KQkq -',Lasker aims to win the advanced P at K5.
349,18,5,Bb5,b'r1bqkb1r/ppp2ppp/2n5/1B1pP3/4n3/2N2Q2/PPPP2PP/R1B1K1NR b KQkq -',Hromadka counters with a pin.
350,18,6,Nxc3,b'r1bqkb1r/ppp2ppp/2n5/1B1pP3/8/2n2Q2/PPPP2PP/R1B1K1NR w KQkq -',Lasker removes the Knight threatening his own center Pawn.
351,18,7,bxc3,b'r1bqkb1r/ppp2ppp/2n5/1B1pP3/8/2P2Q2/P1PP2PP/R1B1K1NR b KQkq -',Hromadka captures towards the center preparing for P-Q4.
352,18,8,Be7,b'r1bqk2r/ppp1bppp/2n5/1B1pP3/8/2P2Q2/P1PP2PP/R1B1K1NR w KQkq -',Lasker prepares to castle.
353,18,9,d4,b'r1bqk2r/ppp1bppp/2n5/1B1pP3/3P4/2P2Q2/P1P3PP/R1B1K1NR b KQkq d3',Hromadka follows up...
354,18,10,O-O,b'r1bq1rk1/ppp1bppp/2n5/1B1pP3/3P4/2P2Q2/P1P3PP/R1B1K1NR w KQ -',...as does Lasker.
355,18,11,Bd3,b'r1bq1rk1/ppp1bppp/2n5/3pP3/3P4/2PB1Q2/P1P3PP/R1B1K1NR b KQ -',With Lasker's K now on KN1 Hromadka repositions his B to aim that direction.
356,18,12,f6,b'r1bq1rk1/ppp1b1pp/2n2p2/3pP3/3P4/2PB1Q2/P1P3PP/R1B1K1NR w KQ -',Creating a flight square.
357,18,13,1Qh5,b'r1bq1rk1/ppp1b1pp/2n2p2/3pP2Q/3P4/2PB4/P1P3PP/R1B1K1NR b KQ -',Threatening QxP ch.
358,18,14,1g6,b'r1bq1rk1/ppp1b2p/2n2pp1/3pP2Q/3P4/2PB4/P1P3PP/R1B1K1NR w KQ -',Cutting the B's diagonal.
359,18,15,1Bxg6,b'r1bq1rk1/ppp1b2p/2n2pB1/3pP2Q/3P4/2P5/P1P3PP/R1B1K1NR b KQ -',Hromadka plays a drawing sacrifice...
360,18,16,1hxg6,b'r1bq1rk1/ppp1b3/2n2pp1/3pP2Q/3P4/2P5/P1P3PP/R1B1K1NR w KQ -',...which Lasker accepts.
361,18,17,1Qxg6+,b'r1bq1rk1/ppp1b3/2n2pQ1/3pP3/3P4/2P5/P1P3PP/R1B1K1NR b KQ -',Forcing Black's response.
362,18,18,1Kh8,b'r1bq1r1k/ppp1b3/2n2pQ1/3pP3/3P4/2P5/P1P3PP/R1B1K1NR w KQ -',Without a piece to interpose on the second rank Lasker has no choice.
363,18,19,1Qh6+,b'r1bq1r1k/ppp1b3/2n2p1Q/3pP3/3P4/2P5/P1P3PP/R1B1K1NR b KQ -',Draw agreed. White has a perpetual check on KR6 and KN6.
364,19,0,e4,b'rnbqkbnr/pppppppp/8/8/4P3/8/PPPP1PPP/RNBQKBNR b KQkq e3',...this is a quick game....where black has to be a little more careful of nasty tactics...
365,19,1,Nc6,b'r1bqkb1r/pp3ppp/2n1p3/2ppPn2/3P1P2/2P2N2/PP4PP/RNBQKB1R w KQkq -',...black is developing well..White is looking to set up a clamp position on the dark squares and push kingside...
366,19,2,Na3,b'r1bqkb1r/pp3ppp/2n1p3/2ppPn2/3P1P2/N1P2N2/PP4PP/R1BQKB1R b KQkq -',..should have played this move earlier...but i didn't..
367,19,3,Bxa3,b'r1bqk2r/pp3ppp/2n1p3/3pPn2/3p1P2/b1PB1N2/PP4PP/R1BQK2R w KQkq -',..black gets in a good move to disrupt the queenside pawns...and will gain material as a result...
368,19,4,1Qc2,b'r1bqk2r/pp3ppp/2n1p3/3pPn2/5P2/P1pB1N2/P1Q3PP/R1B1K2R b KQkq -',..i've focussed on development rather than worrying about the pawn blacks white square bishop is stuck Ra8 is doing nothing and his only viable option is 0-0....
369,19,5,O-O,b'r1bq1rk1/pp3ppp/2n1p3/4Pn2/3p1P2/P1pB1N2/P1Q3PP/R1B2RK1 w - -',...Bxf5 will only help black in the position as he has 2 strong passed pawns if he gets active....
370,19,6,1g4,b'r1bq1rk1/pp3ppp/2n1p3/4Pn2/3p1PP1/P1pB1N2/P1Q4P/R1B2RK1 b - g3',..logical solution..move the knight and attack h7 gaining a pawn back..
371,19,7,Kh8,b'r1bq1r1k/pp3ppB/2n1p3/4P3/3p1PPn/P1p2N2/P1Q4P/R1B2RK1 w - -',..Nxh4 is only good for black so the very nasty move is played instead...
372,19,8,1Ng5,b'r1bq1r1k/pp3ppB/2n1p3/4P1N1/3p1PPn/P1p5/P1Q4P/R1B2RK1 b - -',..the knight is in a great position and cannot be moved. f6 is countered by exf6 and Qf2 is coming home to take the gold...
373,19,9,1Bxg6,b'r1bq1r1k/pp3pp1/2n1p1B1/4P1N1/3p1PP1/P1p5/P1Q4P/R1B2RK1 b - -',..with the knight in such a great position its just how the queen gets to the h file to deliver mate...
374,19,10,1f5,b'r1bq1r1k/pp4p1/2n1p1B1/4PpN1/3p1PP1/P1p5/P1Q4P/R1B2RK1 w - f6',"..interesting and reasonable move. exf ep or gxf5 allow Ne7 and possible defenses but ultimately Qxg5 will have to be played to save the game..
Rf3-h3 is also nasty.."
375,19,11,1Qf2,b'r1bq1r1k/pp4p1/2n1p1B1/4PpN1/3p1PP1/P1p5/P4Q1P/R1B2RK1 b - -',..the easy way..Qxg5 is forced but after fxg5 Qh4+ brings more pain...
376,20,0,1Bb5+,b'r2qk1nr/1p3ppp/8/pBpbP3/1b1Q4/2N5/PPPB1PPP/R3K2R b KQkq -',"Why check when you have a free bishop in front of you?
"
377,20,1,Ne7,b'3rk2r/4nppp/2p5/p1p1P3/1b2N3/8/PPPB1PPP/R3K2R w KQk -',Black should have pushed a pawn to threaten the white knight.  That would give black either the knight or white's black bishop.
378,20,2,1Bc3,b'3rk2r/4nppp/2p5/p1p1P3/1b2N3/2B5/PPP2PPP/R3K2R b KQk -',White could have defended the bishop with O-O-O.
379,20,3,2Kf1,b'6k1/5ppp/2p5/p1p1P3/5P2/2N2nP1/PPPr3P/2R2K2 b - -',Wait why toss the h pawn?
380,20,4,2Nxd4,b'6k1/5ppp/2p5/p1p1P3/3N1P2/6P1/PPP4r/2R2K2 b - -',Oh my God!  Rh1+ is so obvious!  I feel sorry for the white rook.
381,20,5,2cxd4,b'6k1/5ppp/2p5/p3P3/3p1P2/6P1/PPP4r/2R2K2 w - -',Black blunders!
382,20,6,3Ke4,b'8/7p/5p2/p7/4KPk1/6P1/PPP5/8 b - -',Who cares about those white pawns?  White should be rushing c for a queen.  C is passed!
383,20,7,Qh3+,b'2Q5/8/5p2/p4K2/5P2/6kq/PP6/8 w - -',
384,21,0,e4,b'rnbqkbnr/ppp1pppp/3p4/8/3PP3/8/PPP2PPP/RNBQKBNR b KQkq e3',Im playing as white and i open with my Queens Pawn. He decides to open with the queens defense. As you can see by my games I am a very aggresive player even when playing the queens gambit. I am happy with where I am right now.
385,21,1,Nf3,b'r1bqkb1r/ppp1pppp/2np1n2/8/3PP3/2N2N2/PPP2PPP/R1BQKB1R b KQkq -',Were now playing a standard knights game and im just going to wait for my opponent to make a mistake. He is a good player and i never underestimate my opponents. 
386,21,2,Bb5,b'r2qkb1r/ppp2ppp/2np1n2/1B2p3/3PP1b1/2N1BN2/PPP2PPP/R2QK2R b KQkq -',This is where I take control of the game. I know that he has his light sqaured bishop pinning down my knight and i also realize that he will want to put an extra defender on the e5 pawn so i decide to pin his knight to his king. 
387,21,3,Nd7,b'r2qkb1r/pppn1ppp/2np4/1B2p3/3PP1b1/2N1BN2/PPP2PPP/R2QK2R w KQkq -',He now decides to put more protection on his e5 pawn. 
388,21,4,dxe5,b'r2qkb1r/pppn1ppp/2np4/1B2P3/4P1b1/2N1BN2/PPP2PPP/R2QK2R b KQkq -',I see that what he is up too and i decide to capture e5
389,21,5,Ncxe5,b'r2qkb1r/pppn1ppp/3p4/1B2n3/4P1b1/2N1BN2/PPP2PPP/R2QK2R w KQkq -',This is where he blunders. I spot a checkmate oppurtunity and i exploit this weakness
390,21,6,Nxe5,b'r2qkb1r/pppn1ppp/3p4/1B2N3/4P1b1/2N1B3/PPP2PPP/R2QK2R b KQkq -',I capture knight leaving queen open.
391,21,7,Bxd1,b'r2qkb1r/pppn1ppp/3p4/1B2N3/4P3/2N1B3/PPP2PPP/R2bK2R w KQkq -',he obviously captures thinking i blundered
392,21,8,Bxd7+,b'r2qkb1r/pppB1ppp/3p4/4N3/4P3/2N1B3/PPP2PPP/R2bK2R b KQkq -',I then check is King. 
393,21,9,Qxd7,b'r3kb1r/pppq1ppp/3p4/4N3/4P3/2N1B3/PPP2PPP/R2bK2R w KQkq -',His only option is capture bishop. Had he not captured and moved king i would check with bishop to g5 the he would bring pawn to f6 and then i would be bring C line knight to d5 Check Mate!
394,21,10,1Nxd7,b'r3kb1r/pppN1ppp/3p4/8/4P3/2N1B3/PPP2PPP/R2bK2R b KQkq -',But hes not an idiot and we exchange off pieces
395,21,11,1Nd5,b'r6r/pppkbppp/3p4/3N4/4P3/4B3/PPP2PPP/3RK2R b K -',I am now up a knight. I know i have the game in the bag so i grind him down
396,21,12,1c6,b'r6r/pp1kbppp/2pp4/3N4/4P3/4B3/PPP2PPP/3RK2R w K -',I decided to exchange pieces
397,21,13,1Nxe7,b'r6r/pp1kNppp/2pp4/8/4P3/4B3/PPP2PPP/3RK2R b K -',...as you can see
398,21,14,1Rfe1,b'r6r/1p2kppp/p1pp4/8/4P3/4B3/PPP2PPP/3RR1K1 b - -',Im now castled my rooks are centralized so i know the game is over.
399,21,15,Rc1,b'8/5ppp/p1k5/B2R4/2P5/6P1/P4PKP/2r5 w - -',15 moves later i stopped his pawn from advancing and now im basically going to try and exchange rooks for the next few moves. 
400,21,16,g6,b'8/5p1p/p1k3p1/8/2P5/2BR2P1/P1r2PKP/8 w - -',Tried to take pawn on g7 
401,21,17,Rxc4,b'8/7p/p1k3p1/4Bp2/2r5/P2R2P1/5PKP/8 w - -',He finally lets me exchange
402,21,18,4f4,b'8/7p/8/B7/k4PKP/6P1/8/8 b - f3',"I now know the game is over. Thankyou for watching i hope you enjoyed the game. The beauty of a move lies not in its appearance but in the thought behind it. - Aaron Nimzowitsch 

"
403,21,19,4f6,b'8/7p/5P2/1k6/6KP/6P1/8/8 b - -',
404,22,0,f4,b'r1bqkbnr/pp1ppppp/2n5/2p5/4PP2/2N5/PPPP2PP/R1BQKBNR b KQkq f3',"The opening is called ""The Grand Prix Attack."" The point of it is to launch a hard-hitting attack on the king side. Black expertly avoids this however."
405,22,1,d5,b'r1bqk1nr/pp2ppbp/6p1/1Npp4/4PP2/5N2/PPPP2PP/R1BQ1RK1 w kq d6',This move transfered out of opening book ending my attack.  It was a great move by black and transfered the game into a closed posistion.
406,22,2,c4,b'r1bqk2r/1p2ppbp/p5pn/3pP3/2pP1P2/2N2N2/PPP3PP/R1BQ1RK1 w kq -',Not taking the pawn was a wise choice as it would allow White to get back into an open game with attacking chances.
407,22,3,Qa5,b'r1b2rk1/4ppbp/p5pn/qp2P3/P1pP1P2/2N2N2/2P3PP/1RBQ1RK1 w - -',A great move! I didn't see this one coming and took a long time to analyze my way out of it.
408,22,4,Rb8,b'1r1q1rk1/3bppbp/p5pn/1p2P3/P1pP1P2/2Q1NN2/2P3PP/1RB2RK1 w - -',18...bxa5 I think would be better but 18...Rb8 was still a great move.
409,22,5,1axb5,b'1r1q1rk1/3bppbp/p5pn/1P2P3/2pP1P2/2Q1NN2/2P3PP/1RB2RK1 b - -',I do this to relieve some of the tension on the queenside. It may not have been the best move but it helped me to not have to go into long analysis about how to keep that pawn alive.
410,22,6,2Nd4,b'1r1q1rk1/3bppbp/6p1/1p1PPn2/2pN1P2/2Q1N3/2P3PP/1RB2RK1 b - -',Now looking back this may not have been the strongest move as it just invites liquidation in a posistion where my oppenet has two pawn closing in on my turf.
411,22,7,2Bd2,b'1r1q1rk1/3bppbp/6p1/3PP3/1ppN1P2/4Q3/2PB2PP/1R3RK1 b - -',A blunder-like move on my part.
412,22,8,Qc4,b'1r2r1k1/3bppbp/6p1/3PP3/1pqN1P1B/2p1Q3/2P3PP/1R2R1K1 w - -',A great move!
413,22,9,Bxc2,b'1r2r1k1/4ppbp/6p1/3PP3/1pqNQP1B/2p5/2b3PP/R3R1K1 w - -',The Bishop sacrifice seals the game as a draw.  White had the small edge until that point now black has that tiny advantage. However as you will see that advantage isn't enough to win it.
414,22,10,3Rc1,b'1r2r1k1/4ppbp/6p1/3PP3/4RP1B/1pp5/2N3PP/2R3K1 b - -',I offer the material back.  If Black accepts it White gets the edge back. If it is denied Black maintains the small edge.
415,22,11,3Bg5,b'1r2r1k1/4p2p/5bp1/3P2B1/4RP2/2p5/1pN3PP/1R4K1 b - -',I should just have gone with 34. Bxf6 as it may have led to a quicker draw.
416,22,12,Bg7,b'1r2r3/4pkbp/6p1/3P2B1/4RP2/2p5/1pN2KPP/1R6 w - -',A great move! By preserving the Bishop Black ensures that White will not be able to take the lead from him!
417,22,13,3d6,b'1r2r3/4pkbp/3P2p1/6B1/4RP2/2p5/1pN2KPP/1R6 b - -',Here I was just trying for a draw. Other moves would have let Black keep both Rooks making it easier to Queen a pawn.
418,22,14,Rd5,b'8/6b1/3pk1p1/3r3p/4KPP1/2p4P/1pN5/1R2B3 w - -',A small mismove on Black's part. 42...hxg4 43. hxg4 Rc5 may have gotten Black the win he so desired.
419,22,15,4Kd3,b'8/6b1/3pk1p1/2r4p/5PP1/2pK3P/1pN5/1R2B3 b - -',Here neither side can pull out a win so we agreed to a draw.  It was an amazing game by both sides and one of the toughest games I've played here on GameKnot. Great game henrycrun!
420,23,0,d4,b'rnbqkbnr/pp1ppppp/8/2p5/3PP3/8/PPP2PPP/RNBQKBNR b KQkq d3',Smith-Morra Gambit--something I like to try to open the game up right away. White gives up a pawn to get very active pieces on good squares.
421,23,1,e6,b'rnbqkbnr/pp1p1ppp/4p3/8/3pP3/2P5/PP3PPP/RNBQKBNR w KQkq -',But Black isn't having it!
422,23,2,cxd4,b'rnbqkbnr/pp1p1ppp/4p3/8/3PP3/8/PP3PPP/RNBQKBNR b KQkq -',cxd4? Nf3 was probably best to keep the gambit alive.
423,23,3,d5,b'rnbqkbnr/pp3ppp/4p3/3p4/3PP3/8/PP3PPP/RNBQKBNR w KQkq d6',"Striking back at the center for equality although taking the pawn before is better just to make me prove I know what I'm doing.
"
424,23,4,Nf6,b'rnbqkb1r/pp3ppp/5n2/3p4/3P4/5N2/PP3PPP/RNBQKB1R w KQkq -',I'll play with this isolated pawn as White. e5 is my set-up point and the e file is the avenue for attack.
425,23,5,Qe7+,b'rnb1k2r/pp2qppp/5n2/3p4/1b1P4/2NB1N2/PP3PPP/R1BQK2R w KQkq -',Qe7?! Not good--probably looking to trade queens.
426,23,6,Ne5,b'rnb1k2r/pp2qppp/5n2/3pN3/1b1P4/2NB4/PP3PPP/R1BQK2R b KQkq -',Ne5! 
427,23,7,O-O,b'r1b2rk1/pp2qppp/2n2n2/3pN3/1b1P4/2NB4/PP3PPP/R1BQ1RK1 w - -',Black couldn't afford to keep the king out in the open any longer and now his bishop at b4 is doing nothing.
428,23,8,1Re1,b'r1b2rk1/pp2qppp/2n2n2/3pN3/1b1P4/2NB4/PP3PPP/R1BQR1K1 b - -',Now his misplacement of key pieces will be a problem.
429,23,9,1Bg5,b'r4rk1/pp2qppp/4bn2/3pR1B1/1b1P4/2NB4/PP3PPP/R2Q2K1 b - -',Bg5! and now Black is completely tied up and pinned.
430,23,10,1bxc3,b'r4rk1/pp2qppp/4bn2/3pR1B1/3P4/2PB4/P4PPP/R2Q2K1 b - -',This to stay active I suppose but the king-side is the probem.
431,23,11,1f4,b'2r1r1k1/1p2qpp1/p3bn1p/3pR3/3P1P1B/2PB4/P2Q2PP/4R1K1 b - f3',The kind of position I always try to  get: action on one side of the board quiet on the other and a safe king.
432,23,12,1Qa3,b'2r1r1k1/1p3pp1/p3bn1p/3pR3/3P1P1B/q1PB4/P2Q2PP/4R1K1 w - -',Qa3? Still moving in the wrong areas.
433,23,13,2f5,b'2r1rq1k/1p3p2/p3bp1p/3p1P2/3P4/2PB2R1/P2Q2PP/4R1K1 b - -',And as a result the wasted move by the queen and the smashed king position should decide things.
434,23,14,Ba4,b'2r1r3/1p3p1k/p4p1p/3p1P1q/b2P2R1/2PB2R1/P2Q2PP/6K1 w - -',Ba4?
435,23,15,2Rh3,b'2r1r3/1p3p1k/p4p1p/3p1P1q/b2P2R1/2PB3R/P2Q2PP/6K1 b - -',Rh3! Qxg4 leads to mate. The early queen move to e7 and the resulting pins led to a quick loss by Black in an equal position early in the opening.
436,24,0,d6,b'r1bqkb1r/ppp2ppp/2np1n2/1B2p3/4P3/3P1N2/PPP2PPP/RNBQK2R w KQkq -',The moves happened were still according to the book.
437,24,1,c3,b'r1bqkb1r/ppp2ppp/2np1n2/1B2p3/4P3/2PP1N2/PP3PPP/RNBQK2R b KQkq -',This move might be to take some domination over the center and to prevent the black horse either to b4 or d4.
438,24,2,Nbd2,b'r1bqkb1r/ppp2p1p/2np1np1/1B2p3/4P3/2PP1N2/PP1N1PPP/R1BQK2R b KQkq -',How about 6.d4 which threatens with 7.d5 to the pinned horse? 6.Be3 also not bad.
439,24,3,Bg7,b'r1bqk2r/ppp2pbp/2np1np1/1B2p3/4P3/2PP1N2/PP1N1PPP/R1BQK2R w KQkq -',Preparation to the castling and to get rid of the annoying pin.
440,24,4,Nf1,b'r1bqk2r/ppp2pbp/2np1np1/1B2p3/4P3/2PP1N2/PP3PPP/R1BQKN1R b KQkq -',Either to create pressure on d5 with 8.Ne3 or to make a defense wall with 8.Ng3.
441,24,5,Ba4,b'r1bq1rk1/ppp2pbp/2np1np1/4p3/B3P3/2PP1N2/PP3PPP/R1BQKN1R b KQ -',I could not find a considerable reason for that retreat. If he needed to put it on a2-g8 diagonal he could simply put 8.Bc4. 8.Bxc6 also seems no bad. Might be he needed to avoid 8...a6.
442,24,6,Nc5,b'r1bq1rk1/ppp2pbp/2np2p1/2n1p3/B3P3/2PPNN2/PP3PPP/R1BQK2R w KQ -',Do two consecutive horse moves worth only to attack a bishop? If needed so how about 8...a6 and 9...b5 which does the same? It seems pretty good than the actual.
443,24,7,Ne7,b'r1bq1rk1/ppp1npbp/3pn1p1/4p3/4P2P/2PPNN2/PPB2PP1/R1BQK2R w KQ -',Too many consecutive horse moves are made by black.
444,24,8,1h5,b'r1bq1rk1/ppp1npbp/3pn1p1/4p2P/4P3/2PPNN2/PPB2PP1/R1BQK2R b KQ -',First signs of an attack to the black king.
445,24,9,1d5,b'r1bq1rk1/ppp1npbp/4n1p1/3pp2P/4P3/2PPNN2/PPB2PP1/R1BQK2R w KQ -',It was a better move if it was done before the Nf6 was moved thrice.
446,24,10,1hxg6,b'r1bq1rk1/ppp1npbp/4n1P1/3pp3/4P3/2PPNN2/PPB2PP1/R1BQK2R b KQ -',Have a notice at the open h-file. Steinitz is about to launch an attack.
447,24,11,1Bb3,b'r1b2rk1/ppp3bp/4n1p1/3qp3/8/1BPP1N2/PP3PP1/R1BQK2R b KQ -',The light squared bishop is emerging a strong diagonal. In comparison what does the Bc8 doing? It is obvious that Bc1 could be easily moved either to e3 or h6.
448,24,12,Bd7,b'r4rk1/pppb2bp/2q1n1p1/4p3/8/1BPP1N2/PP2QPP1/R1B1K2R w KQ -',Finally it is moved but can you see any good squares to it? I do not think.
449,24,13,Kh8,b'r4r1k/pppb2bp/2q1n1p1/4p3/8/1BPPBN2/PP2QPP1/R3K2R w KQ -',Might be to take the opportunity to move the Ne6.
450,24,14,Rae8,b'4rr1k/pppb2bp/2q1n1p1/4p3/8/1BPPBN2/PP2QPP1/2KR3R w - -',Making more power on the e-file and defending the isolated e-pawn.
451,24,15,2d4,b'4rr1k/1ppb2bp/2q1n1p1/p3p3/3P4/1BP1BN2/PP3PP1/2KR1Q1R b - -',Steinitz was finding more ways to reach the black king.
452,24,16,2Rxd4,b'4rr1k/1ppb2bp/2q3p1/p7/3R4/1BP1B3/PP3PP1/2K2Q1R b - -',Is this a good move? Yes it is. In the first look it might be proceed as 23...Bxd4 24.Bxd4+ Rf6 25.Bxf6+ Qxf6 where the material is equal for both sides. Can you see the BEST reply there? After 23...Bxd4 it is a wonderful mate in 7. But the game was ended in 6 moves.
453,24,17,2Bxd4,b'4rr1k/1ppb3p/2q3p1/p7/3b4/1BP1B3/PP3PP1/2K2Q1R w - -',There you see Tchaigorin was caught. The continuation is really interesting.
454,24,18,Kxh7,b'4rr2/1ppb3k/2q3p1/p7/3b4/1BP1B3/PP3PP1/2K2Q2 w - -',Tchaigon was forced to swap off that rook.
455,24,19,Kg7,b'4rr2/1ppb2k1/2q3p1/p7/3b4/1BP1B3/PP3PP1/2K4Q w - -',25...Bh3 instead of 25...Kg7 would prolong the game by one more move.
456,24,20,2Bh6+,b'4rr2/1ppb2k1/2q3pB/p7/3b4/1BP5/PP3PP1/2K4Q b - -',26...Kh7 or 26...Kh8 ends the game immediately with 27.Bxf8#. Alternatively 26.Qh6+ is also mate in 4 can you see how?
457,24,21,Ke5,b'4rr2/1ppb4/2q3pB/p3k3/3b3Q/1BP5/PP3PP1/2K5 w - -',Every option for this move is no longer than mate in 2.
458,24,22,2Qf4#,b'4rr2/1ppb4/2q3pB/p4k2/5Q2/1BP5/PP3PP1/2K5 b - -',Finally nowhere to the wandering king CHECKMATE!!
459,25,0,e4,b'rnbqkbnr/pppppppp/8/8/4P3/8/PPPP1PPP/RNBQKBNR b KQkq e3',My usual.
460,25,1,Nf3,b'rnbqkbnr/pppp1ppp/8/4p3/4P3/5N2/PPPP1PPP/RNBQKB1R b KQkq -',Thought I might play a little aggressive.
461,25,2,d6,b'r1bqkbnr/ppp2ppp/2np4/1B2p3/4P3/5N2/PPPP1PPP/RNBQK2R w KQkq -',Pinning his Knight.
462,25,3,Nxd4,b'r1bqkbnr/ppp2ppp/2np4/1B6/3NP3/8/PPP2PPP/RNBQK2R b KQkq -',I don't think he saw the pin or else Bd7 may have come earlier.
463,25,4,Nf6,b'r2qkb1r/pppb1ppp/3p1n2/8/2BQP3/8/PPP2PPP/RNB1K2R w KQkq -',I'll trade a pawn to check.
464,25,5,1O-O,b'r2q1rk1/pppbbppp/5n2/4Q1B1/2B5/8/PPP2PPP/RN3RK1 b - -',Now that the middle game is here (it may have been here before) you can see that it is quite an open game.
465,25,6,1Qxf4,b'r2qr1k1/pppb1ppp/5n2/8/2B2Q2/8/PPP2PPP/RN3RK1 b - -',I need his Bishop pair gone.
466,25,7,1Bxf7+,b'r2qr1k1/pppb1Bpp/8/7n/5Q2/8/PPP2PPP/RN3RK1 b - -',I thought about doing it with my Queen but I decided against it.
467,25,8,1Bxh5,b'r2qr2k/pppb2pp/8/7B/5Q2/8/PPP2PPP/RN3RK1 b - -',Bxe8?? loses to Nxf4.
468,25,9,1Nc3,b'r2q1rk1/ppp3pp/2b5/4Q2B/8/2N5/PPP2PPP/R4RK1 b - -',Connecting my Rooks.
469,25,10,2Qf7+,b'r2qr3/ppp1kQ1p/2b1B1p1/8/8/2N5/PPP2PPP/R4RK1 b - -',"Here my opponent disconnected but I do not think that it was by accident.
Thanks for watching please rate and comment."
470,26,0,e6,b'rnbqkbnr/pp1p1ppp/4p3/2p5/3PP3/8/PPP2PPP/RNBQKBNR w KQkq -',I now notice that I should have taken the Queen Pawn. 
471,26,1,d5,b'rnbqkbnr/pp1p1ppp/4p3/2pP4/4P3/8/PPP2PPP/RNBQKBNR b KQkq -',Never saw this comming.
472,26,2,exd5,b'rnbqkbnr/pp1p1ppp/8/2pp4/4P3/8/PPP2PPP/RNBQKBNR w KQkq -',"So I took.
"
473,26,3,Qxd5,b'rnbqkbnr/pp1p1ppp/8/2pQ4/4P3/8/PPP2PPP/RNB1KBNR b KQkq -',I don't see point of this.
474,26,4,Nf6,b'rnbqkb1r/pp1p1ppp/5n2/2pQ4/4P3/8/PPP2PPP/RNB1KBNR w KQkq -',Threatening the pawn and Queen while developing.
475,26,5,Qe5+,b'rnbqkb1r/pp1p1ppp/5n2/2p1Q3/4P3/8/PPP2PPP/RNB1KBNR b KQkq -',Forgot this move.
476,26,6,Be7,b'rnbqk2r/pp1pbppp/5n2/2p1Q3/4P3/8/PPP2PPP/RNB1KBNR w KQkq -',I probably should have traded the Queen.
477,26,7,d6,b'rnbqk2r/pp2bppp/3p1n2/2p1Q3/4P3/4B3/PPP2PPP/RN2KBNR w KQkq -',Forced.
478,26,8,Nxe4,b'rnbqk2r/pp2bppp/3p4/2p3Q1/4n3/4B3/PPP2PPP/RN2KBNR w KQkq -',A good move!
479,26,9,Qxg7,b'rnbqk2r/pp2bpQp/3p4/2p5/4n3/4B3/PPP2PPP/RN2KBNR b KQkq -',Good move!
480,26,10,Bf8,b'rnbqkb1r/pp3pQp/3p4/2p5/4n3/4B3/PPP2PPP/RN2KBNR w KQkq -',I messed up.
481,26,11,1Bxc6+,b'r1bqkb1Q/1p3p1p/p1Bp4/2p5/4n3/4B3/PPP2PPP/RN2K1NR b KQq -',Forced.
482,26,12,Nf6,b'r1bqkb2/5p1Q/p1pp1n2/2p5/8/4B3/PPP2PPP/RN2K1NR w KQq -',Threatening the Queen.
483,26,13,1Bd2,b'r1b1kb2/5p2/p1pp4/q1pn4/7Q/2P5/PP1B1PPP/RN2K1NR b KQq -',Good move!
484,26,14,1Be7,b'r1b1k3/4bp2/p1pp4/q1pn4/7Q/2P5/PP1B1PPP/RN2K1NR w KQq -',Works.
485,26,15,1Qh8+,b'r1b1k2Q/4bp2/p1pp4/q1pn4/8/2P5/PP1B1PPP/RN2K1NR b KQq -',Unusual but works.
486,26,16,1c4,b'r1b1kb1Q/5p2/p1pp4/q1pn4/2P5/8/PP1B1PPP/RN2K1NR b KQq -',Finaly.
487,26,17,2Bxb4,b'r4b1Q/4kp2/p1ppb3/q1p5/1BP5/P7/1P3PPP/RN1K2NR b - -',Never takes the way you want.
488,26,18,Bg7,b'r7/4k1b1/p1ppbp2/q7/1pP4Q/PP3P2/4N1PP/RN1K3R w - -',Sets up...
