,gid,aid,move,fen,annotation
651,19,2,Nf3,b'rnbqkbnr/pppp1ppp/8/4p3/4P3/5N2/PPPP1PPP/RNBQKB1R b KQkq -',So I bring out my Knight.  What happened?  I told my opponent that development is extremely important in a chess game.  That one should get his pieces out ASAP.  With that in mind I also said that this was the cornerstone of development.  In addition I noted that minor pieces (Knights and Bishops) should be developed before the major pieces (Rook and Queen).  In fact the Queen should be the last thing that comes out.
652,19,3,d6,b'rnbqkbnr/ppp2ppp/3p4/4p3/4P3/5N2/PPPP1PPP/RNBQKB1R w KQkq -',He responds by bringing out his d pawn.  I was actually hoping that he would bring out his b8 Knight so that I could play the Ruy Lopez (3.Bb5).  However because that did not happen I have a different response.  What is it?  I also told him that this was not the best as it crams his DSB.  So he will have to waist time to bring it out later on.  @flutie39: Better was 2...Nc6 or 2...Nf6 in this position.
653,19,4,d4,b'rnbqkbnr/ppp2ppp/3p4/4p3/3PP3/5N2/PPP2PPP/RNBQKB1R b KQkq d3',Oh yeah.  I told my opponent that this is the response to his last move.  How did I learn this?  It was actually from a previous annotation by one of the commentators.  That annotation however involved my game against aluke42.  Later on cdeburca told me that d4 is usually best in the beginning if your opponent only advances one square.  The French Defense is an example (1.e4 d6 2.d4.)  And black was correct about the logic behind this.  He guessed that it opened up other lines and variations for an attack.  BTW at this point he thinks that I am a very good coach and he is beginning to understand the positions extremely well.  That is one of my goals.  I want to get him familiar so that he can study analyze and think about the positions.  This is something it takes to be a strong chess player.
654,19,5,a5,b'rnbqkbnr/1pp2ppp/3p4/p3p3/3PP3/5N2/PPP2PPP/RNBQKB1R w KQkq a6',"I am not sure why he played this.  But I told him that 3...exd4 is most common in this position.  Then white generally responds with 4.Nxe4 and everything is even without weakening the position.  This however is not a great move because it loses his e5 pawn pawn with 4.dxe5.  And if white responds with 4...dxe5 5.Qxd8 Kxd8 ultimately losing the chance to castle.  I mentioned that castling is a very important aspect as it protects the King ""Tucks the monarch away"" as it is said."
655,19,6,b6,b'rnbqkbnr/2p2ppp/1p1p4/p3P3/4P3/5N2/PPP2PPP/RNBQKB1R w KQkq -',! Of course 4...Nc6 was also playable but I told him that this move is solid.  Why?  In this position he is prepared to develop his LSB.
656,19,7,Nc3,b'rnbqkbnr/2p2ppp/1p1p4/p3P3/4P3/2N2N2/PPP2PPP/R1BQKB1R b KQkq -',So I develop my Knight just in case he fianchetto's his LSB to plan an attack against my e4 pawn.
657,19,8,Na6,b'r1bqkbnr/2p2ppp/np1p4/p3P3/4P3/2N2N2/PPP2PPP/R1BQKB1R w KQkq -',He decides on this move.  Best however was 5...Nc6 as it is still a developing move (a move that also continues with development.  I explained that concept to him and the fact that a Knight on a rim is grim.  Why?  It generally makes a knight vulnerable to attack gives it less room to escape from danger and reduces it's value (makes it worth less).
658,19,9,Bc4,b'r1bqkbnr/2p2ppp/np1p4/p3P3/2B1P3/2N2N2/PPP2PPP/R1BQK2R b KQkq -',In the meantime I am still determined to castle so I decide to continue with development.  This move also pins his f7 pawn and he cannot attack my LSB as it is protected by that piece and my e4 pawn.  As I explained to him it is extremely important to develop all of your pieces in a chess game.
659,19,10,Nc5,b'r1bqkbnr/2p2ppp/1p1p4/p1n1P3/2B1P3/2N2N2/PPP2PPP/R1BQK2R w KQkq -',"So he is still determined to attack the pawn and bring his Knight on the right square.  I told him that this is where the Knight should be but that previous move caused him to move it twice.  I mentioned that you generally should not move the same piece twice during the beginning.  Why?  It takes away development because you're busy moving that piece multiple times instead of developing.  I told him the same thing that schakertjie told me in a different annotation.  What is it?  ""Your main goal should be to develop develop develop"".  "
660,19,11,O-O,b'r1bqkbnr/2p2ppp/1p1p4/p1n1P3/2B1P3/2N2N2/PPP2PPP/R1BQ1RK1 b kq -',In the meantime I do not waste time to castle.
661,19,12,Nxe4,b'r1bqkbnr/2p2ppp/1p1p4/p3P3/2B1n3/2N2N2/PPP2PPP/R1BQ1RK1 w kq -',"?? He thought that this move would win a free pawn.  This however is his first serious mistake.  Why?  As a direct result I will take back and win his Knight in return.  Therefore he just gave up away piece for a pawn.  Master elyhim has told me ""exchange pawns not pieces.""   After this move my opponent said ""Protected I think I meant the king your king is now protected in the corner Damn I totally missed that I was jeopardizing my knight for your pawn...an error for sure.""  Then I told him that the King was protected and that is why one should castle early and often.  I also told him the definition of general principles.  That General Opening Priniciples=guidelines to help you in the opening.  I told him that one of those guidelines was not moving the same piece twice.  Afterall I am little more developed so I am also a little more prepared and ready as we will see later on.  He said ""Great Advice"".


"
662,19,13,Nh6,b'r1bqkb1r/2p2ppp/1p1p3n/p3P3/2B1N3/5N2/PPP2PPP/R1BQ1RK1 w kq -',So he places his Knight on the rim.  In this case however I told him that a Knight on the rim is dim.  In other words this is best as 8...Ne7 blocks his Queen and DSB for later on and 8...Nf6 looses another Knight for a different pawn.  If he leaves it there however where is the development?  In other words the Knight has to come out somehow and someway.
663,19,14,Bf4,b'r1bqkb1r/2p2ppp/1p1p3n/p3P3/2B1NB2/5N2/PPP2PPP/R2Q1RK1 b kq -',Now I am thinking about another move like Ng5 with one of my Knights but I would like to prevent my Knight from traveling twice at this point in time to set a good example for my opponent.  I also think about playing Qd5 but don't as that would put my Queen in danger and because of what I mentioned in my last sentence.  Therefore I bring out my other bishop.  As I told the opponent this is part of getting all your pieces out.  This move however completely controls the center.  I also mentioned why we want to develop in chess.  One of the goals is to control the center.
664,19,15,Ng4,b'r1bqkb1r/2p2ppp/1p1p4/p3P3/2B1NBn1/5N2/PPP2PPP/R2Q1RK1 w kq -',? I am not sure why he moved there.  However he is still moving the same piece more then once and I told him that this is another mistake.  Why?
665,19,16,1Nfg5,b'r1bqkb1r/2p2ppp/1p1p4/p3P1N1/2B1NBn1/8/PPP2PPP/R2Q1RK1 b kq -',!! Because of this.  BTW this is where I told him that it is ok to move the same piece more then once after the center is controlled.  Now if he takes my Knight 11.Bxg5 so pieces are exchanged.  When you are behind you generally don't want to exchange.  However accepting an exchange is best in this position as we will see momentarily.  Therefore this is a move that deserves two exclamation points as it is extraordinarily brilliant and very well spotted because of what I have in store for him.  
666,19,17,1Be7,b'r1bqk2r/2p1bppp/1p1p4/p3P1N1/2B1NBn1/8/PPP2PPP/R2Q1RK1 w kq -',I understand this move very well.  He wants to castle and is a little worried that I might try to mate him.  However that is not my intention in this position.  With this move I told him that although exchanging is not usually a good idea when you are down material this is an exception.  I also could respond with 11.Nxe7 winning his h8 rook and f7 pawn.  However 11.Bxf7+ is even better.  Why?  Taking with my Knight would still give him a chance to castle Queenside if he completes development.  Although I won't get nearly as much by taking with the bishop this move loses a pawn and his opportunity to castle.  That is why 10.Nfg5!! was extraordinarily brilliant.  Because of this his center is virtually destroyed but I am almost completely developed.  
667,19,18,1Bd5,b'r1bq1k1r/2p1b1pp/1p1p4/p2BP1N1/4NBn1/8/PPP2PPP/R2Q1RK1 b - -',So I pull the bishop back.  Normally I don't want my pieces to get attacked as it wastes tempo.  However this is an exception because of what I just outlined earlier.  Now I have a winning edge even though the game is not lost for black.  Why?  Being a piece ahead is often the difference between a win and loss.
668,19,19,1Ba6,b'r2q1k1r/2p1b1pp/bp1p4/p2BP1N1/4NBn1/8/PPP2PPP/R2Q1RK1 w - -',"?? I'm not sure why he moved here but this is his loosing blunder.  BTW I told him that 12.Bb7 was better.  @flutie39: I apologize for that.  Why?  That would not have been any better.  As it turns out 12...Qe8 was best and still keeps you in the game.  It would have been the only way the protect the Queen and still loses a Rook.  As it turns out however this move loses his Queen and a8 Rook for my g5 Knight after 13.Ne6+.  That is because Ne6 forks the King and Queen so black is forced to get himself out of check.  And he cannot do this with his Queen.  Then he asked ""And I should have been looking for vulnerability of my Queen...""  @flutie39: Yes.  It is always important to be aware of the dangers that lie ahead.
"
669,19,20,Kd7,b'B6r/2pkb1pp/bp1p4/p3P3/4NBn1/8/PPP2PPP/R2Q1RK1 w - -',?? In this position he is trying to win my LSB.  However as mentioned earlier it is always important to see the threat.  @flutie39: This is a perfect example.  Having said that this move is another big mistake as it loses another piece and pawn after placing him in check.
670,19,21,Rf8,b'B3kr2/2p1b1Qp/bp1p4/p3P3/4NB2/8/PPP2PPP/R4RK1 w - -',Now he is forced to protect his Rook.
671,19,22,1Bc6+,b'4kr2/2p1b1Qp/bpBp4/p3P3/4NB2/8/PPP2PPP/R4RK1 b - -',Now I am setting up a good attack against him given that I am completely developed.  This is the cornerstone of the attack.
672,19,23,1Bg5,b'3k1r2/2p1b1Qp/bpBp4/p3P1B1/4N3/8/PPP2PPP/R4RK1 b - -',So I do not waste time to pin his DSB.  In fact this move wins his bishop.  I took that into account before making this move.
673,19,24,Rg8,b'2k3r1/2p1Q2p/bpBp4/p3P1B1/4N3/8/PPP2PPP/R4RK1 w - -',"?? I'm not sure why he moved there but I accurately told him that 20...Rh8 was best.  Then he asked ""Why would Rh8 be better?""  As a result I pointed out that anything else just loses the Rook.  Therefore this move should have won his other rook.  However I missed that opportunity with my next move.  Note: Even coaches and/or mentors miss opportunities.  This happened in one of my games against Jack Stockel.  After I missed a threat he said that he could have taken a piece but overlooked that opportunity.  In addition if my opponents rook leaves the eighth rank it's mate in one.  "
674,19,25,2e6,b'2k3r1/2p1Q2p/bpBpP3/p5B1/4N3/8/PPP2PPP/R4RK1 b - -',This is how I overlook my chance.  Instead 21.Qe6+ should have been played.  That move would have forked his King and remaining Rook.  Then this would have happened 21...Kb8 (forced) 22.Qxg8+ so that he has to respond with Bc8 in order to avoid mate.  
675,19,26,2d5,b'2k3r1/2p1Q2p/bpB1P3/p2p2B1/4N3/8/PPP2PPP/R4RK1 w - -',So he decides to attack my Knight.
676,19,27,2Nf6,b'2k3r1/2p1Q2p/bpB1PN2/p2p2B1/8/8/PPP2PPP/R4RK1 b - -',And I respond by attacking his Rook.
677,19,28,2Rxg5,b'2k5/2p1Q2p/bpB1PN2/p2p2r1/8/8/PPP2PPP/R4RK1 w - -',"?? I understand why he made this move.  It wins a free piece but as the master mater and Master elyhim would say ""To take is a mistake"".  Having said that this was a move that I did not expect.  Unlike most games in a coaching game I always hope that my opponent will make the best move not the worst.  Having said that I told my opponent that 22...Rh8 was best as it still protects his Rook and prevents what I am going to do next.  What is my intention?  This time unlike move 21 I am not going to miss my opportunity as I now have a mate in one after 23.Qe8#.  "
678,19,29,2Qe8#,b'2k1Q3/2p4p/bpB1PN2/p2p2r1/8/8/PPP2PPP/R4RK1 b - -',"BTW I heard about flutie39 before this game from jstevens1.  As it turns out he is also in the ""Walking the Walk and Learning How to Run"" club.  Overall he played extremely well but made two serious mistakes that ended this game.  In fact I believe that he played far north of his rating.  If I had to evaluate I would say that he played more like a 950 rated player then 825.  In general however you want to develop and get your pieces out ASAP. The other thing is that you always want to be careful of your opponents intention.  Afterall his or her plans are just as important as your own.  @flutie39: I believe that you are on a northward trend.  Therefore if you can remember this game and the moral it is extremely likely that your rating will reach 1000 within a year.  Note: I always have optimisim and ""The glass is half full not half empty"" as they say."
679,20,0,e4,b'rnbqkbnr/pppppppp/8/8/4P3/8/PPPP1PPP/RNBQKBNR b KQkq e3',So here I was up against the highest rated player in the tournament
680,20,1,c5,b'rnbqkbnr/pp1ppppp/8/2p5/4P3/8/PPPP1PPP/RNBQKBNR w KQkq c6',So I reply with my usual
681,20,2,Nf3,b'rnbqkbnr/pp1ppppp/8/2p5/4P3/5N2/PPPP1PPP/RNBQKB1R b KQkq -',He follows the main line
682,20,3,Nc6,b'r1bqkbnr/pp1ppppp/2n5/2p5/4P3/5N2/PPPP1PPP/RNBQKB1R w KQkq -',and so do I
683,20,4,d4,b'r1bqkbnr/pp1ppppp/2n5/2p5/3PP3/5N2/PPP2PPP/RNBQKB1R b KQkq d3',He continues with the Open Sicilian
684,20,5,cxd4,b'r1bqkbnr/pp1ppppp/2n5/8/3pP3/5N2/PPP2PPP/RNBQKB1R w KQkq -',So I take
685,20,6,Nxd4,b'r1bqkbnr/pp1ppppp/2n5/8/3NP3/8/PPP2PPP/RNBQKB1R b KQkq -',He takes back
686,20,7,Nf6,b'r1bqkb1r/pp1ppppp/2n2n2/8/3NP3/8/PPP2PPP/RNBQKB1R w KQkq -',I hit the e pawn
687,20,8,Nc3,b'r1bqkb1r/pp1ppppp/2n2n2/8/3NP3/2N5/PPP2PPP/R1BQKB1R b KQkq -',He defends
688,20,9,d6,b'r1bqkb1r/pp2pppp/2np1n2/8/3NP3/2N5/PPP2PPP/R1BQKB1R w KQkq -',I stop ideas such as Nd4xNc6 followed by e5. All this is very standard
689,20,10,Bg5,b'r1bqkb1r/pp2pppp/2np1n2/6B1/3NP3/2N5/PPP2PPP/R2QKB1R b KQkq -',And this is the most popular too the RichterRauzer Attack. The move 6.Bg5 was Kurt Richter's invention threatening to double Black's pawns after Bxf6 and forestalling the Dragon by rendering 6...g6 unplayable as g6 is simply met by BxNf6 and after exf6 Black's pawns are a mess the d6 pawn in particular being isolated and backward on a semi-open file and the d5 square is open for White's pieces.
690,20,11,Bd7,b'r2qkb1r/pp1bpppp/2np1n2/6B1/3NP3/2N5/PPP2PPP/R2QKB1R w KQkq -',I follow a suggestion by Barden
691,20,12,f4,b'r2qkb1r/pp1bpppp/2np1n2/6B1/3NPP2/2N5/PPP3PP/R2QKB1R b KQkq f3',He continues to develop
692,20,13,a6,b'r2qkb1r/1p1bpppp/p1np1n2/6B1/3NPP2/2N5/PPP3PP/R2QKB1R w KQkq -',I start queen side operations. Qb6 is probably stronger taking advantage of the fact this his Bg5 can't defend dark squares in the centre.
693,20,14,Qd2,b'r2qkb1r/1p1bpppp/p1np1n2/6B1/3NPP2/2N5/PPPQ2PP/R3KB1R b KQkq -',He prepares to castle
694,20,15,b5,b'r2qkb1r/3bpppp/p1np1n2/1p4B1/3NPP2/2N5/PPPQ2PP/R3KB1R w KQkq b6',I continue to expand on the queen side
695,20,16,O-O-O,b'r2qkb1r/3bpppp/p1np1n2/1p4B1/3NPP2/2N5/PPPQ2PP/2KR1B1R b kq -',He castles
696,20,17,b4,b'r2qkb1r/3bpppp/p1np1n2/6B1/1p1NPP2/2N5/PPPQ2PP/2KR1B1R w kq -',So I hit his knight. Now he can play 10. Bg5xNf6 as after bxNc3 hitting the white queen White can play 11. Qd2xc3 and after gxBf6 play 12. Nd4xNc6 winning a pawn. However Black can reply with Qc7 and after White retreats his knight exchange queens on c3 and the position is about level. Black has compensation for being a pawn down as White's queen side pawns are smashed. This was better for White compared to what happened where White ends up a pawn down AND a broken pawn formation.
697,20,18,1Nd5,b'r2qkb1r/3bpppp/p1np1n2/3N2B1/1p1NPP2/8/PPPQ2PP/2KR1B1R b kq -',So he keeps his knight
698,20,19,1Nxe4,b'r2qkb1r/3bpppp/p1np4/3N2B1/1p1NnP2/8/PPPQ2PP/2KR1B1R w kq -',But loses a pawn and his queen and bishop are forked
699,20,20,1Qe3,b'r2qkb1r/3bpppp/p1np4/3N2B1/1p1NnP2/4Q3/PPP3PP/2KR1B1R b kq -',So he moves his queen
700,20,21,1Nxg5,b'r2qkb1r/3bpppp/p1np4/3N2n1/1p1N1P2/4Q3/PPP3PP/2KR1B1R w kq -',I take his bishop
701,20,22,1fxg5,b'r2qkb1r/3bpppp/p1np4/3N2P1/1p1N4/4Q3/PPP3PP/2KR1B1R b kq -',He takes back
702,20,23,1a5,b'r2qkb1r/3bpppp/2np4/p2N2P1/1p1N4/4Q3/PPP3PP/2KR1B1R w kq -',I secure my b pawn releasing the Nc6 from protecting it and preparing the following move
703,20,24,1Bc4,b'r2qkb1r/3bpppp/2np4/p2N2P1/1pBN4/4Q3/PPP3PP/2KR3R b kq -',He develops
704,20,25,1Ne5,b'r2qkb1r/3bpppp/3p4/p2Nn1P1/1pBN4/4Q3/PPP3PP/2KR3R w kq -',I hit his bishop and prevent any nonsense down the e file.
705,20,26,1Be2,b'r2qkb1r/3bpppp/3p4/p2Nn1P1/1p1N4/4Q3/PPP1B1PP/2KR3R b kq -',So he retreats his bishop
706,20,27,1g6,b'r2qkb1r/3bpp1p/3p2p1/p2Nn1P1/1p1N4/4Q3/PPP1B1PP/2KR3R w kq -',and I prepare to put my bishop on g7 protecting Ne5 and also with an idea of an attack along the long dark diagonal.
707,20,28,1Nf3,b'r2qkb1r/3bpp1p/3p2p1/p2Nn1P1/1p6/4QN2/PPP1B1PP/2KR3R b kq -',So he tries to exchange my strong knight
708,20,29,1Bg7,b'r2qk2r/3bppbp/3p2p1/p2Nn1P1/1p6/4QN2/PPP1B1PP/2KR3R w kq -',and I strengthen it
709,20,30,1Nb6,b'r2qk2r/3bppbp/1N1p2p1/p3n1P1/1p6/4QN2/PPP1B1PP/2KR3R b kq -',He now takes the opportunity to get rid of one of my bishops
710,20,31,1Rb8,b'1r1qk2r/3bppbp/1N1p2p1/p3n1P1/1p6/4QN2/PPP1B1PP/2KR3R w k -',so I hit the knight
711,20,32,1Nxd7,b'1r1qk2r/3Nppbp/3p2p1/p3n1P1/1p6/4QN2/PPP1B1PP/2KR3R b k -',He takes
712,20,33,1Qxd7,b'1r2k2r/3qppbp/3p2p1/p3n1P1/1p6/4QN2/PPP1B1PP/2KR3R w k -',I take back
713,20,34,1h4,b'1r2k2r/3qppbp/3p2p1/p3n1P1/1p5P/4QN2/PPP1B1P1/2KR3R b k h3',He tries to do something on the king side
714,20,35,1O-O,b'1r3rk1/3qppbp/3p2p1/p3n1P1/1p5P/4QN2/PPP1B1P1/2KR3R w - -',I castle
715,20,36,1Rhe1,b'1r3rk1/3qppbp/3p2p1/p3n1P1/1p5P/4QN2/PPP1B1P1/2KRR3 b - -',This was a bit of a surprise. h5 seemed more consistent
716,20,37,1Qa4,b'1r3rk1/4ppbp/3p2p1/p3n1P1/qp5P/4QN2/PPP1B1P1/2KRR3 w - -',so my queen mobilises. Can you see what I am dreaming of?
717,20,38,2Kb1,b'1r3rk1/4ppbp/3p2p1/p3n1P1/qp5P/4QN2/PPP1B1P1/1K1RR3 b - -',Is the king any safer here?
718,20,39,2Rfc8,b'1rr3k1/4ppbp/3p2p1/p3n1P1/qp5P/4QN2/PPP1B1P1/1K1RR3 w - -',I continue to mobilise
719,20,40,2Rdc1,b'1rr3k1/4ppbp/3p2p1/p3n1P1/qp5P/4QN2/PPP1B1P1/1KR1R3 b - -',and he protects c2
720,20,41,2Ng4,b'1rr3k1/4ppbp/3p2p1/p5P1/qp4nP/4QN2/PPP1B1P1/1KR1R3 w - -',Ihit his queen sacrificing my e7 pawn. I thought he couldn't take it and was expecting another queen move however.....
721,20,42,2Qxe7,b'1rr3k1/4Qpbp/3p2p1/p5P1/qp4nP/5N2/PPP1B1P1/1KR1R3 b - -',OK pause and find my next move!
722,20,43,2Qa3,b'1rr3k1/4Qpbp/3p2p1/p5P1/1p4nP/q4N2/PPP1B1P1/1KR1R3 w - -',I thought I was clearly winning. The threat is Qxb2 mate. If he takes my queen I take back with the pawn discovered check and mate in 2. I couldn't see any defence for White. So pause again and work out what White did play.
723,20,44,2Ne5,b'1rr3k1/4Qpbp/3p2p1/p3N1P1/1p4nP/q7/PPP1B1P1/1KR1R3 b - -',This must be his best shot. If I take with the bishop then he takes my bishop with his queen and after I take take back he can take my queen and this time there is no mate. But what if I take with my knight?
724,20,45,2Nxe5,b'1rr3k1/4Qpbp/3p2p1/p3n1P1/1p5P/q7/PPP1B1P1/1KR1R3 w - -',so I tried this
725,20,46,2bxa3,b'1rr3k1/4Qpbp/3p2p1/p3n1P1/1p5P/P7/P1P1B1P1/1KR1R3 b - -',He takes
726,20,47,2bxa3+,b'1rr3k1/4Qpbp/3p2p1/p3n1P1/7P/p7/P1P1B1P1/1KR1R3 w - -',I take
727,20,48,2Ka1,b'1rr3k1/4Qpbp/3p2p1/p3n1P1/7P/p7/P1P1B1P1/K1R1R3 b - -',King runs
728,20,49,2Nc6+,b'1rr3k1/4Qpbp/2np2p1/p5P1/7P/p7/P1P1B1P1/K1R1R3 w - -',This is ok but lets White escape into an ending. Nd7 was probably better
729,20,50,2Qf6,b'1rr3k1/5pbp/2np1Qp1/p5P1/7P/p7/P1P1B1P1/K1R1R3 b - -',so he blocks the check
730,20,51,2Bxf6+,b'1rr3k1/5p1p/2np1bp1/p5P1/7P/p7/P1P1B1P1/K1R1R3 w - -',I take
731,20,52,2gxf6,b'1rr3k1/5p1p/2np1Pp1/p7/7P/p7/P1P1B1P1/K1R1R3 b - -',He takes
732,20,53,2Rb2,b'2r3k1/5p1p/2np1Pp1/p7/7P/p7/PrP1B1P1/K1R1R3 w - -',I take the 7th rank
733,20,54,2Bf3,b'2r3k1/5p1p/2np1Pp1/p7/7P/p4B2/PrP3P1/K1R1R3 b - -',Bishop mobilises
734,20,55,2Ne5,b'2r3k1/5p1p/3p1Pp1/p3n3/7P/p4B2/PrP3P1/K1R1R3 w - -',Knight advances threatening R(either!)xc2
735,20,56,2c3,b'2r3k1/5p1p/3p1Pp1/p3n3/7P/p1P2B2/Pr4P1/K1R1R3 b - -',He prevents that but runs into....
736,20,57,2Nd3,b'2r3k1/5p1p/3p1Pp1/p7/7P/p1Pn1B2/Pr4P1/K1R1R3 w - -',Picking up the exchange. White resigns. Many thanks for looking at this please rate my annotation on the star system and leave some comments so I know how I am doing. Please remember that this was a quick-play game both sides had just 15 minutes each to make all moves. Until next time!
737,21,0,d4,b'rnbqkbnr/pppppppp/8/8/3P4/8/PPP1PPPP/RNBQKBNR b KQkq d3',I think 1. d4 is very common. Usually I play 1 ... d5 but today I shall decide to do something different.
738,21,1,Nf6,b'rnbqkb1r/pppppppp/5n2/8/3P4/8/PPP1PPPP/RNBQKBNR w KQkq -',I'm not sure if this is the right knight but I don't think I'll regret it too much.
739,21,2,Nc3,b'rnbqkb1r/pppppppp/5n2/8/3P4/2N5/PPP1PPPP/R1BQKBNR b KQkq -',White develops a knight. This protects the e4 square.
740,21,3,d5,b'rnbqkb1r/ppp1pppp/5n2/3p4/3P4/2N5/PPP1PPPP/R1BQKBNR w KQkq d6',But I won't let white take care of the centre that easily. 
741,21,4,Nf3,b'rnbqkb1r/ppp1pppp/5n2/3p4/3P4/2N2N2/PPP1PPPP/R1BQKB1R b KQkq -',White develops another knight. 
742,21,5,Nc6,b'r1bqkb1r/ppp1pppp/2n2n2/3p4/3P4/2N2N2/PPP1PPPP/R1BQKB1R w KQkq -',I do the same. I am just trying to develop my pieces and take control of the centre as everybody usually does. 
743,21,6,Bd2,b'r1bqkb1r/ppp1pppp/2n2n2/3p4/3P4/2N2N2/PPPBPPPP/R2QKB1R b KQkq -',I think this is an intresting move. It will be hard to develop the queen and connect the rooks though.
744,21,7,Bf5,b'r2qkb1r/ppp1pppp/2n2n2/3p1b2/3P4/2N2N2/PPPBPPPP/R2QKB1R w KQkq -',First develop my LSB so I am then ready to play e6
745,21,8,e3,b'r2qkb1r/ppp1pppp/2n2n2/3p1b2/3P4/2N1PN2/PPPB1PPP/R2QKB1R b KQkq -',This move lets white's LSB out but blocks the DSB. Anything better?
746,21,9,Bb5,b'r2qkb1r/ppp2ppp/2n1pn2/1B1p1b2/3P4/2N1PN2/PPPB1PPP/R2QK2R b KQkq -',Pinning my knight and getting ready to castle. 
747,21,10,Bd6,b'r2qk2r/ppp2ppp/2nbpn2/1B1p1b2/3P4/2N1PN2/PPPB1PPP/R2QK2R w KQkq -',Attacking the defend h-pawn which might be a bit vulnerable after white castles.
748,21,11,O-O,b'r2qk2r/ppp2ppp/2nbpn2/1B1p1b2/3P4/2N1PN2/PPPB1PPP/R2Q1RK1 b kq -',Gets the king into saftey or does it?
749,21,12,Re1,b'r2q1rk1/ppp2ppp/2nbpn2/1B1p1b2/3P4/2N1PN2/PPPB1PPP/R2QR1K1 b - -',Nice move. But what's wrong with simply taking the c6 knight?
750,21,13,Qd7,b'r4rk1/pppq1ppp/2nbpn2/1B1p1b2/3P4/2N1PN2/PPPB1PPP/R2QR1K1 w - -',Develops my queen protects the c6 knight and connects the rooks. 3 in 1!
751,21,14,Qe2,b'r4rk1/pppq1ppp/2nbpn2/1B1p1b2/3P4/2N1PN2/PPPBQPPP/R3R1K1 b - -',White now connects his rooks. But I think his position is a bit squashed. 
752,21,15,Rfe8,b'r3r1k1/pppq1ppp/2nbpn2/1B1p1b2/3P4/2N1PN2/PPPBQPPP/R3R1K1 w - -',Developing my rooks.
753,21,16,1Rad1,b'r3r1k1/pppq1ppp/2nbpn2/1B1p1b2/3P4/2N1PN2/PPPBQPPP/3RR1K1 b - -',Good move. But the h2 pawn is left undefended.
754,21,17,1a6,b'r3r1k1/1ppq1ppp/p1nbpn2/1B1p1b2/3P4/2N1PN2/PPPBQPPP/3RR1K1 w - -',Chasing away the bishop 
755,21,18,1Bxc6,b'r3r1k1/1ppq1ppp/p1Bbpn2/3p1b2/3P4/2N1PN2/PPPBQPPP/3RR1K1 b - -',Which one is better Bishop or Knight (in this position)?
756,21,19,1b4,b'r3r1k1/1pp2ppp/p1qbpn2/3p1b2/1P1P4/2N1PN2/P1PBQPPP/3RR1K1 b - b3',White is trying to chase my Queen away.
757,21,20,1b5,b'r3r1k1/2p2ppp/p1qbpn2/1p1p1b2/1P1P4/2N1PN2/P1PBQPPP/3RR1K1 w - b6',Not so fast!
758,21,21,1Ne5,b'r3r1k1/2p2ppp/p1qbpn2/1p1pNb2/1P1P4/2N1P3/P1PBQPPP/3RR1K1 b - -',A fine outpost for the knight attacking my queen as well.
759,21,22,1a4,b'r3r1k1/2p2ppp/pq1bpn2/1p1pNb2/PP1P4/2N1P3/2PBQPPP/3RR1K1 b - a3',Strange and intresting move. 
760,21,23,1bxa4,b'r3r1k1/2p2ppp/pq1bpn2/3pNb2/pP1P4/2N1P3/2PBQPPP/3RR1K1 w - -',What else can I do?
761,22,0,1Nb5,b'4rrk1/p1ppq1bp/bn2Ppp1/1Np5/2P5/6P1/PPQ2PBP/R1B1R1K1 b - -',Up to now it is theory 2 games between really strong GMs reached this position.
762,22,1,1d6,b'4rrk1/p1p1q1bp/bn1pPpp1/1Np5/2P5/6P1/PPQ2PBP/R1B1R1K1 w - -',? Here the 2 games Van der Wiel - Nikolic and Pavasovic - Bozanic continued with dxe6 which I believe is good.
763,22,2,1a4,b'4rrk1/p1p1q1bp/bn1pPpp1/1Np5/P1P5/6P1/1PQ2PBP/R1B1R1K1 b - a3',"! As soon as I saw this position I thought if his Queen wasn't going to be trapped after 17. Nxa7 Bxc4 18. Nc6 but when I got the position on my chessboard I realized Black can play 18... Qd7!! because the pawn on e6 is pinned and White would lose too much material for his Queen.
Finally I decided to move his Knight on a worse position."
764,22,3,1Bc6,b'2n1rrk1/p1p1q1bp/b1BpP1p1/PNp2p2/2P5/6P1/1PQ2P1P/R1B1R1K1 b - -',A little subtlety but I believe the immediate Bd5 is equally good.
765,22,4,2Bd5,b'2nr1rk1/p1p1q1bp/b2pP1p1/PNpB1p2/2P5/6P1/1PQ2P1P/R1B1R1K1 b - -',Hoping to play Nxc7! Qxc7 e7+.
766,22,5,a6,b'2nr1rk1/2p1q1bp/p2pP1p1/PPpB1p2/8/6P1/1PQ2P1P/R1B1R1K1 w - -',Giving up a pawn but Black is completely blocked and cannot do much more than this.
767,22,6,Rxe6,b'3r2k1/nBp1q1b1/P2pr1pp/P1p2p2/RP6/6P1/2Q2P1P/2B1R1K1 w - -',A blunder but not so much better.
768,22,7,2Bd5,b'3r2k1/n1p1q1b1/P2pr1pp/P1pB1p2/RP6/6P1/2Q2P1P/2B1R1K1 b - -',
769,23,0,e4,b'rnbqkbnr/pppppppp/8/8/4P3/8/PPPP1PPP/RNBQKBNR b KQkq e3',Dundee vs St. Andrews - round 3.  The third game between bigpeta and myself.  I have now been added to Pete's growing list of players he's beaten playing the Latvian Gambit.
