,gid,aid,move,fen,annotation
1226,32,57,2axb6,b'3r3r/6pp/kpQ1pp2/4p3/1b6/q7/3N1PPP/1R4K1 w - -',29. ... Rd6 was another option here.   But after 30. Qc4+ Kb7 31. Bc5 RxN 32. Qb5+ (not 32. BxB as 32. ... Qd3 forks queen and rook!) Kc7 33. BxB I've a strong attack.   33. ... Rb8 is a tricky reply however when I can't take the queen because my back rank is weak - 34. Ba5+ Rb6 35. Qa6! is the only way to keep the advantage.   Appropriately the a7 pawn is the weakness now - again as singled out in the opening even if at this stage that's just a pure coincidence.
1227,32,58,3Nc4,b'3r3r/6pp/kpQ1pp2/4p3/1bN5/q7/5PPP/1R4K1 b - -',Again the only follow-up - forking mate and the queen.   Here black has to admit the attack and give up his queen - 30. ... Qa5 31. NxQ BxN 32. Qxe6 and I've a queen for a rook bishop and two pawns and Fritz says I'm not losing though black would have plenty of opportunity to prove me wrong over the board.
1228,32,59,3Rd6,b'7r/6pp/kpQrpp2/4p3/1bN5/q7/5PPP/1R4K1 w - -',This unfortunately is a terminal mistake.
1229,32,60,3Nxd6,b'7r/6pp/kpQNpp2/4p3/1b6/q7/5PPP/1R4K1 b - -',And for a change I spot it.   Black can't recapture because of QxP# while 31. ... Bc5 - maybe black's original plan - is met with 32. Qb7+ Ka5 33. Qa7#
1230,32,61,3Qd3,b'7r/6pp/kpQNpp2/4p3/1b6/3q4/5PPP/1R4K1 w - -',This allows a similar mate to the one just described - black's only defence was to cover b7 by 31. ... Rb8 but I still win with 32. Qc4+ b5 33. Qc6+ Ka7 34. NxP+ RxN 35. QxR and the bishop is gone next and the win will be trivial
1231,32,62,3Qb7+,b'7r/1Q4pp/kp1Npp2/4p3/1b6/3q4/5PPP/1R4K1 b - -',So check
1232,32,63,3Ka5,b'7r/1Q4pp/1p1Npp2/k3p3/1b6/3q4/5PPP/1R4K1 w - -',Forced
1233,32,64,3Qa7+,b'7r/Q5pp/1p1Npp2/k3p3/1b6/3q4/5PPP/1R4K1 b - -',Check
1234,32,65,3Qa6,b'7r/Q5pp/qp1Npp2/k3p3/1b6/8/5PPP/1R4K1 w - -',Forced
1235,32,66,3Ra1+,b'7r/Q5pp/qp1Npp2/k3p3/1b6/8/5PPP/R5K1 b - -',And I pick up the bishop and queen so black resigned.   Aside from the fun tactics (and the embarrassing misses on my behalf!) I found the couple of lines Fritz picked up on that I simply hadn't considered to be interesting - moves where I reckoned there was only one plan of action and was completely blinded to a second better plan as a result.
1236,33,0,e4,b'rnbqkbnr/pppppppp/8/8/4P3/8/PPPP1PPP/RNBQKBNR b KQkq e3',This match is a training game with my teammate kvikas.  We welcome all comments and suggestions for improved play.
1237,33,1,Nf6,b'rnbqkb1r/pppp1ppp/5n2/4p3/4P3/5N2/PPPP1PPP/RNBQKB1R w KQkq -',I really like Petrov and play it a lot.  Part of it is because I just dislike the lines in Ruy Lopez but I just like the path less trodden.
1238,33,2,Nc3,b'rnbqkb1r/pppp1ppp/5n2/4p3/4P3/2N2N2/PPPP1PPP/R1BQKB1R b KQkq -',Now we're in a three knights game.
1239,33,3,d4,b'r1bqkb1r/pppp1ppp/2n2n2/4p3/3PP3/2N2N2/PPP2PPP/R1BQKB1R b KQkq d3',Standard developmental attack.
1240,33,4,Bb4,b'r1bqk2r/pppp1ppp/2n2n2/8/1b1NP3/2N5/PPP2PPP/R1BQKB1R w KQkq -',All book so far...
1241,33,5,Nxc6,b'r1bqk2r/pppp1ppp/2N2n2/8/1b2P3/2N5/PPP2PPP/R1BQKB1R b KQkq -',The first choice.  Note that if I play dxc6 Qxd8+ is a winning play
1242,33,6,Qd3,b'r1bqk2r/p1pp1ppp/2p2n2/8/1b2P3/2NQ4/PPP2PPP/R1B1KB1R b KQkq -',Decent play.  More common is Bd3 continuing development and preparing for a castle.  If you want to move the queen I might also consider Qd4 or Qf3.  Bd2 is also a strong contender...
1243,33,7,O-O,b'r1bq1rk1/p1pp1ppp/2p2n2/8/1b2P3/2NQ4/PPP2PPP/R1B1KB1R w KQ -',No need to hesitate here go for the castle and prep for completing development.
1244,33,8,Bg5,b'r1bq1rk1/p1pp1ppp/2p2n2/6B1/1b2P3/2NQ4/PPP2PPP/R3KB1R b KQ -',Not a bad move especially if you're thinking of castling queenside.  I might have played Bd2 instead.
1245,33,9,Re8,b'r1bqr1k1/p1pp1ppp/2p2n2/6B1/1b2P3/2NQ4/PPP2PPP/R3KB1R w KQ -',When in doubt rooks love half-open files especially when a king is on the other side...
1246,33,10,Be2,b'r1bqr1k1/p1pp1ppp/2p2n2/6B1/1b2P3/2NQ4/PPP1BPPP/R3K2R b KQ -',Puts some separation between the king and rook allows for a kingside castle as well.  White is in pretty good developmental shape and is close to escaping unscathed from the opening.
1247,33,11,Bxc3+,b'r1bqr1k1/p1pp1ppp/2p2n2/6B1/4P3/2bQ4/PPP1BPPP/R3K2R w KQ -',Offering a chance to go up a pawn.  If Qxc3 then Nxe4 wins.
1248,33,12,1bxc3,b'r1bqr1k1/p1pp1ppp/2p2n2/6B1/4P3/2PQ4/P1P1BPPP/R3K2R b KQ -',We're still pretty even here and doubled isolated pawns aren't the end of the world but I still consider myself slightly ahead.
1249,33,13,1h6,b'r1bqr1k1/p1pp1pp1/2p2n1p/6B1/4P3/2PQ4/P1P1BPPP/R3K2R w KQ -',Looking to chase away the bishop or make an exchange...
1250,33,14,1e5,b'r1bqr1k1/p1pp1pp1/2p2n1p/4P1B1/8/2PQ4/P1P1BPPP/R3K2R b KQ -',unexpected!  I think top play was Bxf6 instead.  Black now has a few choices in how to respond.  I can either exchange pieces and win a pawn or just win a pawn and see what happens.
1251,33,15,1Rxe5,b'r1bq2k1/p1pp1pp1/2p2n1p/4r1B1/8/2PQ4/P1P1BPPP/R3K2R w KQ -',I choose pawn now.
1252,33,16,1Bxh6,b'r1bq2k1/p1pp1pp1/2p2n1B/4r3/8/2PQ4/P1P1BPPP/R3K2R b KQ -',More and more unusual.  When you're down points you should trade pawns not pieces.  We also don't want to trade bishops for pawns if we can help it. I expected White to flee or perhaps trade.  
1253,33,17,1f4,b'r1bq2k1/p1pp1p2/2p2n1p/4r3/5P2/2PQ4/P1P1B1PP/R3K2R b KQ f3',Not a bad play forces me to move my rook.
1254,33,18,d6,b'r1bq4/p1p2p1k/2pp1n1p/3r4/5P2/2P3Q1/P1P1B1PP/R4RK1 w - -',Looking to get my LSB into the game.
1255,33,19,1Bc4,b'r1bq4/p1p2p1k/2pp1n1p/3r4/2B2P2/2P3Q1/P1P3PP/R4RK1 b - -',Good move by White.  It threatens Bxf7 setting a possible bad position for my king.
1256,33,20,1Be6,b'r2q4/p1p2p1k/2ppbn1p/3r4/2B2P2/2P3Q1/P1P3PP/R4RK1 w - -',This move was a mistake on my part.  Better to move the rook perhaps to c5 allow the f pawn to be taken and then move my bishop to f5 to finalize deployment of my pieces and protect against the Q/B combo on g6.  I just moved too quickly without fully analyzing my position...
1257,33,21,1Bxd5,b'r2q4/p1p2p1k/2ppbn1p/3B4/5P2/2P3Q1/P1P3PP/R4RK1 b - -',f5 was a stronger play increasing pressure on my pieces.
1258,33,22,1f5,b'r2q4/p1p2p1k/2pp1n1p/3b1P2/8/2P3Q1/P1P3PP/R4RK1 b - -',Eventually the pawn now at f5 could present complications for me but as of right now it's a protective barrier for my knight and queen to inhabit the f6 square.
1259,33,23,1Ne4,b'r2q4/p1p2p1k/2pp3p/3b1P2/4n3/2P3Q1/P1P3PP/R4RK1 w - -',"I also thought about Qg8 here instead.  I wanted to see if I could create any ""play action"" by getting my pieces into the middle of the board."
1260,33,24,1Qh3,b'r2q4/p1p2p1k/2pp3p/3b1P2/4n3/2P4Q/P1P3PP/R4RK1 b - -',Perhaps with an eye towards defending g2 with the queen?  Uncertain.  I feel like Qd3 was a better move as it set the queen on a diagonal with the Black king.  As a general tip when positioning power pieces put them in lines that naturally allow attacks either direct or discovered as it creates pressures and possibilities. Your pieces are generally more useful when they can attack than just being used for defense.
1261,33,25,1Qf6,b'r7/p1p2p1k/2pp1q1p/3b1P2/4n3/2P4Q/P1P3PP/R4RK1 w - -',Natural positioning for the Black queen.
1262,33,26,2Rf4,b'r7/p1p2p1k/2pp1q1p/3b1P2/4nR2/2P4Q/P1P3PP/R5K1 b - -',Good idea getting the rook into the game.
1263,33,27,2Rg8,b'6r1/p1p2p1k/2pp1q1p/3b1P2/4nR2/2P4Q/P1P3PP/R5K1 w - -',Again natural pressure building.
1264,33,28,Ng5,b'6r1/p1p2p1k/2pp1q1p/3b1Pn1/5R2/2P4Q/P1P3PP/4R1K1 w - -',This move isn't as useful as just taking the c3 pawn which is what I wanted to do.  I was curious to get some action against the g2 pawn and see what I can make happen.
1265,33,29,2Qh5,b'6r1/p1p2p1k/2pp1q1p/3b1PnQ/5R2/2P5/P1P3PP/4R1K1 b - -',This move represented a huge blunder on White's part and I didn't see it.  Qxc3 would have been a huge play for Black!  It would threaten the rook with capture and a follow up of Ng3+!!  The top play for White was Qe3.
1266,33,30,2Bxg2,b'6r1/p1p2p1k/2pp1q1p/5PnQ/5R2/2P5/P1P3bP/4R1K1 w - -',Sometimes after a game you look back at what might have been and shake your head at the things you missed.  This move was one of those moments for me.  I saw a small prize and didn't notice the big one that was available.
1267,33,31,2Qxf7+,b'6r1/p1p2Q1k/2pp3p/5P2/5K2/2q5/P1P4P/4R3 b - -',Unexpected.  I thought White might play Re7 first.  A thing to remember the immediate kill isn't always the best option.  Sometimes it's better to build a coalition of strength through more pieces in play before delivering the final blow.  A key difference between junior and more advanced play is the willingness to let power build so you can deliver a more decisive blow rather than taking the first offering.
1268,33,32,Qd4+,b'4Q3/p1p3rk/2pp3p/5P2/3q1K2/8/P1P4P/4R3 w - -',When a king is exposed in the middle of the board and you have a Q/R combo check the possibilities before jumping in.  I should have played Qd2 instead as it affords me the chance to scarf some pawns and get a better set of attacking options.  Poor play by me!
1269,33,33,Qg4+,b'4Q3/p1p3rk/2pp3p/5P2/6q1/5K2/P1P4P/4R3 w - -',Here I make a play for the f5 pawn.  Perhaps Qc3+ would have been better with the chance for 2 pawns instead of 1.
1270,33,34,3Kd1,b'4Q3/p1p4k/2pp3p/q7/8/8/P1P1R1rP/3K4 b - -',Now White is forced into an exchange all but securing a Black victory.
1271,33,35,3Kxe1,b'8/p1p4k/2pp3p/8/8/8/P1P4P/4K3 b - -',When you find yourself in these situations you need a game plan on how to secure victory.  White's pawns are all singletons so there is no support there.  Essentially Black gets their king to the middle of the board pushes the three pawns on the c and d files up and then leverages 3 on 1 attacks with the king to promote.  If White moves to block with their King the Black king can go scarf the h pawn and promote.  It is almost impossible to not win as Black here but you still have to execute.
1272,33,36,c5,b'8/p7/7p/2pp1k2/2p5/P1P1K3/7P/8 w - c6',I'm not certain if this is the best move or not but it hardly matters at this point.  c5 prevents White's king from coming into the d4 square and affords me enough flexibility that regardless of his next move I can start forcing a pawn to promotion.  Either I can attack with the King towards h2 or advance the pawn to d4 and it's all but finished...
1273,33,37,d4,b'8/8/8/p1p1k2p/P1pp3P/2P2K2/8/8 w - -',thanks to kvikas for a good game.  Appreciate your comments.
1274,34,0,b6,b'rnbqkbnr/p1pppppp/1p6/8/5P2/8/PPPPP1PP/RNBQKBNR w KQkq -',I've been experimenting with a universal b6 defense.  This is the first time that I faced f4.
1275,34,1,d4,b'rnbqkbnr/p1pppppp/1p6/8/3P1P2/8/PPP1P1PP/RNBQKBNR b KQkq d3',This I thought was unusual.  b6 tries to control the light squares with the B and d4 just creates a light-square hole on e4.
1276,34,2,Ne4,b'rn1q1rk1/pbpp1ppp/1p2p3/8/3PnP2/2BBPN2/PPP3PP/R2QK2R w KQ -',Dropping the N into the light-square hole.
1277,34,3,f5,b'r2q1rk1/pbpn2pp/1p1pp3/5p2/1BPPnP2/3BPN2/PP4PP/R2Q1RK1 w - f6',Supporting the N further while keeping the diagonal open for the B.
1278,34,4,Qe8,b'r3qrk1/pbp3pp/1p1ppn2/5p2/2PPnP1B/3BPN2/PP4PP/R2Q1RK1 w - -',Immediately removing the pin.
1279,34,5,1Ng5,b'r3qrk1/pbp3pp/1p1ppn2/5pN1/2PPnP1B/3BP3/PP4PP/R2Q1RK1 b - -',This surprised me.  While Ng5 does go after Black's weakness on e3 I would have thought more preparation was needed like Rc1 b4 c5 etc.
1280,34,6,1Be2,b'r4rk1/pbp3pp/1p1ppnq1/5pB1/2PP1P2/4P3/PP2B1PP/R2Q1RK1 b - -',I'm not sure of White's intention here.  Even without Be2 Ng4 can be met easily.  Maybe Bf3 was the eventual intent?
1281,34,7,1h6,b'r4rk1/pbp3p1/1p1ppnqp/5pB1/2PP1P2/4P3/PP2B1PP/R2Q1RK1 w - -',White will now lose material as the B is pinned against a mating square g2.
1282,34,8,1Bxf6,b'r4rk1/pbp3p1/1p1ppBqp/5p2/2PP1P2/4P3/PP2B1PP/R2Q1RK1 b - -',White blunders and misses the tactic.
1283,34,9,1Qxg2#,b'r4rk1/pbp3p1/1p1ppB1p/5p2/2PP1P2/4P3/PP2B1qP/R2Q1RK1 w - -',White had more space and the ability to attack Black's pawn structure.  I think that was what was called for rather than a direct Kingside attack.
1284,35,0,c3,b'rnbqkbnr/pppppppp/8/8/8/2P5/PP1PPPPP/RNBQKBNR b KQkq -',The Saragossa opening. I don't see any strategy to it.
1285,35,1,e5,b'rnbqkbnr/pppp1ppp/8/4p3/8/2P5/PP1PPPPP/RNBQKBNR w KQkq e6',I respond by grabbing the center
1286,35,2,Qa4,b'rnbqkb1r/pppp1ppp/5n2/4p3/Q3P3/2P5/PP1P1PPP/RNB1KBNR b KQkq -',White defends with his queen. It's best not to move the queen this early in the game because developing pieces can attack it and force it to move.
1287,35,3,Bc4,b'r1bqkb1r/pppp1ppp/2n2n2/4p3/Q1B1P3/2P5/PP1P1PPP/RNB1K1NR b KQkq -',White attacks black's weak f7 pawn.
1288,35,4,Nxe4,b'r1bqkb1r/pppp1ppp/2n5/4p3/Q1B1n3/2P5/PP1P1PPP/RNB1K1NR w KQkq -',White's bishop blocked the queen's rank allowing this capture.
1289,35,5,d3,b'r1bqkb1r/pppp1ppp/2n5/4p3/Q1B1n3/2PP4/PP3PPP/RNB1K1NR b KQkq -',White attacks the knight.
1290,35,6,Nc5,b'r1bqkb1r/pppp1ppp/2n5/2n1p3/Q1B5/2PP4/PP3PPP/RNB1K1NR w KQkq -',Black moves his knight to safety and attacks the white queen forcing it to move.
1291,35,7,d6,b'r1bqkb1r/ppp2ppp/2np4/2n1p3/2B5/2PP4/PPQ2PPP/RNB1K1NR w KQkq -',Black gains a diagonal for his c8 bishop.
1292,35,8,b4,b'r1bqkb1r/ppp2ppp/2np4/2n1p3/1PB5/2PP4/P1Q2PPP/RNB1K1NR b KQkq b3',White attacks black's knight again.
1293,35,9,Nd2,b'r1bqk2r/ppp1bppp/2npn3/4p3/PPB5/2PP4/2QN1PPP/R1B1K1NR b KQkq -',More advancing.
1294,35,10,O-O,b'r1bq1rk1/ppp1bppp/2npn3/4p3/PPB5/2PP4/2QN1PPP/R1B1K1NR w KQ -',Black castles.
1295,35,11,1b5,b'r1bq1rk1/ppp1bppp/2npn3/1P2p3/P1B5/2PP4/2QN1PPP/R1B1K1NR b KQ -',Another attack! White's pawns are suffocating.
1296,35,12,1Ba2,b'r1bq1rk1/ppp1bppp/3pn3/nP2p3/P7/2PP4/B1QN1PPP/R1B1K1NR b KQ -',Black chases away the bishop.
1297,35,13,1Bb1,b'r1bq1rk1/ppp1bppp/3p4/nPn1p3/P7/2PP4/2QN1PPP/RBB1K1NR b KQ -',White's move seems pointless.
1298,35,14,1Bf5,b'r2q1rk1/ppp1bppp/3p4/nPn1pb2/P7/2PP4/2QN1PPP/RBB1K1NR w KQ -',An attack on the d3 pawn
1299,35,15,1g4,b'r2q1rk1/ppp1bppp/3p4/nPn1pb2/P5P1/2PP4/2QN1P1P/RBB1K1NR b KQ g3',What's this?
1300,35,16,1Nxd3+,b'r2q1rk1/ppp1bppp/3p4/nP2pb2/P5P1/2Pn4/2QN1P1P/RBB1K1NR w KQ -',Black plans to grab the g4 pawn later.
1301,35,17,Nc4,b'r2q1rk1/ppp1bppp/3p4/1P2pb2/P1n3P1/2Pn4/2QN1P1P/RBB2KNR w - -',Black forgot about the g4 pawn
1302,35,18,Nf4,b'r2q1rk1/ppp1bppp/3p4/1P2pP2/P1n2n2/2P5/2QN1P1P/RBB2KNR w - -',Black moves his knight away from the queen.
1303,35,19,Bxf6,b'r2q1rk1/ppp2ppp/3p1b2/1P2p3/P1n2n2/2P5/2QN1P1P/RBB2KNR w - -',Black takes the pawn without noticing that...
1304,35,20,1Qxh7#,b'r2q1rk1/ppp2ppQ/3p1b2/1P2p3/P1n2n2/2P5/3N1P1P/RBB2KNR b - -',...this was going to happen. 
1305,36,0,Bb7,b'rn1qk2r/pbppbppp/1p2pn2/6B1/2PPP3/2N5/PP3PPP/R2QKBNR w KQkq -',This is an odd way to get into an Owen's Defense setup.  Usually Bb4 is played to pin the Nc3 but the move order was different here.
1306,36,1,Qxe7,b'rn2k2r/pbppqppp/1p2p3/4P3/2PPn3/2N5/PP3PPP/R2QKBNR w KQkq -',Because of White's exchanges White is now lagging slightly in development.
1307,36,2,Bxf3,b'r3k2r/p1pnqppp/1p1pp3/4P3/2PP4/2PB1b2/P2Q1PPP/R3K2R w KQkq -',After the Q moves off d1 the N is protected only by the g pawn.  Black proceeds to ruin White's pawn structure.
1308,36,3,Nxe5,b'r3k2r/p1p1qppp/1p2p3/4n3/2P5/2PB1P2/P2Q1P1P/R3K2R w KQkq -',Now White's pawn structure is a shambles.  Black has an extra pawn too but that won't be the deciding factor.  Black just has to exchange down to an endgame and White is finished.
1309,36,4,1O-O,b'3rk2r/p1p1qppp/1p2p1n1/8/2P5/2P1QP2/P3BP1P/R4RK1 b k -',I was a little surprised by this move considering that the K is exposed but it does link the Rooks nicely.
1310,36,5,Rxd8,b'3r2k1/p1p2ppp/1p2p1n1/8/2P4q/2P1QP2/P3BP1P/5RK1 w - -',Exchanges toward an endgame just help Black at this point.
1311,36,6,1Rd1,b'3r2k1/p1p2ppp/1p2p1n1/8/2P4q/2P1QP2/P3BP1P/3R2K1 b - -',This loses another pawn.  After Bxd1 the c4 pawn will be hanging.
1312,36,7,2Qd3,b'6k1/p1p2ppp/1p2p1n1/8/5q2/1BPQ1P2/P4P1P/6K1 b - -',White correctly avoids exchanging Queens.  There is no back row mate because Black can always interpose with Nf8.  White's Bishop cannot attack on the dark squares.  The only threat White has in this position is Qa6.
1313,36,8,2a5,b'6k1/2p2ppp/1p2p1n1/p7/5q2/1BPQ1P2/P4P1P/6K1 w - a6',Preventing Qa6.  Black's plan is simple.  Protect the c7 pawn create a blowhole for the King and proceed to exchange down into an endgame where White cannot protect all of the isolated pawns.
1314,36,9,2Kg2,b'6k1/2p2ppp/1p2p1n1/p7/P7/1BPQ1P2/5PKP/2q5 b - -',I was expecting Bd1.  Then I can create pressure with Qf4 and Qd6.  Kg2 loses instantly.
1315,36,10,2Nf4+,b'6k1/2p2ppp/1p2p3/p7/P4n2/1BPQ1P2/5PKP/2q5 w - -',White resigned in the face of Nxd3 next move.
1316,37,0,b6,b'rnbqkbnr/p1pppppp/1p6/8/4P3/8/PPPP1PPP/RNBQKBNR w KQkq -',Joe: I like this since it's something different. Without knowing the best response I'm thinking of 2.d4 only because they say that after 1.e4 if black only advances a pawn one square it's generally best to play 2.d4 A perfect example would be in the Caro Kann where 1...c7 is played and white answers with that move.  Ken: 2.d4 is the most common move here and quire playable
1317,37,1,Bb7,b'rn1qkbnr/pbpppppp/1p6/8/3PP3/8/PPP2PPP/RNBQKBNR w KQkq -',Joe:  Now it's about what to do. My e4 pawn is attacked and there are a few ways to protect it. I think that the best move would be 3.Nc3 as this develops.  Ken: a very standard move  
1318,37,2,e6,b'rn1qkbnr/pbpp1ppp/1p2p3/8/3PP3/2N5/PPP2PPP/R1BQKBNR w KQkq -',Joe: That is an interesting move. I'm not exactly sure what to do here but am thinking of 4.Nf3 to continue with my development.  Ken: 4.Nf3 is a very reasonable and standard idea
1319,37,3,Bb4,b'rn1qk1nr/pbpp1ppp/1p2p3/8/1b1PP3/2N2N2/PPP2PPP/R1BQKB1R w KQkq -',Joe: One thing I don't like is the pin. Were it not there I would consider bringing my Bf1 into play right away. But I remember Jack Stockel implying that in general you don't want the pin there. And he mentioned that the most and usually best way to get out of it is with the bishop. With that being said I think that I'm best off with 5.Bd2.  Ken: with a knight on f3 or f6 what Jack told you is right but it is wrong when the knight is on c3 or c6. think a bit more here  Joe: Yes he was alluding to the King's Knight. So I am thinking about bringing my Bf1 into play with the idea of castling. The only question is which square. I like the looks of Bd3 where there is an added defender to my e4.  Ken: that is a common way of playing here
1320,37,4,Ne7,b'rn1qk2r/pbppnppp/1p2p3/8/1b1PP3/2NB1N2/PPP2PPP/R1BQK2R w KQkq -',Joe:  As with a different annotation I think castling is a good idea at once. One reason for playing Bd3 was to castle.  Ken: I don't see a better move
1321,37,5,O-O,b'rn1q1rk1/pbppnppp/1p2p3/8/1b1PP3/2NB1N2/PPP2PPP/R1BQ1RK1 w - -',Joe: Now that you have castled I'm planning to complete my development with my Bc1. I'd love to play Bd2 but as you pointed out it's not a good move. I would also consider Bg5 with the idea of pinning your Ne7 which can be broken with ...f6 Therefore I like the looks of Be3 as both of the Bishops are together. But I think that best is Bf4 as the DSB appears to be better placed then any other square.  Ken: Here you have a wide range of reasonable moves. That's both good and bad for you. Great to have so many good choices but the sheer size of the move tree with all these branches can lead to confusion. That is why I chose this defense so that you will be forced to think for yourself because the database won't be much help. A lot of good plausible moves to choose from. It will come down to deciding which type of position makes you most comfortable.  Joe: That makes sense. The irony is that I don't even look at the database because unless you know why they suggest moves it won't help to listen to it as I learned with tactical-abyss. Yes it's what I like to do here. I am interested in Be3 don't know what happens afterwards.  Ken: It is a reasonable idea and we both will learn from working our way through the variations.  Joe: I was thinking along a variation but after the first lesson about exchanges combined with a mistake in the team game where I got a lucky in which you gave an example of when not to exchange I'm not so sure. I was thinking along the lines of 7.Be3 with the idea being 7...d5 8.exd5 But I'm not sure that exchanging is the right approach. Or possibly 7.Be3 c5 but I'm not comfortable along the line after that. What it boils down to is me trying to avoid the exchange.  I also considered moving my Nc3 but I want to complete development as opposed to moving the same piece twice.  Ken: sounds logical  Joe: Which one Nc3 or Be3.  I meant Be3 or Ne2.  Ken: both are logical. a matter of preference. Which p[osition do you like more?  Joe: I like Ne2 the best.
1322,37,6,f5,b'rn1q1rk1/pbppn1pp/1p2p3/5p2/1b1PP3/3B1N2/PPP1NPPP/R1BQ1RK1 w - f6',Joe: I'd normally wait to take f5 in order to prevent exchanging. The problem is that you would get a free pawn because of your Bb7. So I believe that exf5 is my only option. The only other move that doesn't lose anything would expose my King badly after something like 8.e5?! which allows 8...Bxf3 as now I'm forced to recapture with the pawn right next to the monarch.  Ken: I agree e5 is bad but look a little more there are other plausible choices  Joe: I looked at another option which I don't like as well because this semi restricts my Bc1. It's Ng5 to add a defender to e4.  Ken: This is one other way try a bit more  Joe: It's 8.c3 which is not only an alternative to the problem but just might win a piece in a few moves. It's about what comes after that. I think that c3 is the way to go here.  Looking into it I don't but it prevents the loss of material so it boils down to the best move. I think that the attack is solid.  Ken: now that you studied all the options take a bit more time and decide the one you like the best. This is the point here in playing such a flexible defense. I have given you a lot to have to think about.  Joe: You have and there is one other option that I missed being a3 with the same idea as c3 but it creates a semi open file for my Rook. I'll have to study all of them and will have a difficult time deciding which is best.  Ken: That is the one of the reasonsthis type of defense works. It overloads the opponent with a lot of appetizing choices and even at this slow speed it can be overwhelming.  Joe: I agree with you. I've limited it down to two or three choices. One thing for sure is that I need to be very careful here.  But I think I've figured it out here.  
1323,37,7,fxe4,b'rn1q1rk1/pbppn1pp/1p2p3/8/1b1Pp3/P2B1N2/1PP1NPPP/R1BQ1RK1 w - -',Joe: I figured that you'd played this. I think that axb4 is the best option as it prevents the loss of a piece. Aside from that I don't see any good alternatives.  Ken: check a little more about the order of the moves and yes you absolutely must not come out of this a piece down.  Joe: I can also play 8...fxe3 with the idea of 9.Bxe4 Bxe4 10.axb4 I think that's better as not only haven't I've blundered a piece but my King is a lot safer since I'm not forced to capture with the g pawn that way.  Ken: Your most recent chat(note) is kiond of garbled. I think you mean that I can plaY fxe3 not you. But either way recheck your variation out to at least move 11.  Joe: I was thinking along the lines of 9.Bxe4 Bxe4 10.axb4 but after 10...Bxf3 I'm in rough shape as I'm forced to expose my K in order to prevent the loss of a piece. So it appears that the only move which does any better would be 9.Bxe4 but after 9...Bxe4 10.axb4 Bxf3 I'm still in rough shape for the same reason. So there's no way to prevent the K exposure as those are the only ways to avoid coming out a piece down.  So I'm in bad shape either way. It's about figuring out which of those two variations works better for white.  On the other hand similar to the other games and it's the opposite of what it should be since the pressure is on. I checked out a different variation that works out a lot better for white so I feel much less pressure. In fact I now feel little to no pressure and more comfortable about my position feeling that I know what to do even though it's technically not supposed to be how it works as you noted in our first game when the pressure was on and I felt it. The new variation would be something like 9.Nf4 exf3 10.axb4 fxg2 11.Nxg2 Bxg2 13.Kxg2 Yes the King is open and we don't always want exchanges. But in that context unlike with the first game it would be forced and I'd find that exchange beneficial because more of the pieces around the open K is what leaves it exposed. By having the pieces exposed my monarch is much safer.  Ken: I guess we will find out how safe it is. I am glad to see you diving into the position in depth. check you variations a bit more still before you decide. There are one or two plausible vartiations you should still lookat.  Joe: I did check out a couple of variations and it's not that safe but still the best option available. With some of these lines I still have more options then the other variations that I checked out.
