,gid,aid,move,fen,annotation
901,28,3,d5,b'rn3rk1/p1p1qppp/1p2pn2/3p4/2PP4/P1N2PP1/1P1Q1PBP/R3K2R w KQ d6',Before playing this move Black must have been waiting for the fianchetto development of White's LSB which moves that piece's line of sight off of c4. However Black might have been better served to play it sooner.
902,28,4,1f4,b'rn3rk1/p1p1qppp/1p2pn2/3p4/2PP1P2/P1N3P1/1P1Q1PBP/R3K2R b KQ -',Discovering a pin on Black's d-pawn safeguarding White's c-pawn.
903,28,5,c6,b'r4rk1/p2nqppp/1pp1pn2/3p4/2PP1P2/P1N3P1/1P1Q1PBP/R4RK1 w - -',Black can now play dxc4 if he wants but it's only an even trade (Bxc6)
904,28,6,1Rc2,b'r3nrk1/p2n1ppp/1pp1pq2/3p4/2PP1P2/P1N3P1/1PRQ1PBP/4R1K1 b - -',Preparing to double the rooks on the c-file. The threat of cxd5 soon becomes something for Black to be concerned about.
905,28,7,Rac8,b'2r2rk1/p1nn1ppp/1pp1pq2/3p4/2PP1P2/P1N3P1/1PRQ1PBP/2R3K1 w - -',Finally breaking the menacing of this rook by White's bishop on the a8-h1 diagonal but now Black loses a pawn.
906,28,8,Nxd5,b'2r2rk1/p2n1ppp/1pp2q2/3n4/3P1P2/P5P1/1PRQ1PBP/2R3K1 w - -',Black's c-pawn was pinned before this move and remains pinned after.
907,28,9,2Bg2,b'1nr2rk1/p4ppp/1pp2q2/8/3P1P2/P5P1/1PRQ1PBP/2R3K1 b - -',Although this bishop was not under immediate duress White decides to retreat it back to g2 in order to advance his d-pawn.
908,28,10,2d5,b'1nrr2k1/p4ppp/1pp2q2/3P4/5P2/P5P1/1PRQ1PBP/2R3K1 b - -',Yes that pawn on c6 is still pinned.
909,28,11,2Qd6,b'1nrr2k1/p4ppp/1ppq4/3P4/5P2/P5P1/1PRQ1PBP/2R3K1 w - -',Blockading the passed pawn.
910,28,12,c5,b'1nrr2k1/p4ppp/1p1q4/2pP4/5P2/P1Q3P1/1PR2PBP/2R3K1 w - -',Finally the threats on the c-pawn become too much for Black who is forced to advance it creating a passed pawn for White.
911,28,13,2Re2,b'2rr2k1/p4ppp/np1q4/2pPQ3/5P2/P5P1/1P2RPBP/2R3K1 b - -',Beginning a transfer of the rooks from the c-file where they have done great work to the e-file where they can create back rank issues for Black.
912,28,14,h6,b'2rr2k1/p1n2pp1/1p1q3p/2pPQ3/5P2/P5P1/1P2RPBP/4R1K1 w - -',With his knight maneuver Black has the White d-pawn overmatched--it is attacked three times and only defended twice. But Black absolutely cannot yet take the pawn on account of 26. Qe8+ which would win at least the knight. So he clears room for his king.
913,28,15,2Qxd6,b'2rr2k1/p1n2pp1/1p1Q3p/2pP4/5P2/P5P1/1P2RPBP/4R1K1 b - -',White trades queens. As it turns out the d-pawn really is weak but White decides to trade it off for Black's a-pawn which will also give White one rook on the seventh rank and possibly two at some later point.
914,28,16,a5,b'2r3k1/2n1Rpp1/1p1r3p/p1pP4/5P2/P5P1/1P3PBP/4R1K1 w - a6',Black tries to save the a-pawn first but this move fails to a one-move tactic.
915,28,17,2Bh3,b'2r3k1/2n1Rpp1/1p1r3p/p1pP4/5P2/P5PB/1P3P1P/4R1K1 b - -',Winning a piece. The rest of the game could do without comment. Honestly I was hoping Black might resign here. The last 15 moves somewhat diminish the earlier ones.
916,28,18,Rd8,b'2Br2k1/4Rpp1/1p5p/p1p5/5P2/P5P1/1P3PKP/8 w - -',An optimistic view might have still given Black some chances on the queen side but Black's 31st through 33rd moves betray any such optimism.
917,28,19,3Bxb7,b'6k1/1B3pp1/1p5p/p1p5/5P2/P5P1/1P3PKP/8 b - -',Black's chances go from slim before to none now.
918,28,20,4Kc4,b'6B1/6p1/1p4kp/p1p2p2/P1K2P2/6P1/1P3P1P/8 b - -',Black resigns here. Black realizes the planned continuation 42... Kh5 is hopeless as White will just play either 43. f3 or 43. h3.
919,29,0,f4,b'rnbqkbnr/pppppppp/8/8/5P2/8/PPPPP1PP/RNBQKBNR b KQkq f3',bird opening
920,29,1,c4,b'rnbqkbnr/ppp1pppp/8/3p4/2P2P2/8/PP1PP1PP/RNBQKBNR b KQkq c3',Sturm gambit
921,29,2,Nf6,b'rnbqkb1r/ppp2ppp/4pn2/3P4/5P2/8/PP1PP1PP/RNBQKBNR w KQkq -',living the e pawn to take irresistible temptation ! Then black will stay with a BIG HOLE in the center.
922,29,3,Bxe6,b'rn1qkb1r/ppp2ppp/4bn2/8/5P2/8/PP1PP1PP/RNBQKBNR w KQkq -',2 pieces out but no center. It will be easy to develop for white. 
923,29,4,e3,b'r2qkb1r/ppp2ppp/2n1bn2/8/5P2/4PN2/PP1P2PP/RNBQKB1R b KQkq -',preventing Nd4
924,29,5,a3,b'r2qk2r/ppp2ppp/2nbbn2/8/5P2/P3PN2/1P1P2PP/RNBQKB1R b KQkq -',preventing N o B b4 before to adva
925,29,6,1Nc3,b'r2qr1k1/1pp2ppp/p1nb1n2/3b4/3P1P2/P1N1PN2/1P2B1PP/R1BQ1RK1 b - -',Now we are ready for fight ! In order to place the f3 knight in e5 to provoke an exchange and open f colon retaking with f4 i need to take first the lsb to prevent a dangerous sacrifice in g2
926,29,7,1Ne7,b'r2qr1k1/1pp1nppp/p2b1n2/3b4/3P1P2/P1N1PN2/1P2B1PP/R1BQ1RK1 w - -',preparing attack on the e3 weak pawn
927,29,8,Nexd5,b'r2qr1k1/1pp2ppp/p2b1n2/3n4/3P1P2/P3PN2/1P2B1PP/R1BQ1RK1 w - -',so i have to defend e3 or cancel one of the two threats. I will choose this last option in order to go n developing my plan (open f colon ...etc.)
928,29,9,Qe7,b'r3r1k1/1pp1qppp/p2b1n2/3nN3/3P1P2/P3P3/1P2B1PP/R1BQ1RK1 w - -',will place the f6 knight in e4 then advance f7 to kick my e5 knight and go on on his plan (attack e3)
929,29,10,1Bf3,b'r3r1k1/1pp1qppp/p2b1n2/3nN3/3P1P2/P3PB2/1P4PP/R1BQ1RK1 b - -',so preventing Ne4
930,29,11,1Rad8,b'3rr1k1/1pp1qppp/p2b1n2/3nN3/3P1P2/P3PB2/1P4PP/R1BQ1RK1 w - -',has he supposed that i would like to retake with d4 in case on exchanging my e5 knight ?? This look like a lost tempo...
931,29,12,1Qb3,b'3rr1k1/1pp1qppp/p2b1n2/3nN3/3P1P2/PQ2PB2/1P4PP/R1B2RK1 b - -',double threat on d5 knight pursuing to attack f7
932,29,13,1Rac1,b'3rr1k1/1pq2ppp/p1pb1n2/3nN3/3P1P2/PQ2PB2/1P1B2PP/2R2RK1 b - -',i will win the d5 knight if black exchange dsb with my e5 knight...
933,29,14,1Bxe5,b'3rr1k1/1pq2ppp/p1p2n2/3nb3/3P1P2/PQ2PB2/1P1B2PP/2R2RK1 w - -',exchanging
934,29,15,1fxe5,b'3rr1k1/1pq2ppp/p1p2n2/3nP3/3P4/PQ2PB2/1P1B2PP/2R2RK1 b - -',retaking and now the f6 knight protector of d5 has to move !
935,29,16,1Rxe5,b'3r2k1/1pq2ppp/p1p2n2/3nr3/3P4/PQ2PB2/1P1B2PP/2R2RK1 w - -',oh ! what a nice calculation ! black is -3 anyway  and this was the best option in order to not to break the king castle. But this is ignoring the fact that two rook together are much more powerful and even more in endings games....
936,29,17,2Bxd5,b'3r2k1/1p3ppp/p1p2n2/3Bq3/8/PQ2P3/1P1B2PP/2R2RK1 b - -',to get out the f6 knight in order to threaten f7
937,29,18,2Ba5,b'3r2k1/1p3ppp/p1p5/B2nq3/8/PQ2P3/1P4PP/2R2RK1 b - -',i plan to sacrifice my knight : 21. Ba5 b6  22. Bxb6 Kd5xb6 23.Qxf7+ Kh8 24.Qf8+ Rd8xf8 25.Rf1xf8#
938,29,19,2Re8,b'4r1k1/1p3ppp/p1p5/B2nq3/8/PQ2P3/1P4PP/2R2RK1 w - -',accurate dodge 
939,29,20,2Bb6,b'4r1k1/1p3ppp/pBp5/3nq3/8/PQ2P3/1P4PP/2R2RK1 b - -',still provoking exchange with d5 knight ...If not i will anchor my dsb on d4
940,29,21,2Nf6,b'4r1k1/1p3ppp/pBp2n2/4q3/8/PQ2P3/1P4PP/2R2RK1 w - -',still accurate answer
941,29,22,2Bd4,b'4r1k1/1p3ppp/p1p2n2/4q3/3B4/PQ2P3/1P4PP/2R2RK1 b - -',pressuring the queen to provoke mistake
942,29,23,2Qg5,b'4r1k1/1p3ppp/p1p2n2/6q1/3B4/PQ2P3/1P4PP/2R2RK1 w - -',this is the mistake i was searching ...placing my rook on f3 it will become very dangerous for black (taking the black knight with my dsb black to retake with the g7 pawn opening the g colon then the rook goes to g3 and win the queen !)
943,29,24,2Rf3,b'4r1k1/1p3ppp/p1p2n2/6q1/3B4/PQ2PR2/1P4PP/2R3K1 b - -',Re8 e6 was called...
944,29,25,2Qg6,b'4r1k1/1p3ppp/p1p2nq1/8/3B4/PQ2PR2/1P4PP/2R3K1 w - -',but not the game is done in 3 moves
945,29,26,2Bxf6,b'4r1k1/1p3ppp/p1p2Bq1/8/8/PQ2PR2/1P4PP/2R3K1 b - -',1
946,29,27,2gxf6,b'4r1k1/1p3p1p/p1p2pq1/8/8/PQ2PR2/1P4PP/2R3K1 w - -',2
947,29,28,2Rg3,b'4r1k1/1p3p1p/p1p2pq1/8/8/PQ2P1R1/1P4PP/2R3K1 b - -',3 ! I hope you've enjoyed.
948,30,0,Bc4,b'r1bqkbnr/pppp1ppp/2n5/4p3/2B1P3/5N2/PPPP1PPP/RNBQK2R b KQkq -',A classic move; one of the oldest openings.
949,30,1,Nf6,b'r1bqkb1r/pppp1ppp/2n2n2/4p3/2B1P3/5N2/PPPP1PPP/RNBQK2R w KQkq -',"This is the Two Knights Defense: black pressures the e4 field but reduces his own ability to defend the f7 field. As black this is my favorite e4-e5 opening not because I am particularly successful with it but because it always full of tactical and sharp play.

Mikhail Chigorin who played two matches for the World Champion title against Steinitz loved this opening and played it often."
950,30,2,Nc3,b'r1bqkb1r/pppp1ppp/2n2n2/4p3/2B1P3/2N2N2/PPPP1PPP/R1BQK2R b KQkq -',At a first glance a good move: white develops a knight and defends a pawn. But in this particular position there are better moves: 4.Ng5 (which always tempts me to play the Traxler experiment 4...Lc5?!) 4.d4 or less sharp 4.d3.
951,30,3,Nxe4,b'r1bqkb1r/pppp1ppp/2n5/4p3/2B1n3/2N2N2/PPPP1PPP/R1BQK2R w KQkq -',This is the reason why 4.Nc3 isn't really good: black gains the initiative.
952,30,4,Bxf7+,b'r1bqkb1r/pppp1Bpp/2n5/4p3/4n3/2N2N2/PPPP1PPP/R1BQK2R b KQkq -',On 5.Nxe4 black would reply with a fork 5...d5 so white decides to at least prevent black from castling.
953,30,5,d5,b'r1bq1b1r/ppp2kpp/2n5/3pp3/4N3/5N2/PPPP1PPP/R1BQK2R w KQ d6',Controls the center with the tempo. My plan is to gain space and push white knights back to their ranks.
954,30,6,Neg5+,b'r1bq1b1r/ppp2kpp/2n5/3pp1N1/8/5N2/PPPP1PPP/R1BQK2R b KQ -',I was expecting 7.Ng3. After this check white knight will end on a rim.
955,30,7,Ke8,b'r1bqkb1r/ppp3pp/2n5/3pp1N1/8/5N2/PPPP1PPP/R1BQK2R w KQ -',I regretted this move later 7...Kg8 was probably better. This leaves the black king in the center and puts it on a semi-open e-file. However many times in the past I've lost games that started similarly due to the sudden kingside attacks so this time my personal experience trumped the common sense. Besides I've thought that this move would mean easier future development for the rook. As it turned out that rook served only one purpose till the end - to be captured by the white knight. :)
956,30,8,h4,b'r1bqkb1r/ppp3pp/2n5/3pp1N1/7P/5N2/PPPP1PP1/R1BQK2R b KQ h3',I don't know whether this move was played to protect the knight or to start the kingside offense but neither seems realistic to me. Fritz suggests 8.d4 h6 9.Nh3 Bxh3 10.gxh3 and evaluates this position as slightly better for the black.
957,30,9,h6,b'r1bqkb1r/ppp3p1/2n4p/3pp1N1/7P/5N2/PPPP1PP1/R1BQK2R w KQ -',"I stick to my ""gain space/chase knights back"" plan."
958,30,10,e4,b'r1bqkb1r/ppp3p1/2n4p/3p4/4p2P/5N1N/PPPP1PP1/R1BQK2R w KQ -',And yet again; white knight has to retreat to his starting point.
959,30,11,1Qe2,b'r1bqkb1r/ppp3p1/2n4p/3p4/4p2P/5N1N/PPPPQPP1/R1B1K2R b KQ -',Trying to pin down the pawn but this complication could have ended bad for white.
960,30,12,1Qe7,b'r1b1kb1r/ppp1q1p1/2n4p/3p4/4p2P/5N1N/PPPPQPP1/R1B1K2R w KQ -',As a reply I've played this move without too much thinking missing the opportunity to play 10...Bg4 and the white knight falls after 11...Qe7.
961,30,13,1Nfg1,b'r1b1kb1r/ppp1q1p1/2n4p/3p4/4p2P/7N/PPPPQPP1/R1B1K1NR b KQ -',The knight retreats to g1. I was quite happy with the opening: white is underdeveloped his knight is on the edge of the board black controls the center and has the space advantage.
962,30,14,1Qxh4,b'r1b1kb1r/ppp3p1/2n4p/3p4/4p2q/7N/PPPPQPP1/R1B1K1NR w KQ -',"Capturing the pawn was probably the best move although I felt ""greedy"" after playing it."
963,30,15,1Qb5,b'r1b1kb1r/ppp3p1/2n4p/1Q1p4/4p2q/7N/PPPP1PP1/R1B1K1NR b KQ -',At this point I regretted my earlier Ke8 move. White Queen is attacking the d5 pawn pressuring b7 and pinning down the black knight.
964,30,16,1Qh5,b'r1b1kb1r/ppp3p1/2n4p/1Q1p3q/4p3/7N/PPPP1PP1/R1B1K1NR w KQ -',I wanted to defend my pawn and didn't notice the possibility 12...Qg4 13.f4 Qxg2 14.Nf2 with the better position for black.
965,30,17,1Ne2,b'r1b1kb1r/ppp3p1/2n4p/1Q1p3q/4p3/7N/PPPPNPP1/R1B1K2R b KQ -',A developing move. Fritz suggests 13.c4 instead which increases pressure on d5.
966,30,18,1Qe5,b'r1b1kb1r/ppp3p1/2n4p/1Q1pq3/4p3/7N/PPPPNPP1/R1B1K2R w KQ -',This was meant to prevent 14.Nd4 and to put the queen on a field safe from the white knight attack. However the position is now evaluated as equal by Fritz. It suggests simply 13...Bd6 (and on 14.Nd4 Bd7 without the fear for b7 pawn) or 13...a6.
967,30,19,1d3,b'r1b1kb1r/ppp3p1/2n4p/1Q1pq3/4p3/3P3N/PPP1NPP1/R1B1K2R b KQ -',A mistake. This move means that black will be able to pin down the white knight on e2. Fritz suggests 14.Nhf4 Bd7 15.Qxd5 (not 15.Nxd5 Nb4 16.Qxb7 Qxd5 17.Qxd5 Nxd5 and black is better) Qxd5 16.Nxd5 with the equalization.
968,30,20,1exd3,b'r1b1kb1r/ppp3p1/2n4p/1Q1pq3/8/3p3N/PPP1NPP1/R1B1K2R w KQ -',Computer would attack the queen first: 14...a6 15.Qb3 exd3.
969,30,21,Bf5,b'r3kb1r/ppp3p1/2n4p/3pqb2/8/3Q3N/PPP1NPP1/R1B1K2R w KQ -',An attempt to develop the bishop with the tempo.
970,30,22,1Qb3,b'r3kb1r/ppp3p1/2n4p/3pqb2/8/1Q5N/PPP1NPP1/R1B1K2R b KQ -',? I was expecting 16.Qb5 as that would keep the pin on knight.
971,30,23,1Rb8,b'1r2kb1r/ppp3p1/2n4p/3pqb2/8/1Q5N/PPP1NPP1/R1B1K2R w KQ -',"This was played after the long thinking. As soon as the pin was removed I thought: 16...Nd4 but of course white would reply with 17.Qa4+. Then I thought about 16...Bb4+ and then if 17.c3? Nd4! but then I saw some variation which again loses material and gave up (the computer analysis says that this would be the best move).

The next idea was 16...a6 to take away b5 field as a possibility for the white queen. I was willing to allow Qxb7 and even to sacrifice the rook to start the attack by Nd4. I believed I would have an edge in this variation (again the computer says I was wrong).

Fortunately I opted for 16...Rb8 as the more solid variation."
972,30,24,1Bf4,b'1r2kb1r/ppp3p1/2n4p/3pqb2/5B2/1Q5N/PPP1NPP1/R3K2R b KQ -',For a moment I thought that this move by white will make me a big trouble. But then I saw that black's attack is faster after 17...Qe4 18.Bxc7...
973,30,25,1Qe4,b'1r2kb1r/ppp3p1/2n4p/3p1b2/4qB2/1Q5N/PPP1NPP1/R3K2R w KQ -',"...and I played this. I thought it's an excellent move as it keeps the pin and attacks both c2 and g2.

However I took for granted that white will capture on c7. Fritz takes into account that white can play the best move available and suggests 17...Qxe2+ 18.Ke2 Nd4+ 19.Kd1 Nxb3 20.axb3 a6 and black is better with +1 pawn bishop pair and doubled white pawns."
974,30,26,1Bxc7,b'1r2kb1r/ppB3p1/2n4p/3p1b2/4q3/1Q5N/PPP1NPP1/R3K2R b KQ -',"An expected capture but it's a mistake as white ignores the defense and this bishop will only die here.

According to Fritz white could equalize with 18.0-0-0 g5 19.Nc3 Qxc2 20.Qxc2 Bxc2 21.Kxc2 gxf4 22.Nxd5."
975,30,27,1Rc8,b'2r1kb1r/ppB3p1/2n4p/3p1b2/4q3/1Q5N/PPP1NPP1/R3K2R w KQ -',"Puts the rook under bishop protection and attacks the black bishop. A logical move for me; the machine approves and even gives me an exclamation mark. :)

18...Qxg2 is bad as the tide turns after 19.0-0-0 Rc8 20.Rhe1!"
976,30,28,1Qxb7,b'2r1kb1r/pQB3p1/2n4p/3p1b2/4q3/7N/PPP1NPP1/R3K2R b KQ -',Again ignores the defense. 19.Bf4 bishop escape is better.
977,30,29,1Nd4,b'2r1kb1r/pQB3p1/7p/3p1b2/3nq3/7N/PPP1NPP1/R3K2R w KQ -',This is what I was waiting for! The previous move by white means he's not able to reply with Qa4+ anymore.
978,30,30,Nxc2+,b'2r1kb1r/pQB3p1/7p/3p1b2/4qN2/8/PPn1NPP1/R3K2R w KQ -',I was also considering 20...g5 but decided that I shouldn't complicate the position. (And I was right according to the computer g5 is an inferior move.)
979,30,31,2Kd2,b'2r1kb1r/pQB3p1/7p/3p1b2/4qN2/8/PPnKNPP1/R6R b - -',The best move. 21.Kf1 would only make the job easier for the black knight.
980,30,32,2Bb4+,b'2r1k2r/pQB3p1/7p/3p1b2/1b2qN2/8/PPnKNPP1/R6R w - -',"I wanted to increase the pressure by bringing bishop into play. For some ""romantic"" reason I was complicating the position. I could have won by simply playing 21...Nxa1 22.Qc6+ Bd7 23.Qg6+ Qxg6 24.Nxg6 Bb4+ etc.

What I didn't see here is the danger black faces on the e-file if the white knight is removed from e2. Until now this knight was pinned and during the time the other knight was on h3 and king on e1 I was completely unaware of the white's possibility to castle. In that case e2 knight would remain unprotected and I'd simply capture it with my queen - that was my calculation and it ended there completely ignoring the following move by white - a skewer on e-file! (Correction: pin not skewer thanks haile1996.)

Perhaps white oversaw that as well as he didn't castle in the previous moves."
981,30,33,2Nc3,b'2r1k2r/pQB3p1/7p/3p1b2/1b2qN2/2N5/PPnK1PP1/R6R b - -',I'm not seeing the danger on e-file...
982,30,34,2Nxa1,b'2r1k2r/pQB3p1/7p/3p1b2/1b2qN2/2N5/PP1K1PP1/n6R w - -',??? a losing move. 22...Qd4+ would have won the game in a simple way.
983,30,35,2Qc6+,b'2r1k2r/p1B3p1/2Q4p/3p1b2/1b2qN2/2N5/PP1K1PP1/n6R b - -',"??? but the white also misses 23.Re1 and the road to victory!

After 23...Qxe1 24.Kxe1 the fight would still rage on but white would surely have an advantage.

Until the end of the game I didn't have a clue of what happened in these two moves. The post-game analysis was quite a shock. :)"
984,30,36,2Nxg6,b'2r1k2r/p1Bb2p1/6Np/3p4/1b6/2N5/PP1K1PP1/n6R b - -',After the queen exchange the position is simpler and white has little to hope for.
985,30,37,2Rxc7,b'4k2r/p1rb2p1/6Np/3p4/1b6/2N5/PP1K1PP1/n6R w - -',And this solves the game.
986,30,38,Bf5,b'4k2N/p1r3p1/7p/3p1b2/1b6/2N5/PP1K1PP1/n6R w - -',This traps the white knight. Fritz claims that immediate 26...d4 is better but at this point it doesn't really matter (hey this even rhymes :D).
987,30,39,Bxc3+,b'5k1N/p3r1p1/7p/5b2/8/2b5/P2K1PP1/4R3 w - -',The final blow.
988,30,40,3g4,b'6kN/p5p1/4r2p/5b2/6P1/5P2/P2K4/8 b - g3',This can't save the white knight.
989,30,41,3Bh7,b'6kN/p5pb/4r2p/8/6P1/5P2/P2K4/8 w - -',"And white resigned.

This was really a tactical game. As you saw in these sharp positions players of our level can ruin their own chances with a single move. It is said that the surest way to learn is from your own mistakes but I hope that this annotation will also help some other players to avoid similar errors. :)"
990,31,0,f4,b'rnbqkbnr/pppppppp/8/8/5P2/8/PPPPP1PP/RNBQKBNR b KQkq f3',bird
991,31,1,e5,b'rnbqkbnr/pppp1ppp/8/4p3/5P2/8/PPPPP1PP/RNBQKBNR w KQkq e6',most aggressive defence against bird (according to my experience me)  most often plaid by hight elo players
992,31,2,fxe5,b'rnbqkbnr/pppp1ppp/8/4P3/8/8/PPPPP1PP/RNBQKBNR b KQkq -',the best solution in my opinion but then the situation is not comfortable for white. This is the risk with e4 ...
993,31,3,d6,b'rnbqkbnr/ppp2ppp/3p4/4P3/8/8/PPPPP1PP/RNBQKBNR w KQkq -',what you should not play is exd6 ! then he take back with the dsb and the way for a killer attack with the queen on h5 is done ...
994,31,4,Nf3,b'rnbqkbnr/ppp2ppp/3p4/4P3/8/5N2/PPPPP1PP/RNBQKB1R b KQkq -',this is the best answer but the situation is still very uncomfortable ..
995,31,5,e4,b'rn1qkbnr/ppp2ppp/3p4/4P3/4P1b1/5N2/PPPP2PP/RNBQKB1R b KQkq e3',to develop lsb on e2
996,31,6,Be2,b'r2qkbnr/ppp2ppp/2np4/4P3/4P1b1/5N2/PPPPB1PP/RNBQK2R b KQkq -',the e5 pawn is anyway sacrificed
997,31,7,Bxf3,b'r2qkbnr/ppp2ppp/2np4/4P3/4P3/5B2/PPPP2PP/RNBQK2R b KQkq -',now an attack on h5 could be refuted
998,31,8,g3,b'r3kbnr/ppp2ppp/2np4/4P3/4P2q/5BP1/PPPP3P/RNBQK2R b KQkq -',that ' s all no more danger. this attack is too early and give me a chance to castle (even if the castle is now weak
999,31,9,Qd8,b'r2qkbnr/ppp2ppp/2np4/4P3/4P3/5BP1/PPPP3P/RNBQK2R w KQkq -',ouf ! i have a free tempo
1000,31,10,c3,b'r2qkbnr/ppp2ppp/3p4/4n3/4P3/2P2BP1/PP1P3P/RNBQ1RK1 b kq -',knight take lsb i retake with the rook and place my queen on b3 threatening mate on f7...
1001,31,11,1d4,b'r2qkb1r/ppp2ppp/3p1n2/4n3/3PP3/2P2BP1/PP5P/RNBQ1RK1 b kq d3',forcing the exchange even if my plans are are no longer current
1002,31,12,1Bg5,b'r2qk2r/ppp1bppp/3p1n2/6B1/3PP3/2P2RP1/PP5P/RN1Q2K1 b kq -',if knight x e4 my dsb x e7 threatening the black queen then i place my rook in e3 and intent to win the back knight
1003,31,13,1Re3,b'r3k2r/ppp1qppp/3p4/8/3Pn3/2P1R1P1/PP5P/RN1Q2K1 b kq -',that was the plan but you know this is a 3mn blitz so i had to think quickly and i'm not sure about the suitability of it
1004,31,14,1d5,b'r3k2r/ppp1qppp/8/3p4/3Pn3/2P1R1P1/PP5P/RN1Q2K1 w kq -',that was expected i will play Nd2
1005,31,15,O-O,b'r4rk1/ppp1qppp/8/3p4/3Pn3/2P1R1P1/PP1N3P/R2Q2K1 w - -',so the result of my plan is that i'm 1 pawn less and a very weak situation in king side. great ! at this moment i'm not expecting any victory ...
1006,31,16,1Qe2,b'r4rk1/ppp1qppp/8/8/3Pp3/2P1R1P1/PP2Q2P/R5K1 b - -',wining the pawn ?
1007,31,17,1f5,b'r4rk1/ppp1q1pp/8/5p2/3Pp3/2P1R1P1/PP2Q2P/R5K1 w - f6',of course not !
1008,31,18,Rae8,b'4rrk1/ppp1q1pp/8/5p2/3Pp3/2P1R1P1/PP2Q2P/5RK1 w - -',i will intent my last plan's chance : attacking black castle placing my rook in h4 but i don't believe it will win ..
1009,31,19,2Rh4,b'4rr1k/ppp1q1pp/8/5p2/3Pp2R/2P1R1P1/PP2Q2P/6K1 b - -',i didnt saw the dangerous advancing g pawn ...
1010,31,20,2Qf7,b'4rr1k/ppp2qpp/8/5p2/3Pp2R/2P1R1P1/PP2Q2P/6K1 w - -',preventing Qh5
1011,31,21,g5,b'4rr1k/ppp2q1p/8/5pp1/3Pp2R/2P1R1P1/PP4QP/6K1 w - g6',surprise ! am i going to loose my rook ? not !
1012,31,22,2Rh3,b'4rr1k/ppp2q1p/8/5pp1/3Pp3/2P1R1PR/PP4QP/6K1 b - -',that's all. if g pawn advance i go back to h4 and there is no thing more to kill my rook apart another rook what would be just an exchange.
1013,31,23,2Qe2,b'4r1rk/ppp2q1p/8/5pp1/3Pp3/2P1R1PR/PP2Q2P/6K1 b - -',in case of f pawn advance
1014,31,24,2f4,b'4r1rk/ppp2q1p/8/6p1/3Ppp2/2P1R1PR/PP2Q2P/6K1 w - -',very tight game
1015,31,25,2Qe3,b'4r1rk/ppp2q1p/8/6p1/3PR3/2P1QpPR/PP5P/6K1 b - -',so dangerous pawn most of the time i loose with good player is a question of pawns !
1016,31,26,2Qxe4,b'6rk/ppp2q1p/8/6p1/3PQ3/2P2pPR/PP5P/6K1 b - -',i have a secret weapon for what follows...
1017,31,27,2f2+,b'6rk/ppp2q1p/8/6p1/3PQ3/2P3PR/PP3p1P/6K1 w - -',of course 
1018,31,28,2Kf1,b'6rk/ppp2q1p/8/6p1/3PQ3/2P3PR/PP3p1P/5K2 b - -',the only response
1019,31,29,2Re8,b'4r2k/ppp2q1p/8/6p1/3PQ3/2P3PR/PP3p1P/5K2 w - -',so this is the black plan ! Ans i had found the emergency exit : Rxh7!
1020,31,30,2Rxh7+,b'4r2k/ppp2q1R/8/6p1/3PQ3/2P3P1/PP3p1P/5K2 b - -',here we are that was the wining white move. so what would you play there if you where blacks ?
1021,31,31,3Rxc7,b'6k1/ppR5/8/6p1/3Pr3/2P3P1/PP3p1P/5K2 b - -',and i win at least 2 pawns. then the situation will be clearly in my advantage see it ....
1022,31,32,3Kxf2,b'6k1/ppR5/8/6p1/3P4/2P3P1/PP3K1P/4r3 b - -',the dangerous pawn is dead
1023,31,33,Rxa2,b'6k1/pR6/8/6p1/3P4/2P3P1/rP3K1P/8 w - -',so now i'm +3 and my king can come into the fight easily while black king is blocked on 8th line. so black resign.
1024,32,0,e4,b'rnbqkbnr/pppppppp/8/8/4P3/8/PPPP1PPP/RNBQKBNR b KQkq e3',This game is a well fought game with some interesting ideas on initiative and tempo. The endgame is also quite interesting.
1025,32,1,e5,b'rnbqkbnr/pppp1ppp/8/4p3/4P3/8/PPPP1PPP/RNBQKBNR w KQkq e6',Black responds symmetrically 
1026,32,2,Nf3,b'rnbqkbnr/pppp1ppp/8/4p3/4P3/5N2/PPPP1PPP/RNBQKB1R b KQkq -',"Once I read that this 2.Nf3 is called the 'Russian game'
In any case it is a good move as Black is almost obliged to defend the pawn (unless he plays 2...Nf6 the Petroff defence)"
1027,32,3,Nc6,b'r1bqkbnr/pppp1ppp/2n5/4p3/4P3/5N2/PPPP1PPP/RNBQKB1R w KQkq -',Black defends the pawn and develops a piece
1028,32,4,Bc4,b'r1bqkbnr/pppp1ppp/2n5/4p3/2B1P3/5N2/PPPP1PPP/RNBQK2R b KQkq -',White plays the Italian Game this has a general tendency to turn into a 'open' type of game with either one or both sets of central pawns exchanged.
1029,32,5,Nf6,b'r1bqkb1r/pppp1ppp/2n2n2/4p3/2B1P3/5N2/PPPP1PPP/RNBQK2R w KQkq -',"The immediate development of the knight is called the 'Two Knights Game'.
It is VERY sharp and theoretical and so is not to everyones taste it certainly does not appeal to me playing this move as Black unless you are very well prepared.
If you are well prepared it is EXCELLENT!"
1030,32,6,d4,b'r1bqkb1r/pppp1ppp/2n2n2/4p3/2BPP3/5N2/PPP2PPP/RNBQK2R b KQkq d3',"White immediately makes a move on the centre with a threat and opens a line for the c1 bishop and provides some space for the Queen. 
White threatens 5. dxe5"
1031,32,7,exd4,b'r1bqkb1r/pppp1ppp/2n2n2/8/2BpP3/5N2/PPP2PPP/RNBQK2R w KQkq -',Black captures the pawn removing the threat.
1032,32,8,Ng5,b'r1bqkb1r/pppp1ppp/2n2n2/6N1/2BpP3/8/PPP2PPP/RNBQK2R b KQkq -',White sacrifices a pawn and makes a large threat of Nxf7
1033,32,9,d5,b'r1bqkb1r/ppp2ppp/2n2n2/3p2N1/2BpP3/8/PPP2PPP/RNBQK2R w KQkq d6',"Black threatens the Bishop on c4 and the pawn on e4.
This move is practically forced and is a very familiar theme in the 'Two knights defense'.
"
1034,32,10,exd5,b'r1bqkb1r/ppp2ppp/2n2n2/3P2N1/2Bp4/8/PPP2PPP/RNBQK2R b KQkq -',"White captures the pawn and threatens the knight on c6.
6. Bxd5 Nxd5
7. exd5 Qxd5  and Black is already better as he has the two bishops a extra pawn developed his queen and has exchanged an attacking piece."
1035,32,11,Qe7+,b'r1b1kb1r/ppp1qppp/2n2n2/3P2N1/2Bp4/8/PPP2PPP/RNBQK2R w KQkq -',"Black checks with the queen. This is a very interesting idea for Black. White reply of kf1 is forced.
Both sides will have development problem and king safety issues. 
White will have to somehow develop the h1 rook.
Black on the other hand will have to deal with the fact his queen blocks the dark squared bishop as well as the fact his knight on c6 is en prise to the pawn at the moment."
1036,32,12,Ne5,b'r1b1kb1r/ppp1qppp/5n2/3Pn1N1/2Bp4/8/PPP2PPP/RNBQ1K1R w kq -',Black defends the knight and also threatens the c4 bishop. The knight also defends the important f7 square.
1037,32,13,d6,b'r1b1kb1r/ppp1qppp/3P1n2/4n1N1/2Bp4/8/PPP2PPP/RNBQ1K1R b kq -',White decides to try and increase pressure by sacrificing a pawn.
1038,32,14,Qxd6,b'r1b1kb1r/ppp2ppp/3q1n2/4n1N1/2Bp4/8/PPP2PPP/RNBQ1K1R w kq -',"Black captures the pawn.
8...cxd6 would have seriously messed up Blacks pawn structure."
