,gid,aid,move,fen,annotation
489,26,19,Rh8,b'7r/4k1b1/p1ppbp2/q7/1pPN3Q/PP3P2/6PP/RN1K3R w - -',This. It works but isn't the best.
490,26,20,2Qxh8,b'7Q/4k1b1/p1ppbp2/q7/1pPN4/PP3P2/6PP/RN1K3R b - -',I don't get this.
491,26,21,2Bxh8,b'7b/4k3/p1ppbp2/q7/1pPN4/PP3P2/6PP/RN1K3R w - -',Obvious.
492,26,22,2Nxc6+,b'7b/4k3/p1Npbp2/q7/1pP5/PP3P2/6PP/RN1K3R b - -',Ohhhhh! =(
493,26,23,Bxa1,b'8/3k4/p2pb3/N4p2/1PP5/1P3P2/6PP/bN1K3R w - -',At the time I annotated this I didn't see this. 
494,26,24,3Nxc3,b'8/3k4/4b3/NP1p1p2/8/1PN2P2/6PP/3KR3 b - -',Ohh.
495,26,25,3Na4,b'8/3k4/4b3/NP3p2/N2p4/1P3P2/6PP/3KR3 b - -',I losted on time.
496,27,0,e4,b'rnbqkbnr/pppppppp/8/8/4P3/8/PPPP1PPP/RNBQKBNR b KQkq e3',An interesting mating theme I found among friends. 
497,27,1,Bg7,b'rnbqk1nr/pp1pppbp/6p1/2p5/4PP2/5N2/PPPP2PP/RNBQKB1R w KQkq -',Pretty unusual all the opening... nice and tactics are coming... :-)
498,27,2,Nc6,b'r1bqk1nr/pp1pppbp/2n3p1/2p5/4PP2/2N2N2/PPPP2PP/R1BQKB1R w KQkq -',It is surely bad to exchange the dsb but in this case it has two interesting conuntersides: if white goes d2xc3 leaves the two pawns alone. Yes they are strong but will they survive the midgame? If bxc3 white has a strong center but on the other side has no really safe castling either side. Just wondering. Of course the text move is perfectly ok. 
499,27,3,Nd4,b'r1bqk1nr/pp1pppbp/6p1/1Bp5/3nPP2/2N2N2/PPPP2PP/R1BQK2R w KQkq -',"White's bishop's ""sortie"" wasn't a lucky one because of this move in my opinion. "
500,27,4,d5,b'r1bqk1nr/pp2ppbp/6p1/1Npp4/4PP2/5N2/PPPP2PP/R1BQ1RK1 w kq d6',Black's open lines are more active than white's so it's ok to open up the game. By the other side d6 instead won't have been bad. The white knight will lose a move to return where it belongs and black is shielded. If white goes e5 the exchanges (forced) won't leave black in a bad position - with equality (if I'm not wrong!). 
501,27,5,exd5,b'r1bqk1nr/pp2ppbp/6p1/1NpP4/5P2/5N2/PPPP2PP/R1BQ1RK1 b kq -',"It seems much safer to play e5 blocking the dsb. There are still 2 pawns in the way of black's. Black wont' fall in the Qxd5 trap but can play the nasty Qb6 with serious threats. 
"
502,27,6,Nf6,b'r1bqk2r/1p2ppbp/p4np1/2pP4/5P2/2N2N2/PPPP2PP/R1BQ1RK1 w kq -',"Black preferred to secure his king instead of the ""adventure"" Qb6 (after Nc3 is impossible due to Na4). "
503,27,7,1d4,b'r1bqk2r/1p2ppbp/p4np1/2pP4/3P1P2/2N2N2/PPP3PP/R1BQ1RK1 b kq d3',"Whte gives up the lost e5 but threats c5. Not good for black to take 10... cxd4 because of 11. Qxd4 and the knight f6 is pinned to the bishop (Nh4 will save it but will leave the knight out of the center. 
10... Nxd5 will lead to massive exchanges. After them white can end up with a doubled c pawn (BxN somewhere) or even tripled (if dxc5) :-) 10... Nxd5 11. dxc5? NxNc3 12. QxQ+ KxQ 13. Rd1+ Kc7 14. bxNc3 (virtually forced) Bxc3 15. Rb1 b5 with a better position for black I believe. 
So in my opinion 10... Nxd5 was ok. "
504,27,8,1c4,b'r1bqk2r/1p2ppbp/p4np1/3P4/2pP1P2/2N2N2/PPP3PP/R1BQ1RK1 w kq -',"Black again surprises me :-)
No hurry to take d5 better try to block a little white's already cramped position. But overlooks white's next move: "
505,27,9,1Qe2,b'r1bqk2r/1p2ppbp/p4np1/3P4/2pP1P2/2N2N2/PPP1Q1PP/R1B2RK1 b kq -',Now Nxd5 is countered by Re1 and black cannot castle (NxN QxN Qxe7).
506,27,10,1b5,b'r1bqk2r/4ppbp/p4np1/1p1P4/2pP1P2/2N2N2/PPP1Q1PP/R1B2RK1 w kq b6',Yes but losing a fatal tempo to castle and defend e7. Better was to leave the pawn to white: 11... o-o and if 12. Qxc5 Bd7 threatening Bb4 will keep on the fight. Bd7 cannot be played right now because of d6! 
507,27,11,1Re1,b'r1bqk2r/4ppbp/p4np1/1p1P4/2pP1P2/2N2N2/PPP1Q1PP/R1B1R1K1 b kq -',As predicted. Now black is squeezed. 
508,27,12,1Bb7,b'r2qk2r/1b2ppbp/p4np1/1p1P4/2pP1P2/2N2N2/PPP1Q1PP/R1B1R1K1 w kq -',I would have considered Bg5 with the idea of BxN. Black needs to defend e7 in order to castle and maybe even Ra7 would have been thinkable. 
509,27,13,1f5,b'r2qk2r/1b2ppbp/p4np1/1p1P1P2/2pP4/2N2N2/PPP1Q1PP/R1B1R1K1 b kq -',White goes sidewalking with a meaningful surprise. No tricks over there anyway. Black's defence holds and d5 seems lost. But black has a surprise by his side...
510,27,14,1b4,b'r2qk2r/1b2ppbp/p4np1/3P1P2/1ppP4/2N2N2/PPP1Q1PP/R1B1R1K1 w kq -',It looks that white should have lost a tempo with a3 before adventuring f5.
511,27,15,1fxg6,b'r2qk2r/1b2ppbp/p4nP1/3P4/1ppP4/2N2N2/PPP1Q1PP/R1B1R1K1 b kq -',...and now black must be a good boy and play hxg7 and white has to run with his knight (eg. Ne4) and black would take d5 with good chances. But no...
512,27,16,1bxc3,b'r2qk2r/1b2ppbp/p4nP1/3P4/2pP4/2p2N2/PPP1Q1PP/R1B1R1K1 w kq -',"A piece is a piece but it was obvious white should have made some calculations before leaving it to you. This was a ""I bet you're wrong"" moves... :-)"
513,27,17,Kf8,b'r2q1k1r/1b2pPbp/p4n2/3P4/2pP4/2p2N2/PPP1Q1PP/R1B1R1K1 w - -',Kxc7 Qd6+ followed by Ng5 and white's attack is a win.
514,27,18,Rb8,b'1r1q1k1r/4pPbp/p4n2/3b2N1/2pP4/2P5/P1P1Q1PP/R1B1R1K1 w - -',"Black covers a possible white Rb1 but a move has to be used to take care of white's control of the kingside. If not inmediately h6 or at least Qd7 in order to cover d6 along with the bishop. In case of Nd6+ BxN QxB QxQ RxQ and holds. Or Bxc7 - ok you lose your beloved lsb your best piece but against the fatal pawn on c7 and black can try Ra7 then. 
Of course white has Rb1! But white has an even better move: "
515,27,19,1Ba3,b'1r1q1k1r/4pPbp/p4n2/3b2N1/2pP4/B1P5/P1P1Q1PP/R3R1K1 b - -',This was unstoppable. And definitory.
516,27,20,Rd7,b'3q1k1r/3rpPbp/p4n2/3b2N1/2pP4/B1P5/P1P1Q1PP/1R2R1K1 w - -',"After Qd7 RxR QxR white wins with Bxe7+. 
"
517,27,21,2Rb8,b'1R1q1k1r/3rpPbp/p4n2/3b2N1/2pP4/B1P5/P1P1Q1PP/4R1K1 b - -',"Naturally. Black cannot lose a single e7 defender. A ""small"" underestimaion of white's attack on the e column and an overconfident ""grab it"" by black caussed him to lose the game. Well won a_random_guy!
But another mating squence is possible (thank you randomguy)
20.Qxe7+! Rxe7 21.Bxe7+ Qxe7 22.Rb8+ Ne8 23.Rxe8+ Qxe8 24.Rxe8# 
this one is really really nice!"
518,28,0,d4,b'rnbqkbnr/pppppppp/8/8/3P4/8/PPP1PPPP/RNBQKBNR b KQkq d3',So I start with my usual
519,28,1,c4,b'rnbqkb1r/pppppppp/5n2/8/2PP4/8/PP2PPPP/RNBQKBNR b KQkq c3',Still very normal
520,28,2,d5,b'rnbqkb1r/pp1ppppp/5n2/2pP4/2P5/8/PP2PPPP/RNBQKBNR b KQkq -',So into the Benoni-Benko systems. White has a slight space advantage. But will play his Bf8 to g7 and try to build up pressure along the long black diagonal combined with play on the Queen's side. White may try for a large break through in the centre and/or a king side attack. It is quite unbalanced which is why it is popular. According to the stats 2.....c5 leads to less draws and more wins for both White and Black.
521,28,3,cxb5,b'rnbqkb1r/p2ppppp/5n2/1PpP4/8/8/PP2PPPP/RNBQKBNR b KQkq -',So Dave goes for what the English-speaking world call the Benko Gambit after Pal Benko a Hungarian-American Grandmaster who provided many of the ideas. In other countries it is known as the Volga Gambit. Black gives up a pawn on the Queen side. The idea is to get open a and b files which combined with the Bg7 can give overwhelming pressure on the Queen side. The advanatages of this system is that Black's initiative and pressure can last well into the endgames and can continue even if a number of pieces have been exchanged. It is also a relatively easy system to play for Black.
522,28,4,Nc3,b'rnbqkb1r/3ppppp/p4n2/1PpP4/8/2N5/PP2PPPP/R1BQKBNR b KQkq -',I prefer this to just falling in with Black's idea by taking the second pawn. There are some interesting lines here such as 5. Nc3 axb5 6. e4 b4 7. Nb5 Nxe4 8. Qe2 (if Black moves the knight White has Nd6 mate!) f5 9. f3 Ra5 10. fxe4 Ba6 11. exf5 Bxb5 12. Qh5+ g6 13. fxg6 Bg7 14. gxh7+ Kf8 with advantage to white. Zontakh Andrey (2545) vs. Milanovic Dani… (2420) and Sauleda Roig J… (2152) vs. Fiol Company J… (2189). White won both games.
523,28,5,e4,b'rnbqkb1r/4pppp/p2p1n2/1PpP4/4P3/2N5/PP3PPP/R1BQKBNR b KQkq e3',So I grab the centre and give further protection to my pawn on b5.
524,28,6,f4,b'rnbqkb1r/4pp1p/p2p1np1/1PpP4/4PP2/2N5/PP4PP/R1BQKBNR b KQkq f3',Hoping at some stage to be able to get in e5 and cause disruption to the Black set-up.
525,28,7,Nf3,b'rn1qkb1r/1b2pp1p/p2p1np1/1PpP4/4PP2/2N2N2/PP4PP/R1BQKB1R b KQkq -',I find Bb7 a bit odd. Bg7 looks so natural and indeed is the only move on the Gameknot World Database. Nf3 is played to support an eventual e5.
526,28,8,Bd3,b'rn1qk2r/1b2ppbp/p2p1np1/1PpP4/4PP2/2NB1N2/PP4PP/R1BQK2R b KQkq -',Computer prefers bxa6 or Bc4 here. I did conside Bc4. I was a bit afraid of the bishop being hit by Nb8-d7-b6.
527,28,9,1O-O,b'rn1q1rk1/1b2ppbp/p2p1np1/1PpP4/4PP2/2NB1N2/PP4PP/R1BQ1RK1 b - -',Computer agrees with these moves and already thinks White has the upper hand. I was quite confident too but mindful of my previous 2 games I was being careful not to get over-confident.
528,28,10,1Bxb5,b'rn1q1rk1/1b2ppbp/3p1np1/1BpP4/4PP2/2N2N2/PP4PP/R1BQ1RK1 b - -',Computer agrees these are the best moves for both sides.
529,28,11,1Qe2,b'rn3rk1/1b2ppbp/1q1p1np1/1BpP4/4PP2/2N2N2/PP2Q1PP/R1B2RK1 b - -',Computer prefers Na6 for him and a4 for me. What we both missed was that Black can in fact play Nxe4 here. If White takes the knight with the Queen Black can exchange on c3 and then pick up the Bishop on b5 and if White recaptures the knight on e4 with his knight then Black plays c4 which puts White in Check and then he can play Queen takes bishop next move.
530,28,12,1dxe6,b'rn3rk1/1b3pbp/1q1pPnp1/1Bp5/4PP2/2N2N2/PP2Q1PP/R1B2RK1 b - -',Instead he tries to open the centre but he misses a tactic.
531,28,13,1Ng5,b'rn3rk1/1b4bp/1q1ppnp1/1Bp3N1/4PP2/2N5/PP2Q1PP/R1B2RK1 b - -',This is it! the Black e pawn is hard to defend.
532,28,14,1e5,b'rn3rk1/1b4bp/1q2pnp1/1BppP1N1/5P2/2N5/PP2Q1PP/R1B2RK1 b - -',14...d5 of course defends the e pawn with his Queen but this moves allows me to cut his Bg7 out of the game gains a space advantage and it is still hard for him to prevent losing a pawn. Computer actually likes 15. exd5. What do you think dear reader?
533,28,15,1Ncxe4,b'rn3rk1/1b4bp/1q2p1p1/1BppP1N1/4NP2/8/PP2Q1PP/R1B2RK1 b - -',Rather than go into defensive mode Dave decides to give up a pawn.
534,28,16,1Bc4,b'rn3rk1/1b4bp/1q2p1p1/2p1P1N1/2B1pP2/8/PP2Q1PP/R1B2RK1 b - -',This time I did see that if I took the pawn immediately c4 would lose a bishop
535,28,17,1Nxe4,b'rn3rk1/6bp/1q2p1p1/2pbP3/2B1NP2/8/PP2Q1PP/R1B2RK1 b - -',Computer actually prefers Rd1 but both moves seem good to me.
536,28,18,1Nd6,b'r4rk1/3n2bp/1q1Np1p1/2pbP3/2B2P2/8/PP2Q1PP/R1B2RK1 b - -',Computer prefers Nc6 to Nd7 and still likes Rd1. Certainly the knight on d7 doesn't seem to have many prospects and comes under fire down the d file. I wanted to make sure that there were no sacrifices on e5 - he may well have been loking at giving up a piece for 2 pawns on e5 to free his position.
537,28,19,2Bxd5,b'r4rk1/3n2bp/3Np1p1/2pBP3/1q3P2/8/PP2Q1PP/R1B2RK1 b - -',Now if he takes back with the pawn which is probably best I was going to play Qg4 hitting the knight on d7 and also with ideas of playing Qe6 check followed by Nf7 check picking up the exchange. Computer actually prefers to follow up with 21. Rd1 and thinks White has a decisive advantage because after 21. Qg4 Black has Qd4 check and if Kh1 Black can then take the pawn on e5 with either knight or Queen as there is a pin on the f4 pawn and if White captures on e5 there is Rf8xRf1 mate! Or if instead Rf2 Black has Nxe5 and there is still a pin on the f4 pawn. However Black decides to throw in the Queen check immediately.
538,28,20,2Be3,b'r4rk1/3n2bp/3Np1p1/2pBP3/3q1P2/4B3/PP2Q1PP/R4RK1 b - -',He is getting his bishop back but helping my development.
539,28,21,2Rfd1,b'r4rk1/3n2bp/3Np1p1/2pqP3/5P2/4B3/PP2Q1PP/R2R2K1 b - -',Computer agrees with these moves and says White has a decisive advantage.
540,28,22,2Qc4,b'r4rk1/3n2bp/2qNp1p1/2p1P3/2Q2P2/4B3/PP4PP/R2R2K1 b - -',I was originally going to play Qg4 with similar threats but I thought that this move kept more central control. I was wrong Qg4 would have been better as now he finds a way of staying in the game.
541,28,23,2Qxe6+,b'r4rk1/3n2b1/2qNQ1pp/2p1P3/5P2/4B3/PP4PP/R2R2K1 b - -',With the Queen on g4 I would have been able to play Qxg6 but White is winning easily. For the record computer prefers 24. b4. What do you think dear reader?
542,28,24,2Rac1,b'r4r2/3n2bk/2qNQ1pp/2p1P3/5P2/4B3/PP4PP/2RR2K1 b - -',Mobilising my reserves....computer actually prefers Qe7
543,28,25,2Qh3,b'4rr2/3n2bk/2qN2pp/2p1P3/5P2/4B2Q/PP4PP/2RR2K1 b - -',Dave takes advantage of a pin on my knight so if 26. NxR?? QxQ. Once again I have the chance to win two rooks for the Queen with 26. QxR RxQ 27. NxR but I decided this was better.
544,28,26,2Nc4,b'r4r2/3n2bk/2q3pp/2p1P3/2N2P2/4B2Q/PP4PP/2RR2K1 b - -',Computer actually prefers e6 and afterwards I was thinking that b4 may have been better. I think they all win!
545,28,27,2Rxd7,b'5r2/3R2bk/2q3pp/2p1P3/2N2P2/4B2Q/rP4PP/2R3K1 b - -',After the game Dave confessed he just didn't see this move. Computer prefers the Queen capture.
546,28,28,2Rd6,b'8/6bk/2qR2pp/2p1Pr2/2N2P2/4B2Q/rP4PP/2R3K1 b - -',Rf45 threatened my rook of course.
547,28,29,3Rxg6,b'8/6bk/6Rp/2p1Pr2/q1N2P2/4B2Q/rP4PP/2R3K1 b - -',A nice move to play!
548,28,30,3Qg4+,b'8/6b1/6kp/2p1Pr2/q1N2PQ1/4B3/rP4PP/2R3K1 b - -',Regaining the rook.
549,28,31,3Qxf5+,b'8/6bk/7p/2p1PQ2/q1N2P2/4B3/rP4PP/2R3K1 b - -',White is winning easily. Computer wants to resign this position.
550,28,32,3Nd6,b'6k1/6b1/3N3p/2p1PQ2/q4P2/4B3/rP4PP/2R3K1 b - -',Computer prefers e6 and is probably right.
551,28,33,3Qf7+,b'6k1/5Qb1/3N3p/2p1P3/q4P2/4B3/1P4PP/r1R3K1 b - -',Black is making one last bid....
552,28,34,3Nf5,b'7k/5Qb1/7p/2p1PN2/q4P2/4B3/1P4PP/r1R3K1 b - -',Threatening mate!
553,28,35,3Bxc1,b'7k/5Qb1/7p/2p1PN2/q4P2/8/1P4PP/2B3K1 b - -',Black has just a few spite checks.
554,28,36,3Kf2,b'7k/5Qb1/7p/2p1PN2/5P2/8/1P3KPP/2Bq4 b - -',Black could resign here.
555,28,37,4fxe5,b'7k/5Q2/7p/2p1PN2/8/3qB1K1/1P4PP/8 b - -',and Black finally resigns. Thanks for reading my annotation. Don't forget to leave comments and to rate my annotation to let me know how I am doing! Until next time.....
556,29,0,d5,b'rn1q1rk1/pb2bpp1/2p2n1p/1p1pp3/4P3/PBNP2NP/1PP2PP1/R1BQ1RK1 w - -',Good I will get a pawn !!
557,29,1,1Nxb5,b'rn1q1rk1/pb2bpp1/5n1p/1N1pp3/8/PB1P2NP/1PP2PP1/R1BQ1RK1 b - -',here is the free pawn
558,29,2,1dxe4,b'r4rk1/pb1qbpp1/2n2n1p/8/P1NpP3/1B4NP/1PP2PP1/R1BQ1RK1 b - -',Another pawn
559,29,3,1Bxh6,b'r3r1k1/pb1q1pp1/5n1B/2b5/PnNpP3/1B3QNP/1PP2PP1/R3R1K1 b - -',get a pawn with my bishop to get a knight 
560,29,4,1Nh7,b'r3r1k1/pb1q1ppn/7B/2b5/PnNpP3/1B3QNP/1PP2PP1/R3R1K1 w - -',No deal !! yes his king stucture will be smashedSo moving his knight to kh7 is better for him
561,29,5,2Ne5,b'3rr1k1/pb1q1ppn/8/2b1N3/Pn1pPB2/1B3QNP/1PP2PP1/R3R1K1 b - -',NOW i will get a very good setuationlet's see
562,29,6,2Bxf7+,b'3rr1k1/pb2qBpn/8/2b1N3/Pn1pPB2/5QNP/1PP2PP1/R3R1K1 b - -',"he has 3 options
1-get my bishop by his queen so he will loose it by my knight
2-moving his king to h8  so i will win by moving my knight to g6 ""checkmate""
3-moving his king to f8 also i will move my knight to g6 ""check"" to get his queen
Anyway i will move my knight to g6 

He reassigned I won"
563,30,0,b4,b'rnbqkbnr/pppppppp/8/8/1P6/8/P1PPPPPP/RNBQKBNR b KQkq b3',Interesting opening the Polish (Sokolsky) opening I believe up until Black's second move.
564,30,1,e6,b'rnbqkbnr/ppp2ppp/4p3/3p4/1P6/2N5/P1PPPPPP/R1BQKBNR w KQkq -',All by the book.
565,30,2,e4,b'rnbqkbnr/ppp2ppp/4p3/3p4/1P2P3/2N5/P1PP1PPP/R1BQKBNR b KQkq e3',From this move on the opening is no longer found in the Gameknot database.
566,30,3,Bxb4,b'rnbqk1nr/ppp2ppp/4p3/3p4/1b2P3/2N5/P1PP1PPP/R1BQKBNR w KQkq -',Picking up almost free material.
567,30,4,exd5,b'rnbqk1nr/ppp2ppp/8/3p4/1b6/2N5/P1PP1PPP/R1BQKBNR w KQkq -',Now I'm ahead.
568,30,5,Nb5,b'rnbqk1nr/ppp2ppp/8/1N1p4/1b6/8/P1PP1PPP/R1BQKBNR b KQkq -',Waste of a tempo. Why?
569,30,6,Qe2+,b'rn1qk1nr/pppb1ppp/8/1N1p4/1b6/8/P1PPQPPP/R1B1KBNR b KQkq -',Checking and protecting the Knight.
570,30,7,Ne6,b'rn1q1rk1/1ppbnppp/p3N3/3p4/1b6/6P1/P1PPQP1P/R1B1KBNR b KQ -',Three Knight moves out of the 9 he's had and to no avail.
571,30,8,Bxe6,b'rn1q1rk1/1pp1nppp/p3b3/3p4/1b6/6P1/P1PPQP1P/R1B1KBNR w KQ -',I did not want to weaken my Kingside.
572,30,9,1Bh3,b'rn1q1rk1/1pp1nppp/p3b3/3p4/1b6/6PB/P1PPQP1P/R1B1K1NR b KQ -',Trade when you are ahead.
573,30,10,Nbc6,b'r2q1rk1/1pp1nppp/p1n5/3p4/1b6/6PN/P1PPQP1P/R1B1K2R w KQ -',Hoping for Rook-King fork on c2.
574,30,11,Nd4,b'r2q1rk1/1pp1nppp/p7/3p2N1/1b1n4/6P1/P1PPQP1P/R1B1K2R w KQ -',Might as well scare the Queen.
575,30,12,1Qd3,b'r2q1rk1/1pp1nppp/p7/3p2N1/1b1n4/3Q2P1/P1PP1P1P/R1B1K2R b KQ -',To the wrong spot though.
576,30,13,1Nef5,b'r2q1rk1/1pp2ppp/p7/3p1nN1/1b1n4/3Q2P1/P1PP1P1P/R1B1K2R w KQ -',Saving the Knight. Puts the pair in a weird predicament though.
577,30,14,Qxg5,b'r3r1k1/1pp2ppp/p7/3p1nq1/1b1n2P1/3Q4/P1PP1P1P/R1B2K1R w - -',Pick up a free Knight.
578,30,15,Qf4,b'r3r1k1/1pp2ppp/p7/3p1n2/1b1n1qP1/3Q4/P1PP1P1P/R1B2KR1 w - -',Protecting them both.
579,30,16,Qxh2,b'r3r1k1/1pp2ppp/p7/3p1n2/1b1n2P1/3Q4/PBPP1P1q/R4KR1 w - -',Now I lose them both.
580,30,17,Qf3,b'4r1k1/1pp2ppp/p7/3p4/1b1Q2P1/5q2/P1PP1PR1/5K2 w - -',This should of happened on move 20.
581,30,18,2Qb2,b'4r1k1/1pp2ppp/p7/3p4/1b4P1/5q2/PQPP1PR1/5K2 b - -',Here is the Question: WHY White?! Why??
582,30,19,2Qd1#,b'4r1k1/1pp2ppp/p7/3p4/1b4P1/8/PQPP1PR1/3q1K2 w - -',Maybe he didn't see it...I guess I'll never know. Thanks for watching please rate and comment.
583,31,0,e4,b'rnbqkbnr/pppppppp/8/8/4P3/8/PPPP1PPP/RNBQKBNR b KQkq e3',This is probably one of my better wins though White did throw it away at the end.  I had some fairly interesting plays this game.  Lets start with the typical opening.  e4
584,31,1,c5,b'rnbqkbnr/pp1ppppp/8/2p5/4P3/8/PPPP1PPP/RNBQKBNR w KQkq c6',My typical response to e4 after I learned to play the Sicilian back 4 years ago.
585,31,2,b4,b'rnbqkbnr/pp1ppppp/8/2p5/1P2P3/8/P1PP1PPP/RNBQKBNR b KQkq b3',The wing gambit the only gambit that I can recall of the top of my head for the Sicilian defense.  I believe the idea is for white to try to keep his d-pawn.  White should be able to almost always form the ideal pawn center with this opening.  I see no reason to not accept this sacrifice.
586,31,3,a3,b'rnbqkbnr/pp1ppppp/8/8/1p2P3/P7/2PP1PPP/RNBQKBNR b KQkq -',white plans on opening the file for his rook and allowing the development of the dsb to the a3-f8 diagonal where it plays influence on the development of the e pawn due to the somewhat undermining Bxf8 Kxf8.  I decided that I don't like that plan so instead I decide to start my move on the center and develop if axb4 with the move e6.
587,31,4,c3,b'rnbqk1nr/pp1p1ppp/4p3/8/1b2P3/2P5/3P1PPP/RNBQKBNR b KQkq -',A decent reply white gains the center for now with d4 next move and forces me to expend the tempo I gained from whites axb4.
588,31,5,Be7,b'rnbqk1nr/pp1pbppp/4p3/8/4P3/2P5/3P1PPP/RNBQKBNR w KQkq -',I decided on this move because I wanted to set a solid defense with a Scheveningen style structure for black.  Whites central pawns will end up marching at some point via e5 or d5.  So I plan on having my bishops in a defensive style for the moment and what for my chance to counter attack.
589,31,6,Nf6,b'rnbqk2r/pp1pbppp/4pn2/8/3PP3/2P5/5PPP/RNBQKBNR w KQkq -',Attempting to get white to play e5 so d6 can come with a possible pawn exchange not to mention if I can get my knight set up on d5 could be good for me.  The downside to this move order is white has the potential to increase the squeeze on black.  Example being e5 Nd5 c4 Nc7 where black plans d6 or d5 in order to break things open.
590,31,7,d6,b'rnbqk2r/pp2bppp/3ppn2/8/3PP3/2PB4/5PPP/RNBQK1NR w KQkq -',Adopting my counterattacking structure. I feel fairly flexible with this set up.
591,31,8,O-O,b'rnbq1rk1/pp2bppp/3ppn2/8/3PP3/2PB1N2/5PPP/RNBQK2R w KQ -',I want to get my king away from potential checks along the e8-a4 diagonal though Bd7 was also possible I have the idea of possibly moving my bishop to b7 instead to attack d5 and put pressure on e4.  Keeping the flexibility alive.
592,31,9,a6,b'r1bq1rk1/1p1nbppp/p2ppn2/8/3PP3/N1PB1N2/5PPP/R1BQ1RK1 w - -',Taking back control of the b5 square though I feel that my pawns will be weak after my eventual b5.
593,31,10,b5,b'r1bq1rk1/3nbppp/p2ppn2/1p6/3PP3/N1PB1N2/5PPP/R1BQR1K1 w - b6',? in hindsight I forgot about the pin on the a8 rook though I didn't have a whole lot of choice I could have played b6 first maybe.  The point being I want to get my bishop into the action and fast.
594,31,11,Bb7,b'r2q1rk1/1b1nbppp/p2ppn2/1N6/3PP3/2PB1N2/5PPP/R1BQR1K1 w - -',Now white must expend a tempo to keep the knight.  I haven't lost my passed pawn as of yet. which I would believe blacks advantage at the moment.
595,31,12,Qc7,b'r4rk1/1bqnbppp/p2ppn2/8/3PP3/N1PB1N2/5PPP/R1BQR1K1 w - -',Development and attack of the c3 pawn.  Black is now ready to begin the attack on the center that I have been preparing for.
596,31,13,e5,b'r4rk1/1bqnbppp/p2p1n2/4p3/2PPP3/N2B1N2/5PPP/R1BQR1K1 w - -',My idea was to exchange on d4 or have the possibility of playing Nc5 to attack whites bishop on c3 and possible win the e4 pawn.  If white decides to close down the center with d5 I can play Nc5 and eventually have the plan of f5 to bust open the center.
597,31,14,Rab8,b'1r3rk1/1bqnbppp/p2p1n2/4p3/2PPP3/N2B1N2/1B3PPP/R2QR1K1 w - -',I feel that having the potential to attack the bishop on b2 could be good for me. I also have the possible plan of unbalancing the position which you will see in a few more moves.
598,31,15,1Qd2,b'1r3rk1/1bqnbppp/p2p1n2/4p3/2PPP3/N2B1N2/1B1Q1PPP/R3R1K1 b - -',Protecting the b2 bishop.
599,31,16,1exd4,b'1r3rk1/1bqnbppp/p2p1n2/8/2PpP3/N2B1N2/1B1Q1PPP/R3R1K1 w - -',I want to get my d7 knight out.
600,31,17,1Nxd4,b'1r3rk1/1bqnbppp/p2p1n2/8/2PNP3/N2B4/1B1Q1PPP/R3R1K1 b - -',I believe this is the better of the take backs the knight does well on d4 but this is what I wanted from white.
601,31,18,1Nc5,b'1r3rk1/1bq1bppp/p2p1n2/2n5/2PNP3/N2B4/1B1Q1PPP/R3R1K1 w - -',My knight finally comes to the c5 square where it has a threat on the d3 bishop and the possible plan of Nxd3 Bxe4 or Nxe4.
602,31,19,1f3,b'1r3rk1/1bq1bppp/p2p1n2/2n5/2PNP3/N2B1P2/1B1Q2PP/R3R1K1 b - -',White defends from this threat but now my plan I mentioned a few minutes ago comes into play.  First thing is to remove the defender of the b2 bishop.
603,31,20,1Qxd3,b'1r3rk1/1bq1bppp/p2p1n2/8/2PNP3/N2Q1P2/1B4PP/R3R1K1 b - -',Now that the b2 bishop is undefended I can attack the b2 bishop.
604,31,21,1Bxe4,b'1r3rk1/2q1bppp/p2p1n2/8/2PNb3/N2Q1P2/1B4PP/R3R1K1 w - -',!? here is the plan i mention a few minutes ago.  White won't take back with the rook or queen because I can just play Nxe4.  White now must deal with the reality of the lsb's attack on his/her queen.
605,31,22,2Qe2,b'1r3rk1/2q1bppp/p2p1n2/8/2PNb3/N4P2/1B2Q1PP/R3R1K1 b - -',I think this is the best of what white can play.  But how does black continue now?  
606,31,23,2Bd3,b'1r3rk1/2q1bppp/p2p1n2/8/2PN4/N2b1P2/1B2Q1PP/R3R1K1 w - -',Walking more into the fire white must again deal with bishops attack on the queen he can try Qxe7 Qxe7 Rxe7 Rxb2 and both sides have fairly dynamic position.  I think I may slightly favor white in that position.  But I thought that white may have the better of it when I played Bxe4 but I couldn't resist. 
607,31,24,2Qd2,b'1r3rk1/2q1bppp/p2p1n2/8/2PN4/N2b1P2/1B1Q2PP/R3R1K1 b - -',White's decision attempts to make everything work out well for him.  If Bxc4 Nxc4 and I'm in big trouble.  It keeps the defense of the dsb and if white gets to many move he may find a way to defend everything.
608,31,25,2d5,b'1r3rk1/2q1bppp/p4n2/3p4/2PN4/N2b1P2/1B1Q2PP/R3R1K1 w - -',I plan on however supporting my bishop  with dxc4 or Nxd5 after cxd5 in order to add protection to my e7 bishop.
609,31,26,2Qxd3,b'1r3rk1/2q1bppp/p4n2/3p4/2PN4/N2Q1P2/1B4PP/R3R1K1 b - -',White finally decides to exchange.
610,31,27,2Rab1,b'5rk1/2q1bppp/p4n2/3p4/2PN4/N2Q1P2/1r4PP/1R2R1K1 b - -',Continues the exchange white is probably hoping for Rxb1 Rxb1 dxc4 Nxc4.
611,31,28,2Bxa3,b'5rk1/2q2ppp/p4n2/3p4/2PN4/b2Q1P2/1r4PP/1R2R1K1 w - -',The in between move.
612,31,29,Qxc4,b'5rk1/5ppp/p4n2/3p4/2qN4/Q4P2/6PP/1R4K1 w - -',and now for the moment black is up two pawns and everything is defended.  Whites counter play is his activity.
613,31,30,2Nf5,b'5rk1/5ppp/p4n2/3p1N2/2q5/Q4P2/6PP/1R4K1 b - -',I was seeing sparks from white here with the interesting combination attempt Ne7+ Kh8 Ng6+ winning the rook on f8. I can't move my rook via e8 or c8 due to the nasty fork Nd6. 
614,31,31,2g6,b'5rk1/5p1p/p4np1/3p1N2/2q5/Q4P2/6PP/1R4K1 w - -',?! I don't like this move now my idea was that once white plays Ne7 I could defend with Kg7.
615,31,32,2Qb2,b'5rk1/5p1p/p4np1/3p1N2/2q5/5P2/1Q4PP/1R4K1 b - -',now things are starting to feel very uneasy.  White seems to have formed an attack out of my passive position for the moment.
616,31,33,2d4,b'5rk1/5p1p/p4np1/5N2/2qp4/5P2/1Q4PP/1R4K1 w - -',I sac a pawn in the hopes of trading off queens here.  Thought there is another reason for this sacrifice.
617,31,34,Qc5,b'5rk1/5p1p/p4np1/2q5/3N4/5P2/1Q4PP/1R4K1 w - -',and here it is now white is at least pinned down for the moment and it gives me a few moves to try to come out of my passivity.
618,31,35,2Rc1,b'5rk1/5p1p/p4np1/2q5/3N4/5P2/1Q4PP/2R3K1 b - -',Attempting to free himself.
619,31,36,2Qe5,b'5rk1/5p1p/p4np1/4q3/3N4/5P2/1Q4PP/2R3K1 w - -',another pin.  trying to give myself some time or hopefully some breathing room from a move from white.
620,31,37,3Qf2,b'5rk1/5p1p/p4np1/4q3/3N4/5P2/5QPP/2R3K1 b - -',And here it is the pins are done but whites attack has been slightly weakened black now has the opportunity to come out of the shell a little.
