,gid,aid,move,fen,annotation
0,0,0,e4,b'rnbqkbnr/pppppppp/8/8/4P3/8/PPPP1PPP/RNBQKBNR b KQkq e3',.Black handled badly the opening phase and allowed me to temporarily sacrifice my queen to get a great attack that at least would render me some material advantage
1,0,1,Nf6,b'rnbqkb1r/pppppppp/5n2/8/4P3/8/PPPP1PPP/RNBQKBNR w KQkq -',Alekhine's defence
2,0,2,c4,b'rnbqkb1r/pppppppp/8/3nP3/2P5/8/PP1P1PPP/RNBQKBNR b KQkq c3',I prefer a sideline from the mostly played d4 to keep some pressure on the knight and to populate the centre with my pawns by playing c4 (the Steiner variation) now I plan also to play at some time Nc3 not hampering the c pawn development.
3,0,3,d4,b'rnbqkb1r/pppppppp/1n6/4P3/2PP4/8/PP3PPP/RNBQKBNR b KQkq d3',c4 is protected by Bf1 so d4 is the natural way of progress to populate the centre with pawns psicologicaly is also interesting to contrapose the hyper-modernist ideas behind 1...Nf6 with the more classical approach of gaining space in the center.
4,0,4,d6,b'rnbqkb1r/ppp1pppp/1n1p4/4P3/2PP4/8/PP3PPP/RNBQKBNR w KQkq -',To create some tension and to open the c8-h3 diagonal for the bishop
5,0,5,Nf3,b'rnbqkb1r/ppp1pppp/1n1p4/4P3/2PP4/5N2/PP3PPP/RNBQKB1R b KQkq -',I delayed the common exd6 so I can finally develop a piece I expect Bg4 to pin my knight have doubts about the recapturing piece if black captures my e5 pawn probably knight is a better choice to keep the imbalance of the position as f6 is bad for black's pawn structure the knight will be nice planted on e5 although too early on the game it might prove useful latter on.
6,0,6,Bg4,b'rn1qkb1r/ppp1pppp/1n1p4/4P3/2PP2b1/5N2/PP3PPP/RNBQKB1R w KQkq -',pins my knight
7,0,7,cxd6,b'rn1qkb1r/pp2pppp/1n1p4/8/2PP2b1/5N2/PP3PPP/RNBQKB1R w KQkq -',I was a bit surprised now expected black recapturing with exd6 instead although not terribly bad and frequently played it blocks dark squares bishop further more the d6 pawn can in the future provide a nice target if black opts for development of the e pawn a fianchetto is an option in-line with the hyper-modernism (main line after 7.Nc3 Nc6 8.Be3 g6).
8,0,8,Nc3,b'rn1qkb1r/pp2pppp/1n1p4/8/2PP2b1/2N2N2/PP3PPP/R1BQKB1R b KQkq -',further development is needed although with more space I lack developed pieces My Nc3 looks good behind the pawns as with the early c4 I gained more space in the centre
9,0,9,Be3,b'r2qkb1r/pp2pppp/1nnp4/8/2PP2b1/2N1BN2/PP3PPP/R2QKB1R b KQkq -',overprotecting d4 to allow Qxf3 if needed and developing one more piece
10,0,10,g6,b'r2qkb1r/pp2pp1p/1nnp2p1/8/2PP2b1/2N1BN2/PP3PPP/R2QKB1R w KQkq -',here it is the expected fianchetto...
11,0,11,d5,b'r2qkb1r/pp2pp1p/1nnp2p1/3P4/2P3b1/2N1BN2/PP3PPP/R2QKB1R b KQkq -',and now some little trap instead of the usual and natural h3 black is almost forced to capture Bxf3 as Ne5 allows c5 Nxe5 and Bb5+ to exchange queens with a piece up
12,0,12,Ne5,b'r2qkb1r/pp2pp1p/1n1p2p1/3Pn3/2P3b1/2N1BN2/PP3PPP/R2QKB1R w KQkq -',? but understandable as exchanging a bishop for a knight is usually perceived as bad unless it inflicts some structural damage to the pawn structure.
13,0,13,1c5,b'r2qkb1r/pp2pp1p/1n1p2p1/2PPn3/6b1/2N1BN2/PP3PPP/R2QKB1R b KQkq -',And now the trap is set: 10...dxc5 11.Nxe5 Bxd1 12.Bb5+ Nd7 13.Bxd7+ Qxd7 14.Nxd7 Kxd7 15.Kxd1 a piece up for white 10...Bxf3 is slightly better but also not good due to 11.Bb5+ Nbd7 12.gxf3 and white has more space and can still attack black's knight 
14,0,14,1Nc8,b'r1nqkb1r/pp2pp1p/3p2p1/2PPn3/6b1/2N1BN2/PP3PPP/R2QKB1R w KQkq -',Up until now we were following Krapivin V. - Gorbushin A. 1997 Russia 1-0; now black deviates but the tactics are still on with this move both Bxf3 and Nbd7 stands any chances against Bb5
15,0,15,1Nxe5,b'r1nqkb1r/pp2pp1p/3p2p1/2PPN3/6b1/2N1B3/PP3PPP/R2QKB1R b KQkq -',As Bxd1?? leads to losing material
16,0,16,1Bxd1,b'r1nqkb1r/pp2pp1p/3p2p1/2PPN3/8/2N1B3/PP3PPP/R2bKB1R w KQkq -',?? black's greed starts a forced sequence
17,0,17,Qd7,b'r1n1kb1r/pp1qpp1p/3p2p1/1BPPN3/8/2N1B3/PP3PPP/R2bK2R w KQkq -',only move
18,0,18,Kd8,b'r1nk1b1r/pp1Bpp1p/3p2p1/2PPN3/8/2N1B3/PP3PPP/R2bK2R w KQ -',only move
19,0,19,Rxc8,b'2rk1b1r/pp2pp1p/3p2p1/2PPN3/8/2N1B3/PP3PPP/R2bK2R w KQ -',"? Kxc8 is better as Nxf7 only gains a pawn but black light squares bishop is miserably placed so black is bond to lose more material anyway.
dxe5 is not better although regaining some material back allows for Bxb7 attacking the rook and after Rb8 then c6 protects the bishop and creates havoc in black's field"
20,0,20,1Nxf7+,b'2rk1b1r/pp2pN1p/3p2p1/2PP4/8/2N1B3/PP3PPP/R2bK2R b KQ -',"The fork on King and rook seals black's fate. 
Black's lack of space the king in the centre and uncoordinated pieces allowed for some nice tactics that at least would have allowed white to win a piece it turned quickly in to a bunch of pieces and the game."
21,1,0,e4,b'rnbqkbnr/pppppppp/8/8/4P3/8/PPPP1PPP/RNBQKBNR b KQkq e3',1.e4 remaining as the all time favourite move to begin the game with no matter are you beginner or grandmaster you are going to face this best-by-test move more than any other opening move. But back to the game my opponent decided to go for this instead of playing 1.d4 which was his main opening move(I would have tried to go for kings indian defence if that would have happened).
22,1,1,c5,b'rnbqkbnr/pp1ppppp/8/2p5/4P3/8/PPPP1PPP/RNBQKBNR w KQkq c6',My main defence against e4. I play other moves here too but it is a good rule when facing a stronger opponent on paper to go for the opening which you know the best.
23,1,2,g6,b'rnbqkb1r/pp2pp1p/3p1np1/8/3NP3/2N5/PPP2PPP/R1BQKB1R w KQkq -',My absolute favourite of all times Dragon variation which is also regarded as one of the most complicated openings employed in modern practice. Back in early days of Dragon the moves to begin with were much more different: 1. e4 c5 2. Nf3 Nc6 3. d4 cxd4 4. Nxd4 Nf6 5. Nc3 d6 and after 6. Be2 g6 black would have successfully got where he wanted(move order was developed from avoiding c2-c4 marcozy bind and attacking move e4-e5 when they were used against the imaginary d6 e7 g6 h7 formation resembling Dragon constellation). Modern move order was found after response 6.Bg5 against old move order cause 6...g6? 7.Bxf6 exf6 is no good.
24,1,3,Be3,b'rnbqkb1r/pp2pp1p/3p1np1/8/3NP3/2N1B3/PPP2PPP/R2QKB1R b KQkq -',This move(we should say formation f2-f3 Bc1-e3 Qd1-d2 0-0-0 cause Rauzer started it with 6.f3) was first demonstrated by well-known player Vsevolod Rauzer. It is beginning of organised attack on the kingside with already mentioned formation.
25,1,4,f3,b'rnbqk2r/pp2ppbp/3p1np1/8/3NP3/2N1BP2/PPP3PP/R2QKB1R b KQkq -',With this move we come to position known as Yugoslav Attack(old name Rauzer Attack) white has long castle and a pawn storm in his mind on kingside. Less common replies in use here are 7...Nc6 and 7...a6(which are sometimes called anti-rauzer cause black delays castling counting on other benefits like first bringing pieces on queenside where white intends to castle).
26,1,5,O-O,b'rnbq1rk1/pp2ppbp/3p1np1/8/3NP3/2N1BP2/PPP3PP/R2QKB1R w KQ -',"Most common reply ""Come on I am not afraid of your attack on king's flank"". Black is going to trust on his counterplay which he can get from queenside."
27,1,6,Qd2,b'rnbq1rk1/pp2ppbp/3p1np1/8/3NP3/2N1BP2/PPPQ2PP/R3KB1R b KQ -',"There remains continuation 8.Bc4 Nc6 9.Qe2 which is just ""wrong"" cause true spirit of Yugoslav attack is to go and see who checkmates first! But the continuation I gave there is to go up against blacks counterplay on queenside."
28,1,7,Nc6,b'r1bq1rk1/pp2ppbp/2np1np1/8/3NP3/2N1BP2/PPPQ2PP/R3KB1R w KQ -',Black is ready for the battle counterblow in the center that is. So white is going to either allow it by playing 9. 0-0-0 prevent it by 9.Bc4 or be a haymaker and go for 9.g4.
29,1,8,Bc4,b'r1bq1rk1/pp2ppbp/2np1np1/8/2BNP3/2N1BP2/PPPQ2PP/R3K2R b KQ -',Some call this a modern approach of this opening as after many games and research done with the move 9. 0-0-0 this is regarded as the best shot by white to get the advantage in game(keep in mind that in openings you never know when old moves come into fashion again. There is surely room for new ideas in 0-0-0 variation you just have to find them). This move is to prevent any ...d6-d5 plans while developing light-squared bishop to its most active diagonal. So what white is planning then? Long castle h2-h4-h5 Be3-h6 if needed launching attack against black king.
30,1,9,Bd7,b'r2q1rk1/pp1bppbp/2np1np1/8/2BNP3/2N1BP2/PPPQ2PP/R3K2R w KQ -',Alright I am not going into details with other possibilities as 9...Nxd4 9...Nd7 9...Na5 9...a6 or 9...a5(if this would be introduction of opening then yes). Bishop move ...Bd7 is a flexible choice in this position black has lot of possibilities. For example there is knight manoeuvre possibility ...Nc6-e5-c4(without developing queen before it cause simply saving tempo).
31,1,10,1O-O-O,b'r2q1rk1/pp1bppbp/2np1np1/8/2BNP3/2N1BP2/PPPQ2PP/2KR3R b - -',And white continues the plan I introduced. If you want to try something else here then go for 10.Bb3 cause immediate 10.h4 Rc8 11.Bb3 Ne5 leads to transposition(unless you are planning to delay castling then maybe some difference).
32,1,11,1Rc8,b'2rq1rk1/pp1bppbp/2np1np1/8/2BNP3/2N1BP2/PPPQ2PP/2KR3R w - -',Black has to start working on his own counterplay queenside. There is nothing else now that we have come here so thematic c-file control in sicilian is a great way to start it.
33,1,12,1Bb3,b'2rq1rk1/pp1bppbp/2np1np1/8/3NP3/1BN1BP2/PPPQ2PP/2KR3R b - -',I don't believe there is much anything else. 11. Nxc6 Bxc6 12.Bb3 is not recommended as it doesn't give anything and black can even sacrifice pawn for an initiative: 12...b5!? 13.Bxa7 Qa5 14.Bd4 b4 15.Bxf6 Bxf6 16.Nd5 Bxd5 17. exd5 Rc5 and chances are usually on the side of player who is having more active bishop in cases where bishops are different colour included with other pieces on board.
34,1,13,1Ne5,b'2rq1rk1/pp1bppbp/3p1np1/4n3/3NP3/1BN1BP2/PPPQ2PP/2KR3R w - -',"And continuing with manoeuvre plan aiming for c4. White has now option to go for interesting 12.Kb1 which is prophylactic king move(when I was younger we used to joke about these as ""GM moves""). Other interesting possibility is to play 12. Bg5 where white wants to play e4-e5 break cause of a pin on d-file. Main continuation is 12.h4 which we shall see in the game."
35,1,14,1h4,b'2rq1rk1/pp1bppbp/3p1np1/4n3/3NP2P/1BN1BP2/PPPQ2P1/2KR3R b - h3',Flank attack following the spirit of this opening and starting the attack against black king.
36,1,15,1h5,b'2rq1rk1/pp1bppb1/3p1np1/4n2p/3NP2P/1BN1BP2/PPPQ2P1/2KR3R w - h6',Black weakens his castled position which should not be done if following general rules. Reason of this move is not to prevent g2-g4 advance cause it will come at some point anyway. But the reason is to delay it and make white to prepare it first. Question is: Can black achieve anything during that duration. 12...a5 is another move reducing blacks possibilities and 12...Nc4 is played here frequently.
37,1,16,1Bg5,b'2rq1rk1/pp1bppb1/3p1np1/4n1Bp/3NP2P/1BN2P2/PPPQ2P1/2KR3R b - -',Here white had several possibilites: 13. g4 13. Kb1 13. Bh6 13. Rhe1 leading to a different game. White goes to threaten knight protecting g2-g4 break and also narrows blacks counterplay possibilities.
38,1,17,1Rc5,b'3q1rk1/pp1bppb1/3p1np1/2r1n1Bp/3NP2P/1BN2P2/PPPQ2P1/2KR3R w - -',Now this is interesting move which needs an explanation. Here has been tried 13...Nc4 but it doesn't look promising after 14. Qe2 Na5 15. Kb1 and white is happy to set attack on the kingside(1-0 Nunn - Mestel London 1986 can be taken as example game). This rook move is unusual in Dragon but wonderful possibility in this position prepares b7-b5 and scouts important squares on 5th rank.
39,1,18,1Kb1,b'3q1rk1/pp1bppb1/3p1np1/2r1n1Bp/3NP2P/1BN2P2/PPPQ2P1/1K1R3R b - -',14.f4 and 14.g4 are other two moves used here which are more like risking everything. King move is safer option but useful one at this point. Other options let black too easily to get counterplay with knight manoeuvre e5-c4.
40,1,19,1b5,b'3q1rk1/p2bppb1/3p1np1/1pr1n1Bp/3NP2P/1BN2P2/PPPQ2P1/1K1R3R w - b6',Preparation is done so I started my play on queenside by pushing a pawn.
41,1,20,1g4,b'3q1rk1/p2bppb1/3p1np1/1pr1n1Bp/3NP1PP/1BN2P2/PPPQ4/1K1R3R b - g3',Yeah! This is what Dragon should be typical plan in opposite-castled position you have to be first with the attack!
42,1,21,1a5,b'3q1rk1/3bppb1/3p1np1/ppr1n1Bp/3NP1PP/1BN2P2/PPPQ4/1K1R3R w - a6',Instead of going 15...hxg4 the sharpest continuation and where every move values extremely high I decided to go for other accepted idea here which is to get a-pawn threaten bishop while it's not the only reason. Other plan is to get a-pawn to a3 and open up diagonal h8-a1 for bishop in some scenarios.
43,1,22,1gxh5,b'3q1rk1/3bppb1/3p1np1/ppr1n1BP/3NP2P/1BN2P2/PPPQ4/1K1R3R b - -',All makes sense white continues his attack.
44,1,23,1a4,b'3q1rk1/3bppb1/3p1np1/1pr1n1BP/p2NP2P/1BN2P2/PPPQ4/1K1R3R w - -',16...Nxh5 would be the other move here which is a passive method dealing against whites attack by defending. Most likely the move played here offers better possibilities for black to actually do something.
45,1,24,1h6,b'3q1rk1/3bppb1/3p1npP/1pr1n1B1/p2NP2P/1BN2P2/PPPQ4/1K1R3R b - -',From what I heard this move is nowadays considered as intermediate move. The move which is considered to be stronger move is not hard to find that is 17.Bxf7(Schmidt - Varga Germany 1991 white got strong attack with 17.Bxf7 Kxf7 18.hxg6+ Nxg6 19.h5 Ne5 20.Qg2 Rg8 21.h6 Bh8 22.f4 Nc4 23.Qh2 Nxb2 24.Rdg1 Rxc3 25.h7 Rg6 26.f5 Rxg5 27.Rxg5).
46,1,25,1Bh8,b'3q1rkb/3bpp2/3p1npP/1pr1n1B1/p2NP2P/1BN2P2/PPPQ4/1K1R3R w - -',Forced move nothing too interesting.
47,1,26,Nxh7,b'3q1rkb/3bpp1n/3p2p1/1pr1n1B1/p2NP2P/1BN2P2/PPPQ4/1K1R3R w - -',Again forced.
48,1,27,a3,b'3q1rkb/3bpp1n/3p2p1/1prBn1B1/3NP2P/p1N2P2/PPPQ4/1K1R3R w - -',Okay now this is some sort of novelty. Move that has been tried here instead of this is 19...b4 where black should be doing just fine. But as I mentioned earlier this move is to increase power of dark-squared bishop(and yes it does some damage around whites king) so idea to play this came quite naturally into my head in this game. How much I spent thinking the move 19...b5 as I do have some analysed lines in my old notes... well I can still remember this like yesterday that I was simply too excited to find out where 19...a3 leads and didn't spend much time on 19...b5(I want to show you funny execution in here 19...Qc7 20.Bxe7 Re8 21.h5 Rxe7 22.hxg6 Nxg6 23.Rdg1 Nhf8 24.Nf5 Bxf5 25.exf5 Bxc3 26.fxg6 Re1+ 27.Qxe1 Rxd5 28.Qe4 Qc4 29.Qe8 fxg6 30.bxc3 g5 31.Rh8+ Kxh8 32.Qxf8+ Kh7 33.Qf7+ 1-0 and German player Hausrath was defeated in fashion by the best ranked player from Estonia nowadays Kaido Kulaots in wch U16 1992)
49,1,28,e6,b'3q1rkb/3b1p1n/3pp1pB/1prBn3/3NP2P/p1N2P2/PPPQ4/1K1R3R w - -',I didn't like 20...Re8 21.h5 e6 22.hxg6 Nxg6 23.Bb3 axb2 24.Rdg1 which seems to give white good chances. So instead I went for ...e6 immediately and maybe lose the exchange but this path seems to give black possibilities(certainly better than 20...Re8 which asks for trouble).
50,1,29,2Bxf8,b'3q1Bkb/3b1p1n/3pp1p1/1prBn3/3NP2P/p1N2P2/PPPQ4/1K1R3R b - -',White decides to grab the material. 21.Bb3 would have been another choice and its hard to determine which one is the more accurate one between these two(hopefully someone finds the reason). Maybe 21.Bb3 would be the right choice by keeping dark-squared bishop on kingside for possibilities or that is what I have started to believe more I look this position. Problem with 21.Bxf8 seems to be that it just throws the fuel out and white can't create anything but aslong as his bishop stays on board it can be nasty for black. One example would be 21.Bb3 Re8 22.h5 g5 23.f4 b4 24.Nce2 Ng4 25.Bxg5 Nxg5 26.fxg5 Nf2 27.g6 Nxd1 28.gxf7+ Kxf7 29.Rxd1 Qg5 and now white has 30.Qxb4 otherwise it would be better for black but now it leads to whites advantage.
51,1,30,2Bb3,b'3q1nkb/3b1p2/3pp1p1/1pr1n3/3NP2P/pBN2P2/PPPQ4/1K1R3R b - -',Now we get to the same point but white doesn't have his bishop and this doesn't look bad for black.
52,1,31,2Bg7,b'3q1nk1/3b1pb1/3pp1p1/1pr1n3/3NP2P/pBN2P2/PPPQ4/1K1R3R w - -',Now this looks weird move. The reason why I wanted to do this is that in some scenarios in chess it is not good to give opponent change to do check and develope a piece to good square same time(in here rook to g1 and check same time).
53,1,32,gxh5,b'3q1nk1/3b1pb1/3pp3/1pr1n2p/3NP3/pBN2P2/PPPQ4/1K1R3R w - -',This is already looking dangerous for black(if you look deeper in position you might disagree) but 23...gxh5 is the only option what else and now we see a quite odd thing. Rook that was played to c5 square suddenly eyes this pawn aswell. White can't go for 24.Rxh5 cause black just goes 24...Nxf3 25.Nxf3 Rxh5. From how the game goes on it might be that 24.bxa3 would have been the right move as a-pawn is going to be troublesome in this game.
54,1,33,2f4,b'3q1nk1/3b1pb1/3pp3/1pr1n2p/3NPP2/pBN5/PPPQ4/1K1R3R b - -',?! I just don't know what was going in head of this guy. He decides to change his light-squared bishop to my knight while opening lines front of his king. Maybe he had seen something I didn't? or is it that white doesn't have better ideas like maybe just playing knight to e2 or rook to g1 and I can't see much wrong in those options.
55,1,34,2Bxc4,b'3q1nk1/3b1pb1/3pp3/1pr4p/2BNPP2/p1N5/PPPQ4/1K1R3R b - -',This would make more sense if I take with Rook here: 25...Rxc4 26.e5! and he would get my h-pawn while keeping comfortable position.
56,1,35,2f5,b'3q1nk1/3b1pb1/3pp3/2r2P1p/2pNP3/p1N5/PPPQ4/1K1R3R b - -',? So was this what white planned with f-push? makes even less sense as it doesn't seem to be doing much and I have hard time accepting that title player would go for this. Maybe there were snakes he saw and nobody else did?
57,1,36,2Qb8,b'1q3nk1/3b1pb1/3pp3/2r2P1p/2pNP3/p1N5/PPPQ4/1K1R3R w - -',! This had to be done now. Leading to forced sequence of moves after which black has his dark-squared bishop in great position towards white king and possibilities of using his h-pawn. And when you add the fact that black wins a pawn by clearing white pawns that stand on squares e4 and f5 this is starting to look really good. 
58,1,37,Rxf5,b'1q3nk1/5pb1/3p4/5r1p/8/pPN5/P2Q4/1K1R3R w - -',Now after seeing this position arising it makes me think would it have been any difference if white would have gone 28. axb3 keeping pawn on c2 to maybe(?) prevent ideas against his king.
59,1,38,3Rhg1,b'1q3nk1/5pb1/3p4/5r1p/8/pPN5/P2Q4/1K1R2R1 b - -',Maybe rook would have been better on e-file as black has possibility to just close the g-file now with knight.
60,1,39,3Ng6,b'1q4k1/5pb1/3p2n1/5r1p/8/pPN5/P2Q4/1K1R2R1 w - -',This is beginning of interesting and one of my most successful endgames. There was no reason to accept draw. The truth might be that black can't win this but as so often in games with these kind of chances you might sometimes earn the prize by trying. Black has a3-pawn in nasty position preventing whites play and three passed pawns from which h-pawn should be used in order to make possibility for chances. So maybe the earlier bxa3 would have done good for white(and that f-push included with losing those pawns on center was just terrible).
61,1,40,3Nd5,b'1q4k1/5pb1/3p2n1/3N1r1p/8/pP6/P2Q4/1K1R2R1 b - -',? This might already lead into lost game for white cause of possibility to play 32...Qe8 and when analysed further it seems to be really good for black. 33.Rde1 Re5 34.Nc3 h4 for example is promising. So what else if not 32.Nd5... it seems that rook move 32.Rc1! would be the move that could save the game like if the game would continue 32.Rc1! h4 33.Qd3 Rc5 34.Ne4 Rxc1+ 35.Rxc1 Qe8 36.Qd5 there is good chances for draw. Maybe black has some other possibilities but 32.Rc1! must be strong move here.
62,1,41,3Qb5,b'6k1/5pb1/3p2n1/1q1N1r1p/8/pP6/P2Q4/1K1R2R1 w - -',Straight ...Qe8 was the right plan but this doesn't throw it away yet and black still has possibility to play queen to important e8 square. If white goes for move 33.Rge1 preventing queen from moving to e8 then it seems black can maintain advantage by playing 33...h4 34.Nc7 Qb6 35. Re8+ Kh7 36.Nd5 Qf2 37.Re2 Qg3.
63,1,42,Qe8,b'4q1k1/5pb1/3p2n1/3N1r1p/8/pP6/P5Q1/1K1R2R1 w - -',! Black is probably winning now.
64,1,43,3Rde1,b'4q1k1/5pb1/3p2n1/3N1r1p/8/pP6/P5Q1/1K2R1R1 b - -',Now what else? 34.Rc1!? seems like alternative try but after 34...Qe5 35.Nc3 h4 36.Rc2 there remains another ace 36...d5!
65,1,44,3Re5,b'4q1k1/5pb1/3p2n1/3Nr2p/8/pP6/P5Q1/1K2R1R1 w - -',Only move for example if black goes 34...Qf8 then white gets into the game after 35.Rc1 Kh7 36.Ne3 Re5 37.Qf3 Qe8 38.Nc4 Qe6 39.Nxe5 Qxe5 40.Rg2.
66,1,45,3Qd2,b'4q1k1/5pb1/3p2n1/3Nr2p/8/pP6/P2Q4/1K2R1R1 b - -',Rooks needs to be protected.
67,1,46,3Qe6,b'6k1/5pb1/3pq1n1/3Nr2p/8/pP6/P2Q4/1K2R1R1 w - -',Focing knight to move away from center.
68,1,47,3Nb4,b'6k1/5pb1/3pq1n1/4r2p/1N6/pP6/P2Q4/1K2R1R1 b - -',Forced and now black is winning. Probably 36...Nh4 does the same  thing as the move I played in the game.
69,1,48,3Rxe1+,b'6k1/5pb1/3pq1n1/7p/1N6/pP6/P2Q4/1K2r1R1 w - -',! Absolute stunner!
70,1,49,3Rxe1,b'6k1/5pb1/3pq1n1/7p/1N6/pP6/P2Q4/1K2R3 b - -',Maybe 37. Qxe1 would have been better by simply offering trade of queens to draw the game(if you know you are losing it is sometimes worth trying even stupid stuff). Black of course shouldn't change queens then but instead play 37...Qf6.
71,1,50,3Qf6,b'6k1/5pb1/3p1qn1/7p/1N6/pP6/P2Q4/1K2R3 w - -',Using the power of mighty a1-h8 diagonal.
72,1,51,Qa1+,b'6k1/5pb1/3p2n1/7p/1N6/pP6/P2QR3/qK6 w - -',38...h4 might lead into won game aswell.
73,1,52,Bc3,b'6k1/5p2/3p2n1/7p/1N6/pPb5/Pq1QR3/3K4 w - -',This move had to be made otherwise white manages to hold. For example 40...Qb1+ 41.Qc1 Qxc1+ 42.Kxc1 just throws it away.
74,1,53,axb2,b'6k1/5p2/3p2n1/7p/1N6/1Pb5/Pp2R3/3K4 w - -',Not 41...Bxb2? cause white has rook and this forces white to give knight away.
75,1,54,4Kc2,b'6k1/5p2/3p2n1/7p/1N6/1Pb5/PpK1R3/8 b - -',42.Re8+ Kg7 43.Kc2 Bxb4 44.Kxb2 Ne5 and black wins.
76,1,55,d5,b'6k1/5p2/6n1/3p3p/1b6/1P6/PK2R3/8 w - -',!
77,1,56,4Rc2,b'6k1/5p2/8/3p3p/1b3n2/PP6/1KR5/8 b - -',45.Rh2 can be tried here as it will lead to game where black needs to play carefully if he wants to win the game. So I am going to introduce one long variation right now for that: 45.Rh2!? Bd6 46.Rh1 Be5+ 47.Ka2 Kf8 48.a4 Ke7 49.a5 Kd6 50.Ka3 Kc6 51.Ka4 d4 52.b4 d3 53.b5+ Kb7 54.Kb3 Bc7 55.a6+ Ka7 56.Rh4 f5 57.Kb2 Be5+ 58.Kb3 Ne6 59.Rxh5 Nc5+! 60.Kc4 d2 61.Rh7+ Ka8 62.Rh1 Ne4 63.Rd1 Bf4 64.b6 Nf2 65.Rb1 d1Q 66.Rrxd1 Nxd1 and black wins.
78,1,57,h4,b'6k1/5p2/8/3p4/1P3n1p/P7/1KR5/4b3 w - -',Black must push h-pawn in order to win this.
79,1,58,4Kb3,b'6k1/5p2/8/3p4/1P3n1p/PK6/2R5/4b3 b - -',47.b5 doesn't help anything 47...h3 48.b6 Bg3 saves the day for black.
80,1,59,Nf2,b'6k1/5p2/8/P2p4/1P6/1K4b1/5n1p/7R w - -',This all has been just playing moves out nothing too interesting but now at first it might look that white has brilliant idea which unfortunately doesn't work
81,1,60,5a6,b'6k1/5p2/P7/3p4/1P6/1K4b1/5n1p/7R b - -',White plays his last hope to get a queen on table.
82,1,61,5Nxh1,b'6k1/5p2/P7/3p4/1P6/1K4b1/7p/7n w - -',This had to be played now and not to react whites idea of promoting queen.
83,1,62,5Qxd5,b'8/5p1k/8/3Q4/1P6/1K4b1/5n1p/8 b - -',White is already in position which can be resigned but this good example how to win this position with black and something like this could be found from some endgame manual even(yes I am flattering myself cause I was and still am so happy about this game.)
84,1,63,5h1=Q,b'8/5p1k/8/3Q4/1P6/1K4b1/5n2/7q w - -',No surprise now it is just playing.
85,1,64,Kg1,b'8/1Q6/8/8/1P6/1K4b1/5n2/6kq w - -',My friend mikey45 asked here why white doesn't trade queens. I agree that would be the best try but black manages to stop b-pawn from promotion without losing a piece(just in time). Then it would be bishop+knight checkmate pattern.
86,1,65,Ke3,b'8/8/3b4/3q4/KP6/3nk3/2Q5/8 w - -',And white resigned showing that title players are not immortal(even against patzer like me). Black made few small inaccuracies which lost him the game: maybe trading the bishop to rook and not taking a3 pawn earlier in the game where bad choices and f3-f4-f5 push was something horribly wrong. Endgame which arose was really nice for myself to get a win out of it(feels good). Hopefully you find this game exciting aswell. I won't say it is 100% won endgame but it is clear that black is playing for win which I did!
87,2,0,d4,b'rnbqkbnr/pppppppp/8/8/3P4/8/PPP1PPPP/RNBQKBNR b KQkq d3',So he starts with d4
88,2,1,Nf6,b'rnbqkb1r/pppppppp/5n2/8/3P4/8/PPP1PPPP/RNBQKBNR w KQkq -',I play my usual
89,2,2,c4,b'rnbqkb1r/pppppppp/5n2/8/2PP4/8/PP2PPPP/RNBQKBNR b KQkq c3',Still very conventional
90,2,3,g6,b'rnbqkb1r/pppppp1p/5np1/8/2PP4/8/PP2PPPP/RNBQKBNR w KQkq -',and the same from me
91,2,4,g3,b'rnbqkb1r/pppppp1p/5np1/8/2PP4/6P1/PP2PP1P/RNBQKBNR b KQkq -',Slightly unusual Nc3 is more common
92,2,5,Bg7,b'rnbqk2r/ppppppbp/5np1/8/2PP4/6P1/PP2PP1P/RNBQKBNR w KQkq -',I develop
93,2,6,Bg2,b'rnbqk2r/ppppppbp/5np1/8/2PP4/6P1/PP2PPBP/RNBQK1NR b KQkq -',So does he
94,2,7,d5,b'rnbqk2r/ppp1ppbp/5np1/3p4/2PP4/6P1/PP2PPBP/RNBQK1NR w KQkq d6',I prevent e4. I call this the semi-grunfeld but I see the opening database calls it the King's Indian (E60) 3.g3 counterthrust variation.
95,2,8,cxd5,b'rnbqk2r/ppp1ppbp/5np1/3P4/3P4/6P1/PP2PPBP/RNBQK1NR b KQkq -',so he takes
96,2,9,Nxd5,b'rnbqk2r/ppp1ppbp/6p1/3n4/3P4/6P1/PP2PPBP/RNBQK1NR w KQkq -',and I take back
97,2,10,Nf3,b'rnbqk2r/ppp1ppbp/6p1/3n4/3P4/5NP1/PP2PPBP/RNBQK2R b KQkq -',He develops
98,2,11,O-O,b'rnbq1rk1/ppp1ppbp/6p1/3n4/3P4/5NP1/PP2PPBP/RNBQK2R w KQ -',I castle
99,2,12,O-O,b'rnbq1rk1/ppp1ppbp/6p1/3n4/3P4/5NP1/PP2PPBP/RNBQ1RK1 b - -',so does he
