,gid,aid,move,fen,annotation
310,8,11,Ne7,b'rnbqkb1r/pp2np1p/2pp2p1/8/3P4/8/PPP1QPPP/RNB1KBNR w KQkq -',Black develops his knight to e7 blocking the check at the expense of a pin. He could of done this also with his queen or his bishops. Black is leading this game so far!
311,8,12,Nc3,b'rnbqkb1r/pp2np1p/2pp2p1/8/3P4/2N5/PPP1QPPP/R1B1KBNR b KQkq -',I develop Kc3. I still have a center pawn unprotected a better move would of been Nf3. But I am most likely to castle queen side. I will have have to first move out my dsb.
312,8,13,d5,b'rnbqkb1r/pp2np1p/2p3p1/3p4/3P4/2N5/PPP1QPPP/R1B1KBNR w KQkq -',book
313,8,14,Qe5,b'rnbqkb1r/pp2np1p/2p3p1/3pQ3/3P4/2N5/PPP2PPP/R1B1KBNR b KQkq -',Now that black moved a pawn left e5 open I move my queen there. The knight is still pinned and  lack can counter this move easy enough.
314,8,15,Rg8,b'rnbqkbr1/pp2np1p/2p3p1/3pQ3/3P4/2N5/PPP2PPP/R1B1KBNR w KQq -',Black moves his rook out of danger. I do think this was the best move for black.
315,8,16,Bf4,b'rnbqkbr1/pp2np1p/2p3p1/3pQ3/3P1B2/2N5/PPP2PPP/R3KBNR b KQq -',I send out my dsb. I will now be able to castle Queen side.
316,8,17,Bg7,b'rnbqk1r1/pp2npbp/2p3p1/3pQ3/3P1B2/2N5/PPP2PPP/R3KBNR w KQq -',Black brings out his dsb and is now attacking my queen!
317,8,18,1Qe3,b'rnbqk1r1/pp2npbp/2p3p1/3p4/3P1B2/2N1Q3/PPP2PPP/R3KBNR b KQq -',I retreat Lizzy (my Queen) to e3.
318,8,19,1Be6,b'rn1qk1r1/pp2npbp/2p1b1p1/3p4/3P1B2/2N1Q3/PPP2PPP/R3KBNR w KQq -',Black continues to develop bring out his lsb to e6
319,8,20,1Nf3,b'rn1qk1r1/pp2npbp/2p1b1p1/3p4/3P1B2/2N1QN2/PPP2PPP/R3KB1R b KQq -', keeping  up with blacks development with Nf3.
320,8,21,1Nf5,b'rn1qk1r1/pp3pbp/2p1b1p1/3p1n2/3P1B2/2N1QN2/PPP2PPP/R3KB1R w KQq -',Black sends out his knight to attack Lizzy.
321,8,22,1Qd2,b'rn1qk1r1/pp3pbp/2p1b1p1/3p1n2/3P1B2/2N2N2/PPPQ1PPP/R3KB1R b KQq -',Lizzy moves to d2 away from blacks attacking Knight
322,8,23,1h6,b'rn1qk1r1/pp3pb1/2p1b1pp/3p1n2/3P1B2/2N2N2/PPPQ1PPP/R3KB1R w KQq -',h6 pawn by black
323,8,24,1h4,b'rn1qk1r1/pp3pb1/2p1b1pp/3p1n2/3P1B1P/2N2N2/PPPQ1PP1/R3KB1R b KQq h3',h4 by white
324,8,25,1Nd7,b'r2qk1r1/pp1n1pb1/2p1b1pp/3p1n2/3P1B1P/2N2N2/PPPQ1PP1/R3KB1R w KQq -',Nd7 by black  more development.
325,8,26,1O-O-O,b'r2qk1r1/pp1n1pb1/2p1b1pp/3p1n2/3P1B1P/2N2N2/PPPQ1PP1/2KR1B1R b q -',White castles 0-0-0
326,8,27,1Qb6,b'r3k1r1/pp1n1pb1/1qp1b1pp/3p1n2/3P1B1P/2N2N2/PPPQ1PP1/2KR1B1R w q -',Black brings out Qb6
327,8,28,1Be2,b'r3k1r1/pp1n1pb1/1qp1b1pp/3p1n2/3P1B1P/2N2N2/PPPQBPP1/2KR3R b q -',White brings out lsb to to e2 pairing up the rooks
328,8,29,1Nf6,b'r3k1r1/pp3pb1/1qp1bnpp/3p1n2/3P1B1P/2N2N2/PPPQBPP1/2KR3R w q -',Blacks Knight moves to f6 behind the other black Knight on f5. Together the 2 knights can cover alot of space on the board and can be very strong together In this location they control 11 spaces.
329,8,30,1Na4,b'r3k1r1/pp3pb1/1qp1bnpp/3p1n2/N2P1B1P/5N2/PPPQBPP1/2KR3R b q -',Na4 to attack Blacks Queen.
330,8,31,1Qc7,b'r3k1r1/ppq2pb1/2p1bnpp/3p1n2/N2P1B1P/5N2/PPPQBPP1/2KR3R w q -',?Queen moves to  c7 . This is going to be taken with whites dsb. Remember this is a blitz game.
331,8,32,1Bxc7,b'r3k1r1/ppB2pb1/2p1bnpp/3p1n2/N2P3P/5N2/PPPQBPP1/2KR3R b q -',I see the un-protected queen and take with my dsb Bxc7. Keeping in mind this was a blitz game I take with caution neverless. 
332,8,33,1Ne4,b'r3k1r1/ppB2pb1/2p1b1pp/3p1n2/N2Pn2P/5N2/PPPQBPP1/2KR3R w q -',Black moves up his knight to outpost on e4 attacking Lizzy
333,8,34,1Qe1,b'r3k1r1/ppB2pb1/2p1b1pp/3p1n2/N2Pn2P/5N2/PPP1BPP1/2KRQ2R b q -',Lizzy moves out of harm to e1
334,8,35,1h5,b'r3k1r1/ppB2pb1/2p1b1p1/3p1n1p/N2Pn2P/5N2/PPP1BPP1/2KRQ2R w q -',black pushes up the h pawn allowing a look to my king
335,8,36,1Kb1,b'r3k1r1/ppB2pb1/2p1b1p1/3p1n1p/N2Pn2P/5N2/PPP1BPP1/1K1RQ2R b q -',I move the king to b2
336,8,37,1b5,b'r3k1r1/p1B2pb1/2p1b1p1/1p1p1n1p/N2Pn2P/5N2/PPP1BPP1/1K1RQ2R w q b6',pawn to b5 attacking white knight on the side at a4
337,8,38,2Nc3,b'r3k1r1/p1B2pb1/2p1b1p1/1p1p1n1p/3Pn2P/2N2N2/PPP1BPP1/1K1RQ2R b q -',it was either here on c3 or c5 for retreating my knight 
338,8,39,2b4,b'r3k1r1/p1B2pb1/2p1b1p1/3p1n1p/1p1Pn2P/2N2N2/PPP1BPP1/1K1RQ2R w q -',pawn attacks white knight
339,8,40,2Nxe4,b'r3k1r1/p1B2pb1/2p1b1p1/3p1n1p/1p1PN2P/5N2/PPP1BPP1/1K1RQ2R b q -',white knight takes black knight on e4
340,8,41,2dxe4,b'r3k1r1/p1B2pb1/2p1b1p1/5n1p/1p1Pp2P/5N2/PPP1BPP1/1K1RQ2R w q -',pawn takes knight and attacks other white knight
341,8,42,2Ng5,b'r3k1r1/p1B2pb1/2p1b1p1/5nNp/1p1Pp2P/8/PPP1BPP1/1K1RQ2R b q -',advancing knight to a safe home on g5
342,8,43,2a5,b'r3k1r1/2B2pb1/2p1b1p1/p4nNp/1p1Pp2P/8/PPP1BPP1/1K1RQ2R w q a6',black moves up pawn 2 spaces to a5
343,8,44,2Nxe6,b'r3k1r1/2B2pb1/2p1N1p1/p4n1p/1p1Pp2P/8/PPP1BPP1/1K1RQ2R b q -',white knight takes lsb on e6
344,8,45,2fxe6,b'r3k1r1/2B3b1/2p1p1p1/p4n1p/1p1Pp2P/8/PPP1BPP1/1K1RQ2R w q -',pawn takes knight
345,8,46,2g4,b'r3k1r1/2B3b1/2p1p1p1/p4n1p/1p1Pp1PP/8/PPP1BP2/1K1RQ2R b q g3',white moves pawn out 2 spaces attacking knight on f5 expecting pawn to take and retake with my lsb
346,8,47,2hxg4,b'r3k1r1/2B3b1/2p1p1p1/p4n2/1p1Pp1pP/8/PPP1BP2/1K1RQ2R w q -',pawn takes pawn
347,8,48,2Bxg4,b'r3k1r1/2B3b1/2p1p1p1/p4n2/1p1Pp1BP/8/PPP2P2/1K1RQ2R b q -',lsb takes pawn on g4
348,8,49,2Bxd4,b'r3k1r1/2B5/2p1p1p1/p4n2/1p1bp1BP/8/PPP2P2/1K1RQ2R w q -',dsb takes pawn on d4
349,8,50,2Bxf5,b'r3k1r1/2B5/2p1p1p1/p4B2/1p1bp2P/8/PPP2P2/1K1RQ2R b q -',lsb takes knight on f5
350,8,51,2exf5,b'r3k1r1/2B5/2p3p1/p4p2/1p1bp2P/8/PPP2P2/1K1RQ2R w q -',pawn takes lsb
351,8,52,2Rxd4,b'r3k1r1/2B5/2p3p1/p4p2/1p1Rp2P/8/PPP2P2/1K2Q2R b q -',rook take dsb on d4
352,8,53,2Rc8,b'2r1k1r1/2B5/2p3p1/p4p2/1p1Rp2P/8/PPP2P2/1K2Q2R w - -',black moves rook to attack dsb on c7
353,8,54,2Bb6,b'2r1k1r1/8/1Bp3p1/p4p2/1p1Rp2P/8/PPP2P2/1K2Q2R b - -',dsb moves to b6 and this is last move I make as resigns with very little time on the clock.  THE END
354,9,0,e6,b'rnbqkbnr/pppp1ppp/4p3/8/4P3/8/PPPP1PPP/RNBQKBNR w KQkq -',Now this makes me chuckle. I know it is the beginning of the French defense which many grandmasters do play but I don't like it. Just because I often move an early e5 to give black fits and take him out of any ideas of a traditional French. Yes it loses a tempo and is probably unsound. But it's fun and to me that is what chess is. Fun!
355,9,1,e5,b'rnbqkbnr/pppp1ppp/4p3/4P3/8/8/PPPP1PPP/RNBQKBNR b KQkq -',So I do this.
356,9,2,exd6,b'rnbqkbnr/ppp2ppp/3Pp3/8/8/8/PPPP1PPP/RNBQKBNR b KQkq -',And exchange it off. Black now has a lead in development and white has gained nothing except that black is no longer just playing 'book' French Defense moves.
357,9,3,Bb5+,b'rnbqk1nr/ppp2ppp/3bp3/1B6/8/8/PPPP1PPP/RNBQK1NR b KQkq -',This is another waste of time by white. But my intention here is to provoke c6. You see here is the fun in what I just did: black ought to play aggressively now and continue to do so. But someone who favors a certain style of play can't easily switch gears... yet... if I'm playing a really highly rated player I don't play like this. There's no getting away with such games then!
358,9,4,c6,b'rnbqk1nr/pp3ppp/2pbp3/1B6/8/8/PPPP1PPP/RNBQK1NR w KQkq -',Black obliges. I've given him every opportunity to play much more aggressively and still he favors the stolid type opening. But... stay tuned.
359,9,5,Ba4,b'rnbqk1nr/pp3ppp/2pbp3/8/B7/8/PPPP1PPP/RNBQK1NR b KQkq -',What will black do now?
360,9,6,b5,b'rnbqk1nr/p4ppp/2pbp3/1p6/B7/8/PPPP1PPP/RNBQK1NR w KQkq b6',Aha! Now he's playing a bit more aggressively. Okay then time for fun.
361,9,7,a5,b'rnbqk1nr/5ppp/2pbp3/pp6/8/1B6/PPPP1PPP/RNBQK1NR w KQkq a6',Black continues aggresive play. Now here I decide to play a4.
362,9,8,c3,b'rnbqk1nr/5ppp/2pbp3/p7/Pp6/1BP5/1P1P1PPP/RNBQK1NR b KQkq -',I really don't like my queenside now but just wait: it gets far worse. Dr. Jekyll is fully taking advantage of my laisse faire attitude about those pawns. This last move of mine was due to that careless attitude.
363,9,9,O-O,b'rnbq1rk1/5pp1/2pbpn1p/p7/Pp6/1BP2N2/1P1P1PPP/RNBQ1RK1 w - -',Just normal development the last few moves.
364,9,10,1d4,b'rnbq1rk1/5pp1/2pbpn1p/p7/Pp1P4/1BP2N2/1P3PPP/RNBQ1RK1 b - d3',And white's position frankly sucks.
365,9,11,1c4,b'rn1q1rk1/1b3pp1/2pbpn1p/p7/PpPP4/1B3N2/1P3PPP/RNBQ1RK1 b - -',I make it worse because I'm not ready to do what I just did.
366,9,12,1c5,b'rn1q1rk1/1b3pp1/3bpn1p/p1p5/PpPP4/1B3N2/1P3PPP/RNBQ1RK1 w - -',Here I thought about taking the c pawn but did not like the scope those black bishops would have if I did. But unfortunately I did not think past that thought and white really now already is lost. But wait I'm not just playing Dr. Jekyll. Mr Hyde will soon show.
367,9,13,1d5,b'rn1q1rk1/1b3pp1/3bpn1p/p1pP4/PpP5/1B3N2/1P3PPP/RNBQ1RK1 b - -',So I even make it worse yet. And Dr. Jekyll is not missing anything just now.
368,9,14,Ba6,b'rn1q1rk1/5pp1/b2b1n1p/p1pP4/Pp6/1B3N2/1P3PPP/RNBQ1RK1 w - -',Again I was not thinking beyond the obvious. Duh. Rook attacked. Move rook. 
369,9,15,c4,b'rn1q1rk1/5pp1/b2b1n1p/p2P4/Ppp5/1B3N2/1P3PPP/RNBQR1K1 w - -',Bam! now white is in a real bind.
370,9,16,Bb7,b'rn1q1rk1/1b3pp1/3b1n1p/p2P4/Ppp5/5N2/1PB2PPP/RNBQR1K1 w - -',Now here black opted not to advance the b pawn he has something else in mind and I am paying no mind to the machinations of one Dr. Jekyll. So far my opponent has played very well demonstrating a good grasp of strategy while I've played simply awful.
371,9,17,1b3,b'rn1q1rk1/1b3pp1/3b1n1p/p2P4/Ppp5/1P3N2/2B2PPP/RNBQR1K1 b - -',This was rather stupid.
372,9,18,1c3,b'rn1q1rk1/1b3pp1/3b1n1p/p2P4/Pp6/1Pp2N2/2B2PPP/RNBQR1K1 w - -',Suddenly half of my army is cut off from play by my poor play and Dr. Jekyll's taking the opportunities I just granted him. Now this guy was rated 1650 and although I have defeated players rated above 2300 (well and lost to those also) he's just plain kicking my posterior. In this rather sad position I realize I will lose this game without a major shift on my part.
373,9,19,1Bxh6,b'rn1q1rk1/1b3pp1/3b1n1B/p2P4/Pp6/1Pp2N2/2B2PPP/RN1QR1K1 b - -',So why not I thought. This game is lost Dr. Jekyll has seen to it... but wait a minute Dr. Jekyll is no where to be found of a sudden. Instead there is naught but a hideous noise now as Mr. Hyde suddenly sits on the other side of the board.
374,9,20,1Ng4,b'rn1q1rk1/1b3pp1/3b3B/p2P4/Pp4n1/1Pp2N2/2B2PPP/RN1QR1K1 w - -',"Well HECK I thought. I was throwing the bishop away for a chance at some counterplay. Seriously outmanned outpositioned and just crushed on the queenside this move astounds me. So I give further instructions to the bishop. ""Continue"" I said ""excommunicating the King's knaves"". The bishop complies as most are wont to be obedient..."
375,9,21,1Bxg7,b'rn1q1rk1/1b3pB1/3b4/p2P4/Pp4n1/1Pp2N2/2B2PPP/RN1QR1K1 b - -',And now the King finally decides this rogue bishop must die.
376,9,22,2Qd4+,b'rn1q1r2/1b3pk1/3b4/p2P4/Pp1Q2n1/1Pp2N2/2B2PPP/RN2R1K1 b - -',The tunnel is still dark any light is likely an oncoming train. But I am not willing to just give up despite my earlier horrendous play. Turns out Mr. Hyde is about to lose in great style here.
377,9,23,2Qh4,b'rn1q1r2/1b3pk1/3b1n2/p2P4/Pp5Q/1Pp2N2/2B2PPP/RN2R1K1 b - -',Suddenly the Black King is very uncomfortable despite a major part of my army having a tea party in the corner of the board.
378,9,24,2Qg5+,b'rn1q3r/1b3pk1/3b1n2/p2P2Q1/Pp6/1Pp2N2/2B2PPP/RN2R1K1 b - -',Another fruitless check but what else does white have? Nothing. Oh wait that's right. Mr. Hyde is playing...
379,9,25,2h3,b'rn1q1k1r/1b3p2/3b1n2/p2P2Q1/Pp6/1Pp2N1P/2B2PP1/RN2R1K1 b - -',A nod to the pressure on the white King. Mr. Hyde now begins to make moves I don't understand. Nearly everyone would see that trading of pieces in this position would result in a won endgame for black as not only am I down a piece I will likely lose another piece just to liberate the queenside pieces that Dr. Jekyll so neatly imprisoned in a very strong dungeon.
380,9,26,2Bxd5,b'rn1q1k1r/5p2/3b1n2/p2b2Q1/Pp6/1Pp2N1P/2B2PP1/RN2R1K1 w - -',"But inexplicably Mr. Hyde gives in to his animal nature. ""Pawn. Must grab pawn"". And so he does."
381,9,27,2Nd4,b'rn1q1k1r/5p2/3b1n2/p2b2Q1/Pp1N4/1Pp4P/2B2PP1/RN2R1K1 b - -',All kinds of black tactics are available but Dr. Jekyll is no where in sight. This is my most embarrassing game I've played including the blitz games I've lost to others. It's hilarious! When you play like I have in this game you realize: it's time to go to bed and give it a rest. But I couldn't resist annotating this one. The entertainment continues...
382,9,28,2Nbd7,b'r2q1k1r/3n1p2/3b1n2/p2b2Q1/Pp1N4/1Pp4P/2B2PP1/RN2R1K1 w - -',Inexplicably black decides he needs further help. Let's see; I'm assaulting the black king with two pieces and there are six swarming to it's defense. Oh wait I miscounted: the Rook has the e file. 
383,9,29,2Nf5,b'r2q1k1r/3n1p2/3b1n2/p2b1NQ1/Pp6/1Pp4P/2B2PP1/RN2R1K1 b - -',I really didn't think this was going anywhere but about this point I realize that black's king really is in a little trouble. Now. Thanks to Mr. Hyde's reluctance to trade queens. A softspot for a pretty lady has been many a downfall for us guys hasn't it.
384,9,30,2Bh2+,b'r2q1k1r/3n1p2/5n2/p2b1NQ1/Pp6/1Pp4P/2B2PPb/RN2R1K1 w - -',Black does this but for the life of me I can't figure out why.
385,9,31,2Kg1,b'r4k1r/2qn1p2/5n2/p2b1NQ1/Pp6/1Pp4P/2B2PP1/RN2R1K1 b - -',So I can understand a reluctance to trade queens I suppose. There is after all something to be said for holding onto one's firepower. But here white's king still has ample protection for the time being despite the ponderous pressure heading that way. Meanwhile I practically jump at the chance to get back in the game...
386,9,32,2Be6,b'r4k1r/2qn1p2/4bn2/p4NQ1/Pp6/1Pp4P/2B2PP1/RN2R1K1 w - -',This move was probably necessary but it's far too slow for the position. I understand it; cutting the rook off from the e file. Black should have seen to his defense a lot sooner and now it's too late. There is lousy chess like I played for most of the first part of this game and good chess such as Dr. Jekyll played. And then there's the total wreck Mr. Hyde is inflicting on himself. There's a reason Dr. Jekyll is the one that should do the chess playing!
387,9,33,Ke8,b'r3k2r/2qn1pQ1/4bn2/p4N2/Pp6/1Pp4P/2B2PP1/RN2R1K1 w - -',Forced.
388,9,34,Nf8,b'r3kn1Q/2q2p2/4bn2/p4N2/Pp6/1Pp4P/2B2PP1/RN2R1K1 w - -',Also forced pretty much.
389,9,35,3Qxf6,b'r3kn2/2q2p2/4bQ2/p4N2/Pp6/1Pp4P/2B2PP1/RN2R1K1 b - -',I am now winning since Dr. Jekyll retired. Mr Hyde ensures such to be the case with his next move:
390,9,36,3Nh7,b'r3k3/2q2p1n/4bQ2/p4N2/Pp6/1Pp4P/2B2PP1/RN2R1K1 w - -',Nh7? Perhaps it deserves two ?'s. Mr. Hyde is reluctant to leave his pawn thinking falsely that it will protect him. And this last move results in at least massive material loss for black. Even Dr. Jekyll could not fix Mr. Hyde's position now.
391,9,37,3Ng7+,b'r3k3/2q2pNn/4bQ2/p7/Pp6/1Pp4P/2B2PP1/RN2R1K1 b - -',There are only two available moves. One leads to a mate in four: Kf8. The other Kd7 is not much better.
392,9,38,3Kf8,b'r4k2/2q2pNn/4bQ2/p7/Pp6/1Pp4P/2B2PP1/RN2R1K1 w - -',Kf8?? And Mr Hyde has undone all of Dr. Jekyll's fine work. The simple tactical shot wins...
393,9,39,3Nxe6+,b'r4k2/2q2p1n/4NQ2/p7/Pp6/1Pp4P/2B2PP1/RN2R1K1 b - -',Now the mate is in three and it's a nice one. ( ...Ke8 Nf8!+ Kxf8 Qh8#) Even novice players will notice if the mate is missed that besides the fork of the black queen to add insult to injury yet another fork after on the rook exists too. Thus Mr. Hyde recognized that it was curtains for him and stomps off in a rage. I certainly learned one thing from this: not to take pawn advances so carelessly just because my opponent doesn't seem all that highly rated. I'll probably still play nearly anything to avoid obvious book lines because I'm lazy don't want to memorize a lot of openings and enjoy odd positions. But when you do that take it from me: sometimes you'll face Dr. Jekyll not always Mr. Hyde.
394,10,0,Nf3,b'rnbqkbnr/pppppppp/8/8/8/5N2/PPPPPPPP/RNBQKB1R b KQkq -',White begins with the Reti opening.
395,10,1,a6,b'rnbqkbnr/1ppppppp/p7/8/8/5N2/PPPPPPPP/RNBQKB1R w KQkq -',A very unorthodox move for black.  I suppose he is just toying with me or perhaps he is providing a handicap in order to give me a chance.  I am sure there is a name for this defense but I don't know what it is.  The GameKnot database says that there have only been 83 people in the history of the universe that have ever used this response to the Reti.
396,10,2,d4,b'rnbqkbnr/1ppppppp/p7/8/3P4/5N2/PPP1PPPP/RNBQKB1R b KQkq d3',White pushes the d pawn rather than the c which means that we are no longer following Reti.  I was spooked away from pushing the c because I thought my opponent had something up his sleeve.  
397,10,3,e6,b'rnbqkbnr/1ppp1ppp/p3p3/8/3P4/5N2/PPP1PPPP/RNBQKB1R w KQkq -',Black opens the diagonals for the Queen and Bishop.  This strikes me as a conservative move.  Not showing any aggression here.
398,10,4,Bf4,b'rnbqkbnr/1ppp1ppp/p3p3/8/3P1B2/5N2/PPP1PPPP/RN1QKB1R b KQkq -',Developing a Bishop.
399,10,5,Nf6,b'rnbqkb1r/1ppp1ppp/p3pn2/8/3P1B2/5N2/PPP1PPPP/RN1QKB1R w KQkq -',Developing a Knight.
400,10,6,c4,b'rnbqkb1r/1ppp1ppp/p3pn2/8/2PP1B2/5N2/PP2PPPP/RN1QKB1R b KQkq c3',I push the c pawn which discorages the black d pawn from coming forward and it also opens a diagonal for my Queen.
401,10,7,Be7,b'rnbqk2r/1pppbppp/p3pn2/8/2PP1B2/5N2/PP2PPPP/RN1QKB1R w KQkq -',Another conservative move for black.  This allows him to castle on the next move if he desires to do so.
402,10,8,Nc3,b'rnbqk2r/1pppbppp/p3pn2/8/2PP1B2/2N2N2/PP2PPPP/R2QKB1R b KQkq -',Developing my other horse.
403,10,9,d5,b'rnbqk2r/1pp1bppp/p3pn2/3p4/2PP1B2/2N2N2/PP2PPPP/R2QKB1R w KQkq d6',Here comes that d pawn that I was expecting.  The black d pawn is protected in 3 ways.
404,10,10,cxd5,b'rnbqk2r/1pp1bppp/p3pn2/3P4/3P1B2/2N2N2/PP2PPPP/R2QKB1R b KQkq -',I decide to swap pawns.  The experts say that center pawns are worth more than the others so if I can take a d pawn with a c pawn then it seems like a good idea to me.
405,10,11,Nxd5,b'rnbqk2r/1pp1bppp/p3p3/3n4/3P1B2/2N2N2/PP2PPPP/R2QKB1R w KQkq -',Black evens up the score using his horse.  This threatens the unprotected white Bishop which perhaps should never have been placed there to begin with.
406,10,12,Bd2,b'rnbqk2r/1pp1bppp/p3p3/3n4/3P4/2N2N2/PP1BPPPP/R2QKB1R b KQkq -',The white Bishop tucks his tail and retreats whilst giving a little more support to the white Knight.
407,10,13,O-O,b'rnbq1rk1/1pp1bppp/p3p3/3n4/3P4/2N2N2/PP1BPPPP/R2QKB1R w KQ -',Black castles.  Another solid conservative move.
408,10,14,e4,b'rnbq1rk1/1pp1bppp/p3p3/3n4/3PP3/2N2N2/PP1B1PPP/R2QKB1R b KQ e3',White now has a pawn on e4 and d4 supported by Knights on c3 and f3.  In all the books I have read this is a really good thing for white.  This is the classic center-controlling set up that people drool over.  I am feeling really good at this point.
409,10,15,Nxc3,b'rnbq1rk1/1pp1bppp/p3p3/8/3PP3/2n2N2/PP1B1PPP/R2QKB1R w KQ -',Black decides to swap Knights.  This negates my protection on e4.  
410,10,16,bxc3,b'rnbq1rk1/1pp1bppp/p3p3/8/3PP3/2P2N2/P2B1PPP/R2QKB1R b KQ -',White evens the score.  I opted to take the Knight with the b pawn instead of the Bishop.  In my opinion its a good idea to support your center pawns with other pawns rather than with pieces.  This gives my Bishop a chance to do other things rather than to babysit with pawns.
411,10,17,c5,b'rnbq1rk1/1p2bppp/p3p3/2p5/3PP3/2P2N2/P2B1PPP/R2QKB1R w KQ c6',Black attacks my precious center pawns which I was so proud of.  Looks like they won't stay there for long.
412,10,18,1Rb1,b'rnbq1rk1/1p2bppp/p3p3/2p5/3PP3/2P2N2/P2B1PPP/1R1QKB1R b K -',White ignores the pawn threat because the d pawn is so nicely protected by the c pawn.  White decides to take control of that empty b file.  In the books that I have read it says that controlling territory is a good thing.
413,10,19,1Nc6,b'r1bq1rk1/1p2bppp/p1n1p3/2p5/3PP3/2P2N2/P2B1PPP/1R1QKB1R w K -',Black piles more threats on d4 and develops a Knight in the ordinary fashion.
414,10,20,1Be3,b'r1bq1rk1/1p2bppp/p1n1p3/2p5/3PP3/2P1BN2/P4PPP/1R1QKB1R b K -',I am trying with all my might to maintain my beautiful e4 and d4 which everyone tells me is such a wonderful thing to behold.
415,10,21,1cxd4,b'r1bq1rk1/1p2bppp/p1n1p3/8/3pP3/2P1BN2/P4PPP/1R1QKB1R w K -',Black hammers away at my wall.
416,10,22,1cxd4,b'r1bq1rk1/1p2bppp/p1n1p3/8/3PP3/4BN2/P4PPP/1R1QKB1R b K -',Once again I have my d4 and e4 back.  I am so proud.  My d4 is protected with 3 pieces.  My e4 has no protection at all.  That could be a bad omen.
417,10,23,1Qa5+,b'r1b2rk1/1p2bppp/p1n1p3/q7/3PP3/4BN2/P4PPP/1R1QKB1R w K -',Now we see that white should never have moved the Rook to b.  The black Queen executes a lovely forking maneuver threatening both the King and the a pawn.
418,10,24,1Bd2,b'r1b2rk1/1p2bppp/p1n1p3/q7/3PP3/5N2/P2B1PPP/1R1QKB1R b K -',I decide not to block the check with my Queen because then the black Bishop would come down and give me a nasty Skewer.  By blocking with my Bishop I lose a pawn but the alternative would be really bad.
419,10,25,1Qxa2,b'r1b2rk1/1p2bppp/p1n1p3/8/3PP3/5N2/q2B1PPP/1R1QKB1R w K -',As expected white loses a4 and goes a point down.
420,10,26,1Be2,b'r1b2rk1/1p2bppp/p1n1p3/8/3PP3/5N2/q2BBPPP/1R1QK2R b K -',I suppose the Queen scared me and I am now preparing to castle.
421,10,27,1Rd8,b'r1br2k1/1p2bppp/p1n1p3/8/3PP3/5N2/q2BBPPP/1R1QK2R w K -',Black threatens d4
422,10,28,1Ra1,b'r1br2k1/1p2bppp/p1n1p3/8/3PP3/5N2/q2BBPPP/R2QK2R b K -',"White ignores the threat on d4 and decides to play ""chase the queen."""
423,10,29,1Qb2,b'r1br2k1/1p2bppp/p1n1p3/8/3PP3/5N2/1q1BBPPP/R2QK2R w K -',The queen ducks away.
424,10,30,1Rb1,b'r1br2k1/1p2bppp/p1n1p3/8/3PP3/5N2/1q1BBPPP/1R1QK2R b K -',"White continues with this game of ""chase the queen."" "
425,10,31,1Qa3,b'r1br2k1/1p2bppp/p1n1p3/8/3PP3/q4N2/3BBPPP/1R1QK2R w K -',The queen ducks away again.
426,10,32,1Ra1,b'r1br2k1/1p2bppp/p1n1p3/8/3PP3/q4N2/3BBPPP/R2QK2R b K -',White continues to pester.
427,10,33,1Qd6,b'r1br2k1/1p2bppp/p1nqp3/8/3PP3/5N2/3BBPPP/R2QK2R w K -',Black Queen finally takes the hint.  White d4 now has 3 threats and only one protector.
428,10,34,1Bc3,b'r1br2k1/1p2bppp/p1nqp3/8/3PP3/2B2N2/4BPPP/R2QK2R b K -',White adds two protectors to d4.
429,10,35,1Rb8,b'1rbr2k1/1p2bppp/p1nqp3/8/3PP3/2B2N2/4BPPP/R2QK2R w K -',Black prepares to push the b pawn.  I am now thinking that my last move should have been Bishop to e3 rather than c3.
430,10,36,1O-O,b'1rbr2k1/1p2bppp/p1nqp3/8/3PP3/2B2N2/4BPPP/R2Q1RK1 b - -',White takes the opportunity to castle.
431,10,37,1b5,b'1rbr2k1/4bppp/p1nqp3/1p6/3PP3/2B2N2/4BPPP/R2Q1RK1 w - b6',As expected black pushes the b pawn.  No threat yet but it will be soon.
432,10,38,2e5,b'1rbr2k1/4bppp/p1nqp3/1p2P3/3P4/2B2N2/4BPPP/R2Q1RK1 b - -',"White decides to abandon the classic e4 d4 pawn structure to continue the game of ""chase the queen.""  I can't really claim that e4 and d4 was doing me any good but all the books say that it is such a wonderful thing.  I guess I am proud that I could maintain those 2 soldiers for as long as I did."
433,10,39,2Qc7,b'1rbr2k1/2q1bppp/p1n1p3/1p2P3/3P4/2B2N2/4BPPP/R2Q1RK1 w - -',I scared the black queen away.  This makes me happy.  It takes some pressure off of d4.  The black queen is now in a cramped place.
434,10,40,2Qd2,b'1rbr2k1/2q1bppp/p1n1p3/1p2P3/3P4/2B2N2/3QBPPP/R4RK1 b - -',I made this move to control more territory to allow my Rooks more freedom to move on the back row and I was also thinking about executing a Skewer by putting my Bishop on a5.
435,10,41,2b4,b'1rbr2k1/2q1bppp/p1n1p3/4P3/1p1P4/2B2N2/3QBPPP/R4RK1 w - -',Here comes that b pawn that I was expecting.  Once again I am wishing that I had put that Bishop on e3 rather than c3. 
436,10,42,2Bb2,b'1rbr2k1/2q1bppp/p1n1p3/4P3/1p1P4/5N2/1B1QBPPP/R4RK1 b - -',My bishop retreats while keeping the protection on d4.
437,10,43,2Nxe5,b'1rbr2k1/2q1bppp/p3p3/4n3/1p1P4/5N2/1B1QBPPP/R4RK1 w - -',Here is a brilliant move which shows why my opponent is a 2164.  I would have never thought to make this move.  White goes 2 points down.
438,10,44,2Qf4,b'1rbr2k1/2q1bppp/p3p3/4n3/1p1P1Q2/5N2/1B2BPPP/R4RK1 b - -',I thought this was a good response.  The d4 pawn is now free to take the Knight and the Knight does not really want to move away because QxQ.
439,10,45,2Nxf3+,b'1rbr2k1/2q1bppp/p3p3/8/1p1P1Q2/5n2/1B2BPPP/R4RK1 w - -',Another brilliant move for black.  It is always a good idea to check. Now the white Queen is in trouble.
440,10,46,2Qxf3,b'1rbr2k1/2q1bppp/p3p3/8/1p1P4/5Q2/1B2BPPP/R4RK1 b - -',White gets out of the predicament and remains 2 points down.  The white d4 pawn is very lonely with no supporting pawns although not in trouble right now.
441,10,47,2Bb7,b'1r1r2k1/1bq1bppp/p3p3/8/1p1P4/5Q2/1B2BPPP/R4RK1 w - -',Now black plays chase the queen.
442,10,48,2Qg4,b'1r1r2k1/1bq1bppp/p3p3/8/1p1P2Q1/8/1B2BPPP/R4RK1 b - -',White queen moves out of harms way.
443,10,49,2Qc2,b'1r1r2k1/1b2bppp/p3p3/8/1p1P2Q1/8/1Bq1BPPP/R4RK1 w - -',Another nice move for black.  The b2 Bishop is nearly trapped.
444,10,50,2Rab1,b'1r1r2k1/1b2bppp/p3p3/8/1p1P2Q1/8/1Bq1BPPP/1R3RK1 b - -',White manages to save the Bishop.
445,10,51,2f5,b'1r1r2k1/1b2b1pp/p3p3/5p2/1p1P2Q1/8/1Bq1BPPP/1R3RK1 w - f6',The white Queen is threatened.  The white Queen wants to protect the Bishop on e2.  She is reluctant to simply move away.
446,10,52,2Rfc1,b'1r1r2k1/1b2b1pp/p3p3/5p2/1p1P2Q1/8/1Bq1BPPP/1RR3K1 b - -',If you get me then I get you.
447,10,53,2Qxc1+,b'1r1r2k1/1b2b1pp/p3p3/5p2/1p1P2Q1/8/1B2BPPP/1Rq3K1 w - -',I never would have thought of this.  This is a 2164 move.  It is brilliant. 
448,10,54,2Rxc1,b'1r1r2k1/1b2b1pp/p3p3/5p2/1p1P2Q1/8/1B2BPPP/2R3K1 b - -',White negates the check.
449,10,55,2fxg4,b'1r1r2k1/1b2b1pp/p3p3/8/1p1P2p1/8/1B2BPPP/2R3K1 w - -',Black takes Queen.
450,10,56,2Bxg4,b'1r1r2k1/1b2b1pp/p3p3/8/1p1P2B1/8/1B3PPP/2R3K1 b - -',At this point white has no hope but holds on a little longer.
