,gid,aid,move,fen,annotation
0,0,0,Nf3,b'rnbqkbnr/pp3ppp/3p4/2p5/4P3/5N2/PPP2PPP/RNBQKB1R b KQkq -',"by this time, my opponent got abusive: he was going to learn me a strong lesson; that is the friendly translation..."
1,0,1,e5,b'rnbqkbnr/1p4pp/p2p4/2p1Pp2/8/5N2/PPP1BPPP/RNBQK2R b KQkq -',Augh...
2,0,2,b5,b'rnbqkbnr/6pp/p2p4/1pp1Pp2/8/5N2/PPP1BPPP/RNBQK2R w KQkq b6',in denial...
3,0,3,exd6,b'rnbqkb1r/4n1pp/p2P4/1pp2pB1/8/5N2/PPP1BPPP/RN1QK2R b KQkq -',Augh again...
4,0,4,1Bd2,b'rnb1kb1r/4n1pp/p2P4/qpp2p2/8/5N2/PPPBBPPP/RN1QK2R b KQkq -',of course: Ne7 is lost...
5,0,5,1Bc4,b'rnb1k2r/4b1pp/p7/q1p2p2/1pB5/5N2/PPPB1PPP/RN1QK2R b KQkq -',prohibiting castling...
6,0,6,1O-O,b'rnb1k2r/4b1p1/p6p/q1p2p2/1pB5/5N2/PPPB1PPP/RN1Q1RK1 b kq -',time to castle...
7,0,7,1c3,b'r1b1k2r/4b1p1/p1n4p/q1p2p2/1pB5/2P2N2/PP1B1PPP/RN1Q1RK1 b kq -',preventing Nd4...
8,0,8,Qc7,b'r1b1k2r/2q1b1p1/p1n4p/2p2p2/2B5/2B2N2/PP3PPP/RN1Q1RK1 w kq -',losing more tempo: White is a full light piece ahead...
9,0,9,Bd7,b'r3k2r/2qbb1p1/p1n4p/2p2p2/2B5/2B2N2/PP3PPP/RN1QR1K1 w kq -',preparing castling long: right into trouble...
10,0,10,O-O-O,b'2kr3r/2qbb1p1/p1n4p/2p1Np2/2B5/2B5/PP3PPP/RN1QR1K1 w - -',"hoping for an attack, on the White Queen..."
11,0,11,1Bxa6+,b'2krr3/2qbb1p1/B1n3Np/2p2p2/8/2B5/PP3PPP/RN1QR1K1 b - -',a lost pawn...
12,0,12,2Be5,b'1k1rr3/2qbb1p1/B1n3Np/2p1Bp2/8/8/PP3PPP/RN1QR1K1 b - -',pinning the Black Queen unto the King: Be5 has to be taken...
13,0,13,2Nxe5,b'1k1rr3/2qbb1p1/B6p/2p1Np2/8/8/PP3PPP/RN1QR1K1 b - -',"White is still winning the trade: the real threat is Qb3+, whatever happens..."
14,0,14,2Qb3,b'1k1rr3/3bb1p1/Bq5p/2p1Np2/8/1Q6/PP3PPP/RN2R1K1 b - -',the winning move...
15,0,15,2f4,b'1k1rr3/3b2p1/B4b1p/2p1Np2/5P2/1P6/1P4PP/RN2R1K1 b - f3',"also Nxe7+, Rxe7, Rxe8+, was an option: this closes the deal..."
16,0,16,2Bc4+,b'3rr3/k2b2p1/5b1p/2p1Np2/2B2P2/1P6/1P4PP/RN2R1K1 b - -',"in this position, Black timed out: he is running mate..."
17,1,0,1Nf7,b'rnbqkb1r/1p2pN2/p1p5/3p3p/2PPp3/4B1PB/PP2P2P/R2Q1RK1 b kq -',Fork guarded by rook
18,1,1,1Qd7,b'rnb1kb1r/1p1qpN2/p1p5/3p3p/2PPp3/4B1PB/PP2P2P/R2Q1RK1 w kq -',Bad queen move
19,1,2,1Bxd7+,b'rnb1kb1r/1p1BpN2/p1p5/3p3p/2PPp3/4B1P1/PP2P2P/R2Q1RK1 b kq -',No more black queen
20,1,3,1Nxh8,b'rn2kb1N/1p1bp3/p1p5/3p3p/2PPp3/4B1P1/PP2P2P/R2Q1RK1 b q -',Forgot about the rook
21,1,4,b4,b'8/4p3/Q3bbk1/3p3p/1p1Pp3/4B1P1/PP2P2P/R4RK1 w - -',Random pawn move
22,1,5,2Rxf6,b'8/4p1k1/4QR2/3p3p/1p1Pp3/4B1P1/PP2P2P/R5K1 b - -',Get rid of bishop
23,1,6,2Kh7,b'8/4p2k/4QR2/3p3p/1p1Pp3/4B1P1/PP2P2P/R5K1 w - -',Didn’t take the rook
24,1,7,3Qc8#,b'2Q4k/4pR2/8/3p3p/1p1Pp3/4B1P1/PP2P2P/R5K1 b - -',Checkmate
25,2,0,d5,b'rnbq1rk1/4npbp/p3p1p1/1p1pP3/3P1P2/2NB1N2/PP4PP/R1BQK2R w KQ d6',"so far, a regular Bulgarian variation in the Sicilian: against some form of a Grand Prix Attack; but White takes a wrong turn..."
26,2,1,Bb7,b'1n3rk1/rb3pbp/p2qp1p1/1p3n2/3PBP2/2N2N2/PP3BPP/R2QK2R w KQ -',exposing the weakness of White: Black is just a move away from finishing development...
27,2,2,1Kxd2,b'1n3rk1/1r3pbp/p3p1p1/1p3n2/3PNP2/5N2/PP1K1BPP/R6R b - -',"White prefers this, over losing d4: that will cost him..."
28,2,3,1Rhd1,b'1n1r2k1/1r3pbp/p3p1p1/1p3n2/3PNP2/5N2/PP1K1BPP/R2R4 b - -',probably the losing move...
29,2,4,1Nc6,b'3r2k1/1r3pbp/p1n1p1p1/1p3n2/3PNP2/5N2/PP1K1BPP/R2R4 w - -',d4 is lost...
30,2,5,2Nf6+,b'3r2k1/1r3p1p/p3pNp1/1p6/3b1P2/8/PP2K1PP/R2R4 b - -',losing it...
31,2,6,Bg1,b'6k1/1r3p1p/p2R2p1/1p6/5P2/5K1P/PP6/6b1 w - -',the work is done...
32,2,7,3Kf6,b'6k1/4r2p/R4Kp1/5p2/1p3P2/7P/PP6/6b1 b - -',the move of a madman: White is seriously considering a mate attempt...
33,2,8,Kg7,b'8/5rkp/R3K1p1/5p2/1p3P2/7P/PP6/6b1 w - -',threatening Rf6+: White resigned...
34,3,0,exd4,b'rnbqkbnr/pppp1ppp/8/8/2Pp4/8/PP2PPPP/RNBQKBNR w KQkq -',"usually a variation, Black wants to try: the Nordic gambit..."
35,3,1,a3,b'r1b1k2r/pppp1ppp/2nb3n/4q3/2P1Q3/P1N5/1P2PPPP/R1B1KBNR b KQkq -',"White is already acknowledging the problem: Nc6, landing on square c2 with check..."
36,3,2,1Kd2,b'r1b1k2r/pp1p1ppp/3p3n/8/2Pn4/P7/1P1KPPPP/R1B2BNR b kq -',forced: although better Kd1...
37,3,3,Ne5,b'r1b2rk1/pp1p1ppp/3p3n/4n3/2P5/P3PN2/1P1K1PPP/R1B2B1R w - -',"no rest, for the wicked..."
38,3,4,f5,b'r4rk1/pb1p2pp/1p1p3n/5p2/2P1P3/PP3P2/1B1K1P1P/R4B1R w - f6',relentless...
39,3,5,Rae8,b'4rrk1/pb1p3p/1p1p2pn/8/2P1P3/PP2K3/1B3P1P/R4BR1 w - -',preparing d5...
40,3,6,Nf5+,b'4rrk1/pb1p3p/1p4p1/3P1n2/4P3/PP2KP2/1B5P/R4BR1 w - -',waiting for it...
41,3,7,h5,b'4rrk1/pb1p4/1p4p1/3P3p/4P3/Pn3PK1/1B5P/3R1BR1 w - h6',preparing Kh7...
42,3,8,Nxe4,b'4rr2/pb1p3k/1p4p1/3P3p/2B1n2K/P4P1P/1B6/3R2R1 w - -',the beginning of the end: this sacrifice is totally correct...
43,3,9,Rxc4,b'5r2/pb1p3k/1p4p1/3P3p/2r5/P5KP/1B6/3R2R1 w - -',winning the sacced piece back...
44,3,10,Rc2+,b'5r2/pb1p3k/1p4p1/3P3p/8/P6P/1Br4K/3R2R1 w - -',asking for it...
45,3,11,Rxf2+,b'8/pb1p3k/1p4p1/3P3p/8/P6P/1B3r1K/3R4 w - -',White resigns...
46,4,0,f4,b'rnbqkbnr/pppp1ppp/8/4p3/4PP2/8/PPPP2PP/RNBQKBNR b KQkq f3',"I have been studying the King's Gambit a lot since late May and have found it to be an extremely interesting opening.  With enough studying under my belt, I decided it was time to venture forth from theory to practice.  (This has been the only opening I have studied heavily thus far, and I'm still not a pro at it by any means.)  I have already had some very interesting games on-line and OTB.  One thing I have noticed is that unlike other openings, the King's Gambit has a tendency to lead white to quick victory in the mid-game (as in this game) or disastrous defeat in the end due to piece sacrifices.  I wasn't originally planning on annotating these games and making this a pseudo-series, but then I realized the Gameknot community might have a lot to share/learn with/from me with regards to my moves (and perhaps enjoy mocking me).  (Like ""you idiot, why didn't you see this move, you could have totally had him"" or ""you orangutan, go read 'crying like a Grandmaster' by GM Ben Finegold."")  I will also be including in this pseudo-series annotations of Grandmaster level games.  Without much further ado, I give you my first very successful game that celebrates the King's Gambit ferocity.  I hope you enjoy it and comments/feedback on moves made are greatly appreciated!"
47,4,1,Nf6,b'rnbqkb1r/pppp1ppp/5n2/4p3/4PP2/8/PPPP2PP/RNBQKBNR w KQkq -',"It's the Petrov Defense in the King's Gambit Declined line.  This is an interesting way to decline the King's Gambit because rather than taking the offered pawn and free threat of check on Qh4, black has elected to threaten the e4 pawn in an attempt to arrest white's center control.  Not to say this opening is a mistake, but I think this response gives white some time back because now the black queen cannot threaten check for at least a turn.  White's best moves here, in my opinion, are fxe5, Bc4, d3, Nc3 or Nf3.  In the King's Gambit, it is often important to develop the King side and castle rapidly.  Bobby Fischer loved the move Bc4, even in the accepted line- the so called Bishop's Gambit.  Nf6 by black gives white the opportunity to do this a bit earlier.  Although I think it's a good move, I personally don't like d3 in the King's Gambit unless I'm ready to spend a move on d4 in the future because d3 makes developing the light square bishop harder and honestly cramps the King's Gambit style.  There are also games where the King's gambit transposes into less aggressive games about position and center control and other theory that I still don't have a firm grasp on yet.  (I'm still studying lines around d4.  That might be a good move here, too.)  Nf3 is a bit too passive at this moment in the Petrov Defense, but it isn't terrible.  Nc3 is also passive but is better here because it protects the e4 pawn, develops the queen side knight and opens the a1 rook for later use; if you play the King's Gambit right, I can almost guarantee every piece from c1 to h1 will be developed quickly.  However, it transposes the game to a Vienna Gambit in a Vienna Game, which is not bad, but if you want to play a Vienna Gambit, I'd suggest a different order of moves.  The a1 rook sometimes feels like a missed asset in my games.  In fact, if I had had earlier access to it in some of my other games, I would have definitely won.  I would say the next move here is a matter of taste for white."
48,4,2,fxe5,b'rnbqkb1r/pppp1ppp/5n2/4P3/4P3/8/PPPP2PP/RNBQKBNR b KQkq -',"In this game, I decided to gobble up the e5 pawn.  This does a lot of good for white for three reasons: One, because it forces black to respond with his knight, he either under-develops or takes the e4 pawn; two, it brings a pawn to the e5 square, which quite frankly can cramp black's game and become extra fodder against black depending (and as we will see in this game); and, three, because taking the e4 pawn is absolutely what black will do, this brings the knight into an isolated square that makes it prone to early game harassment and potentially an easy capture.  (Note, that the knight will now no longer be able to move back to d6 or f6 because of the e5 pawn.)"
49,4,3,Nf3,b'rnbqkb1r/pppp1ppp/8/4P3/4n3/5N2/PPPP2PP/RNBQKB1R b KQkq -',"At this point, white must play Nf3 or g3 to prevent Qh4+.  (There might actually be other moves white can make.  I haven't actually considered others yet.  Let me know if you find others.)  The pawn to g3 is definitely rubbish compared to Nf3 since the latter develops a piece and clears the king side for castling.  For those of you still very new to the King's Gambit, consider what would happen if play went like this: 4. a3 Qh4+.  What can white do in this situation?  See if you can identify the permutations; it isn't too challenging."
50,4,4,Bc5,b'rnbqk2r/pppp1ppp/8/2b1P3/4n3/5N2/PPPP2PP/RNBQKB1R w KQkq -',"This is, I'm pretty sure, black's first mistake.  I'm not sure just how bad it is, but it definitely gives white tempo.  The obvious threat is either Nf2 or Bf2.  Either one will take away castling rights (I'd like Bf2 better because it brings the king to an uncomfy square), but the only real move white can make to counter this is arguably the best move.  Not only will black have to respond by retreating the bishop (or be down material, but we'll assume that's not an option), it also further isolates the knight by taking away the c5 square for retreat."
51,4,5,d4,b'rnbqk2r/pppp1ppp/8/2b1P3/3Pn3/5N2/PPP3PP/RNBQKB1R b KQkq d3',The obvious move.
52,4,6,Be7,b'rnbqk2r/ppppbppp/8/4P3/3Pn3/5N2/PPP3PP/RNBQKB1R w KQkq -',"It was either this move (Be7) or Bb6.  I think Be7 is probably the best move black can make because it provides some material to defend the king side, which is what the King's Gambit aims to obliterate for black as far as I understand the opening, and provides two defenders on the g5 square- the only square black's knight can feasibly run away to.  Bb6 could make the dark square bishop useless for black for most of the game considering white's pawn structure.  Bb4+ is also complete rubbish because it gives white free development with c3.  (As white, do not play Nc3 to defend against Bb4+.  If it isn't obvious, I recommend the reader play the permutation out and find the winning moves for black as an exercise.)"
53,4,7,Bd3,b'rnbqk2r/ppppbppp/8/4P3/3Pn3/3B1N2/PPP3PP/RNBQK2R b KQkq -',"At this point in the game, I felt it was important for me to consider where I could sacrifice my pieces- yes, sacrifice them.  Back in ye olde days of chess, when this opening was still played competitively, Grandmasters were encouraged to play ""gutsy"" and wild by sacrificing their pieces for positional advantages.  I considered playing Bc4 with the idea of potentially sacrificing my bishop on f7 to bring black's king out.  I have seen this sacrificial play made before.  (I'll provide a reference game once I find it in my notes and update this post.)  However, in this position, it looked like black was going to castle king side, so if bringing his king out was the positional advantage I was looking for, then d3 was a better square for my bishop.  Plus it threatens his knight and gives me more tempo.  Yay!"
54,4,8,Ng5,b'rnbqk2r/ppppbppp/8/4P1n1/3P4/3B1N2/PPP3PP/RNBQK2R w KQkq -',Tactical puzzle ahead!  Scroll down one frame at a time if you don't want spoilers!
55,4,9,O-O,b'rnbqk2r/ppppbppp/8/4P1n1/3P4/3B1N2/PPP3PP/RNBQ1RK1 b kq -',"I didn't want to trade pieces because although we'd trade even, it wouldn't do much for me in the way of position.  His knight now has Nxf3 or Ne6 in the way of moves.  If he takes my knight, then I could simply develop my queen and put it in file with my rook on his f7 pawn.  It would put black in a position where castling king side seems favorable (especially with my e5 pawn there), which is what any player utilizing the King's Gambit will often want.  Because this opening is often attempting to pulverize black's king side pawn structure, for black to castle king side is giving white a positional edge... in my opinion."
56,4,10,O-O,b'rnbq1rk1/ppppbppp/8/4P1n1/3P4/3B1N2/PPP3PP/RNBQ1RK1 w - -',"Try to not look ahead to the next frame from here!  He elects to castle, and this is where the fireworks start for white.  (It is my strong opinion, and I welcome arguments against this opinion, but I think black should never castle king side if he can help it against the King's Gambit.)  I didn't see anything in this position at first, but then I left on a brief vacation.  Despite my girlfriend's best attempts to distract me, my mind often came back to this game.  I really wanted to have a super successful King's Gambit game.  A lot of my OTB games and various other online games were almost successful, but failed because I couldn't see mating sequences or positional traps fast enough.  Perhaps some of the readers already see the sequence; if you don't, consider this a tactical puzzle for you to crack!  If you get impatient, read on!"
57,4,11,Nxg5,b'rnbq1rk1/ppppbppp/8/4P1N1/3P4/3B4/PPP3PP/RNBQ1RK1 b - -',"This just trades even, right?"
58,4,12,Bxh7+,b'rnbq1rk1/pppp1ppB/8/4P1b1/3P4/8/PPP3PP/RNBQ1RK1 b - -',"Actually it doesn't.  This is where the bishop sacrifice I was already considering comes into use.  Once more, I feel like I have seen this sacrifice before even if the position was slightly different.  I'll be looking for references in a bit, but if someone else knows one already, please share it!"
59,4,13,Kxh7,b'rnbq1r2/pppp1ppk/8/4P1b1/3P4/8/PPP3PP/RNBQ1RK1 w - -',"Black decides to nom a ""free"" bishop."
60,4,14,1Qh5+,b'rnbq1r2/pppp1ppk/8/4P1bQ/3P4/8/PPP3PP/RNB2RK1 b - -',Now my queen is active.
61,4,15,1Bh6,b'rnbq1r2/pppp1ppk/7b/4P2Q/3P4/8/PPP3PP/RNB2RK1 w - -',"His king is temporarily safe, but now his bishop is pinned."
62,4,16,1Rf6,b'rnbq1r2/pppp1ppk/5R1b/4P2Q/3P4/8/PPP3PP/RNB3K1 b - -',"This is perhaps the key move in the tactical puzzle; without this move, the bishop sacrifice at 9. Bxh7+ doesn't seem worth it.  Even in this position, though, I have to admit I wasn't first convinced this position was any good.  It felt good, but I wanted to be sure.  It seemed like black could simply take a free rook, right?  Of course, if he does, then the white queen takes black's bishop forcing the black king into a corner on the g8 square.  This should be real bad for black and a mating net probably existed, but I wasn't sure.  This is perhaps another tactical exercise for the reader; can you identify what can happen to black if he plays 11. ... gxf6?  I'll provide a hint to the solution in two slides (look for $$).  Once I determined taking the rook with the pawn was bad news for black, I decided this whole line starting from 8. Nxg5 was worth it.  I would, of course welcome a rook and bishop for queen trade.  I want to post a puzzle here for this, but I don't know for sure if this (the permutation where he captures the rook with the pawn) is a guaranteed mate yet.  I merely mapped things out in the game until I either reached checkmate for black or decided the new position for black was terrible for him.  "
63,4,17,1Kg8,b'rnbq1rk1/pppp1pp1/5R1b/4P2Q/3P4/8/PPP3PP/RNB3K1 w - -',"The idea is ok, but I'm not sure this was the best move black could have made.  Black wants to free his bishop from the pin so it can become useful again.  If it were me, I would consider getting the light square bishop or b8 knight into the game ASAP!  Maybe black did consider this; maybe there are simply no good moves left here.  I haven't yet considered what would happen if black decided along these lines instead because black elected this move.  I simply focused mental energies on what happened."
64,4,18,1Bxh6,b'rnbq1rk1/pppp1pp1/5R1B/4P2Q/3P4/8/PPP3PP/RN4K1 b - -',"After more careful thought, I decided taking with the bishop was the best move.  What's funny is that I first considered queen sacrifices and then rook sacrifices.  Maybe I like playing classically ""gutsy"" chess.  Here is yet another puzzle to solve for the reader.  What are the sequences that guarantee checkmate here?  If white plays correctly here, he will win.  I'm not this good yet; I admit to making a flow chart of moves using pen and paper to help me here, and I still missed some moves black made.

$$ The hint to the solution to 11. ... gxf6 is 12. Qxh6+ Kg7 13. exf6 ... .  It should only be moderately difficult to solve from there.  I would like to mention that I didn't see every permutation through to the end during the game.  (Also, can someone tell me how to indent my paragraphs.  Is it possible?)"
65,4,19,1Qxf6,b'rnb2rk1/pppp1pp1/5q1B/4P2Q/3P4/8/PPP3PP/RN4K1 w - -',"Black attempts to stop checkmate with this queen sacrifice.  Luckily, this only delays checkmate rather than stopping it."
66,4,20,1exf6,b'rnb2rk1/pppp1pp1/5P1B/7Q/3P4/8/PPP3PP/RN4K1 b - -',"Pawn takes, and now the moves white has are pretty easy to see."
67,4,21,1g6,b'rnb2rk1/pppp1p2/5PpB/7Q/3P4/8/PPP3PP/RN4K1 w - -',"This is a good move.  I had forgotten to consider this move when I was in the game and was worried that this might buy black enough time to stop mate.  Even though I'm up in material, I was still worried about this game turning into another near victory, which many of my King's Gambit games have been.  Especially OTB games- mostly due to time constraints; I don't have the luxury of lots of time to think.  Qh3 is bad because it makes d5 an option for black, which may actually prevent checkmate... .  I haven't actually studied that line yet, I simply avoided moving my queen into harm's way of black's bishop.  When I have the time, I'll look into it and update this post to include the outcome of that and other lines I have mentioned but not fully considered."
68,4,22,1Qh4,b'rnb2rk1/pppp1p2/5PpB/8/3P3Q/8/PPP3PP/RN4K1 b - -',"Fortunately, checkmate is still guaranteed in this position.  Here my opponent resigned.  I thoroughly enjoyed this game, and it is because of crazy games like this, that I love the King's Gambit!  By turn 10, every piece from d1 to h1 (minus the king) was bearing down on my opponent's king and several piece sacrifices for position were made.  I think I love making sacrifices.  I wonder if any of you share my same burning passion for this opening.  Please feel free to comment on this, and if you want to hear more King's Gambit games, consider liking this annotation?  I'll probably keep making annotations when I have the time because I sense I learn a lot when I do, but it's nice to know someone else is enjoying them, too.  The next King's Gambit game I review will be an OTB game I played against my professor (names will be excluded for privacy's sake) that I nearly won, but failed to do so.  I think it will highlight some of the pitfalls of the King's Gambit and also show the importance of being good at tactical puzzles when playing this opening.  Until the next installment!  I hope you enjoyed this very short game!"
69,5,0,f4,b'rnbqkbnr/pppppppp/8/8/5P2/8/PPPPP1PP/RNBQKBNR b KQkq f3',"1. f4 however, is made of other proportions: this move plays a major role in many opening systems for White; like e4, e5, f4 (Kings' Gambit), or e5, c5, f4 (Morra Gambit), and a couple of others: in this case, it will turn into a regular Dutch defense Reversed; or Advanced, or whatever..."
70,5,1,d5,b'rnbqkbnr/ppp1pppp/8/3p4/5P2/8/PPPPP1PP/RNBQKBNR w KQkq d6',"the logical reply: in fact, we are playing 1. d4, f5; but reversed in colour: these are very instructive games..."
71,5,2,c3,b'r1bqkbnr/ppp1pppp/2n5/3p4/5P2/2P3P1/PP1PP2P/RNBQKBNR b KQkq -',"analog to c6, after Nc3: keep the Knight at bay..."
72,5,3,d3,b'r1bqkb1r/ppp1pppp/2n2n2/3p4/5P2/2PP2P1/PP2P2P/RNBQKBNR b KQkq -',also Ne4 needs to be discouraged: White has no fear for Ng4/Bg4; h3 will solve that...
73,5,4,Nh4,b'r2qk2r/ppp2ppp/2nb1n2/3ppb2/5P1N/2PP2P1/PP2P1BP/RNBQK2R b KQkq -',Black is rushing things: e5 comes way too early...
74,5,5,Bg6,b'r2qk2r/ppp2ppp/2nb1nb1/3pp3/5P1N/2PP2P1/PP2P1BP/RNBQK2R w KQkq -',the only other safe move is Bd7: Black does not give up that easily...
75,5,6,e4,b'r2qk2r/ppp2ppp/2nb1n2/3p1P1b/4p2N/2PP2PP/PP2P1B1/RNBQK2R w KQkq -',a clever counter attack: but Black is under pressure...
76,5,7,1e3,b'r2qk2r/ppp2ppp/2n5/3p1P1n/4p2b/2PPP2P/PP4B1/RNBQ1K1R b kq -',attacking Nh5...
77,5,8,dxe4,b'2kr3r/ppp2ppp/2n5/5Pq1/4p1Qb/2P1P2P/PP4B1/RNB4K w - -',introducing a new problem: Rd1+ will lose Bc1...
78,5,9,Re8,b'2k1r3/ppp2ppp/2n5/5Pb1/2N1p1P1/2P1P3/PP4BK/R1Br4 w - -',something needs to be done about e4...
79,5,10,Rd3,b'2k1r3/2p2ppp/p1n5/1p3Pb1/4p1P1/NPPrP3/P5BK/R1B5 w - -',"back to Rd1, will bring Black nothing..."
80,5,11,2cxb5,b'2k1r3/2p2ppp/p1n5/1P3P2/4p1P1/NP1rb3/P5BK/R1B5 b - -',a nasty twist...
81,5,12,2Nxb5,b'2k1r3/2p2ppp/2n5/1N3P2/4p1P1/1P1r4/P5BK/2R5 b - -',Whites' Queen side pawns are loose...
82,5,13,2Red8,b'2kr4/2p2ppp/2n5/1N3P2/4p1P1/1P1r4/P5BK/2R5 w - -',losing control...
83,5,14,3Bxc6,b'2k5/2p2ppp/2Br4/1N3P2/6P1/1P4K1/P2r4/2R5 b - -',"Nxd6, Rxd6, is giving Black drawing prospects: White first needs to tilt the material balance in favor..."
84,5,15,3Na7+,b'2k5/N1p2ppp/2r5/5P2/6P1/1P4K1/P2r4/2R5 b - -',"stronger, than a direct Rxc6: never waste a good threat..."
85,5,16,c4,b'8/1k3ppp/8/3N1P2/2p3P1/1PR3K1/1r6/8 w - -',"an interesting position: White cannot play Rxc4, Rxb3+; bxc4 induces Kc6, bringing White all kinds of trouble..."
86,5,17,Kxe7,b'8/4kppp/8/5P2/1PR3P1/6K1/1r6/8 w - -',White has to return material: before things go sour...
87,5,18,Rxb4,b'8/6Rp/3k1p2/5P2/1r4PK/8/8/8 w - -',"Rh2+, Kg3 leads to nothing..."
88,5,19,4Rg6,b'8/8/6R1/4kP2/5rPK/8/8/8 b - -',
89,6,0,e3,b'rnbqkbnr/pppppppp/8/8/8/4P3/PPPP1PPP/RNBQKBNR b KQkq -',i
90,6,1,e5,b'rnbqkbnr/pppp1ppp/8/4p3/8/4P3/PPPP1PPP/RNBQKBNR w KQkq e6',pawn
91,6,2,Nf3,b'rnbqkbnr/pppp1ppp/8/4p3/8/4PN2/PPPP1PPP/RNBQKB1R b KQkq -',knight
92,6,3,Bc5,b'rnbqk1nr/pppp1ppp/8/2b1p3/8/4PN2/PPPP1PPP/RNBQKB1R w KQkq -', this play  likes to play  some hard chess
93,6,4,d4,b'rnbqk1nr/pppp1ppp/8/2b1p3/3P4/4PN2/PPP2PPP/RNBQKB1R b KQkq d3',pawn wall
94,6,5,exd4,b'rnbqk1nr/pppp1ppp/8/2b5/3p4/4PN2/PPP2PPP/RNBQKB1R w KQkq -',pawn
95,6,6,exd4,b'rnbqk1nr/pppp1ppp/8/2b5/3P4/5N2/PPP2PPP/RNBQKB1R b KQkq -',pawn
96,6,7,Bb4+,b'rnbqk1nr/pppp1ppp/8/8/1b1P4/5N2/PPP2PPP/RNBQKB1R w KQkq -',check
97,6,8,c3,b'rnbqk1nr/pppp1ppp/8/8/1b1P4/2P2N2/PP3PPP/RNBQKB1R b KQkq -', pawn
98,6,9,Bd6,b'rnbqk1nr/pppp1ppp/3b4/8/3P4/2P2N2/PP3PPP/RNBQKB1R w KQkq -',moves back
99,6,10,Bd3,b'rnbqk1nr/pppp1ppp/3b4/8/3P4/2PB1N2/PP3PPP/RNBQK2R b KQkq -',bishop
100,6,11,Qe7+,b'rnb1k1nr/ppppqppp/3b4/8/3P4/2PB1N2/PP3PPP/RNBQK2R w KQkq -',this this player normal play.
101,6,12,Kf1,b'rnb1k1nr/ppppqppp/3b4/8/3P4/2PB1N2/PP3PPP/RNBQ1K1R b kq -',safe for now before 
102,6,13,Nf6,b'rnb1k2r/ppppqppp/3b1n2/8/3P4/2PB1N2/PP3PPP/RNBQ1K1R w kq -',knight
103,6,14,Kg1,b'rnb1k2r/ppppqppp/3b1n2/8/3P4/2PB1N2/PP3PPP/RNBQ2KR b kq -',i could never relax with player
104,6,15,Ng4,b'rnb1k2r/ppppqppp/3b4/8/3P2n1/2PB1N2/PP3PPP/RNBQ2KR w kq -',knight
105,6,16,h3,b'rnb1k2r/ppppqppp/3b4/8/3P2n1/2PB1N1P/PP3PP1/RNBQ2KR b kq -',pawn
106,6,17,Nc6,b'r1b1k2r/ppppqppp/2nb4/8/3P2n1/2PB1N1P/PP3PP1/RNBQ2KR w kq -',knight
107,6,18,1Bg5,b'r1b1k2r/ppppqppp/2nb4/6B1/3P2n1/2PB1N1P/PP3PP1/RN1Q2KR b kq -',set a trap for  black
108,6,19,1Na5,b'r1b1k2r/ppppqppp/3b4/n5B1/3P2n1/2PB1N1P/PP3PP1/RN1Q2KR w kq -',knight
109,6,20,1Bxe7,b'r1b1k2r/ppppBppp/3b4/n7/3P2n1/2PB1N1P/PP3PP1/RN1Q2KR b kq -',forgot about the queen
110,6,21,1Bxe7,b'r1b1k2r/ppppbppp/8/n7/3P2n1/2PB1N1P/PP3PP1/RN1Q2KR w kq -',  was willing to give that bishop to get that queen
111,6,22,1b4,b'r1b1k2r/ppppbppp/8/n7/1P1P2n1/2PB1N1P/P4PP1/RN1Q2KR b kq b3',pawn
112,6,23,1Nh6,b'r1b1k2r/ppppbppp/7n/n7/1P1P4/2PB1N1P/P4PP1/RN1Q2KR w kq -',moves back
113,6,24,1Na3,b'r1b1k2r/ppppbppp/7n/n7/1P1P4/N1PB1N1P/P4PP1/R2Q2KR b kq -',final minor piece out
114,6,25,1Nc6,b'r1b1k2r/ppppbppp/2n4n/8/1P1P4/N1PB1N1P/P4PP1/R2Q2KR w kq -',black is moving back a lot
115,6,26,1d5,b'r1b1k2r/ppppbppp/2n4n/3P4/1P6/N1PB1N1P/P4PP1/R2Q2KR b kq -',pawn
116,6,27,1Nb8,b'rnb1k2r/ppppbppp/7n/3P4/1P6/N1PB1N1P/P4PP1/R2Q2KR w kq -',this first time ever made this player go back so many times
117,6,28,1Qf1,b'rnb1k2r/ppppbppp/7n/3P4/1P6/N1PB1N1P/P4PP1/R4QKR b kq -',queen
118,6,29,1Ng8,b'rnb1k1nr/ppppbppp/8/3P4/1P6/N1PB1N1P/P4PP1/R4QKR w kq -', black king is not in good  place
119,6,30,1c4,b'rnb1k1nr/ppppbppp/8/3P4/1PP5/N2B1N1P/P4PP1/R4QKR b kq -',pawn
120,6,31,1Na6,b'r1b1k1nr/ppppbppp/n7/3P4/1PP5/N2B1N1P/P4PP1/R4QKR w kq -',knight
121,6,32,1Nb5,b'r1b1k1nr/ppppbppp/n7/1N1P4/1PP5/3B1N1P/P4PP1/R4QKR b kq -',knight
122,6,33,1Nxb4,b'r1b1k1nr/ppppbppp/8/1N1P4/1nP5/3B1N1P/P4PP1/R4QKR w kq -',knight
123,6,34,1Nxc7+,b'r1b1k1nr/ppNpbppp/8/3P4/1nP5/3B1N1P/P4PP1/R4QKR b kq -',check
124,6,35,1Kd8,b'r1bk2nr/ppNpbppp/8/3P4/1nP5/3B1N1P/P4PP1/R4QKR w - -',king
125,6,36,1Nxa8,b'N1bk2nr/pp1pbppp/8/3P4/1nP5/3B1N1P/P4PP1/R4QKR b - -',knight
126,6,37,1Bc5,b'N1bk2nr/pp1p1ppp/8/2bP4/1nP5/3B1N1P/P4PP1/R4QKR w - -',last effect to get some pieces
127,6,38,2Ng5,b'N1bk2nr/pp1p1ppp/8/2bP2N1/1nP5/3B3P/P4PP1/R4QKR b - -',knight
